Sheet: Table1
A1: bl
A2: 174 | B2: =LN(RC[-1]+1 )*400 -> 2065.914389569406 | C2: =LOG(RC[-2]+1 )*1000 -> 2243.0380486862946
A3: 144 | B3: =LN(RC[-1]+1 )*400 -> 1990.6934969682297 | C3: =LOG(RC[-2]+1 )*1000 -> 2161.3680022349749
A4: 142 | B4: =LN(RC[-1]+1 )*400 -> 1985.1378521039628 | C4: =LOG(RC[-2]+1 )*1000 -> 2155.336037465062
A5: 106 | B5: =LN(RC[-1]+1 )*400 -> 1869.1315337847623 | C5: =LOG(RC[-2]+1 )*1000 -> 2029.3837776852097
A6: 88 | B6: =LN(RC[-1]+1 )*400 -> 1795.4545478928558 | C6: =LOG(RC[-2]+1 )*1000 -> 1949.3900066449128
A7: 86 | B7: =LN(RC[-1]+1 )*400 -> 1786.3632474618335 | C7: =LOG(RC[-2]+1 )*1000 -> 1939.5192526186186
A8: 83 | B8: =LN(RC[-1]+1 )*400 -> 1772.3267195373253 | C8: =LOG(RC[-2]+1 )*1000 -> 1924.2792860618815
A9: 82 | B9: =LN(RC[-1]+1 )*400 -> 1767.5362431186393 | C9: =LOG(RC[-2]+1 )*1000 -> 1919.078092376074
A10: 82 | B10: =LN(RC[-1]+1 )*400 -> 1767.5362431186393 | C10: =LOG(RC[-2]+1 )*1000 -> 1919.078092376074
A11: 82 | B11: =LN(RC[-1]+1 )*400 -> 1767.5362431186393 | C11: =LOG(RC[-2]+1 )*1000 -> 1919.078092376074
A12: 82 | B12: =LN(RC[-1]+1 )*400 -> 1767.5362431186393 | C12: =LOG(RC[-2]+1 )*1000 -> 1919.078092376074
A13: 78 | B13: =LN(RC[-1]+1 )*400 -> 1747.7791409868087 | C13: =LOG(RC[-2]+1 )*1000 -> 1897.6270912904413
A14: 74 | B14: =LN(RC[-1]+1 )*400 -> 1726.9952454145241 | C14: =LOG(RC[-2]+1 )*1000 -> 1875.0612633917001
A15: 72 | B15: =LN(RC[-1]+1 )*400 -> 1716.1837764593563 | C15: =LOG(RC[-2]+1 )*1000 -> 1863.322860120456
A16: 70 | B16: =LN(RC[-1]+1 )*400 -> 1705.0719508165262 | C16: =LOG(RC[-2]+1 )*1000 -> 1851.2583487190752
A17: 68 | B17: =LN(RC[-1]+1 )*400 -> 1693.6426018389038 | C17: =LOG(RC[-2]+1 )*1000 -> 1838.8490907372552
A18: 62 | B18: =LN(RC[-1]+1 )*400 -> 1657.253890556613 | C18: =LOG(RC[-2]+1 )*1000 -> 1799.3405494535816
A19: 62 | B19: =LN(RC[-1]+1 )*400 -> 1657.253890556613 | C19: =LOG(RC[-2]+1 )*1000 -> 1799.3405494535816
A20: 60 | B20: =LN(RC[-1]+1 )*400 -> 1644.3495456693245 | C20: =LOG(RC[-2]+1 )*1000 -> 1785.3298350107671
A21: 58 | B21: =LN(RC[-1]+1 )*400 -> 1631.0149775622879 | C21: =LOG(RC[-2]+1 )*1000 -> 1770.8520116421441
A22: 54 | B22: =LN(RC[-1]+1 )*400 -> 1602.9332740929885 | C22: =LOG(RC[-2]+1 )*1000 -> 1740.3626894942438
A23: 52 | B23: =LN(RC[-1]+1 )*400 -> 1588.1167654208489 | C23: =LOG(RC[-2]+1 )*1000 -> 1724.2758696007888
A24: 52 | B24: =LN(RC[-1]+1 )*400 -> 1588.1167654208489 | C24: =LOG(RC[-2]+1 )*1000 -> 1724.2758696007888
A25: 50 | B25: =LN(RC[-1]+1 )*400 -> 1572.7302530897302 | C25: =LOG(RC[-2]+1 )*1000 -> 1707.5701760979362
A26: 46 | B26: =LN(RC[-1]+1 )*400 -> 1540.0590406840233 | C26: =LOG(RC[-2]+1 )*1000 -> 1672.0978579357175
A27: 46 | B27: =LN(RC[-1]+1 )*400 -> 1540.0590406840233 | C27: =LOG(RC[-2]+1 )*1000 -> 1672.0978579357175
A28: 44 | B28: =LN(RC[-1]+1 )*400 -> 1522.6649959081278 | C28: =LOG(RC[-2]+1 )*1000 -> 1653.2125137753437
A29: 44 | B29: =LN(RC[-1]+1 )*400 -> 1522.6649959081278 | C29: =LOG(RC[-2]+1 )*1000 -> 1653.2125137753437
A30: 44 | B30: =LN(RC[-1]+1 )*400 -> 1522.6649959081278 | C30: =LOG(RC[-2]+1 )*1000 -> 1653.2125137753437
A31: 42 | B31: =LN(RC[-1]+1 )*400 -> 1504.4800462774249 | C31: =LOG(RC[-2]+1 )*1000 -> 1633.4684555795864
A32: 42 | B32: =LN(RC[-1]+1 )*400 -> 1504.4800462774249 | C32: =LOG(RC[-2]+1 )*1000 -> 1633.4684555795864
A33: 42 | B33: =LN(RC[-1]+1 )*400 -> 1504.4800462774249 | C33: =LOG(RC[-2]+1 )*1000 -> 1633.4684555795864
A34: 40 | B34: =LN(RC[-1]+1 )*400 -> 1485.4288266817232 | C34: =LOG(RC[-2]+1 )*1000 -> 1612.7838567197355
A35: 40 | B35: =LN(RC[-1]+1 )*400 -> 1485.4288266817232 | C35: =LOG(RC[-2]+1 )*1000 -> 1612.7838567197355
A36: 38 | B36: =LN(RC[-1]+1 )*400 -> 1465.4246584518585 | C36: =LOG(RC[-2]+1 )*1000 -> 1591.0646070264991
A37: 38 | B37: =LN(RC[-1]+1 )*400 -> 1465.4246584518585 | C37: =LOG(RC[-2]+1 )*1000 -> 1591.0646070264991
A38: 38 | B38: =LN(RC[-1]+1 )*400 -> 1465.4246584518585 | C38: =LOG(RC[-2]+1 )*1000 -> 1591.0646070264991
A39: 38 | B39: =LN(RC[-1]+1 )*400 -> 1465.4246584518585 | C39: =LOG(RC[-2]+1 )*1000 -> 1591.0646070264991
A40: 38 | B40: =LN(RC[-1]+1 )*400 -> 1465.4246584518585 | C40: =LOG(RC[-2]+1 )*1000 -> 1591.0646070264991
A41: 36 | B41: =LN(RC[-1]+1 )*400 -> 1444.3671650576898 | C41: =LOG(RC[-2]+1 )*1000 -> 1568.201724066995
A42: 36 | B42: =LN(RC[-1]+1 )*400 -> 1444.3671650576898 | C42: =LOG(RC[-2]+1 )*1000 -> 1568.201724066995
A43: 36 | B43: =LN(RC[-1]+1 )*400 -> 1444.3671650576898 | C43: =LOG(RC[-2]+1 )*1000 -> 1568.201724066995
A44: 36 | B44: =LN(RC[-1]+1 )*400 -> 1444.3671650576898 | C44: =LOG(RC[-2]+1 )*1000 -> 1568.201724066995
A45: 36 | B45: =LN(RC[-1]+1 )*400 -> 1444.3671650576898 | C45: =LOG(RC[-2]+1 )*1000 -> 1568.201724066995
A46: 34 | B46: =LN(RC[-1]+1 )*400 -> 1422.1392245957654 | C46: =LOG(RC[-2]+1 )*1000 -> 1544.0680443502756
A47: 32 | B47: =LN(RC[-1]+1 )*400 -> 1398.603024586592 | C47: =LOG(RC[-2]+1 )*1000 -> 1518.5139398778874
A48: 32 | B48: =LN(RC[-1]+1 )*400 -> 1398.603024586592 | C48: =LOG(RC[-2]+1 )*1000 -> 1518.5139398778874
A49: 32 | B49: =LN(RC[-1]+1 )*400 -> 1398.603024586592 | C49: =LOG(RC[-2]+1 )*1000 -> 1518.5139398778874
A50: 32 | B50: =LN(RC[-1]+1 )*400 -> 1398.603024586592 | C50: =LOG(RC[-2]+1 )*1000 -> 1518.5139398778874
A51: 32 | B51: =LN(RC[-1]+1 )*400 -> 1398.603024586592 | C51: =LOG(RC[-2]+1 )*1000 -> 1518.5139398778874
A52: 32 | B52: =LN(RC[-1]+1 )*400 -> 1398.603024586592 | C52: =LOG(RC[-2]+1 )*1000 -> 1518.5139398778874
A53: 30 | B53: =LN(RC[-1]+1 )*400 -> 1373.5948817940584 | C53: =LOG(RC[-2]+1 )*1000 -> 1491.3616938342727
A54: 30 | B54: =LN(RC[-1]+1 )*400 -> 1373.5948817940584 | C54: =LOG(RC[-2]+1 )*1000 -> 1491.3616938342727
A55: 30 | B55: =LN(RC[-1]+1 )*400 -> 1373.5948817940584 | C55: =LOG(RC[-2]+1 )*1000 -> 1491.3616938342727
A56: 28 | B56: =LN(RC[-1]+1 )*400 -> 1346.9183319945896 | C56: =LOG(RC[-2]+1 )*1000 -> 1462.3979978989562
A57: 28 | B57: =LN(RC[-1]+1 )*400 -> 1346.9183319945896 | C57: =LOG(RC[-2]+1 )*1000 -> 1462.3979978989562
A58: 28 | B58: =LN(RC[-1]+1 )*400 -> 1346.9183319945896 | C58: =LOG(RC[-2]+1 )*1000 -> 1462.3979978989562
A59: 26 | B59: =LN(RC[-1]+1 )*400 -> 1318.3347464017315 | C59: =LOG(RC[-2]+1 )*1000 -> 1431.3637641589874
A60: 26 | B60: =LN(RC[-1]+1 )*400 -> 1318.3347464017315 | C60: =LOG(RC[-2]+1 )*1000 -> 1431.3637641589874
A61: 26 | B61: =LN(RC[-1]+1 )*400 -> 1318.3347464017315 | C61: =LOG(RC[-2]+1 )*1000 -> 1431.3637641589874
A62: 26 | B62: =LN(RC[-1]+1 )*400 -> 1318.3347464017315 | C62: =LOG(RC[-2]+1 )*1000 -> 1431.3637641589874
A63: 26 | B63: =LN(RC[-1]+1 )*400 -> 1318.3347464017315 | C63: =LOG(RC[-2]+1 )*1000 -> 1431.3637641589874
A64: 26 | B64: =LN(RC[-1]+1 )*400 -> 1318.3347464017315 | C64: =LOG(RC[-2]+1 )*1000 -> 1431.3637641589874
A65: 26 | B65: =LN(RC[-1]+1 )*400 -> 1318.3347464017315 | C65: =LOG(RC[-2]+1 )*1000 -> 1431.3637641589874
A66: 26 | B66: =LN(RC[-1]+1 )*400 -> 1318.3347464017315 | C66: =LOG(RC[-2]+1 )*1000 -> 1431.3637641589874
A67: 26 | B67: =LN(RC[-1]+1 )*400 -> 1318.3347464017315 | C67: =LOG(RC[-2]+1 )*1000 -> 1431.3637641589874
A68: 26 | B68: =LN(RC[-1]+1 )*400 -> 1318.3347464017315 | C68: =LOG(RC[-2]+1 )*1000 -> 1431.3637641589874
A69: 26 | B69: =LN(RC[-1]+1 )*400 -> 1318.3347464017315 | C69: =LOG(RC[-2]+1 )*1000 -> 1431.3637641589874
A70: 26 | B70: =LN(RC[-1]+1 )*400 -> 1318.3347464017315 | C70: =LOG(RC[-2]+1 )*1000 -> 1431.3637641589874
A71: 24 | B71: =LN(RC[-1]+1 )*400 -> 1287.5503299472803 | C71: =LOG(RC[-2]+1 )*1000 -> 1397.9400086720377
A72: 24 | B72: =LN(RC[-1]+1 )*400 -> 1287.5503299472803 | C72: =LOG(RC[-2]+1 )*1000 -> 1397.9400086720377
A73: 24 | B73: =LN(RC[-1]+1 )*400 -> 1287.5503299472803 | C73: =LOG(RC[-2]+1 )*1000 -> 1397.9400086720377
A74: 24 | B74: =LN(RC[-1]+1 )*400 -> 1287.5503299472803 | C74: =LOG(RC[-2]+1 )*1000 -> 1397.9400086720377
A75: 24 | B75: =LN(RC[-1]+1 )*400 -> 1287.5503299472803 | C75: =LOG(RC[-2]+1 )*1000 -> 1397.9400086720377
A76: 24 | B76: =LN(RC[-1]+1 )*400 -> 1287.5503299472803 | C76: =LOG(RC[-2]+1 )*1000 -> 1397.9400086720377
A77: 24 | B77: =LN(RC[-1]+1 )*400 -> 1287.5503299472803 | C77: =LOG(RC[-2]+1 )*1000 -> 1397.9400086720377
A78: 24 | B78: =LN(RC[-1]+1 )*400 -> 1287.5503299472803 | C78: =LOG(RC[-2]+1 )*1000 -> 1397.9400086720377
A79: 22 | B79: =LN(RC[-1]+1 )*400 -> 1254.19768637166 | C79: =LOG(RC[-2]+1 )*1000 -> 1361.7278360175928
A80: 22 | B80: =LN(RC[-1]+1 )*400 -> 1254.19768637166 | C80: =LOG(RC[-2]+1 )*1000 -> 1361.7278360175928
A81: 22 | B81: =LN(RC[-1]+1 )*400 -> 1254.19768637166 | C81: =LOG(RC[-2]+1 )*1000 -> 1361.7278360175928
A82: 22 | B82: =LN(RC[-1]+1 )*400 -> 1254.19768637166 | C82: =LOG(RC[-2]+1 )*1000 -> 1361.7278360175928
A83: 22 | B83: =LN(RC[-1]+1 )*400 -> 1254.19768637166 | C83: =LOG(RC[-2]+1 )*1000 -> 1361.7278360175928
A84: 22 | B84: =LN(RC[-1]+1 )*400 -> 1254.19768637166 | C84: =LOG(RC[-2]+1 )*1000 -> 1361.7278360175928
A85: 22 | B85: =LN(RC[-1]+1 )*400 -> 1254.19768637166 | C85: =LOG(RC[-2]+1 )*1000 -> 1361.7278360175928
A86: 22 | B86: =LN(RC[-1]+1 )*400 -> 1254.19768637166 | C86: =LOG(RC[-2]+1 )*1000 -> 1361.7278360175928
A87: 22 | B87: =LN(RC[-1]+1 )*400 -> 1254.19768637166 | C87: =LOG(RC[-2]+1 )*1000 -> 1361.7278360175928
A88: 22 | B88: =LN(RC[-1]+1 )*400 -> 1254.19768637166 | C88: =LOG(RC[-2]+1 )*1000 -> 1361.7278360175928
A89: 22 | B89: =LN(RC[-1]+1 )*400 -> 1254.19768637166 | C89: =LOG(RC[-2]+1 )*1000 -> 1361.7278360175928
A90: 22 | B90: =LN(RC[-1]+1 )*400 -> 1254.19768637166 | C90: =LOG(RC[-2]+1 )*1000 -> 1361.7278360175928
A91: 20 | B91: =LN(RC[-1]+1 )*400 -> 1217.8089750893691 | C91: =LOG(RC[-2]+1 )*1000 -> 1322.2192947339192
A92: 20 | B92: =LN(RC[-1]+1 )*400 -> 1217.8089750893691 | C92: =LOG(RC[-2]+1 )*1000 -> 1322.2192947339192
A93: 20 | B93: =LN(RC[-1]+1 )*400 -> 1217.8089750893691 | C93: =LOG(RC[-2]+1 )*1000 -> 1322.2192947339192
A94: 20 | B94: =LN(RC[-1]+1 )*400 -> 1217.8089750893691 | C94: =LOG(RC[-2]+1 )*1000 -> 1322.2192947339192
A95: 20 | B95: =LN(RC[-1]+1 )*400 -> 1217.8089750893691 | C95: =LOG(RC[-2]+1 )*1000 -> 1322.2192947339192
A96: 20 | B96: =LN(RC[-1]+1 )*400 -> 1217.8089750893691 | C96: =LOG(RC[-2]+1 )*1000 -> 1322.2192947339192
A97: 20 | B97: =LN(RC[-1]+1 )*400 -> 1217.8089750893691 | C97: =LOG(RC[-2]+1 )*1000 -> 1322.2192947339192
A98: 20 | B98: =LN(RC[-1]+1 )*400 -> 1217.8089750893691 | C98: =LOG(RC[-2]+1 )*1000 -> 1322.2192947339192
A99: 20 | B99: =LN(RC[-1]+1 )*400 -> 1217.8089750893691 | C99: =LOG(RC[-2]+1 )*1000 -> 1322.2192947339192
A100: 20 | B100: =LN(RC[-1]+1 )*400 -> 1217.8089750893691 | C100: =LOG(RC[-2]+1 )*1000 -> 1322.2192947339192
A101: 20 | B101: =LN(RC[-1]+1 )*400 -> 1217.8089750893691 | C101: =LOG(RC[-2]+1 )*1000 -> 1322.2192947339192
A102: 20 | B102: =LN(RC[-1]+1 )*400 -> 1217.8089750893691 | C102: =LOG(RC[-2]+1 )*1000 -> 1322.2192947339192
A103: 20 | B103: =LN(RC[-1]+1 )*400 -> 1217.8089750893691 | C103: =LOG(RC[-2]+1 )*1000 -> 1322.2192947339192
A104: 20 | B104: =LN(RC[-1]+1 )*400 -> 1217.8089750893691 | C104: =LOG(RC[-2]+1 )*1000 -> 1322.2192947339192
A105: 20 | B105: =LN(RC[-1]+1 )*400 -> 1217.8089750893691 | C105: =LOG(RC[-2]+1 )*1000 -> 1322.2192947339192
A106: 20 | B106: =LN(RC[-1]+1 )*400 -> 1217.8089750893691 | C106: =LOG(RC[-2]+1 )*1000 -> 1322.2192947339192
A107: 18 | B107: =LN(RC[-1]+1 )*400 -> 1177.775591666576 | C107: =LOG(RC[-2]+1 )*1000 -> 1278.7536009528289
A108: 18 | B108: =LN(RC[-1]+1 )*400 -> 1177.775591666576 | C108: =LOG(RC[-2]+1 )*1000 -> 1278.7536009528289
A109: 18 | B109: =LN(RC[-1]+1 )*400 -> 1177.775591666576 | C109: =LOG(RC[-2]+1 )*1000 -> 1278.7536009528289
A110: 18 | B110: =LN(RC[-1]+1 )*400 -> 1177.775591666576 | C110: =LOG(RC[-2]+1 )*1000 -> 1278.7536009528289
A111: 18 | B111: =LN(RC[-1]+1 )*400 -> 1177.775591666576 | C111: =LOG(RC[-2]+1 )*1000 -> 1278.7536009528289
A112: 18 | B112: =LN(RC[-1]+1 )*400 -> 1177.775591666576 | C112: =LOG(RC[-2]+1 )*1000 -> 1278.7536009528289
A113: 18 | B113: =LN(RC[-1]+1 )*400 -> 1177.775591666576 | C113: =LOG(RC[-2]+1 )*1000 -> 1278.7536009528289
A114: 18 | B114: =LN(RC[-1]+1 )*400 -> 1177.775591666576 | C114: =LOG(RC[-2]+1 )*1000 -> 1278.7536009528289
A115: 18 | B115: =LN(RC[-1]+1 )*400 -> 1177.775591666576 | C115: =LOG(RC[-2]+1 )*1000 -> 1278.7536009528289
A116: 18 | B116: =LN(RC[-1]+1 )*400 -> 1177.775591666576 | C116: =LOG(RC[-2]+1 )*1000 -> 1278.7536009528289
A117: 16 | B117: =LN(RC[-1]+1 )*400 -> 1133.2853376224864 | C117: =LOG(RC[-2]+1 )*1000 -> 1230.4489213782738
A118: 16 | B118: =LN(RC[-1]+1 )*400 -> 1133.2853376224864 | C118: =LOG(RC[-2]+1 )*1000 -> 1230.4489213782738
A119: 16 | B119: =LN(RC[-1]+1 )*400 -> 1133.2853376224864 | C119: =LOG(RC[-2]+1 )*1000 -> 1230.4489213782738
A120: 16 | B120: =LN(RC[-1]+1 )*400 -> 1133.2853376224864 | C120: =LOG(RC[-2]+1 )*1000 -> 1230.4489213782738
A121: 16 | B121: =LN(RC[-1]+1 )*400 -> 1133.2853376224864 | C121: =LOG(RC[-2]+1 )*1000 -> 1230.4489213782738
A122: 16 | B122: =LN(RC[-1]+1 )*400 -> 1133.2853376224864 | C122: =LOG(RC[-2]+1 )*1000 -> 1230.4489213782738
A123: 16 | B123: =LN(RC[-1]+1 )*400 -> 1133.2853376224864 | C123: =LOG(RC[-2]+1 )*1000 -> 1230.4489213782738
A124: 16 | B124: =LN(RC[-1]+1 )*400 -> 1133.2853376224864 | C124: =LOG(RC[-2]+1 )*1000 -> 1230.4489213782738
A125: 16 | B125: =LN(RC[-1]+1 )*400 -> 1133.2853376224864 | C125: =LOG(RC[-2]+1 )*1000 -> 1230.4489213782738
A126: 16 | B126: =LN(RC[-1]+1 )*400 -> 1133.2853376224864 | C126: =LOG(RC[-2]+1 )*1000 -> 1230.4489213782738
A127: 16 | B127: =LN(RC[-1]+1 )*400 -> 1133.2853376224864 | C127: =LOG(RC[-2]+1 )*1000 -> 1230.4489213782738
A128: 16 | B128: =LN(RC[-1]+1 )*400 -> 1133.2853376224864 | C128: =LOG(RC[-2]+1 )*1000 -> 1230.4489213782738
A129: 16 | B129: =LN(RC[-1]+1 )*400 -> 1133.2853376224864 | C129: =LOG(RC[-2]+1 )*1000 -> 1230.4489213782738
A130: 16 | B130: =LN(RC[-1]+1 )*400 -> 1133.2853376224864 | C130: =LOG(RC[-2]+1 )*1000 -> 1230.4489213782738
A131: 16 | B131: =LN(RC[-1]+1 )*400 -> 1133.2853376224864 | C131: =LOG(RC[-2]+1 )*1000 -> 1230.4489213782738
A132: 16 | B132: =LN(RC[-1]+1 )*400 -> 1133.2853376224864 | C132: =LOG(RC[-2]+1 )*1000 -> 1230.4489213782738
A133: 16 | B133: =LN(RC[-1]+1 )*400 -> 1133.2853376224864 | C133: =LOG(RC[-2]+1 )*1000 -> 1230.4489213782738
A134: 16 | B134: =LN(RC[-1]+1 )*400 -> 1133.2853376224864 | C134: =LOG(RC[-2]+1 )*1000 -> 1230.4489213782738
A135: 16 | B135: =LN(RC[-1]+1 )*400 -> 1133.2853376224864 | C135: =LOG(RC[-2]+1 )*1000 -> 1230.4489213782738
A136: 16 | B136: =LN(RC[-1]+1 )*400 -> 1133.2853376224864 | C136: =LOG(RC[-2]+1 )*1000 -> 1230.4489213782738
A137: 16 | B137: =LN(RC[-1]+1 )*400 -> 1133.2853376224864 | C137: =LOG(RC[-2]+1 )*1000 -> 1230.4489213782738
A138: 16 | B138: =LN(RC[-1]+1 )*400 -> 1133.2853376224864 | C138: =LOG(RC[-2]+1 )*1000 -> 1230.4489213782738
A139: 16 | B139: =LN(RC[-1]+1 )*400 -> 1133.2853376224864 | C139: =LOG(RC[-2]+1 )*1000 -> 1230.4489213782738
A140: 16 | B140: =LN(RC[-1]+1 )*400 -> 1133.2853376224864 | C140: =LOG(RC[-2]+1 )*1000 -> 1230.4489213782738
A141: 16 | B141: =LN(RC[-1]+1 )*400 -> 1133.2853376224864 | C141: =LOG(RC[-2]+1 )*1000 -> 1230.4489213782738
A142: 16 | B142: =LN(RC[-1]+1 )*400 -> 1133.2853376224864 | C142: =LOG(RC[-2]+1 )*1000 -> 1230.4489213782738
A143: 16 | B143: =LN(RC[-1]+1 )*400 -> 1133.2853376224864 | C143: =LOG(RC[-2]+1 )*1000 -> 1230.4489213782738
A144: 14 | B144: =LN(RC[-1]+1 )*400 -> 1083.220080440884 | C144: =LOG(RC[-2]+1 )*1000 -> 1176.0912590556813
A145: 14 | B145: =LN(RC[-1]+1 )*400 -> 1083.220080440884 | C145: =LOG(RC[-2]+1 )*1000 -> 1176.0912590556813
A146: 14 | B146: =LN(RC[-1]+1 )*400 -> 1083.220080440884 | C146: =LOG(RC[-2]+1 )*1000 -> 1176.0912590556813
A147: 14 | B147: =LN(RC[-1]+1 )*400 -> 1083.220080440884 | C147: =LOG(RC[-2]+1 )*1000 -> 1176.0912590556813
A148: 14 | B148: =LN(RC[-1]+1 )*400 -> 1083.220080440884 | C148: =LOG(RC[-2]+1 )*1000 -> 1176.0912590556813
A149: 14 | B149: =LN(RC[-1]+1 )*400 -> 1083.220080440884 | C149: =LOG(RC[-2]+1 )*1000 -> 1176.0912590556813
A150: 14 | B150: =LN(RC[-1]+1 )*400 -> 1083.220080440884 | C150: =LOG(RC[-2]+1 )*1000 -> 1176.0912590556813
A151: 14 | B151: =LN(RC[-1]+1 )*400 -> 1083.220080440884 | C151: =LOG(RC[-2]+1 )*1000 -> 1176.0912590556813
A152: 14 | B152: =LN(RC[-1]+1 )*400 -> 1083.220080440884 | C152: =LOG(RC[-2]+1 )*1000 -> 1176.0912590556813
A153: 14 | B153: =LN(RC[-1]+1 )*400 -> 1083.220080440884 | C153: =LOG(RC[-2]+1 )*1000 -> 1176.0912590556813
A154: 14 | B154: =LN(RC[-1]+1 )*400 -> 1083.220080440884 | C154: =LOG(RC[-2]+1 )*1000 -> 1176.0912590556813
A155: 14 | B155: =LN(RC[-1]+1 )*400 -> 1083.220080440884 | C155: =LOG(RC[-2]+1 )*1000 -> 1176.0912590556813
A156: 14 | B156: =LN(RC[-1]+1 )*400 -> 1083.220080440884 | C156: =LOG(RC[-2]+1 )*1000 -> 1176.0912590556813
A157: 12 | B157: =LN(RC[-1]+1 )*400 -> 1025.9797429846146 | C157: =LOG(RC[-2]+1 )*1000 -> 1113.9433523068367
A158: 12 | B158: =LN(RC[-1]+1 )*400 -> 1025.9797429846146 | C158: =LOG(RC[-2]+1 )*1000 -> 1113.9433523068367
A159: 12 | B159: =LN(RC[-1]+1 )*400 -> 1025.9797429846146 | C159: =LOG(RC[-2]+1 )*1000 -> 1113.9433523068367
A160: 12 | B160: =LN(RC[-1]+1 )*400 -> 1025.9797429846146 | C160: =LOG(RC[-2]+1 )*1000 -> 1113.9433523068367
A161: 12 | B161: =LN(RC[-1]+1 )*400 -> 1025.9797429846146 | C161: =LOG(RC[-2]+1 )*1000 -> 1113.9433523068367
A162: 12 | B162: =LN(RC[-1]+1 )*400 -> 1025.9797429846146 | C162: =LOG(RC[-2]+1 )*1000 -> 1113.9433523068367
A163: 12 | B163: =LN(RC[-1]+1 )*400 -> 1025.9797429846146 | C163: =LOG(RC[-2]+1 )*1000 -> 1113.9433523068367
A164: 12 | B164: =LN(RC[-1]+1 )*400 -> 1025.9797429846146 | C164: =LOG(RC[-2]+1 )*1000 -> 1113.9433523068367
A165: 12 | B165: =LN(RC[-1]+1 )*400 -> 1025.9797429846146 | C165: =LOG(RC[-2]+1 )*1000 -> 1113.9433523068367
A166: 12 | B166: =LN(RC[-1]+1 )*400 -> 1025.9797429846146 | C166: =LOG(RC[-2]+1 )*1000 -> 1113.9433523068367
A167: 12 | B167: =LN(RC[-1]+1 )*400 -> 1025.9797429846146 | C167: =LOG(RC[-2]+1 )*1000 -> 1113.9433523068367
A168: 12 | B168: =LN(RC[-1]+1 )*400 -> 1025.9797429846146 | C168: =LOG(RC[-2]+1 )*1000 -> 1113.9433523068367
A169: 12 | B169: =LN(RC[-1]+1 )*400 -> 1025.9797429846146 | C169: =LOG(RC[-2]+1 )*1000 -> 1113.9433523068367
A170: 12 | B170: =LN(RC[-1]+1 )*400 -> 1025.9797429846146 | C170: =LOG(RC[-2]+1 )*1000 -> 1113.9433523068367
A171: 12 | B171: =LN(RC[-1]+1 )*400 -> 1025.9797429846146 | C171: =LOG(RC[-2]+1 )*1000 -> 1113.9433523068367
A172: 12 | B172: =LN(RC[-1]+1 )*400 -> 1025.9797429846146 | C172: =LOG(RC[-2]+1 )*1000 -> 1113.9433523068367
A173: 12 | B173: =LN(RC[-1]+1 )*400 -> 1025.9797429846146 | C173: =LOG(RC[-2]+1 )*1000 -> 1113.9433523068367
A174: 12 | B174: =LN(RC[-1]+1 )*400 -> 1025.9797429846146 | C174: =LOG(RC[-2]+1 )*1000 -> 1113.9433523068367
A175: 12 | B175: =LN(RC[-1]+1 )*400 -> 1025.9797429846146 | C175: =LOG(RC[-2]+1 )*1000 -> 1113.9433523068367
A176: 12 | B176: =LN(RC[-1]+1 )*400 -> 1025.9797429846146 | C176: =LOG(RC[-2]+1 )*1000 -> 1113.9433523068367
A177: 12 | B177: =LN(RC[-1]+1 )*400 -> 1025.9797429846146 | C177: =LOG(RC[-2]+1 )*1000 -> 1113.9433523068367
A178: 12 | B178: =LN(RC[-1]+1 )*400 -> 1025.9797429846146 | C178: =LOG(RC[-2]+1 )*1000 -> 1113.9433523068367
A179: 12 | B179: =LN(RC[-1]+1 )*400 -> 1025.9797429846146 | C179: =LOG(RC[-2]+1 )*1000 -> 1113.9433523068367
A180: 12 | B180: =LN(RC[-1]+1 )*400 -> 1025.9797429846146 | C180: =LOG(RC[-2]+1 )*1000 -> 1113.9433523068367
A181: 12 | B181: =LN(RC[-1]+1 )*400 -> 1025.9797429846146 | C181: =LOG(RC[-2]+1 )*1000 -> 1113.9433523068367
A182: 12 | B182: =LN(RC[-1]+1 )*400 -> 1025.9797429846146 | C182: =LOG(RC[-2]+1 )*1000 -> 1113.9433523068367
A183: 12 | B183: =LN(RC[-1]+1 )*400 -> 1025.9797429846146 | C183: =LOG(RC[-2]+1 )*1000 -> 1113.9433523068367
A184: 12 | B184: =LN(RC[-1]+1 )*400 -> 1025.9797429846146 | C184: =LOG(RC[-2]+1 )*1000 -> 1113.9433523068367
A185: 12 | B185: =LN(RC[-1]+1 )*400 -> 1025.9797429846146 | C185: =LOG(RC[-2]+1 )*1000 -> 1113.9433523068367
A186: 12 | B186: =LN(RC[-1]+1 )*400 -> 1025.9797429846146 | C186: =LOG(RC[-2]+1 )*1000 -> 1113.9433523068367
A187: 12 | B187: =LN(RC[-1]+1 )*400 -> 1025.9797429846146 | C187: =LOG(RC[-2]+1 )*1000 -> 1113.9433523068367
A188: 12 | B188: =LN(RC[-1]+1 )*400 -> 1025.9797429846146 | C188: =LOG(RC[-2]+1 )*1000 -> 1113.9433523068367
A189: 12 | B189: =LN(RC[-1]+1 )*400 -> 1025.9797429846146 | C189: =LOG(RC[-2]+1 )*1000 -> 1113.9433523068367
A190: 10 | B190: =LN(RC[-1]+1 )*400 -> 959.1581091193483 | C190: =LOG(RC[-2]+1 )*1000 -> 1041.392685158225
A191: 10 | B191: =LN(RC[-1]+1 )*400 -> 959.1581091193483 | C191: =LOG(RC[-2]+1 )*1000 -> 1041.392685158225
A192: 10 | B192: =LN(RC[-1]+1 )*400 -> 959.1581091193483 | C192: =LOG(RC[-2]+1 )*1000 -> 1041.392685158225
A193: 10 | B193: =LN(RC[-1]+1 )*400 -> 959.1581091193483 | C193: =LOG(RC[-2]+1 )*1000 -> 1041.392685158225
A194: 10 | B194: =LN(RC[-1]+1 )*400 -> 959.1581091193483 | C194: =LOG(RC[-2]+1 )*1000 -> 1041.392685158225
A195: 10 | B195: =LN(RC[-1]+1 )*400 -> 959.1581091193483 | C195: =LOG(RC[-2]+1 )*1000 -> 1041.392685158225
A196: 10 | B196: =LN(RC[-1]+1 )*400 -> 959.1581091193483 | C196: =LOG(RC[-2]+1 )*1000 -> 1041.392685158225
A197: 10 | B197: =LN(RC[-1]+1 )*400 -> 959.1581091193483 | C197: =LOG(RC[-2]+1 )*1000 -> 1041.392685158225
A198: 10 | B198: =LN(RC[-1]+1 )*400 -> 959.1581091193483 | C198: =LOG(RC[-2]+1 )*1000 -> 1041.392685158225
A199: 10 | B199: =LN(RC[-1]+1 )*400 -> 959.1581091193483 | C199: =LOG(RC[-2]+1 )*1000 -> 1041.392685158225
A200: 10 | B200: =LN(RC[-1]+1 )*400 -> 959.1581091193483 | C200: =LOG(RC[-2]+1 )*1000 -> 1041.392685158225
A201: 10 | B201: =LN(RC[-1]+1 )*400 -> 959.1581091193483 | C201: =LOG(RC[-2]+1 )*1000 -> 1041.392685158225
A202: 10 | B202: =LN(RC[-1]+1 )*400 -> 959.1581091193483 | C202: =LOG(RC[-2]+1 )*1000 -> 1041.392685158225
A203: 10 | B203: =LN(RC[-1]+1 )*400 -> 959.1581091193483 | C203: =LOG(RC[-2]+1 )*1000 -> 1041.392685158225
A204: 10 | B204: =LN(RC[-1]+1 )*400 -> 959.1581091193483 | C204: =LOG(RC[-2]+1 )*1000 -> 1041.392685158225
A205: 10 | B205: =LN(RC[-1]+1 )*400 -> 959.1581091193483 | C205: =LOG(RC[-2]+1 )*1000 -> 1041.392685158225
A206: 10 | B206: =LN(RC[-1]+1 )*400 -> 959.1581091193483 | C206: =LOG(RC[-2]+1 )*1000 -> 1041.392685158225
A207: 10 | B207: =LN(RC[-1]+1 )*400 -> 959.1581091193483 | C207: =LOG(RC[-2]+1 )*1000 -> 1041.392685158225
A208: 10 | B208: =LN(RC[-1]+1 )*400 -> 959.1581091193483 | C208: =LOG(RC[-2]+1 )*1000 -> 1041.392685158225
A209: 10 | B209: =LN(RC[-1]+1 )*400 -> 959.1581091193483 | C209: =LOG(RC[-2]+1 )*1000 -> 1041.392685158225
A210: 10 | B210: =LN(RC[-1]+1 )*400 -> 959.1581091193483 | C210: =LOG(RC[-2]+1 )*1000 -> 1041.392685158225
A211: 10 | B211: =LN(RC[-1]+1 )*400 -> 959.1581091193483 | C211: =LOG(RC[-2]+1 )*1000 -> 1041.392685158225
A212: 10 | B212: =LN(RC[-1]+1 )*400 -> 959.1581091193483 | C212: =LOG(RC[-2]+1 )*1000 -> 1041.392685158225
A213: 10 | B213: =LN(RC[-1]+1 )*400 -> 959.1581091193483 | C213: =LOG(RC[-2]+1 )*1000 -> 1041.392685158225
A214: 10 | B214: =LN(RC[-1]+1 )*400 -> 959.1581091193483 | C214: =LOG(RC[-2]+1 )*1000 -> 1041.392685158225
A215: 10 | B215: =LN(RC[-1]+1 )*400 -> 959.1581091193483 | C215: =LOG(RC[-2]+1 )*1000 -> 1041.392685158225
A216: 10 | B216: =LN(RC[-1]+1 )*400 -> 959.1581091193483 | C216: =LOG(RC[-2]+1 )*1000 -> 1041.392685158225
A217: 10 | B217: =LN(RC[-1]+1 )*400 -> 959.1581091193483 | C217: =LOG(RC[-2]+1 )*1000 -> 1041.392685158225
A218: 10 | B218: =LN(RC[-1]+1 )*400 -> 959.1581091193483 | C218: =LOG(RC[-2]+1 )*1000 -> 1041.392685158225
A219: 10 | B219: =LN(RC[-1]+1 )*400 -> 959.1581091193483 | C219: =LOG(RC[-2]+1 )*1000 -> 1041.392685158225
A220: 8 | B220: =LN(RC[-1]+1 )*400 -> 878.8898309344878 | C220: =LOG(RC[-2]+1 )*1000 -> 954.24250943932486
A221: 8 | B221: =LN(RC[-1]+1 )*400 -> 878.8898309344878 | C221: =LOG(RC[-2]+1 )*1000 -> 954.24250943932486
A222: 8 | B222: =LN(RC[-1]+1 )*400 -> 878.8898309344878 | C222: =LOG(RC[-2]+1 )*1000 -> 954.24250943932486
A223: 8 | B223: =LN(RC[-1]+1 )*400 -> 878.8898309344878 | C223: =LOG(RC[-2]+1 )*1000 -> 954.24250943932486
A224: 8 | B224: =LN(RC[-1]+1 )*400 -> 878.8898309344878 | C224: =LOG(RC[-2]+1 )*1000 -> 954.24250943932486
A225: 8 | B225: =LN(RC[-1]+1 )*400 -> 878.8898309344878 | C225: =LOG(RC[-2]+1 )*1000 -> 954.24250943932486
A226: 8 | B226: =LN(RC[-1]+1 )*400 -> 878.8898309344878 | C226: =LOG(RC[-2]+1 )*1000 -> 954.24250943932486
A227: 8 | B227: =LN(RC[-1]+1 )*400 -> 878.8898309344878 | C227: =LOG(RC[-2]+1 )*1000 -> 954.24250943932486
A228: 8 | B228: =LN(RC[-1]+1 )*400 -> 878.8898309344878 | C228: =LOG(RC[-2]+1 )*1000 -> 954.24250943932486
A229: 8 | B229: =LN(RC[-1]+1 )*400 -> 878.8898309344878 | C229: =LOG(RC[-2]+1 )*1000 -> 954.24250943932486
A230: 8 | B230: =LN(RC[-1]+1 )*400 -> 878.8898309344878 | C230: =LOG(RC[-2]+1 )*1000 -> 954.24250943932486
A231: 8 | B231: =LN(RC[-1]+1 )*400 -> 878.8898309344878 | C231: =LOG(RC[-2]+1 )*1000 -> 954.24250943932486
A232: 8 | B232: =LN(RC[-1]+1 )*400 -> 878.8898309344878 | C232: =LOG(RC[-2]+1 )*1000 -> 954.24250943932486
A233: 8 | B233: =LN(RC[-1]+1 )*400 -> 878.8898309344878 | C233: =LOG(RC[-2]+1 )*1000 -> 954.24250943932486
A234: 8 | B234: =LN(RC[-1]+1 )*400 -> 878.8898309344878 | C234: =LOG(RC[-2]+1 )*1000 -> 954.24250943932486
A235: 8 | B235: =LN(RC[-1]+1 )*400 -> 878.8898309344878 | C235: =LOG(RC[-2]+1 )*1000 -> 954.24250943932486
A236: 8 | B236: =LN(RC[-1]+1 )*400 -> 878.8898309344878 | C236: =LOG(RC[-2]+1 )*1000 -> 954.24250943932486
A237: 8 | B237: =LN(RC[-1]+1 )*400 -> 878.8898309344878 | C237: =LOG(RC[-2]+1 )*1000 -> 954.24250943932486
A238: 8 | B238: =LN(RC[-1]+1 )*400 -> 878.8898309344878 | C238: =LOG(RC[-2]+1 )*1000 -> 954.24250943932486
A239: 8 | B239: =LN(RC[-1]+1 )*400 -> 878.8898309344878 | C239: =LOG(RC[-2]+1 )*1000 -> 954.24250943932486
A240: 8 | B240: =LN(RC[-1]+1 )*400 -> 878.8898309344878 | C240: =LOG(RC[-2]+1 )*1000 -> 954.24250943932486
A241: 8 | B241: =LN(RC[-1]+1 )*400 -> 878.8898309344878 | C241: =LOG(RC[-2]+1 )*1000 -> 954.24250943932486
A242: 8 | B242: =LN(RC[-1]+1 )*400 -> 878.8898309344878 | C242: =LOG(RC[-2]+1 )*1000 -> 954.24250943932486
A243: 8 | B243: =LN(RC[-1]+1 )*400 -> 878.8898309344878 | C243: =LOG(RC[-2]+1 )*1000 -> 954.24250943932486
A244: 8 | B244: =LN(RC[-1]+1 )*400 -> 878.8898309344878 | C244: =LOG(RC[-2]+1 )*1000 -> 954.24250943932486
A245: 8 | B245: =LN(RC[-1]+1 )*400 -> 878.8898309344878 | C245: =LOG(RC[-2]+1 )*1000 -> 954.24250943932486
A246: 8 | B246: =LN(RC[-1]+1 )*400 -> 878.8898309344878 | C246: =LOG(RC[-2]+1 )*1000 -> 954.24250943932486
A247: 8 | B247: =LN(RC[-1]+1 )*400 -> 878.8898309344878 | C247: =LOG(RC[-2]+1 )*1000 -> 954.24250943932486
A248: 8 | B248: =LN(RC[-1]+1 )*400 -> 878.8898309344878 | C248: =LOG(RC[-2]+1 )*1000 -> 954.24250943932486
A249: 8 | B249: =LN(RC[-1]+1 )*400 -> 878.8898309344878 | C249: =LOG(RC[-2]+1 )*1000 -> 954.24250943932486
A250: 8 | B250: =LN(RC[-1]+1 )*400 -> 878.8898309344878 | C250: =LOG(RC[-2]+1 )*1000 -> 954.24250943932486
A251: 8 | B251: =LN(RC[-1]+1 )*400 -> 878.8898309344878 | C251: =LOG(RC[-2]+1 )*1000 -> 954.24250943932486
A252: 8 | B252: =LN(RC[-1]+1 )*400 -> 878.8898309344878 | C252: =LOG(RC[-2]+1 )*1000 -> 954.24250943932486
A253: 8 | B253: =LN(RC[-1]+1 )*400 -> 878.8898309344878 | C253: =LOG(RC[-2]+1 )*1000 -> 954.24250943932486
A254: 8 | B254: =LN(RC[-1]+1 )*400 -> 878.8898309344878 | C254: =LOG(RC[-2]+1 )*1000 -> 954.24250943932486
A255: 8 | B255: =LN(RC[-1]+1 )*400 -> 878.8898309344878 | C255: =LOG(RC[-2]+1 )*1000 -> 954.24250943932486
A256: 8 | B256: =LN(RC[-1]+1 )*400 -> 878.8898309344878 | C256: =LOG(RC[-2]+1 )*1000 -> 954.24250943932486
A257: 8 | B257: =LN(RC[-1]+1 )*400 -> 878.8898309344878 | C257: =LOG(RC[-2]+1 )*1000 -> 954.24250943932486
A258: 8 | B258: =LN(RC[-1]+1 )*400 -> 878.8898309344878 | C258: =LOG(RC[-2]+1 )*1000 -> 954.24250943932486
A259: 8 | B259: =LN(RC[-1]+1 )*400 -> 878.8898309344878 | C259: =LOG(RC[-2]+1 )*1000 -> 954.24250943932486
A260: 8 | B260: =LN(RC[-1]+1 )*400 -> 878.8898309344878 | C260: =LOG(RC[-2]+1 )*1000 -> 954.24250943932486
A261: 8 | B261: =LN(RC[-1]+1 )*400 -> 878.8898309344878 | C261: =LOG(RC[-2]+1 )*1000 -> 954.24250943932486
A262: 8 | B262: =LN(RC[-1]+1 )*400 -> 878.8898309344878 | C262: =LOG(RC[-2]+1 )*1000 -> 954.24250943932486
A263: 8 | B263: =LN(RC[-1]+1 )*400 -> 878.8898309344878 | C263: =LOG(RC[-2]+1 )*1000 -> 954.24250943932486
A264: 8 | B264: =LN(RC[-1]+1 )*400 -> 878.8898309344878 | C264: =LOG(RC[-2]+1 )*1000 -> 954.24250943932486
A265: 8 | B265: =LN(RC[-1]+1 )*400 -> 878.8898309344878 | C265: =LOG(RC[-2]+1 )*1000 -> 954.24250943932486
A266: 8 | B266: =LN(RC[-1]+1 )*400 -> 878.8898309344878 | C266: =LOG(RC[-2]+1 )*1000 -> 954.24250943932486
A267: 8 | B267: =LN(RC[-1]+1 )*400 -> 878.8898309344878 | C267: =LOG(RC[-2]+1 )*1000 -> 954.24250943932486
A268: 8 | B268: =LN(RC[-1]+1 )*400 -> 878.8898309344878 | C268: =LOG(RC[-2]+1 )*1000 -> 954.24250943932486
A269: 8 | B269: =LN(RC[-1]+1 )*400 -> 878.8898309344878 | C269: =LOG(RC[-2]+1 )*1000 -> 954.24250943932486
A270: 8 | B270: =LN(RC[-1]+1 )*400 -> 878.8898309344878 | C270: =LOG(RC[-2]+1 )*1000 -> 954.24250943932486
A271: 8 | B271: =LN(RC[-1]+1 )*400 -> 878.8898309344878 | C271: =LOG(RC[-2]+1 )*1000 -> 954.24250943932486
A272: 8 | B272: =LN(RC[-1]+1 )*400 -> 878.8898309344878 | C272: =LOG(RC[-2]+1 )*1000 -> 954.24250943932486
A273: 8 | B273: =LN(RC[-1]+1 )*400 -> 878.8898309344878 | C273: =LOG(RC[-2]+1 )*1000 -> 954.24250943932486
A274: 8 | B274: =LN(RC[-1]+1 )*400 -> 878.8898309344878 | C274: =LOG(RC[-2]+1 )*1000 -> 954.24250943932486
A275: 8 | B275: =LN(RC[-1]+1 )*400 -> 878.8898309344878 | C275: =LOG(RC[-2]+1 )*1000 -> 954.24250943932486
A276: 8 | B276: =LN(RC[-1]+1 )*400 -> 878.8898309344878 | C276: =LOG(RC[-2]+1 )*1000 -> 954.24250943932486
A277: 8 | B277: =LN(RC[-1]+1 )*400 -> 878.8898309344878 | C277: =LOG(RC[-2]+1 )*1000 -> 954.24250943932486
A278: 8 | B278: =LN(RC[-1]+1 )*400 -> 878.8898309344878 | C278: =LOG(RC[-2]+1 )*1000 -> 954.24250943932486
A279: 8 | B279: =LN(RC[-1]+1 )*400 -> 878.8898309344878 | C279: =LOG(RC[-2]+1 )*1000 -> 954.24250943932486
A280: 8 | B280: =LN(RC[-1]+1 )*400 -> 878.8898309344878 | C280: =LOG(RC[-2]+1 )*1000 -> 954.24250943932486
A281: 8 | B281: =LN(RC[-1]+1 )*400 -> 878.8898309344878 | C281: =LOG(RC[-2]+1 )*1000 -> 954.24250943932486
A282: 8 | B282: =LN(RC[-1]+1 )*400 -> 878.8898309344878 | C282: =LOG(RC[-2]+1 )*1000 -> 954.24250943932486
A283: 8 | B283: =LN(RC[-1]+1 )*400 -> 878.8898309344878 | C283: =LOG(RC[-2]+1 )*1000 -> 954.24250943932486
A284: 8 | B284: =LN(RC[-1]+1 )*400 -> 878.8898309344878 | C284: =LOG(RC[-2]+1 )*1000 -> 954.24250943932486
A285: 8 | B285: =LN(RC[-1]+1 )*400 -> 878.8898309344878 | C285: =LOG(RC[-2]+1 )*1000 -> 954.24250943932486
A286: 8 | B286: =LN(RC[-1]+1 )*400 -> 878.8898309344878 | C286: =LOG(RC[-2]+1 )*1000 -> 954.24250943932486
A287: 8 | B287: =LN(RC[-1]+1 )*400 -> 878.8898309344878 | C287: =LOG(RC[-2]+1 )*1000 -> 954.24250943932486
A288: 8 | B288: =LN(RC[-1]+1 )*400 -> 878.8898309344878 | C288: =LOG(RC[-2]+1 )*1000 -> 954.24250943932486
A289: 8 | B289: =LN(RC[-1]+1 )*400 -> 878.8898309344878 | C289: =LOG(RC[-2]+1 )*1000 -> 954.24250943932486
A290: 8 | B290: =LN(RC[-1]+1 )*400 -> 878.8898309344878 | C290: =LOG(RC[-2]+1 )*1000 -> 954.24250943932486
A291: 8 | B291: =LN(RC[-1]+1 )*400 -> 878.8898309344878 | C291: =LOG(RC[-2]+1 )*1000 -> 954.24250943932486
A292: 8 | B292: =LN(RC[-1]+1 )*400 -> 878.8898309344878 | C292: =LOG(RC[-2]+1 )*1000 -> 954.24250943932486
A293: 8 | B293: =LN(RC[-1]+1 )*400 -> 878.8898309344878 | C293: =LOG(RC[-2]+1 )*1000 -> 954.24250943932486
A294: 8 | B294: =LN(RC[-1]+1 )*400 -> 878.8898309344878 | C294: =LOG(RC[-2]+1 )*1000 -> 954.24250943932486
A295: 8 | B295: =LN(RC[-1]+1 )*400 -> 878.8898309344878 | C295: =LOG(RC[-2]+1 )*1000 -> 954.24250943932486
A296: 8 | B296: =LN(RC[-1]+1 )*400 -> 878.8898309344878 | C296: =LOG(RC[-2]+1 )*1000 -> 954.24250943932486
A297: 8 | B297: =LN(RC[-1]+1 )*400 -> 878.8898309344878 | C297: =LOG(RC[-2]+1 )*1000 -> 954.24250943932486
A298: 6 | B298: =LN(RC[-1]+1 )*400 -> 778.3640596221253 | C298: =LOG(RC[-2]+1 )*1000 -> 845.09804001425687
A299: 6 | B299: =LN(RC[-1]+1 )*400 -> 778.3640596221253 | C299: =LOG(RC[-2]+1 )*1000 -> 845.09804001425687
A300: 6 | B300: =LN(RC[-1]+1 )*400 -> 778.3640596221253 | C300: =LOG(RC[-2]+1 )*1000 -> 845.09804001425687
A301: 6 | B301: =LN(RC[-1]+1 )*400 -> 778.3640596221253 | C301: =LOG(RC[-2]+1 )*1000 -> 845.09804001425687
A302: 6 | B302: =LN(RC[-1]+1 )*400 -> 778.3640596221253 | C302: =LOG(RC[-2]+1 )*1000 -> 845.09804001425687
A303: 6 | B303: =LN(RC[-1]+1 )*400 -> 778.3640596221253 | C303: =LOG(RC[-2]+1 )*1000 -> 845.09804001425687
A304: 6 | B304: =LN(RC[-1]+1 )*400 -> 778.3640596221253 | C304: =LOG(RC[-2]+1 )*1000 -> 845.09804001425687
A305: 6 | B305: =LN(RC[-1]+1 )*400 -> 778.3640596221253 | C305: =LOG(RC[-2]+1 )*1000 -> 845.09804001425687
A306: 6 | B306: =LN(RC[-1]+1 )*400 -> 778.3640596221253 | C306: =LOG(RC[-2]+1 )*1000 -> 845.09804001425687
A307: 6 | B307: =LN(RC[-1]+1 )*400 -> 778.3640596221253 | C307: =LOG(RC[-2]+1 )*1000 -> 845.09804001425687
A308: 6 | B308: =LN(RC[-1]+1 )*400 -> 778.3640596221253 | C308: =LOG(RC[-2]+1 )*1000 -> 845.09804001425687
A309: 6 | B309: =LN(RC[-1]+1 )*400 -> 778.3640596221253 | C309: =LOG(RC[-2]+1 )*1000 -> 845.09804001425687
A310: 6 | B310: =LN(RC[-1]+1 )*400 -> 778.3640596221253 | C310: =LOG(RC[-2]+1 )*1000 -> 845.09804001425687
A311: 6 | B311: =LN(RC[-1]+1 )*400 -> 778.3640596221253 | C311: =LOG(RC[-2]+1 )*1000 -> 845.09804001425687
A312: 6 | B312: =LN(RC[-1]+1 )*400 -> 778.3640596221253 | C312: =LOG(RC[-2]+1 )*1000 -> 845.09804001425687
A313: 6 | B313: =LN(RC[-1]+1 )*400 -> 778.3640596221253 | C313: =LOG(RC[-2]+1 )*1000 -> 845.09804001425687
A314: 6 | B314: =LN(RC[-1]+1 )*400 -> 778.3640596221253 | C314: =LOG(RC[-2]+1 )*1000 -> 845.09804001425687
A315: 6 | B315: =LN(RC[-1]+1 )*400 -> 778.3640596221253 | C315: =LOG(RC[-2]+1 )*1000 -> 845.09804001425687
A316: 6 | B316: =LN(RC[-1]+1 )*400 -> 778.3640596221253 | C316: =LOG(RC[-2]+1 )*1000 -> 845.09804001425687
A317: 6 | B317: =LN(RC[-1]+1 )*400 -> 778.3640596221253 | C317: =LOG(RC[-2]+1 )*1000 -> 845.09804001425687
A318: 6 | B318: =LN(RC[-1]+1 )*400 -> 778.3640596221253 | C318: =LOG(RC[-2]+1 )*1000 -> 845.09804001425687
A319: 6 | B319: =LN(RC[-1]+1 )*400 -> 778.3640596221253 | C319: =LOG(RC[-2]+1 )*1000 -> 845.09804001425687
A320: 6 | B320: =LN(RC[-1]+1 )*400 -> 778.3640596221253 | C320: =LOG(RC[-2]+1 )*1000 -> 845.09804001425687
A321: 6 | B321: =LN(RC[-1]+1 )*400 -> 778.3640596221253 | C321: =LOG(RC[-2]+1 )*1000 -> 845.09804001425687
A322: 6 | B322: =LN(RC[-1]+1 )*400 -> 778.3640596221253 | C322: =LOG(RC[-2]+1 )*1000 -> 845.09804001425687
A323: 6 | B323: =LN(RC[-1]+1 )*400 -> 778.3640596221253 | C323: =LOG(RC[-2]+1 )*1000 -> 845.09804001425687
A324: 6 | B324: =LN(RC[-1]+1 )*400 -> 778.3640596221253 | C324: =LOG(RC[-2]+1 )*1000 -> 845.09804001425687
A325: 6 | B325: =LN(RC[-1]+1 )*400 -> 778.3640596221253 | C325: =LOG(RC[-2]+1 )*1000 -> 845.09804001425687
A326: 6 | B326: =LN(RC[-1]+1 )*400 -> 778.3640596221253 | C326: =LOG(RC[-2]+1 )*1000 -> 845.09804001425687
A327: 6 | B327: =LN(RC[-1]+1 )*400 -> 778.3640596221253 | C327: =LOG(RC[-2]+1 )*1000 -> 845.09804001425687
A328: 6 | B328: =LN(RC[-1]+1 )*400 -> 778.3640596221253 | C328: =LOG(RC[-2]+1 )*1000 -> 845.09804001425687
A329: 6 | B329: =LN(RC[-1]+1 )*400 -> 778.3640596221253 | C329: =LOG(RC[-2]+1 )*1000 -> 845.09804001425687
A330: 6 | B330: =LN(RC[-1]+1 )*400 -> 778.3640596221253 | C330: =LOG(RC[-2]+1 )*1000 -> 845.09804001425687
A331: 6 | B331: =LN(RC[-1]+1 )*400 -> 778.3640596221253 | C331: =LOG(RC[-2]+1 )*1000 -> 845.09804001425687
A332: 6 | B332: =LN(RC[-1]+1 )*400 -> 778.3640596221253 | C332: =LOG(RC[-2]+1 )*1000 -> 845.09804001425687
A333: 6 | B333: =LN(RC[-1]+1 )*400 -> 778.3640596221253 | C333: =LOG(RC[-2]+1 )*1000 -> 845.09804001425687
A334: 6 | B334: =LN(RC[-1]+1 )*400 -> 778.3640596221253 | C334: =LOG(RC[-2]+1 )*1000 -> 845.09804001425687
A335: 6 | B335: =LN(RC[-1]+1 )*400 -> 778.3640596221253 | C335: =LOG(RC[-2]+1 )*1000 -> 845.09804001425687
A336: 6 | B336: =LN(RC[-1]+1 )*400 -> 778.3640596221253 | C336: =LOG(RC[-2]+1 )*1000 -> 845.09804001425687
A337: 6 | B337: =LN(RC[-1]+1 )*400 -> 778.3640596221253 | C337: =LOG(RC[-2]+1 )*1000 -> 845.09804001425687
A338: 6 | B338: =LN(RC[-1]+1 )*400 -> 778.3640596221253 | C338: =LOG(RC[-2]+1 )*1000 -> 845.09804001425687
A339: 6 | B339: =LN(RC[-1]+1 )*400 -> 778.3640596221253 | C339: =LOG(RC[-2]+1 )*1000 -> 845.09804001425687
A340: 6 | B340: =LN(RC[-1]+1 )*400 -> 778.3640596221253 | C340: =LOG(RC[-2]+1 )*1000 -> 845.09804001425687
A341: 6 | B341: =LN(RC[-1]+1 )*400 -> 778.3640596221253 | C341: =LOG(RC[-2]+1 )*1000 -> 845.09804001425687
A342: 6 | B342: =LN(RC[-1]+1 )*400 -> 778.3640596221253 | C342: =LOG(RC[-2]+1 )*1000 -> 845.09804001425687
A343: 6 | B343: =LN(RC[-1]+1 )*400 -> 778.3640596221253 | C343: =LOG(RC[-2]+1 )*1000 -> 845.09804001425687
A344: 6 | B344: =LN(RC[-1]+1 )*400 -> 778.3640596221253 | C344: =LOG(RC[-2]+1 )*1000 -> 845.09804001425687
A345: 6 | B345: =LN(RC[-1]+1 )*400 -> 778.3640596221253 | C345: =LOG(RC[-2]+1 )*1000 -> 845.09804001425687
A346: 6 | B346: =LN(RC[-1]+1 )*400 -> 778.3640596221253 | C346: =LOG(RC[-2]+1 )*1000 -> 845.09804001425687
A347: 6 | B347: =LN(RC[-1]+1 )*400 -> 778.3640596221253 | C347: =LOG(RC[-2]+1 )*1000 -> 845.09804001425687
A348: 6 | B348: =LN(RC[-1]+1 )*400 -> 778.3640596221253 | C348: =LOG(RC[-2]+1 )*1000 -> 845.09804001425687
A349: 6 | B349: =LN(RC[-1]+1 )*400 -> 778.3640596221253 | C349: =LOG(RC[-2]+1 )*1000 -> 845.09804001425687
A350: 6 | B350: =LN(RC[-1]+1 )*400 -> 778.3640596221253 | C350: =LOG(RC[-2]+1 )*1000 -> 845.09804001425687
A351: 6 | B351: =LN(RC[-1]+1 )*400 -> 778.3640596221253 | C351: =LOG(RC[-2]+1 )*1000 -> 845.09804001425687
A352: 6 | B352: =LN(RC[-1]+1 )*400 -> 778.3640596221253 | C352: =LOG(RC[-2]+1 )*1000 -> 845.09804001425687
A353: 6 | B353: =LN(RC[-1]+1 )*400 -> 778.3640596221253 | C353: =LOG(RC[-2]+1 )*1000 -> 845.09804001425687
A354: 6 | B354: =LN(RC[-1]+1 )*400 -> 778.3640596221253 | C354: =LOG(RC[-2]+1 )*1000 -> 845.09804001425687
A355: 6 | B355: =LN(RC[-1]+1 )*400 -> 778.3640596221253 | C355: =LOG(RC[-2]+1 )*1000 -> 845.09804001425687
A356: 6 | B356: =LN(RC[-1]+1 )*400 -> 778.3640596221253 | C356: =LOG(RC[-2]+1 )*1000 -> 845.09804001425687
A357: 6 | B357: =LN(RC[-1]+1 )*400 -> 778.3640596221253 | C357: =LOG(RC[-2]+1 )*1000 -> 845.09804001425687
A358: 6 | B358: =LN(RC[-1]+1 )*400 -> 778.3640596221253 | C358: =LOG(RC[-2]+1 )*1000 -> 845.09804001425687
A359: 6 | B359: =LN(RC[-1]+1 )*400 -> 778.3640596221253 | C359: =LOG(RC[-2]+1 )*1000 -> 845.09804001425687
A360: 6 | B360: =LN(RC[-1]+1 )*400 -> 778.3640596221253 | C360: =LOG(RC[-2]+1 )*1000 -> 845.09804001425687
A361: 6 | B361: =LN(RC[-1]+1 )*400 -> 778.3640596221253 | C361: =LOG(RC[-2]+1 )*1000 -> 845.09804001425687
A362: 6 | B362: =LN(RC[-1]+1 )*400 -> 778.3640596221253 | C362: =LOG(RC[-2]+1 )*1000 -> 845.09804001425687
A363: 6 | B363: =LN(RC[-1]+1 )*400 -> 778.3640596221253 | C363: =LOG(RC[-2]+1 )*1000 -> 845.09804001425687
A364: 6 | B364: =LN(RC[-1]+1 )*400 -> 778.3640596221253 | C364: =LOG(RC[-2]+1 )*1000 -> 845.09804001425687
A365: 6 | B365: =LN(RC[-1]+1 )*400 -> 778.3640596221253 | C365: =LOG(RC[-2]+1 )*1000 -> 845.09804001425687
A366: 6 | B366: =LN(RC[-1]+1 )*400 -> 778.3640596221253 | C366: =LOG(RC[-2]+1 )*1000 -> 845.09804001425687
A367: 6 | B367: =LN(RC[-1]+1 )*400 -> 778.3640596221253 | C367: =LOG(RC[-2]+1 )*1000 -> 845.09804001425687
A368: 6 | B368: =LN(RC[-1]+1 )*400 -> 778.3640596221253 | C368: =LOG(RC[-2]+1 )*1000 -> 845.09804001425687
A369: 6 | B369: =LN(RC[-1]+1 )*400 -> 778.3640596221253 | C369: =LOG(RC[-2]+1 )*1000 -> 845.09804001425687
A370: 6 | B370: =LN(RC[-1]+1 )*400 -> 778.3640596221253 | C370: =LOG(RC[-2]+1 )*1000 -> 845.09804001425687
A371: 6 | B371: =LN(RC[-1]+1 )*400 -> 778.3640596221253 | C371: =LOG(RC[-2]+1 )*1000 -> 845.09804001425687
A372: 6 | B372: =LN(RC[-1]+1 )*400 -> 778.3640596221253 | C372: =LOG(RC[-2]+1 )*1000 -> 845.09804001425687
A373: 6 | B373: =LN(RC[-1]+1 )*400 -> 778.3640596221253 | C373: =LOG(RC[-2]+1 )*1000 -> 845.09804001425687
A374: 6 | B374: =LN(RC[-1]+1 )*400 -> 778.3640596221253 | C374: =LOG(RC[-2]+1 )*1000 -> 845.09804001425687
A375: 6 | B375: =LN(RC[-1]+1 )*400 -> 778.3640596221253 | C375: =LOG(RC[-2]+1 )*1000 -> 845.09804001425687
A376: 6 | B376: =LN(RC[-1]+1 )*400 -> 778.3640596221253 | C376: =LOG(RC[-2]+1 )*1000 -> 845.09804001425687
A377: 6 | B377: =LN(RC[-1]+1 )*400 -> 778.3640596221253 | C377: =LOG(RC[-2]+1 )*1000 -> 845.09804001425687
A378: 4 | B378: =LN(RC[-1]+1 )*400 -> 643.77516497364013 | C378: =LOG(RC[-2]+1 )*1000 -> 698.97000433601886
A379: 4 | B379: =LN(RC[-1]+1 )*400 -> 643.77516497364013 | C379: =LOG(RC[-2]+1 )*1000 -> 698.97000433601886
A380: 4 | B380: =LN(RC[-1]+1 )*400 -> 643.77516497364013 | C380: =LOG(RC[-2]+1 )*1000 -> 698.97000433601886
A381: 4 | B381: =LN(RC[-1]+1 )*400 -> 643.77516497364013 | C381: =LOG(RC[-2]+1 )*1000 -> 698.97000433601886
A382: 4 | B382: =LN(RC[-1]+1 )*400 -> 643.77516497364013 | C382: =LOG(RC[-2]+1 )*1000 -> 698.97000433601886
A383: 4 | B383: =LN(RC[-1]+1 )*400 -> 643.77516497364013 | C383: =LOG(RC[-2]+1 )*1000 -> 698.97000433601886
A384: 4 | B384: =LN(RC[-1]+1 )*400 -> 643.77516497364013 | C384: =LOG(RC[-2]+1 )*1000 -> 698.97000433601886
A385: 4 | B385: =LN(RC[-1]+1 )*400 -> 643.77516497364013 | C385: =LOG(RC[-2]+1 )*1000 -> 698.97000433601886
A386: 4 | B386: =LN(RC[-1]+1 )*400 -> 643.77516497364013 | C386: =LOG(RC[-2]+1 )*1000 -> 698.97000433601886
A387: 4 | B387: =LN(RC[-1]+1 )*400 -> 643.77516497364013 | C387: =LOG(RC[-2]+1 )*1000 -> 698.97000433601886
A388: 4 | B388: =LN(RC[-1]+1 )*400 -> 643.77516497364013 | C388: =LOG(RC[-2]+1 )*1000 -> 698.97000433601886
A389: 4 | B389: =LN(RC[-1]+1 )*400 -> 643.77516497364013 | C389: =LOG(RC[-2]+1 )*1000 -> 698.97000433601886
A390: 4 | B390: =LN(RC[-1]+1 )*400 -> 643.77516497364013 | C390: =LOG(RC[-2]+1 )*1000 -> 698.97000433601886
A391: 4 | B391: =LN(RC[-1]+1 )*400 -> 643.77516497364013 | C391: =LOG(RC[-2]+1 )*1000 -> 698.97000433601886
A392: 4 | B392: =LN(RC[-1]+1 )*400 -> 643.77516497364013 | C392: =LOG(RC[-2]+1 )*1000 -> 698.97000433601886
A393: 4 | B393: =LN(RC[-1]+1 )*400 -> 643.77516497364013 | C393: =LOG(RC[-2]+1 )*1000 -> 698.97000433601886
A394: 4 | B394: =LN(RC[-1]+1 )*400 -> 643.77516497364013 | C394: =LOG(RC[-2]+1 )*1000 -> 698.97000433601886
A395: 4 | B395: =LN(RC[-1]+1 )*400 -> 643.77516497364013 | C395: =LOG(RC[-2]+1 )*1000 -> 698.97000433601886
A396: 4 | B396: =LN(RC[-1]+1 )*400 -> 643.77516497364013 | C396: =LOG(RC[-2]+1 )*1000 -> 698.97000433601886
A397: 4 | B397: =LN(RC[-1]+1 )*400 -> 643.77516497364013 | C397: =LOG(RC[-2]+1 )*1000 -> 698.97000433601886
A398: 4 | B398: =LN(RC[-1]+1 )*400 -> 643.77516497364013 | C398: =LOG(RC[-2]+1 )*1000 -> 698.97000433601886
A399: 4 | B399: =LN(RC[-1]+1 )*400 -> 643.77516497364013 | C399: =LOG(RC[-2]+1 )*1000 -> 698.97000433601886
A400: 4 | B400: =LN(RC[-1]+1 )*400 -> 643.77516497364013 | C400: =LOG(RC[-2]+1 )*1000 -> 698.97000433601886
A401: 4 | B401: =LN(RC[-1]+1 )*400 -> 643.77516497364013 | C401: =LOG(RC[-2]+1 )*1000 -> 698.97000433601886
A402: 4 | B402: =LN(RC[-1]+1 )*400 -> 643.77516497364013 | C402: =LOG(RC[-2]+1 )*1000 -> 698.97000433601886
A403: 4 | B403: =LN(RC[-1]+1 )*400 -> 643.77516497364013 | C403: =LOG(RC[-2]+1 )*1000 -> 698.97000433601886
A404: 4 | B404: =LN(RC[-1]+1 )*400 -> 643.77516497364013 | C404: =LOG(RC[-2]+1 )*1000 -> 698.97000433601886
A405: 4 | B405: =LN(RC[-1]+1 )*400 -> 643.77516497364013 | C405: =LOG(RC[-2]+1 )*1000 -> 698.97000433601886
A406: 4 | B406: =LN(RC[-1]+1 )*400 -> 643.77516497364013 | C406: =LOG(RC[-2]+1 )*1000 -> 698.97000433601886
A407: 4 | B407: =LN(RC[-1]+1 )*400 -> 643.77516497364013 | C407: =LOG(RC[-2]+1 )*1000 -> 698.97000433601886
A408: 4 | B408: =LN(RC[-1]+1 )*400 -> 643.77516497364013 | C408: =LOG(RC[-2]+1 )*1000 -> 698.97000433601886
A409: 4 | B409: =LN(RC[-1]+1 )*400 -> 643.77516497364013 | C409: =LOG(RC[-2]+1 )*1000 -> 698.97000433601886
A410: 4 | B410: =LN(RC[-1]+1 )*400 -> 643.77516497364013 | C410: =LOG(RC[-2]+1 )*1000 -> 698.97000433601886
A411: 4 | B411: =LN(RC[-1]+1 )*400 -> 643.77516497364013 | C411: =LOG(RC[-2]+1 )*1000 -> 698.97000433601886
A412: 4 | B412: =LN(RC[-1]+1 )*400 -> 643.77516497364013 | C412: =LOG(RC[-2]+1 )*1000 -> 698.97000433601886
A413: 4 | B413: =LN(RC[-1]+1 )*400 -> 643.77516497364013 | C413: =LOG(RC[-2]+1 )*1000 -> 698.97000433601886
A414: 4 | B414: =LN(RC[-1]+1 )*400 -> 643.77516497364013 | C414: =LOG(RC[-2]+1 )*1000 -> 698.97000433601886
A415: 4 | B415: =LN(RC[-1]+1 )*400 -> 643.77516497364013 | C415: =LOG(RC[-2]+1 )*1000 -> 698.97000433601886
A416: 4 | B416: =LN(RC[-1]+1 )*400 -> 643.77516497364013 | C416: =LOG(RC[-2]+1 )*1000 -> 698.97000433601886
A417: 4 | B417: =LN(RC[-1]+1 )*400 -> 643.77516497364013 | C417: =LOG(RC[-2]+1 )*1000 -> 698.97000433601886
A418: 4 | B418: =LN(RC[-1]+1 )*400 -> 643.77516497364013 | C418: =LOG(RC[-2]+1 )*1000 -> 698.97000433601886
A419: 4 | B419: =LN(RC[-1]+1 )*400 -> 643.77516497364013 | C419: =LOG(RC[-2]+1 )*1000 -> 698.97000433601886
A420: 4 | B420: =LN(RC[-1]+1 )*400 -> 643.77516497364013 | C420: =LOG(RC[-2]+1 )*1000 -> 698.97000433601886
A421: 4 | B421: =LN(RC[-1]+1 )*400 -> 643.77516497364013 | C421: =LOG(RC[-2]+1 )*1000 -> 698.97000433601886
A422: 4 | B422: =LN(RC[-1]+1 )*400 -> 643.77516497364013 | C422: =LOG(RC[-2]+1 )*1000 -> 698.97000433601886
A423: 4 | B423: =LN(RC[-1]+1 )*400 -> 643.77516497364013 | C423: =LOG(RC[-2]+1 )*1000 -> 698.97000433601886
A424: 4 | B424: =LN(RC[-1]+1 )*400 -> 643.77516497364013 | C424: =LOG(RC[-2]+1 )*1000 -> 698.97000433601886
A425: 4 | B425: =LN(RC[-1]+1 )*400 -> 643.77516497364013 | C425: =LOG(RC[-2]+1 )*1000 -> 698.97000433601886
A426: 4 | B426: =LN(RC[-1]+1 )*400 -> 643.77516497364013 | C426: =LOG(RC[-2]+1 )*1000 -> 698.97000433601886
A427: 4 | B427: =LN(RC[-1]+1 )*400 -> 643.77516497364013 | C427: =LOG(RC[-2]+1 )*1000 -> 698.97000433601886
A428: 4 | B428: =LN(RC[-1]+1 )*400 -> 643.77516497364013 | C428: =LOG(RC[-2]+1 )*1000 -> 698.97000433601886
A429: 4 | B429: =LN(RC[-1]+1 )*400 -> 643.77516497364013 | C429: =LOG(RC[-2]+1 )*1000 -> 698.97000433601886
A430: 4 | B430: =LN(RC[-1]+1 )*400 -> 643.77516497364013 | C430: =LOG(RC[-2]+1 )*1000 -> 698.97000433601886
A431: 4 | B431: =LN(RC[-1]+1 )*400 -> 643.77516497364013 | C431: =LOG(RC[-2]+1 )*1000 -> 698.97000433601886
A432: 4 | B432: =LN(RC[-1]+1 )*400 -> 643.77516497364013 | C432: =LOG(RC[-2]+1 )*1000 -> 698.97000433601886
A433: 4 | B433: =LN(RC[-1]+1 )*400 -> 643.77516497364013 | C433: =LOG(RC[-2]+1 )*1000 -> 698.97000433601886
A434: 4 | B434: =LN(RC[-1]+1 )*400 -> 643.77516497364013 | C434: =LOG(RC[-2]+1 )*1000 -> 698.97000433601886
A435: 4 | B435: =LN(RC[-1]+1 )*400 -> 643.77516497364013 | C435: =LOG(RC[-2]+1 )*1000 -> 698.97000433601886
A436: 4 | B436: =LN(RC[-1]+1 )*400 -> 643.77516497364013 | C436: =LOG(RC[-2]+1 )*1000 -> 698.97000433601886
A437: 4 | B437: =LN(RC[-1]+1 )*400 -> 643.77516497364013 | C437: =LOG(RC[-2]+1 )*1000 -> 698.97000433601886
A438: 4 | B438: =LN(RC[-1]+1 )*400 -> 643.77516497364013 | C438: =LOG(RC[-2]+1 )*1000 -> 698.97000433601886
A439: 4 | B439: =LN(RC[-1]+1 )*400 -> 643.77516497364013 | C439: =LOG(RC[-2]+1 )*1000 -> 698.97000433601886
A440: 4 | B440: =LN(RC[-1]+1 )*400 -> 643.77516497364013 | C440: =LOG(RC[-2]+1 )*1000 -> 698.97000433601886
A441: 4 | B441: =LN(RC[-1]+1 )*400 -> 643.77516497364013 | C441: =LOG(RC[-2]+1 )*1000 -> 698.97000433601886
A442: 4 | B442: =LN(RC[-1]+1 )*400 -> 643.77516497364013 | C442: =LOG(RC[-2]+1 )*1000 -> 698.97000433601886
A443: 4 | B443: =LN(RC[-1]+1 )*400 -> 643.77516497364013 | C443: =LOG(RC[-2]+1 )*1000 -> 698.97000433601886
A444: 4 | B444: =LN(RC[-1]+1 )*400 -> 643.77516497364013 | C444: =LOG(RC[-2]+1 )*1000 -> 698.97000433601886
A445: 4 | B445: =LN(RC[-1]+1 )*400 -> 643.77516497364013 | C445: =LOG(RC[-2]+1 )*1000 -> 698.97000433601886
A446: 4 | B446: =LN(RC[-1]+1 )*400 -> 643.77516497364013 | C446: =LOG(RC[-2]+1 )*1000 -> 698.97000433601886
A447: 4 | B447: =LN(RC[-1]+1 )*400 -> 643.77516497364013 | C447: =LOG(RC[-2]+1 )*1000 -> 698.97000433601886
A448: 4 | B448: =LN(RC[-1]+1 )*400 -> 643.77516497364013 | C448: =LOG(RC[-2]+1 )*1000 -> 698.97000433601886
A449: 4 | B449: =LN(RC[-1]+1 )*400 -> 643.77516497364013 | C449: =LOG(RC[-2]+1 )*1000 -> 698.97000433601886
A450: 4 | B450: =LN(RC[-1]+1 )*400 -> 643.77516497364013 | C450: =LOG(RC[-2]+1 )*1000 -> 698.97000433601886
A451: 4 | B451: =LN(RC[-1]+1 )*400 -> 643.77516497364013 | C451: =LOG(RC[-2]+1 )*1000 -> 698.97000433601886
A452: 4 | B452: =LN(RC[-1]+1 )*400 -> 643.77516497364013 | C452: =LOG(RC[-2]+1 )*1000 -> 698.97000433601886
A453: 4 | B453: =LN(RC[-1]+1 )*400 -> 643.77516497364013 | C453: =LOG(RC[-2]+1 )*1000 -> 698.97000433601886
A454: 4 | B454: =LN(RC[-1]+1 )*400 -> 643.77516497364013 | C454: =LOG(RC[-2]+1 )*1000 -> 698.97000433601886
A455: 4 | B455: =LN(RC[-1]+1 )*400 -> 643.77516497364013 | C455: =LOG(RC[-2]+1 )*1000 -> 698.97000433601886
A456: 4 | B456: =LN(RC[-1]+1 )*400 -> 643.77516497364013 | C456: =LOG(RC[-2]+1 )*1000 -> 698.97000433601886
A457: 4 | B457: =LN(RC[-1]+1 )*400 -> 643.77516497364013 | C457: =LOG(RC[-2]+1 )*1000 -> 698.97000433601886
A458: 4 | B458: =LN(RC[-1]+1 )*400 -> 643.77516497364013 | C458: =LOG(RC[-2]+1 )*1000 -> 698.97000433601886
A459: 4 | B459: =LN(RC[-1]+1 )*400 -> 643.77516497364013 | C459: =LOG(RC[-2]+1 )*1000 -> 698.97000433601886
A460: 4 | B460: =LN(RC[-1]+1 )*400 -> 643.77516497364013 | C460: =LOG(RC[-2]+1 )*1000 -> 698.97000433601886
A461: 4 | B461: =LN(RC[-1]+1 )*400 -> 643.77516497364013 | C461: =LOG(RC[-2]+1 )*1000 -> 698.97000433601886
A462: 4 | B462: =LN(RC[-1]+1 )*400 -> 643.77516497364013 | C462: =LOG(RC[-2]+1 )*1000 -> 698.97000433601886
A463: 4 | B463: =LN(RC[-1]+1 )*400 -> 643.77516497364013 | C463: =LOG(RC[-2]+1 )*1000 -> 698.97000433601886
A464: 4 | B464: =LN(RC[-1]+1 )*400 -> 643.77516497364013 | C464: =LOG(RC[-2]+1 )*1000 -> 698.97000433601886
A465: 4 | B465: =LN(RC[-1]+1 )*400 -> 643.77516497364013 | C465: =LOG(RC[-2]+1 )*1000 -> 698.97000433601886
A466: 4 | B466: =LN(RC[-1]+1 )*400 -> 643.77516497364013 | C466: =LOG(RC[-2]+1 )*1000 -> 698.97000433601886
A467: 4 | B467: =LN(RC[-1]+1 )*400 -> 643.77516497364013 | C467: =LOG(RC[-2]+1 )*1000 -> 698.97000433601886
A468: 4 | B468: =LN(RC[-1]+1 )*400 -> 643.77516497364013 | C468: =LOG(RC[-2]+1 )*1000 -> 698.97000433601886
A469: 4 | B469: =LN(RC[-1]+1 )*400 -> 643.77516497364013 | C469: =LOG(RC[-2]+1 )*1000 -> 698.97000433601886
A470: 4 | B470: =LN(RC[-1]+1 )*400 -> 643.77516497364013 | C470: =LOG(RC[-2]+1 )*1000 -> 698.97000433601886
A471: 4 | B471: =LN(RC[-1]+1 )*400 -> 643.77516497364013 | C471: =LOG(RC[-2]+1 )*1000 -> 698.97000433601886
A472: 4 | B472: =LN(RC[-1]+1 )*400 -> 643.77516497364013 | C472: =LOG(RC[-2]+1 )*1000 -> 698.97000433601886
A473: 4 | B473: =LN(RC[-1]+1 )*400 -> 643.77516497364013 | C473: =LOG(RC[-2]+1 )*1000 -> 698.97000433601886
A474: 4 | B474: =LN(RC[-1]+1 )*400 -> 643.77516497364013 | C474: =LOG(RC[-2]+1 )*1000 -> 698.97000433601886
A475: 4 | B475: =LN(RC[-1]+1 )*400 -> 643.77516497364013 | C475: =LOG(RC[-2]+1 )*1000 -> 698.97000433601886
A476: 4 | B476: =LN(RC[-1]+1 )*400 -> 643.77516497364013 | C476: =LOG(RC[-2]+1 )*1000 -> 698.97000433601886
A477: 4 | B477: =LN(RC[-1]+1 )*400 -> 643.77516497364013 | C477: =LOG(RC[-2]+1 )*1000 -> 698.97000433601886
A478: 4 | B478: =LN(RC[-1]+1 )*400 -> 643.77516497364013 | C478: =LOG(RC[-2]+1 )*1000 -> 698.97000433601886
A479: 4 | B479: =LN(RC[-1]+1 )*400 -> 643.77516497364013 | C479: =LOG(RC[-2]+1 )*1000 -> 698.97000433601886
A480: 4 | B480: =LN(RC[-1]+1 )*400 -> 643.77516497364013 | C480: =LOG(RC[-2]+1 )*1000 -> 698.97000433601886
A481: 4 | B481: =LN(RC[-1]+1 )*400 -> 643.77516497364013 | C481: =LOG(RC[-2]+1 )*1000 -> 698.97000433601886
A482: 4 | B482: =LN(RC[-1]+1 )*400 -> 643.77516497364013 | C482: =LOG(RC[-2]+1 )*1000 -> 698.97000433601886
A483: 4 | B483: =LN(RC[-1]+1 )*400 -> 643.77516497364013 | C483: =LOG(RC[-2]+1 )*1000 -> 698.97000433601886
A484: 4 | B484: =LN(RC[-1]+1 )*400 -> 643.77516497364013 | C484: =LOG(RC[-2]+1 )*1000 -> 698.97000433601886
A485: 4 | B485: =LN(RC[-1]+1 )*400 -> 643.77516497364013 | C485: =LOG(RC[-2]+1 )*1000 -> 698.97000433601886
A486: 4 | B486: =LN(RC[-1]+1 )*400 -> 643.77516497364013 | C486: =LOG(RC[-2]+1 )*1000 -> 698.97000433601886
A487: 4 | B487: =LN(RC[-1]+1 )*400 -> 643.77516497364013 | C487: =LOG(RC[-2]+1 )*1000 -> 698.97000433601886
A488: 4 | B488: =LN(RC[-1]+1 )*400 -> 643.77516497364013 | C488: =LOG(RC[-2]+1 )*1000 -> 698.97000433601886
A489: 4 | B489: =LN(RC[-1]+1 )*400 -> 643.77516497364013 | C489: =LOG(RC[-2]+1 )*1000 -> 698.97000433601886
A490: 4 | B490: =LN(RC[-1]+1 )*400 -> 643.77516497364013 | C490: =LOG(RC[-2]+1 )*1000 -> 698.97000433601886
A491: 4 | B491: =LN(RC[-1]+1 )*400 -> 643.77516497364013 | C491: =LOG(RC[-2]+1 )*1000 -> 698.97000433601886
A492: 4 | B492: =LN(RC[-1]+1 )*400 -> 643.77516497364013 | C492: =LOG(RC[-2]+1 )*1000 -> 698.97000433601886
A493: 4 | B493: =LN(RC[-1]+1 )*400 -> 643.77516497364013 | C493: =LOG(RC[-2]+1 )*1000 -> 698.97000433601886
A494: 4 | B494: =LN(RC[-1]+1 )*400 -> 643.77516497364013 | C494: =LOG(RC[-2]+1 )*1000 -> 698.97000433601886
A495: 4 | B495: =LN(RC[-1]+1 )*400 -> 643.77516497364013 | C495: =LOG(RC[-2]+1 )*1000 -> 698.97000433601886
A496: 4 | B496: =LN(RC[-1]+1 )*400 -> 643.77516497364013 | C496: =LOG(RC[-2]+1 )*1000 -> 698.97000433601886
A497: 4 | B497: =LN(RC[-1]+1 )*400 -> 643.77516497364013 | C497: =LOG(RC[-2]+1 )*1000 -> 698.97000433601886
A498: 4 | B498: =LN(RC[-1]+1 )*400 -> 643.77516497364013 | C498: =LOG(RC[-2]+1 )*1000 -> 698.97000433601886
A499: 4 | B499: =LN(RC[-1]+1 )*400 -> 643.77516497364013 | C499: =LOG(RC[-2]+1 )*1000 -> 698.97000433601886
A500: 4 | B500: =LN(RC[-1]+1 )*400 -> 643.77516497364013 | C500: =LOG(RC[-2]+1 )*1000 -> 698.97000433601886
A501: 4 | B501: =LN(RC[-1]+1 )*400 -> 643.77516497364013 | C501: =LOG(RC[-2]+1 )*1000 -> 698.97000433601886
A502: 4 | B502: =LN(RC[-1]+1 )*400 -> 643.77516497364013 | C502: =LOG(RC[-2]+1 )*1000 -> 698.97000433601886
A503: 4 | B503: =LN(RC[-1]+1 )*400 -> 643.77516497364013 | C503: =LOG(RC[-2]+1 )*1000 -> 698.97000433601886
A504: 4 | B504: =LN(RC[-1]+1 )*400 -> 643.77516497364013 | C504: =LOG(RC[-2]+1 )*1000 -> 698.97000433601886
A505: 4 | B505: =LN(RC[-1]+1 )*400 -> 643.77516497364013 | C505: =LOG(RC[-2]+1 )*1000 -> 698.97000433601886
A506: 4 | B506: =LN(RC[-1]+1 )*400 -> 643.77516497364013 | C506: =LOG(RC[-2]+1 )*1000 -> 698.97000433601886
A507: 4 | B507: =LN(RC[-1]+1 )*400 -> 643.77516497364013 | C507: =LOG(RC[-2]+1 )*1000 -> 698.97000433601886
A508: 4 | B508: =LN(RC[-1]+1 )*400 -> 643.77516497364013 | C508: =LOG(RC[-2]+1 )*1000 -> 698.97000433601886
A509: 4 | B509: =LN(RC[-1]+1 )*400 -> 643.77516497364013 | C509: =LOG(RC[-2]+1 )*1000 -> 698.97000433601886
A510: 4 | B510: =LN(RC[-1]+1 )*400 -> 643.77516497364013 | C510: =LOG(RC[-2]+1 )*1000 -> 698.97000433601886
A511: 3 | B511: =LN(RC[-1]+1 )*400 -> 554.51774444795626 | C511: =LOG(RC[-2]+1 )*1000 -> 602.05999132796239
A512: 3 | B512: =LN(RC[-1]+1 )*400 -> 554.51774444795626 | C512: =LOG(RC[-2]+1 )*1000 -> 602.05999132796239
A513: 2 | B513: =LN(RC[-1]+1 )*400 -> 439.4449154672439 | C513: =LOG(RC[-2]+1 )*1000 -> 477.12125471966243
A514: 2 | B514: =LN(RC[-1]+1 )*400 -> 439.4449154672439 | C514: =LOG(RC[-2]+1 )*1000 -> 477.12125471966243
A515: 2 | B515: =LN(RC[-1]+1 )*400 -> 439.4449154672439 | C515: =LOG(RC[-2]+1 )*1000 -> 477.12125471966243
A516: 2 | B516: =LN(RC[-1]+1 )*400 -> 439.4449154672439 | C516: =LOG(RC[-2]+1 )*1000 -> 477.12125471966243
A517: 2 | B517: =LN(RC[-1]+1 )*400 -> 439.4449154672439 | C517: =LOG(RC[-2]+1 )*1000 -> 477.12125471966243
A518: 2 | B518: =LN(RC[-1]+1 )*400 -> 439.4449154672439 | C518: =LOG(RC[-2]+1 )*1000 -> 477.12125471966243
A519: 2 | B519: =LN(RC[-1]+1 )*400 -> 439.4449154672439 | C519: =LOG(RC[-2]+1 )*1000 -> 477.12125471966243
A520: 2 | B520: =LN(RC[-1]+1 )*400 -> 439.4449154672439 | C520: =LOG(RC[-2]+1 )*1000 -> 477.12125471966243
A521: 2 | B521: =LN(RC[-1]+1 )*400 -> 439.4449154672439 | C521: =LOG(RC[-2]+1 )*1000 -> 477.12125471966243
A522: 2 | B522: =LN(RC[-1]+1 )*400 -> 439.4449154672439 | C522: =LOG(RC[-2]+1 )*1000 -> 477.12125471966243
A523: 2 | B523: =LN(RC[-1]+1 )*400 -> 439.4449154672439 | C523: =LOG(RC[-2]+1 )*1000 -> 477.12125471966243
A524: 2 | B524: =LN(RC[-1]+1 )*400 -> 439.4449154672439 | C524: =LOG(RC[-2]+1 )*1000 -> 477.12125471966243
A525: 2 | B525: =LN(RC[-1]+1 )*400 -> 439.4449154672439 | C525: =LOG(RC[-2]+1 )*1000 -> 477.12125471966243
A526: 2 | B526: =LN(RC[-1]+1 )*400 -> 439.4449154672439 | C526: =LOG(RC[-2]+1 )*1000 -> 477.12125471966243
A527: 2 | B527: =LN(RC[-1]+1 )*400 -> 439.4449154672439 | C527: =LOG(RC[-2]+1 )*1000 -> 477.12125471966243
A528: 2 | B528: =LN(RC[-1]+1 )*400 -> 439.4449154672439 | C528: =LOG(RC[-2]+1 )*1000 -> 477.12125471966243
A529: 2 | B529: =LN(RC[-1]+1 )*400 -> 439.4449154672439 | C529: =LOG(RC[-2]+1 )*1000 -> 477.12125471966243
A530: 2 | B530: =LN(RC[-1]+1 )*400 -> 439.4449154672439 | C530: =LOG(RC[-2]+1 )*1000 -> 477.12125471966243
A531: 2 | B531: =LN(RC[-1]+1 )*400 -> 439.4449154672439 | C531: =LOG(RC[-2]+1 )*1000 -> 477.12125471966243
A532: 2 | B532: =LN(RC[-1]+1 )*400 -> 439.4449154672439 | C532: =LOG(RC[-2]+1 )*1000 -> 477.12125471966243
A533: 2 | B533: =LN(RC[-1]+1 )*400 -> 439.4449154672439 | C533: =LOG(RC[-2]+1 )*1000 -> 477.12125471966243
A534: 2 | B534: =LN(RC[-1]+1 )*400 -> 439.4449154672439 | C534: =LOG(RC[-2]+1 )*1000 -> 477.12125471966243
A535: 2 | B535: =LN(RC[-1]+1 )*400 -> 439.4449154672439 | C535: =LOG(RC[-2]+1 )*1000 -> 477.12125471966243
A536: 2 | B536: =LN(RC[-1]+1 )*400 -> 439.4449154672439 | C536: =LOG(RC[-2]+1 )*1000 -> 477.12125471966243
A537: 2 | B537: =LN(RC[-1]+1 )*400 -> 439.4449154672439 | C537: =LOG(RC[-2]+1 )*1000 -> 477.12125471966243
A538: 2 | B538: =LN(RC[-1]+1 )*400 -> 439.4449154672439 | C538: =LOG(RC[-2]+1 )*1000 -> 477.12125471966243
A539: 2 | B539: =LN(RC[-1]+1 )*400 -> 439.4449154672439 | C539: =LOG(RC[-2]+1 )*1000 -> 477.12125471966243
A540: 2 | B540: =LN(RC[-1]+1 )*400 -> 439.4449154672439 | C540: =LOG(RC[-2]+1 )*1000 -> 477.12125471966243
A541: 2 | B541: =LN(RC[-1]+1 )*400 -> 439.4449154672439 | C541: =LOG(RC[-2]+1 )*1000 -> 477.12125471966243
A542: 2 | B542: =LN(RC[-1]+1 )*400 -> 439.4449154672439 | C542: =LOG(RC[-2]+1 )*1000 -> 477.12125471966243
A543: 2 | B543: =LN(RC[-1]+1 )*400 -> 439.4449154672439 | C543: =LOG(RC[-2]+1 )*1000 -> 477.12125471966243
A544: 2 | B544: =LN(RC[-1]+1 )*400 -> 439.4449154672439 | C544: =LOG(RC[-2]+1 )*1000 -> 477.12125471966243
A545: 2 | B545: =LN(RC[-1]+1 )*400 -> 439.4449154672439 | C545: =LOG(RC[-2]+1 )*1000 -> 477.12125471966243
A546: 2 | B546: =LN(RC[-1]+1 )*400 -> 439.4449154672439 | C546: =LOG(RC[-2]+1 )*1000 -> 477.12125471966243
A547: 2 | B547: =LN(RC[-1]+1 )*400 -> 439.4449154672439 | C547: =LOG(RC[-2]+1 )*1000 -> 477.12125471966243
A548: 2 | B548: =LN(RC[-1]+1 )*400 -> 439.4449154672439 | C548: =LOG(RC[-2]+1 )*1000 -> 477.12125471966243
A549: 2 | B549: =LN(RC[-1]+1 )*400 -> 439.4449154672439 | C549: =LOG(RC[-2]+1 )*1000 -> 477.12125471966243
A550: 2 | B550: =LN(RC[-1]+1 )*400 -> 439.4449154672439 | C550: =LOG(RC[-2]+1 )*1000 -> 477.12125471966243
A551: 2 | B551: =LN(RC[-1]+1 )*400 -> 439.4449154672439 | C551: =LOG(RC[-2]+1 )*1000 -> 477.12125471966243
A552: 2 | B552: =LN(RC[-1]+1 )*400 -> 439.4449154672439 | C552: =LOG(RC[-2]+1 )*1000 -> 477.12125471966243
A553: 2 | B553: =LN(RC[-1]+1 )*400 -> 439.4449154672439 | C553: =LOG(RC[-2]+1 )*1000 -> 477.12125471966243
A554: 2 | B554: =LN(RC[-1]+1 )*400 -> 439.4449154672439 | C554: =LOG(RC[-2]+1 )*1000 -> 477.12125471966243
A555: 2 | B555: =LN(RC[-1]+1 )*400 -> 439.4449154672439 | C555: =LOG(RC[-2]+1 )*1000 -> 477.12125471966243
A556: 2 | B556: =LN(RC[-1]+1 )*400 -> 439.4449154672439 | C556: =LOG(RC[-2]+1 )*1000 -> 477.12125471966243
A557: 2 | B557: =LN(RC[-1]+1 )*400 -> 439.4449154672439 | C557: =LOG(RC[-2]+1 )*1000 -> 477.12125471966243
A558: 2 | B558: =LN(RC[-1]+1 )*400 -> 439.4449154672439 | C558: =LOG(RC[-2]+1 )*1000 -> 477.12125471966243
A559: 2 | B559: =LN(RC[-1]+1 )*400 -> 439.4449154672439 | C559: =LOG(RC[-2]+1 )*1000 -> 477.12125471966243
A560: 2 | B560: =LN(RC[-1]+1 )*400 -> 439.4449154672439 | C560: =LOG(RC[-2]+1 )*1000 -> 477.12125471966243
A561: 2 | B561: =LN(RC[-1]+1 )*400 -> 439.4449154672439 | C561: =LOG(RC[-2]+1 )*1000 -> 477.12125471966243
A562: 2 | B562: =LN(RC[-1]+1 )*400 -> 439.4449154672439 | C562: =LOG(RC[-2]+1 )*1000 -> 477.12125471966243
A563: 2 | B563: =LN(RC[-1]+1 )*400 -> 439.4449154672439 | C563: =LOG(RC[-2]+1 )*1000 -> 477.12125471966243
A564: 2 | B564: =LN(RC[-1]+1 )*400 -> 439.4449154672439 | C564: =LOG(RC[-2]+1 )*1000 -> 477.12125471966243
A565: 2 | B565: =LN(RC[-1]+1 )*400 -> 439.4449154672439 | C565: =LOG(RC[-2]+1 )*1000 -> 477.12125471966243
A566: 2 | B566: =LN(RC[-1]+1 )*400 -> 439.4449154672439 | C566: =LOG(RC[-2]+1 )*1000 -> 477.12125471966243
A567: 2 | B567: =LN(RC[-1]+1 )*400 -> 439.4449154672439 | C567: =LOG(RC[-2]+1 )*1000 -> 477.12125471966243
A568: 2 | B568: =LN(RC[-1]+1 )*400 -> 439.4449154672439 | C568: =LOG(RC[-2]+1 )*1000 -> 477.12125471966243
A569: 2 | B569: =LN(RC[-1]+1 )*400 -> 439.4449154672439 | C569: =LOG(RC[-2]+1 )*1000 -> 477.12125471966243
A570: 2 | B570: =LN(RC[-1]+1 )*400 -> 439.4449154672439 | C570: =LOG(RC[-2]+1 )*1000 -> 477.12125471966243
A571: 2 | B571: =LN(RC[-1]+1 )*400 -> 439.4449154672439 | C571: =LOG(RC[-2]+1 )*1000 -> 477.12125471966243
A572: 2 | B572: =LN(RC[-1]+1 )*400 -> 439.4449154672439 | C572: =LOG(RC[-2]+1 )*1000 -> 477.12125471966243
A573: 2 | B573: =LN(RC[-1]+1 )*400 -> 439.4449154672439 | C573: =LOG(RC[-2]+1 )*1000 -> 477.12125471966243
A574: 2 | B574: =LN(RC[-1]+1 )*400 -> 439.4449154672439 | C574: =LOG(RC[-2]+1 )*1000 -> 477.12125471966243
A575: 2 | B575: =LN(RC[-1]+1 )*400 -> 439.4449154672439 | C575: =LOG(RC[-2]+1 )*1000 -> 477.12125471966243
A576: 2 | B576: =LN(RC[-1]+1 )*400 -> 439.4449154672439 | C576: =LOG(RC[-2]+1 )*1000 -> 477.12125471966243
A577: 2 | B577: =LN(RC[-1]+1 )*400 -> 439.4449154672439 | C577: =LOG(RC[-2]+1 )*1000 -> 477.12125471966243
A578: 2 | B578: =LN(RC[-1]+1 )*400 -> 439.4449154672439 | C578: =LOG(RC[-2]+1 )*1000 -> 477.12125471966243
A579: 2 | B579: =LN(RC[-1]+1 )*400 -> 439.4449154672439 | C579: =LOG(RC[-2]+1 )*1000 -> 477.12125471966243
A580: 2 | B580: =LN(RC[-1]+1 )*400 -> 439.4449154672439 | C580: =LOG(RC[-2]+1 )*1000 -> 477.12125471966243
A581: 2 | B581: =LN(RC[-1]+1 )*400 -> 439.4449154672439 | C581: =LOG(RC[-2]+1 )*1000 -> 477.12125471966243
A582: 2 | B582: =LN(RC[-1]+1 )*400 -> 439.4449154672439 | C582: =LOG(RC[-2]+1 )*1000 -> 477.12125471966243
A583: 2 | B583: =LN(RC[-1]+1 )*400 -> 439.4449154672439 | C583: =LOG(RC[-2]+1 )*1000 -> 477.12125471966243
A584: 2 | B584: =LN(RC[-1]+1 )*400 -> 439.4449154672439 | C584: =LOG(RC[-2]+1 )*1000 -> 477.12125471966243
A585: 2 | B585: =LN(RC[-1]+1 )*400 -> 439.4449154672439 | C585: =LOG(RC[-2]+1 )*1000 -> 477.12125471966243
A586: 2 | B586: =LN(RC[-1]+1 )*400 -> 439.4449154672439 | C586: =LOG(RC[-2]+1 )*1000 -> 477.12125471966243
A587: 2 | B587: =LN(RC[-1]+1 )*400 -> 439.4449154672439 | C587: =LOG(RC[-2]+1 )*1000 -> 477.12125471966243
A588: 2 | B588: =LN(RC[-1]+1 )*400 -> 439.4449154672439 | C588: =LOG(RC[-2]+1 )*1000 -> 477.12125471966243
A589: 2 | B589: =LN(RC[-1]+1 )*400 -> 439.4449154672439 | C589: =LOG(RC[-2]+1 )*1000 -> 477.12125471966243
A590: 2 | B590: =LN(RC[-1]+1 )*400 -> 439.4449154672439 | C590: =LOG(RC[-2]+1 )*1000 -> 477.12125471966243
A591: 2 | B591: =LN(RC[-1]+1 )*400 -> 439.4449154672439 | C591: =LOG(RC[-2]+1 )*1000 -> 477.12125471966243
A592: 2 | B592: =LN(RC[-1]+1 )*400 -> 439.4449154672439 | C592: =LOG(RC[-2]+1 )*1000 -> 477.12125471966243
A593: 2 | B593: =LN(RC[-1]+1 )*400 -> 439.4449154672439 | C593: =LOG(RC[-2]+1 )*1000 -> 477.12125471966243
A594: 2 | B594: =LN(RC[-1]+1 )*400 -> 439.4449154672439 | C594: =LOG(RC[-2]+1 )*1000 -> 477.12125471966243
A595: 2 | B595: =LN(RC[-1]+1 )*400 -> 439.4449154672439 | C595: =LOG(RC[-2]+1 )*1000 -> 477.12125471966243
A596: 2 | B596: =LN(RC[-1]+1 )*400 -> 439.4449154672439 | C596: =LOG(RC[-2]+1 )*1000 -> 477.12125471966243
A597: 2 | B597: =LN(RC[-1]+1 )*400 -> 439.4449154672439 | C597: =LOG(RC[-2]+1 )*1000 -> 477.12125471966243
A598: 2 | B598: =LN(RC[-1]+1 )*400 -> 439.4449154672439 | C598: =LOG(RC[-2]+1 )*1000 -> 477.12125471966243
A599: 2 | B599: =LN(RC[-1]+1 )*400 -> 439.4449154672439 | C599: =LOG(RC[-2]+1 )*1000 -> 477.12125471966243
A600: 2 | B600: =LN(RC[-1]+1 )*400 -> 439.4449154672439 | C600: =LOG(RC[-2]+1 )*1000 -> 477.12125471966243
A601: 2 | B601: =LN(RC[-1]+1 )*400 -> 439.4449154672439 | C601: =LOG(RC[-2]+1 )*1000 -> 477.12125471966243
A602: 2 | B602: =LN(RC[-1]+1 )*400 -> 439.4449154672439 | C602: =LOG(RC[-2]+1 )*1000 -> 477.12125471966243
A603: 2 | B603: =LN(RC[-1]+1 )*400 -> 439.4449154672439 | C603: =LOG(RC[-2]+1 )*1000 -> 477.12125471966243
A604: 2 | B604: =LN(RC[-1]+1 )*400 -> 439.4449154672439 | C604: =LOG(RC[-2]+1 )*1000 -> 477.12125471966243
A605: 2 | B605: =LN(RC[-1]+1 )*400 -> 439.4449154672439 | C605: =LOG(RC[-2]+1 )*1000 -> 477.12125471966243
A606: 2 | B606: =LN(RC[-1]+1 )*400 -> 439.4449154672439 | C606: =LOG(RC[-2]+1 )*1000 -> 477.12125471966243
A607: 2 | B607: =LN(RC[-1]+1 )*400 -> 439.4449154672439 | C607: =LOG(RC[-2]+1 )*1000 -> 477.12125471966243
A608: 2 | B608: =LN(RC[-1]+1 )*400 -> 439.4449154672439 | C608: =LOG(RC[-2]+1 )*1000 -> 477.12125471966243
A609: 2 | B609: =LN(RC[-1]+1 )*400 -> 439.4449154672439 | C609: =LOG(RC[-2]+1 )*1000 -> 477.12125471966243
A610: 2 | B610: =LN(RC[-1]+1 )*400 -> 439.4449154672439 | C610: =LOG(RC[-2]+1 )*1000 -> 477.12125471966243
A611: 2 | B611: =LN(RC[-1]+1 )*400 -> 439.4449154672439 | C611: =LOG(RC[-2]+1 )*1000 -> 477.12125471966243
A612: 2 | B612: =LN(RC[-1]+1 )*400 -> 439.4449154672439 | C612: =LOG(RC[-2]+1 )*1000 -> 477.12125471966243
A613: 2 | B613: =LN(RC[-1]+1 )*400 -> 439.4449154672439 | C613: =LOG(RC[-2]+1 )*1000 -> 477.12125471966243
A614: 2 | B614: =LN(RC[-1]+1 )*400 -> 439.4449154672439 | C614: =LOG(RC[-2]+1 )*1000 -> 477.12125471966243
A615: 2 | B615: =LN(RC[-1]+1 )*400 -> 439.4449154672439 | C615: =LOG(RC[-2]+1 )*1000 -> 477.12125471966243
A616: 2 | B616: =LN(RC[-1]+1 )*400 -> 439.4449154672439 | C616: =LOG(RC[-2]+1 )*1000 -> 477.12125471966243
A617: 2 | B617: =LN(RC[-1]+1 )*400 -> 439.4449154672439 | C617: =LOG(RC[-2]+1 )*1000 -> 477.12125471966243
A618: 2 | B618: =LN(RC[-1]+1 )*400 -> 439.4449154672439 | C618: =LOG(RC[-2]+1 )*1000 -> 477.12125471966243
A619: 2 | B619: =LN(RC[-1]+1 )*400 -> 439.4449154672439 | C619: =LOG(RC[-2]+1 )*1000 -> 477.12125471966243
A620: 2 | B620: =LN(RC[-1]+1 )*400 -> 439.4449154672439 | C620: =LOG(RC[-2]+1 )*1000 -> 477.12125471966243
A621: 2 | B621: =LN(RC[-1]+1 )*400 -> 439.4449154672439 | C621: =LOG(RC[-2]+1 )*1000 -> 477.12125471966243
A622: 2 | B622: =LN(RC[-1]+1 )*400 -> 439.4449154672439 | C622: =LOG(RC[-2]+1 )*1000 -> 477.12125471966243
A623: 2 | B623: =LN(RC[-1]+1 )*400 -> 439.4449154672439 | C623: =LOG(RC[-2]+1 )*1000 -> 477.12125471966243
A624: 2 | B624: =LN(RC[-1]+1 )*400 -> 439.4449154672439 | C624: =LOG(RC[-2]+1 )*1000 -> 477.12125471966243
A625: 2 | B625: =LN(RC[-1]+1 )*400 -> 439.4449154672439 | C625: =LOG(RC[-2]+1 )*1000 -> 477.12125471966243
A626: 2 | B626: =LN(RC[-1]+1 )*400 -> 439.4449154672439 | C626: =LOG(RC[-2]+1 )*1000 -> 477.12125471966243
A627: 2 | B627: =LN(RC[-1]+1 )*400 -> 439.4449154672439 | C627: =LOG(RC[-2]+1 )*1000 -> 477.12125471966243
A628: 2 | B628: =LN(RC[-1]+1 )*400 -> 439.4449154672439 | C628: =LOG(RC[-2]+1 )*1000 -> 477.12125471966243
A629: 2 | B629: =LN(RC[-1]+1 )*400 -> 439.4449154672439 | C629: =LOG(RC[-2]+1 )*1000 -> 477.12125471966243
A630: 2 | B630: =LN(RC[-1]+1 )*400 -> 439.4449154672439 | C630: =LOG(RC[-2]+1 )*1000 -> 477.12125471966243
A631: 2 | B631: =LN(RC[-1]+1 )*400 -> 439.4449154672439 | C631: =LOG(RC[-2]+1 )*1000 -> 477.12125471966243
A632: 2 | B632: =LN(RC[-1]+1 )*400 -> 439.4449154672439 | C632: =LOG(RC[-2]+1 )*1000 -> 477.12125471966243
A633: 2 | B633: =LN(RC[-1]+1 )*400 -> 439.4449154672439 | C633: =LOG(RC[-2]+1 )*1000 -> 477.12125471966243
A634: 2 | B634: =LN(RC[-1]+1 )*400 -> 439.4449154672439 | C634: =LOG(RC[-2]+1 )*1000 -> 477.12125471966243
A635: 2 | B635: =LN(RC[-1]+1 )*400 -> 439.4449154672439 | C635: =LOG(RC[-2]+1 )*1000 -> 477.12125471966243
A636: 2 | B636: =LN(RC[-1]+1 )*400 -> 439.4449154672439 | C636: =LOG(RC[-2]+1 )*1000 -> 477.12125471966243
A637: 2 | B637: =LN(RC[-1]+1 )*400 -> 439.4449154672439 | C637: =LOG(RC[-2]+1 )*1000 -> 477.12125471966243
A638: 2 | B638: =LN(RC[-1]+1 )*400 -> 439.4449154672439 | C638: =LOG(RC[-2]+1 )*1000 -> 477.12125471966243
A639: 2 | B639: =LN(RC[-1]+1 )*400 -> 439.4449154672439 | C639: =LOG(RC[-2]+1 )*1000 -> 477.12125471966243
A640: 2 | B640: =LN(RC[-1]+1 )*400 -> 439.4449154672439 | C640: =LOG(RC[-2]+1 )*1000 -> 477.12125471966243
A641: 2 | B641: =LN(RC[-1]+1 )*400 -> 439.4449154672439 | C641: =LOG(RC[-2]+1 )*1000 -> 477.12125471966243
A642: 2 | B642: =LN(RC[-1]+1 )*400 -> 439.4449154672439 | C642: =LOG(RC[-2]+1 )*1000 -> 477.12125471966243
A643: 2 | B643: =LN(RC[-1]+1 )*400 -> 439.4449154672439 | C643: =LOG(RC[-2]+1 )*1000 -> 477.12125471966243
A644: 2 | B644: =LN(RC[-1]+1 )*400 -> 439.4449154672439 | C644: =LOG(RC[-2]+1 )*1000 -> 477.12125471966243
A645: 2 | B645: =LN(RC[-1]+1 )*400 -> 439.4449154672439 | C645: =LOG(RC[-2]+1 )*1000 -> 477.12125471966243
A646: 2 | B646: =LN(RC[-1]+1 )*400 -> 439.4449154672439 | C646: =LOG(RC[-2]+1 )*1000 -> 477.12125471966243
A647: 2 | B647: =LN(RC[-1]+1 )*400 -> 439.4449154672439 | C647: =LOG(RC[-2]+1 )*1000 -> 477.12125471966243
A648: 2 | B648: =LN(RC[-1]+1 )*400 -> 439.4449154672439 | C648: =LOG(RC[-2]+1 )*1000 -> 477.12125471966243
A649: 2 | B649: =LN(RC[-1]+1 )*400 -> 439.4449154672439 | C649: =LOG(RC[-2]+1 )*1000 -> 477.12125471966243
A650: 2 | B650: =LN(RC[-1]+1 )*400 -> 439.4449154672439 | C650: =LOG(RC[-2]+1 )*1000 -> 477.12125471966243
A651: 0 | B651: =LN(RC[-1]+1 )*400 -> 0 | C651: =LOG(RC[-2]+1 )*1000 -> 0
A652: 0 | B652: =LN(RC[-1]+1 )*400 -> 0 | C652: =LOG(RC[-2]+1 )*1000 -> 0
A653: 0 | B653: =LN(RC[-1]+1 )*400 -> 0 | C653: =LOG(RC[-2]+1 )*1000 -> 0
A654: 0 | B654: =LN(RC[-1]+1 )*400 -> 0 | C654: =LOG(RC[-2]+1 )*1000 -> 0
A655: 0 | B655: =LN(RC[-1]+1 )*400 -> 0 | C655: =LOG(RC[-2]+1 )*1000 -> 0
A656: 0 | B656: =LN(RC[-1]+1 )*400 -> 0 | C656: =LOG(RC[-2]+1 )*1000 -> 0
A657: 0 | B657: =LN(RC[-1]+1 )*400 -> 0 | C657: =LOG(RC[-2]+1 )*1000 -> 0
A658: 0 | B658: =LN(RC[-1]+1 )*400 -> 0 | C658: =LOG(RC[-2]+1 )*1000 -> 0
A659: 0 | B659: =LN(RC[-1]+1 )*400 -> 0 | C659: =LOG(RC[-2]+1 )*1000 -> 0
A660: 0 | B660: =LN(RC[-1]+1 )*400 -> 0 | C660: =LOG(RC[-2]+1 )*1000 -> 0
A661: 0 | B661: =LN(RC[-1]+1 )*400 -> 0 | C661: =LOG(RC[-2]+1 )*1000 -> 0
A662: 0 | B662: =LN(RC[-1]+1 )*400 -> 0 | C662: =LOG(RC[-2]+1 )*1000 -> 0
A663: 0 | B663: =LN(RC[-1]+1 )*400 -> 0 | C663: =LOG(RC[-2]+1 )*1000 -> 0
A664: 0 | B664: =LN(RC[-1]+1 )*400 -> 0 | C664: =LOG(RC[-2]+1 )*1000 -> 0
A665: 0 | B665: =LN(RC[-1]+1 )*400 -> 0 | C665: =LOG(RC[-2]+1 )*1000 -> 0
A666: 0 | B666: =LN(RC[-1]+1 )*400 -> 0 | C666: =LOG(RC[-2]+1 )*1000 -> 0
A667: 0 | B667: =LN(RC[-1]+1 )*400 -> 0 | C667: =LOG(RC[-2]+1 )*1000 -> 0
A668: 0 | B668: =LN(RC[-1]+1 )*400 -> 0 | C668: =LOG(RC[-2]+1 )*1000 -> 0
A669: 0 | B669: =LN(RC[-1]+1 )*400 -> 0 | C669: =LOG(RC[-2]+1 )*1000 -> 0
A670: 0 | B670: =LN(RC[-1]+1 )*400 -> 0 | C670: =LOG(RC[-2]+1 )*1000 -> 0
A671: 0 | B671: =LN(RC[-1]+1 )*400 -> 0 | C671: =LOG(RC[-2]+1 )*1000 -> 0
A672: 0 | B672: =LN(RC[-1]+1 )*400 -> 0 | C672: =LOG(RC[-2]+1 )*1000 -> 0
A673: 0 | B673: =LN(RC[-1]+1 )*400 -> 0 | C673: =LOG(RC[-2]+1 )*1000 -> 0
A674: 0 | B674: =LN(RC[-1]+1 )*400 -> 0 | C674: =LOG(RC[-2]+1 )*1000 -> 0
A675: 0 | B675: =LN(RC[-1]+1 )*400 -> 0 | C675: =LOG(RC[-2]+1 )*1000 -> 0
A676: 0 | B676: =LN(RC[-1]+1 )*400 -> 0 | C676: =LOG(RC[-2]+1 )*1000 -> 0
A677: 0 | B677: =LN(RC[-1]+1 )*400 -> 0 | C677: =LOG(RC[-2]+1 )*1000 -> 0
A678: 0 | B678: =LN(RC[-1]+1 )*400 -> 0 | C678: =LOG(RC[-2]+1 )*1000 -> 0
A679: 0 | B679: =LN(RC[-1]+1 )*400 -> 0 | C679: =LOG(RC[-2]+1 )*1000 -> 0
A680: 0 | B680: =LN(RC[-1]+1 )*400 -> 0 | C680: =LOG(RC[-2]+1 )*1000 -> 0
A681: 0 | B681: =LN(RC[-1]+1 )*400 -> 0 | C681: =LOG(RC[-2]+1 )*1000 -> 0
A682: 0 | B682: =LN(RC[-1]+1 )*400 -> 0 | C682: =LOG(RC[-2]+1 )*1000 -> 0
A683: 0 | B683: =LN(RC[-1]+1 )*400 -> 0 | C683: =LOG(RC[-2]+1 )*1000 -> 0
A684: 0 | B684: =LN(RC[-1]+1 )*400 -> 0 | C684: =LOG(RC[-2]+1 )*1000 -> 0
A685: 0 | B685: =LN(RC[-1]+1 )*400 -> 0 | C685: =LOG(RC[-2]+1 )*1000 -> 0
A686: 0 | B686: =LN(RC[-1]+1 )*400 -> 0 | C686: =LOG(RC[-2]+1 )*1000 -> 0
A687: 0 | B687: =LN(RC[-1]+1 )*400 -> 0 | C687: =LOG(RC[-2]+1 )*1000 -> 0
A688: 0 | B688: =LN(RC[-1]+1 )*400 -> 0 | C688: =LOG(RC[-2]+1 )*1000 -> 0
A689: 0 | B689: =LN(RC[-1]+1 )*400 -> 0 | C689: =LOG(RC[-2]+1 )*1000 -> 0
A690: 0 | B690: =LN(RC[-1]+1 )*400 -> 0 | C690: =LOG(RC[-2]+1 )*1000 -> 0
A691: 0 | B691: =LN(RC[-1]+1 )*400 -> 0 | C691: =LOG(RC[-2]+1 )*1000 -> 0
A692: 0 | B692: =LN(RC[-1]+1 )*400 -> 0 | C692: =LOG(RC[-2]+1 )*1000 -> 0
A693: 0 | B693: =LN(RC[-1]+1 )*400 -> 0 | C693: =LOG(RC[-2]+1 )*1000 -> 0
A694: 0 | B694: =LN(RC[-1]+1 )*400 -> 0 | C694: =LOG(RC[-2]+1 )*1000 -> 0
A695: 0 | B695: =LN(RC[-1]+1 )*400 -> 0 | C695: =LOG(RC[-2]+1 )*1000 -> 0
A696: 0 | B696: =LN(RC[-1]+1 )*400 -> 0 | C696: =LOG(RC[-2]+1 )*1000 -> 0
A697: 0 | B697: =LN(RC[-1]+1 )*400 -> 0 | C697: =LOG(RC[-2]+1 )*1000 -> 0
A698: 0 | B698: =LN(RC[-1]+1 )*400 -> 0 | C698: =LOG(RC[-2]+1 )*1000 -> 0
A699: 0 | B699: =LN(RC[-1]+1 )*400 -> 0 | C699: =LOG(RC[-2]+1 )*1000 -> 0
A700: 0 | B700: =LN(RC[-1]+1 )*400 -> 0 | C700: =LOG(RC[-2]+1 )*1000 -> 0
A701: 0 | B701: =LN(RC[-1]+1 )*400 -> 0 | C701: =LOG(RC[-2]+1 )*1000 -> 0
A702: 0 | B702: =LN(RC[-1]+1 )*400 -> 0 | C702: =LOG(RC[-2]+1 )*1000 -> 0
A703: 0 | B703: =LN(RC[-1]+1 )*400 -> 0 | C703: =LOG(RC[-2]+1 )*1000 -> 0
A704: 0 | B704: =LN(RC[-1]+1 )*400 -> 0 | C704: =LOG(RC[-2]+1 )*1000 -> 0
A705: 0 | B705: =LN(RC[-1]+1 )*400 -> 0 | C705: =LOG(RC[-2]+1 )*1000 -> 0
A706: 0 | B706: =LN(RC[-1]+1 )*400 -> 0 | C706: =LOG(RC[-2]+1 )*1000 -> 0
A707: 0 | B707: =LN(RC[-1]+1 )*400 -> 0 | C707: =LOG(RC[-2]+1 )*1000 -> 0
A708: 0 | B708: =LN(RC[-1]+1 )*400 -> 0 | C708: =LOG(RC[-2]+1 )*1000 -> 0
A709: 0 | B709: =LN(RC[-1]+1 )*400 -> 0 | C709: =LOG(RC[-2]+1 )*1000 -> 0
A710: 0 | B710: =LN(RC[-1]+1 )*400 -> 0 | C710: =LOG(RC[-2]+1 )*1000 -> 0
A711: 0 | B711: =LN(RC[-1]+1 )*400 -> 0 | C711: =LOG(RC[-2]+1 )*1000 -> 0
A712: 0 | B712: =LN(RC[-1]+1 )*400 -> 0 | C712: =LOG(RC[-2]+1 )*1000 -> 0
A713: 0 | B713: =LN(RC[-1]+1 )*400 -> 0 | C713: =LOG(RC[-2]+1 )*1000 -> 0
A714: 0 | B714: =LN(RC[-1]+1 )*400 -> 0 | C714: =LOG(RC[-2]+1 )*1000 -> 0
A715: 0 | B715: =LN(RC[-1]+1 )*400 -> 0 | C715: =LOG(RC[-2]+1 )*1000 -> 0
A716: 0 | B716: =LN(RC[-1]+1 )*400 -> 0 | C716: =LOG(RC[-2]+1 )*1000 -> 0
A717: 0 | B717: =LN(RC[-1]+1 )*400 -> 0 | C717: =LOG(RC[-2]+1 )*1000 -> 0
A718: 0 | B718: =LN(RC[-1]+1 )*400 -> 0 | C718: =LOG(RC[-2]+1 )*1000 -> 0
A719: 0 | B719: =LN(RC[-1]+1 )*400 -> 0 | C719: =LOG(RC[-2]+1 )*1000 -> 0
A720: 0 | B720: =LN(RC[-1]+1 )*400 -> 0 | C720: =LOG(RC[-2]+1 )*1000 -> 0
A721: 0 | B721: =LN(RC[-1]+1 )*400 -> 0 | C721: =LOG(RC[-2]+1 )*1000 -> 0
A722: 0 | B722: =LN(RC[-1]+1 )*400 -> 0 | C722: =LOG(RC[-2]+1 )*1000 -> 0
A723: 0 | B723: =LN(RC[-1]+1 )*400 -> 0 | C723: =LOG(RC[-2]+1 )*1000 -> 0
A724: 0 | B724: =LN(RC[-1]+1 )*400 -> 0 | C724: =LOG(RC[-2]+1 )*1000 -> 0
A725: 0 | B725: =LN(RC[-1]+1 )*400 -> 0 | C725: =LOG(RC[-2]+1 )*1000 -> 0
A726: 0 | B726: =LN(RC[-1]+1 )*400 -> 0 | C726: =LOG(RC[-2]+1 )*1000 -> 0
A727: 0 | B727: =LN(RC[-1]+1 )*400 -> 0 | C727: =LOG(RC[-2]+1 )*1000 -> 0
A728: 0 | B728: =LN(RC[-1]+1 )*400 -> 0 | C728: =LOG(RC[-2]+1 )*1000 -> 0
A729: 0 | B729: =LN(RC[-1]+1 )*400 -> 0 | C729: =LOG(RC[-2]+1 )*1000 -> 0
A730: 0 | B730: =LN(RC[-1]+1 )*400 -> 0 | C730: =LOG(RC[-2]+1 )*1000 -> 0
A731: 0 | B731: =LN(RC[-1]+1 )*400 -> 0 | C731: =LOG(RC[-2]+1 )*1000 -> 0
A732: 0 | B732: =LN(RC[-1]+1 )*400 -> 0 | C732: =LOG(RC[-2]+1 )*1000 -> 0
A733: 0 | B733: =LN(RC[-1]+1 )*400 -> 0 | C733: =LOG(RC[-2]+1 )*1000 -> 0
A734: 0 | B734: =LN(RC[-1]+1 )*400 -> 0 | C734: =LOG(RC[-2]+1 )*1000 -> 0
A735: 0 | B735: =LN(RC[-1]+1 )*400 -> 0 | C735: =LOG(RC[-2]+1 )*1000 -> 0
A736: 0 | B736: =LN(RC[-1]+1 )*400 -> 0 | C736: =LOG(RC[-2]+1 )*1000 -> 0
A737: 0 | B737: =LN(RC[-1]+1 )*400 -> 0 | C737: =LOG(RC[-2]+1 )*1000 -> 0
A738: 0 | B738: =LN(RC[-1]+1 )*400 -> 0 | C738: =LOG(RC[-2]+1 )*1000 -> 0
A739: 0 | B739: =LN(RC[-1]+1 )*400 -> 0 | C739: =LOG(RC[-2]+1 )*1000 -> 0
A740: 0 | B740: =LN(RC[-1]+1 )*400 -> 0 | C740: =LOG(RC[-2]+1 )*1000 -> 0
A741: 0 | B741: =LN(RC[-1]+1 )*400 -> 0 | C741: =LOG(RC[-2]+1 )*1000 -> 0
A742: 0 | B742: =LN(RC[-1]+1 )*400 -> 0 | C742: =LOG(RC[-2]+1 )*1000 -> 0
A743: 0 | B743: =LN(RC[-1]+1 )*400 -> 0 | C743: =LOG(RC[-2]+1 )*1000 -> 0
A744: 0 | B744: =LN(RC[-1]+1 )*400 -> 0 | C744: =LOG(RC[-2]+1 )*1000 -> 0
A745: 0 | B745: =LN(RC[-1]+1 )*400 -> 0 | C745: =LOG(RC[-2]+1 )*1000 -> 0
A746: 0 | B746: =LN(RC[-1]+1 )*400 -> 0 | C746: =LOG(RC[-2]+1 )*1000 -> 0
A747: 0 | B747: =LN(RC[-1]+1 )*400 -> 0 | C747: =LOG(RC[-2]+1 )*1000 -> 0
A748: 0 | B748: =LN(RC[-1]+1 )*400 -> 0 | C748: =LOG(RC[-2]+1 )*1000 -> 0
A749: 0 | B749: =LN(RC[-1]+1 )*400 -> 0 | C749: =LOG(RC[-2]+1 )*1000 -> 0
A750: 0 | B750: =LN(RC[-1]+1 )*400 -> 0 | C750: =LOG(RC[-2]+1 )*1000 -> 0
A751: 0 | B751: =LN(RC[-1]+1 )*400 -> 0 | C751: =LOG(RC[-2]+1 )*1000 -> 0
A752: 0 | B752: =LN(RC[-1]+1 )*400 -> 0 | C752: =LOG(RC[-2]+1 )*1000 -> 0
A753: 0 | B753: =LN(RC[-1]+1 )*400 -> 0 | C753: =LOG(RC[-2]+1 )*1000 -> 0
A754: 0 | B754: =LN(RC[-1]+1 )*400 -> 0 | C754: =LOG(RC[-2]+1 )*1000 -> 0
A755: 0 | B755: =LN(RC[-1]+1 )*400 -> 0 | C755: =LOG(RC[-2]+1 )*1000 -> 0
A756: 0 | B756: =LN(RC[-1]+1 )*400 -> 0 | C756: =LOG(RC[-2]+1 )*1000 -> 0
A757: 0 | B757: =LN(RC[-1]+1 )*400 -> 0 | C757: =LOG(RC[-2]+1 )*1000 -> 0
A758: 0 | B758: =LN(RC[-1]+1 )*400 -> 0 | C758: =LOG(RC[-2]+1 )*1000 -> 0
A759: 0 | B759: =LN(RC[-1]+1 )*400 -> 0 | C759: =LOG(RC[-2]+1 )*1000 -> 0
A760: 0 | B760: =LN(RC[-1]+1 )*400 -> 0 | C760: =LOG(RC[-2]+1 )*1000 -> 0
A761: 0 | B761: =LN(RC[-1]+1 )*400 -> 0 | C761: =LOG(RC[-2]+1 )*1000 -> 0
A762: 0 | B762: =LN(RC[-1]+1 )*400 -> 0 | C762: =LOG(RC[-2]+1 )*1000 -> 0
A763: 0 | B763: =LN(RC[-1]+1 )*400 -> 0 | C763: =LOG(RC[-2]+1 )*1000 -> 0
A764: 0 | B764: =LN(RC[-1]+1 )*400 -> 0 | C764: =LOG(RC[-2]+1 )*1000 -> 0
A765: 0 | B765: =LN(RC[-1]+1 )*400 -> 0 | C765: =LOG(RC[-2]+1 )*1000 -> 0
A766: 0 | B766: =LN(RC[-1]+1 )*400 -> 0 | C766: =LOG(RC[-2]+1 )*1000 -> 0
A767: 0 | B767: =LN(RC[-1]+1 )*400 -> 0 | C767: =LOG(RC[-2]+1 )*1000 -> 0
A768: 0 | B768: =LN(RC[-1]+1 )*400 -> 0 | C768: =LOG(RC[-2]+1 )*1000 -> 0
A769: 0 | B769: =LN(RC[-1]+1 )*400 -> 0 | C769: =LOG(RC[-2]+1 )*1000 -> 0
A770: 0 | B770: =LN(RC[-1]+1 )*400 -> 0 | C770: =LOG(RC[-2]+1 )*1000 -> 0
A771: 0 | B771: =LN(RC[-1]+1 )*400 -> 0 | C771: =LOG(RC[-2]+1 )*1000 -> 0
A772: 0 | B772: =LN(RC[-1]+1 )*400 -> 0 | C772: =LOG(RC[-2]+1 )*1000 -> 0
A773: 0 | B773: =LN(RC[-1]+1 )*400 -> 0 | C773: =LOG(RC[-2]+1 )*1000 -> 0
A774: 0 | B774: =LN(RC[-1]+1 )*400 -> 0 | C774: =LOG(RC[-2]+1 )*1000 -> 0
A775: 0 | B775: =LN(RC[-1]+1 )*400 -> 0 | C775: =LOG(RC[-2]+1 )*1000 -> 0
A776: 0 | B776: =LN(RC[-1]+1 )*400 -> 0 | C776: =LOG(RC[-2]+1 )*1000 -> 0
A777: 0 | B777: =LN(RC[-1]+1 )*400 -> 0 | C777: =LOG(RC[-2]+1 )*1000 -> 0
A778: 0 | B778: =LN(RC[-1]+1 )*400 -> 0 | C778: =LOG(RC[-2]+1 )*1000 -> 0
A779: 0 | B779: =LN(RC[-1]+1 )*400 -> 0 | C779: =LOG(RC[-2]+1 )*1000 -> 0
A780: 0 | B780: =LN(RC[-1]+1 )*400 -> 0
A781: 0 | B781: =LN(RC[-1]+1 )*400 -> 0
A782: 0 | B782: =LN(RC[-1]+1 )*400 -> 0
A783: 0 | B783: =LN(RC[-1]+1 )*400 -> 0
A784: 0 | B784: =LN(RC[-1]+1 )*400 -> 0
A785: 0 | B785: =LN(RC[-1]+1 )*400 -> 0
A786: 0 | B786: =LN(RC[-1]+1 )*400 -> 0
A787: 0 | B787: =LN(RC[-1]+1 )*400 -> 0
A788: 0 | B788: =LN(RC[-1]+1 )*400 -> 0
A789: 0 | B789: =LN(RC[-1]+1 )*400 -> 0
A790: 0 | B790: =LN(RC[-1]+1 )*400 -> 0
A791: 0 | B791: =LN(RC[-1]+1 )*400 -> 0
A792: 0 | B792: =LN(RC[-1]+1 )*400 -> 0
A793: 0 | B793: =LN(RC[-1]+1 )*400 -> 0
A794: 0 | B794: =LN(RC[-1]+1 )*400 -> 0
A795: 0 | B795: =LN(RC[-1]+1 )*400 -> 0
A796: 0 | B796: =LN(RC[-1]+1 )*400 -> 0
A797: 0 | B797: =LN(RC[-1]+1 )*400 -> 0
A798: 0 | B798: =LN(RC[-1]+1 )*400 -> 0
A799: 0 | B799: =LN(RC[-1]+1 )*400 -> 0
A800: 0 | B800: =LN(RC[-1]+1 )*400 -> 0
A801: 0 | B801: =LN(RC[-1]+1 )*400 -> 0
A802: 0 | B802: =LN(RC[-1]+1 )*400 -> 0
A803: 0 | B803: =LN(RC[-1]+1 )*400 -> 0
A804: 0 | B804: =LN(RC[-1]+1 )*400 -> 0
A805: 0 | B805: =LN(RC[-1]+1 )*400 -> 0
A806: 0 | B806: =LN(RC[-1]+1 )*400 -> 0
A807: 0 | B807: =LN(RC[-1]+1 )*400 -> 0
A808: 0 | B808: =LN(RC[-1]+1 )*400 -> 0
A809: 0 | B809: =LN(RC[-1]+1 )*400 -> 0
A810: 0 | B810: =LN(RC[-1]+1 )*400 -> 0
A811: 0 | B811: =LN(RC[-1]+1 )*400 -> 0
A812: 0 | B812: =LOG(RC[-1]+1)*900 -> 0
A813: 0 | B813: =LOG(RC[-1]+1)*900 -> 0
A814: 0 | B814: =LOG(RC[-1]+1)*900 -> 0
A815: 0 | B815: =LOG(RC[-1]+1)*900 -> 0
A816: 0 | B816: =LOG(RC[-1]+1)*900 -> 0
A817: 0 | B817: =LOG(RC[-1]+1)*900 -> 0
A818: 0 | B818: =LOG(RC[-1]+1)*900 -> 0
A819: 0 | B819: =LOG(RC[-1]+1)*900 -> 0
A820: 0 | B820: =LOG(RC[-1]+1)*900 -> 0
A821: 0 | B821: =LOG(RC[-1]+1)*900 -> 0
A822: 0 | B822: =LOG(RC[-1]+1)*900 -> 0
A823: 0 | B823: =LOG(RC[-1]+1)*900 -> 0
A824: 0 | B824: =LOG(RC[-1]+1)*900 -> 0
A825: 0 | B825: =LOG(RC[-1]+1)*900 -> 0
A826: 0 | B826: =LOG(RC[-1]+1)*900 -> 0
A827: 0 | B827: =LOG(RC[-1]+1)*900 -> 0
A828: 0 | B828: =LOG(RC[-1]+1)*900 -> 0
A829: 0 | B829: =LOG(RC[-1]+1)*900 -> 0
A830: 0 | B830: =LOG(RC[-1]+1)*900 -> 0
A831: 0 | B831: =LOG(RC[-1]+1)*900 -> 0
A832: 0 | B832: =LOG(RC[-1]+1)*900 -> 0
A833: 0 | B833: =LOG(RC[-1]+1)*900 -> 0
A834: 0 | B834: =LOG(RC[-1]+1)*900 -> 0
A835: 0 | B835: =LOG(RC[-1]+1)*900 -> 0
A836: 0 | B836: =LOG(RC[-1]+1)*900 -> 0
A837: 0 | B837: =LOG(RC[-1]+1)*900 -> 0
A838: 0 | B838: =LOG(RC[-1]+1)*900 -> 0
A839: 0 | B839: =LOG(RC[-1]+1)*900 -> 0
A840: 0 | B840: =LOG(RC[-1]+1)*900 -> 0
A841: 0 | B841: =LOG(RC[-1]+1)*900 -> 0
A842: 0 | B842: =LOG(RC[-1]+1)*900 -> 0
A843: 0 | B843: =LOG(RC[-1]+1)*900 -> 0
A844: 0 | B844: =LOG(RC[-1]+1)*900 -> 0
A845: 0 | B845: =LOG(RC[-1]+1)*900 -> 0
A846: 0 | B846: =LOG(RC[-1]+1)*900 -> 0
A847: 0 | B847: =LOG(RC[-1]+1)*900 -> 0
A848: 0 | B848: =LOG(RC[-1]+1)*900 -> 0
A849: 0 | B849: =LOG(RC[-1]+1)*900 -> 0
A850: 0 | B850: =LOG(RC[-1]+1)*900 -> 0
A851: 0 | B851: =LOG(RC[-1]+1)*900 -> 0
A852: 0 | B852: =LOG(RC[-1]+1)*900 -> 0
A853: 0 | B853: =LOG(RC[-1]+1)*900 -> 0
A854: 0 | B854: =LOG(RC[-1]+1)*900 -> 0
A855: 0 | B855: =LOG(RC[-1]+1)*900 -> 0
A856: 0 | B856: =LOG(RC[-1]+1)*900 -> 0
A857: 0 | B857: =LOG(RC[-1]+1)*900 -> 0
A858: 0 | B858: =LOG(RC[-1]+1)*900 -> 0
A859: 0 | B859: =LOG(RC[-1]+1)*900 -> 0
A860: 0 | B860: =LOG(RC[-1]+1)*900 -> 0
A861: 0 | B861: =LOG(RC[-1]+1)*900 -> 0
A862: 0 | B862: =LOG(RC[-1]+1)*900 -> 0
A863: 0 | B863: =LOG(RC[-1]+1)*900 -> 0
A864: 0 | B864: =LOG(RC[-1]+1)*900 -> 0
A865: 0 | B865: =LOG(RC[-1]+1)*900 -> 0
A866: 0 | B866: =LOG(RC[-1]+1)*900 -> 0
A867: 0 | B867: =LOG(RC[-1]+1)*900 -> 0
A868: 0 | B868: =LOG(RC[-1]+1)*900 -> 0
A869: 0 | B869: =LOG(RC[-1]+1)*900 -> 0
A870: 0 | B870: =LOG(RC[-1]+1)*900 -> 0
A871: 0 | B871: =LOG(RC[-1]+1)*900 -> 0
A872: 0 | B872: =LOG(RC[-1]+1)*900 -> 0
A873: 0 | B873: =LOG(RC[-1]+1)*900 -> 0
A874: 0 | B874: =LOG(RC[-1]+1)*900 -> 0
A875: 0 | B875: =LOG(RC[-1]+1)*900 -> 0
A876: 0 | B876: =LOG(RC[-1]+1)*900 -> 0
A877: 0 | B877: =LOG(RC[-1]+1)*900 -> 0
A878: 0 | B878: =LOG(RC[-1]+1)*900 -> 0
A879: 0 | B879: =LOG(RC[-1]+1)*900 -> 0
A880: 0 | B880: =LOG(RC[-1]+1)*900 -> 0
A881: 0 | B881: =LOG(RC[-1]+1)*900 -> 0
A882: 0 | B882: =LOG(RC[-1]+1)*900 -> 0
A883: 0 | B883: =LOG(RC[-1]+1)*900 -> 0
A884: 0 | B884: =LOG(RC[-1]+1)*900 -> 0
A885: 0 | B885: =LOG(RC[-1]+1)*900 -> 0
A886: 0 | B886: =LOG(RC[-1]+1)*900 -> 0
A887: 0 | B887: =LOG(RC[-1]+1)*900 -> 0
A888: 0 | B888: =LOG(RC[-1]+1)*900 -> 0
A889: 0 | B889: =LOG(RC[-1]+1)*900 -> 0
A890: 0 | B890: =LOG(RC[-1]+1)*900 -> 0
A891: 0 | B891: =LOG(RC[-1]+1)*900 -> 0
A892: 0 | B892: =LOG(RC[-1]+1)*900 -> 0
A893: 0 | B893: =LOG(RC[-1]+1)*900 -> 0
A894: 0 | B894: =LOG(RC[-1]+1)*900 -> 0
A895: 0 | B895: =LOG(RC[-1]+1)*900 -> 0
A896: 0 | B896: =LOG(RC[-1]+1)*1000 -> 0
A897: 0 | B897: =LOG(RC[-1]+1)*1000 -> 0
A898: 0 | B898: =LOG(RC[-1]+1)*1000 -> 0
A899: 0 | B899: =LOG(RC[-1]+1)*1000 -> 0
A900: 0 | B900: =LOG(RC[-1]+1)*1000 -> 0
A901: 0 | B901: =LOG(RC[-1]+1)*1000 -> 0
A902: 0 | B902: =LOG(RC[-1]+1)*1000 -> 0
A903: 0 | B903: =LOG(RC[-1]+1)*1000 -> 0
A904: 0 | B904: =LOG(RC[-1]+1)*1000 -> 0
A905: 0 | B905: =LOG(RC[-1]+1)*1000 -> 0
A906: 0 | B906: =LOG(RC[-1]+1)*1000 -> 0
A907: 0 | B907: =LOG(RC[-1]+1)*1000 -> 0
A908: 0 | B908: =LOG(RC[-1]+1)*1000 -> 0
A909: 0 | B909: =LOG(RC[-1]+1)*1000 -> 0
A910: 0 | B910: =LOG(RC[-1]+1)*1000 -> 0
A911: 0 | B911: =LOG(RC[-1]+1)*1000 -> 0
A912: 0 | B912: =LOG(RC[-1]+1)*1000 -> 0
A913: 0 | B913: =LOG(RC[-1]+1)*1000 -> 0
A914: 0 | B914: =LOG(RC[-1]+1)*1000 -> 0
A915: 0 | B915: =LOG(RC[-1]+1)*1000 -> 0
A916: 0 | B916: =LOG(RC[-1]+1)*1000 -> 0
A917: 0 | B917: =LOG(RC[-1]+1)*1000 -> 0
A918: 0 | B918: =LOG(RC[-1]+1)*1000 -> 0
A919: 0 | B919: =LOG(RC[-1]+1)*1000 -> 0
A920: 0 | B920: =LOG(RC[-1]+1)*1000 -> 0
A921: 0 | B921: =LOG(RC[-1]+1)*1000 -> 0
A922: 0 | B922: =LOG(RC[-1]+1)*1000 -> 0
A923: 0 | B923: =LOG(RC[-1]+1)*1000 -> 0
A924: 0 | B924: =LOG(RC[-1]+1)*1000 -> 0
A925: 0 | B925: =LOG(RC[-1]+1)*1000 -> 0
A926: 0 | B926: =LOG(RC[-1]+1)*1000 -> 0
A927: 0 | B927: =LOG(RC[-1]+1)*1000 -> 0
A928: 0 | B928: =LOG(RC[-1]+1)*1000 -> 0
A929: 0 | B929: =LOG(RC[-1]+1)*1000 -> 0
A930: 0 | B930: =LOG(RC[-1]+1)*1000 -> 0
A931: 0 | B931: =LOG(RC[-1]+1)*1000 -> 0
A932: 0 | B932: =LOG(RC[-1]+1)*1000 -> 0
A933: 0 | B933: =LOG(RC[-1]+1)*1000 -> 0
A934: 0 | B934: =LOG(RC[-1]+1)*1000 -> 0
A935: 0 | B935: =LOG(RC[-1]+1)*1000 -> 0
A936: 0 | B936: =LOG(RC[-1]+1)*1000 -> 0
A937: 0 | B937: =LOG(RC[-1]+1)*1000 -> 0
A938: 0 | B938: =LOG(RC[-1]+1)*1000 -> 0
A939: 0 | B939: =LOG(RC[-1]+1)*1000 -> 0
A940: 0 | B940: =LOG(RC[-1]+1)*1000 -> 0
A941: 0 | B941: =LOG(RC[-1]+1)*1000 -> 0
A942: 0 | B942: =LOG(RC[-1]+1)*1000 -> 0
A943: 0 | B943: =LOG(RC[-1]+1)*1000 -> 0
A944: 0 | B944: =LOG(RC[-1]+1)*1000 -> 0
A945: 0 | B945: =LOG(RC[-1]+1)*1000 -> 0
A946: 0 | B946: =LOG(RC[-1]+1)*1000 -> 0
A947: 0 | B947: =LOG(RC[-1]+1)*1000 -> 0
A948: 0 | B948: =LOG(RC[-1]+1)*1000 -> 0
A949: 0 | B949: =LOG(RC[-1]+1)*1000 -> 0
A950: 0 | B950: =LOG(RC[-1]+1)*1000 -> 0
A951: 0 | B951: =LOG(RC[-1]+1)*1000 -> 0
A952: 0 | B952: =LOG(RC[-1]+1)*1000 -> 0
A953: 0 | B953: =LOG(RC[-1]+1)*1000 -> 0
A954: 0 | B954: =LOG(RC[-1]+1)*1000 -> 0
A955: 0 | B955: =LOG(RC[-1]+1)*1000 -> 0
A956: 0 | B956: =LOG(RC[-1]+1)*1000 -> 0
A957: 0 | B957: =LOG(RC[-1]+1)*1000 -> 0
A958: 0 | B958: =LOG(RC[-1]+1)*1000 -> 0
A959: 0 | B959: =LOG(RC[-1]+1)*1000 -> 0
A960: 0 | B960: =LOG(RC[-1]+1)*1000 -> 0
A961: 0 | B961: =LOG(RC[-1]+1)*1000 -> 0
A962: 0 | B962: =LOG(RC[-1]+1)*1000 -> 0
A963: 0 | B963: =LOG(RC[-1]+1)*1000 -> 0
A964: 0 | B964: =LOG(RC[-1]+1)*1000 -> 0
A965: 0 | B965: =LOG(RC[-1]+1)*1000 -> 0
A966: 0 | B966: =LOG(RC[-1]+1)*1000 -> 0
A967: 0 | B967: =LOG(RC[-1]+1)*1000 -> 0
A968: 0 | B968: =LOG(RC[-1]+1)*1000 -> 0
A969: 0 | B969: =LOG(RC[-1]+1)*1000 -> 0
A970: 0 | B970: =LOG(RC[-1]+1)*1000 -> 0
A971: 0 | B971: =LOG(RC[-1]+1)*1000 -> 0
A972: 0 | B972: =LOG(RC[-1]+1)*1000 -> 0
A973: 0 | B973: =LOG(RC[-1]+1)*1000 -> 0
A974: 0 | B974: =LOG(RC[-1]+1)*1000 -> 0
A975: 0 | B975: =LOG(RC[-1]+1)*1000 -> 0
A976: 0 | B976: =LOG(RC[-1]+1)*1000 -> 0
A977: 0 | B977: =LOG(RC[-1]+1)*1000 -> 0
A978: 0 | B978: =LOG(RC[-1]+1)*1000 -> 0
A979: 0 | B979: =LOG(RC[-1]+1)*1000 -> 0
A980: 0 | B980: =LOG(RC[-1]+1)*1000 -> 0
A981: 0 | B981: =LOG(RC[-1]+1)*1000 -> 0
A982: 0 | B982: =LOG(RC[-1]+1)*1000 -> 0
A983: 0 | B983: =LOG(RC[-1]+1)*1000 -> 0
A984: 0 | B984: =LOG(RC[-1]+1)*1000 -> 0
A985: 0 | B985: =LOG(RC[-1]+1)*1000 -> 0
A986: 0 | B986: =LOG(RC[-1]+1)*1000 -> 0
A987: 0 | B987: =LOG(RC[-1]+1)*1000 -> 0
A988: 0 | B988: =LOG(RC[-1]+1)*1000 -> 0
A989: 0 | B989: =LOG(RC[-1]+1)*1000 -> 0
A990: 0 | B990: =LOG(RC[-1]+1)*1000 -> 0
A991: 0 | B991: =LOG(RC[-1]+1)*1000 -> 0
A992: 0 | B992: =LOG(RC[-1]+1)*1000 -> 0
A993: 0 | B993: =LOG(RC[-1]+1)*1000 -> 0
A994: 0 | B994: =LOG(RC[-1]+1)*1000 -> 0
A995: 0 | B995: =LOG(RC[-1]+1)*1000 -> 0
A996: 0 | B996: =LOG(RC[-1]+1)*1000 -> 0
A997: 0 | B997: =LOG(RC[-1]+1)*1000 -> 0
A998: 0 | B998: =LOG(RC[-1]+1)*1000 -> 0
A999: 0 | B999: =LOG(RC[-1]+1)*1000 -> 0
A1000: 0 | B1000: =LOG(RC[-1]+1)*1000 -> 0
A1001: 0 | B1001: =LOG(RC[-1]+1)*1000 -> 0
A1002: 0 | B1002: =LOG(RC[-1]+1)*1000 -> 0
A1003: 0 | B1003: =LOG(RC[-1]+1)*1000 -> 0
A1004: 0 | B1004: =LOG(RC[-1]+1)*1000 -> 0
A1005: 0 | B1005: =LOG(RC[-1]+1)*1000 -> 0
A1006: 0 | B1006: =LOG(RC[-1]+1)*1000 -> 0
A1007: 0 | B1007: =LOG(RC[-1]+1)*1000 -> 0
A1008: 0 | B1008: =LOG(RC[-1]+1)*1000 -> 0
A1009: 0 | B1009: =LOG(RC[-1]+1)*1000 -> 0
A1010: 0 | B1010: =LOG(RC[-1]+1)*1000 -> 0
A1011: 0 | B1011: =LOG(RC[-1]+1)*1000 -> 0
A1012: 0 | B1012: =LOG(RC[-1]+1)*1000 -> 0
A1013: 0 | B1013: =LOG(RC[-1]+1)*1000 -> 0
A1014: 0 | B1014: =LOG(RC[-1]+1)*1000 -> 0
A1015: 0 | B1015: =LOG(RC[-1]+1)*1000 -> 0
A1016: 0 | B1016: =LOG(RC[-1]+1)*1000 -> 0
A1017: 0 | B1017: =LOG(RC[-1]+1)*1000 -> 0
A1018: 0 | B1018: =LOG(RC[-1]+1)*1000 -> 0
A1019: 0 | B1019: =LOG(RC[-1]+1)*1000 -> 0
A1020: 0 | B1020: =LOG(RC[-1]+1)*1000 -> 0
A1021: 0 | B1021: =LOG(RC[-1]+1)*1000 -> 0
A1022: 0 | B1022: =LOG(RC[-1]+1)*1000 -> 0
A1023: 0 | B1023: =LOG(RC[-1]+1)*1000 -> 0
A1024: 0 | B1024: =LOG(RC[-1]+1)*1000 -> 0
A1025: 0 | B1025: =LOG(RC[-1]+1)*1000 -> 0
A1026: 0 | B1026: =LOG(RC[-1]+1)*1000 -> 0
A1027: 0 | B1027: =LOG(RC[-1]+1)*1000 -> 0
A1028: 0 | B1028: =LOG(RC[-1]+1)*1000 -> 0
A1029: 0 | B1029: =LOG(RC[-1]+1)*1000 -> 0
A1030: 0 | B1030: =LOG(RC[-1]+1)*1000 -> 0
A1031: 0 | B1031: =LOG(RC[-1]+1)*1000 -> 0
A1032: 0 | B1032: =LOG(RC[-1]+1)*1000 -> 0
A1033: 0 | B1033: =LOG(RC[-1]+1)*1000 -> 0
A1034: 0 | B1034: =LOG(RC[-1]+1)*1000 -> 0
A1035: 0 | B1035: =LOG(RC[-1]+1)*1000 -> 0
A1036: 0 | B1036: =LOG(RC[-1]+1)*1000 -> 0
A1037: 0 | B1037: =LOG(RC[-1]+1)*1000 -> 0
A1038: 0 | B1038: =LOG(RC[-1]+1)*1000 -> 0
A1039: 0 | B1039: =LOG(RC[-1]+1)*1000 -> 0
A1040: 0 | B1040: =LOG(RC[-1]+1)*1000 -> 0
A1041: 0 | B1041: =LOG(RC[-1]+1)*1000 -> 0
A1042: 0 | B1042: =LOG(RC[-1]+1)*1000 -> 0
A1043: 0 | B1043: =LOG(RC[-1]+1)*1000 -> 0
A1044: 0 | B1044: =LOG(RC[-1]+1)*1000 -> 0
A1045: 0 | B1045: =LOG(RC[-1]+1)*1000 -> 0
A1046: 0 | B1046: =LOG(RC[-1]+1)*1000 -> 0
A1047: 0 | B1047: =LOG(RC[-1]+1)*1000 -> 0
A1048: 0 | B1048: =LOG(RC[-1]+1)*1000 -> 0
A1049: 0 | B1049: =LOG(RC[-1]+1)*1000 -> 0
A1050: 0 | B1050: =LOG(RC[-1]+1)*1000 -> 0
A1051: 0 | B1051: =LOG(RC[-1]+1)*1000 -> 0
A1052: 0 | B1052: =LOG(RC[-1]+1)*1000 -> 0
A1053: 0 | B1053: =LOG(RC[-1]+1)*1000 -> 0
A1054: 0 | B1054: =LOG(RC[-1]+1)*1000 -> 0
A1055: 0 | B1055: =LOG(RC[-1]+1)*1000 -> 0
A1056: 0 | B1056: =LOG(RC[-1]+1)*1000 -> 0
A1057: 0 | B1057: =LOG(RC[-1]+1)*1000 -> 0
A1058: 0 | B1058: =LOG(RC[-1]+1)*1000 -> 0
A1059: 0 | B1059: =LOG(RC[-1]+1)*1000 -> 0
A1060: 0 | B1060: =LOG(RC[-1]+1)*1000 -> 0
A1061: 0 | B1061: =LOG(RC[-1]+1)*1000 -> 0
A1062: 0 | B1062: =LOG(RC[-1]+1)*1000 -> 0
A1063: 0 | B1063: =LOG(RC[-1]+1)*1000 -> 0
A1064: 0 | B1064: =LOG(RC[-1]+1)*1000 -> 0
A1065: 0 | B1065: =LOG(RC[-1]+1)*1000 -> 0
A1066: 0 | B1066: =LOG(RC[-1]+1)*1000 -> 0
A1067: 0 | B1067: =LOG(RC[-1]+1)*1000 -> 0
A1068: 0 | B1068: =LOG(RC[-1]+1)*1000 -> 0
A1069: 0 | B1069: =LOG(RC[-1]+1)*1000 -> 0
A1070: 0 | B1070: =LOG(RC[-1]+1)*1000 -> 0
A1071: 0 | B1071: =LOG(RC[-1]+1)*1000 -> 0
A1072: 0 | B1072: =LOG(RC[-1]+1)*1000 -> 0
A1073: 0 | B1073: =LOG(RC[-1]+1)*1000 -> 0
A1074: 0 | B1074: =LOG(RC[-1]+1)*1000 -> 0
A1075: 0 | B1075: =LOG(RC[-1]+1)*1000 -> 0
A1076: 0 | B1076: =LOG(RC[-1]+1)*1000 -> 0
A1077: 0 | B1077: =LOG(RC[-1]+1)*1000 -> 0
A1078: 0 | B1078: =LOG(RC[-1]+1)*1000 -> 0
A1079: 0 | B1079: =LOG(RC[-1]+1)*1000 -> 0
A1080: 0 | B1080: =LOG(RC[-1]+1)*1000 -> 0
A1081: 0 | B1081: =LOG(RC[-1]+1)*1000 -> 0
A1082: 0 | B1082: =LOG(RC[-1]+1)*1000 -> 0
A1083: 0 | B1083: =LOG(RC[-1]+1)*1000 -> 0
A1084: 0 | B1084: =LOG(RC[-1]+1)*1000 -> 0
A1085: 0 | B1085: =LOG(RC[-1]+1)*1000 -> 0
A1086: 0 | B1086: =LOG(RC[-1]+1)*1000 -> 0
A1087: 0 | B1087: =LOG(RC[-1]+1)*1000 -> 0
A1088: 0 | B1088: =LOG(RC[-1]+1)*1000 -> 0
A1089: 0 | B1089: =LOG(RC[-1]+1)*1000 -> 0
A1090: 0 | B1090: =LOG(RC[-1]+1)*1000 -> 0
A1091: 0 | B1091: =LOG(RC[-1]+1)*1000 -> 0
A1092: 0 | B1092: =LOG(RC[-1]+1)*1000 -> 0
A1093: 0 | B1093: =LOG(RC[-1]+1)*1000 -> 0
A1094: 0 | B1094: =LOG(RC[-1]+1)*1000 -> 0
A1095: 0 | B1095: =LOG(RC[-1]+1)*1000 -> 0
A1096: 0 | B1096: =LOG(RC[-1]+1)*1000 -> 0
A1097: 0 | B1097: =LOG(RC[-1]+1)*1000 -> 0
A1098: 0 | B1098: =LOG(RC[-1]+1)*1000 -> 0
A1099: 0 | B1099: =LOG(RC[-1]+1)*1000 -> 0
A1100: 0 | B1100: =LOG(RC[-1]+1)*1000 -> 0
A1101: 0 | B1101: =LOG(RC[-1]+1)*1000 -> 0
A1102: 0 | B1102: =LOG(RC[-1]+1)*1000 -> 0
A1103: 0 | B1103: =LOG(RC[-1]+1)*1000 -> 0
A1104: 0 | B1104: =LOG(RC[-1]+1)*1000 -> 0
A1105: 0 | B1105: =LOG(RC[-1]+1)*1000 -> 0
A1106: 0 | B1106: =LOG(RC[-1]+1)*1000 -> 0
A1107: 0 | B1107: =LOG(RC[-1]+1)*1000 -> 0
A1108: 0 | B1108: =LOG(RC[-1]+1)*1000 -> 0
A1109: 0 | B1109: =LOG(RC[-1]+1)*1000 -> 0
A1110: 0 | B1110: =LOG(RC[-1]+1)*1000 -> 0
A1111: 0 | B1111: =LOG(RC[-1]+1)*1000 -> 0
A1112: 0 | B1112: =LOG(RC[-1]+1)*1000 -> 0
A1113: 0 | B1113: =LOG(RC[-1]+1)*1000 -> 0
A1114: 0 | B1114: =LOG(RC[-1]+1)*1000 -> 0
A1115: 0 | B1115: =LOG(RC[-1]+1)*1000 -> 0
A1116: 0 | B1116: =LOG(RC[-1]+1)*1000 -> 0
A1117: 0 | B1117: =LOG(RC[-1]+1)*1000 -> 0
A1118: 0 | B1118: =LOG(RC[-1]+1)*1000 -> 0
A1119: 0 | B1119: =LOG(RC[-1]+1)*1000 -> 0
A1120: 0 | B1120: =LOG(RC[-1]+1)*1000 -> 0
A1121: 0 | B1121: =LOG(RC[-1]+1)*1000 -> 0
A1122: 0 | B1122: =LOG(RC[-1]+1)*1000 -> 0
A1123: 0 | B1123: =LOG(RC[-1]+1)*1000 -> 0
A1124: 0 | B1124: =LOG(RC[-1]+1)*1000 -> 0
A1125: 0 | B1125: =LOG(RC[-1]+1)*1000 -> 0
A1126: 0 | B1126: =LOG(RC[-1]+1)*1000 -> 0
A1127: 0 | B1127: =LOG(RC[-1]+1)*1000 -> 0
A1128: 0 | B1128: =LOG(RC[-1]+1)*1000 -> 0
A1129: 0 | B1129: =LOG(RC[-1]+1)*1000 -> 0
A1130: 0 | B1130: =LOG(RC[-1]+1)*1000 -> 0
A1131: 0 | B1131: =LOG(RC[-1]+1)*1000 -> 0
A1132: 0 | B1132: =LOG(RC[-1]+1)*1000 -> 0
A1133: 0 | B1133: =LOG(RC[-1]+1)*1000 -> 0
A1134: 0 | B1134: =LOG(RC[-1]+1)*1000 -> 0
A1135: 0 | B1135: =LOG(RC[-1]+1)*1000 -> 0
A1136: 0 | B1136: =LOG(RC[-1]+1)*1000 -> 0
A1137: 0 | B1137: =LOG(RC[-1]+1)*1000 -> 0
A1138: 0 | B1138: =LOG(RC[-1]+1)*1000 -> 0
A1139: 0 | B1139: =LOG(RC[-1]+1)*1000 -> 0
A1140: 0 | B1140: =LOG(RC[-1]+1)*1000 -> 0
A1141: 0 | B1141: =LOG(RC[-1]+1)*1000 -> 0
A1142: 0 | B1142: =LOG(RC[-1]+1)*1000 -> 0
A1143: 0 | B1143: =LOG(RC[-1]+1)*1000 -> 0
A1144: 0 | B1144: =LOG(RC[-1]+1)*1000 -> 0
A1145: 0 | B1145: =LOG(RC[-1]+1)*1000 -> 0
A1146: 0 | B1146: =LOG(RC[-1]+1)*1000 -> 0
A1147: 0 | B1147: =LOG(RC[-1]+1)*1000 -> 0
A1148: 0 | B1148: =LOG(RC[-1]+1)*1000 -> 0
A1149: 0 | B1149: =LOG(RC[-1]+1)*1000 -> 0
A1150: 0 | B1150: =LOG(RC[-1]+1)*1000 -> 0
A1151: 0 | B1151: =LOG(RC[-1]+1)*1000 -> 0
A1152: 0 | B1152: =LOG(RC[-1]+1)*1000 -> 0
A1153: 0 | B1153: =LOG(RC[-1]+1)*1000 -> 0
A1154: 0 | B1154: =LOG(RC[-1]+1)*1000 -> 0
A1155: 0 | B1155: =LOG(RC[-1]+1)*1000 -> 0
A1156: 0 | B1156: =LOG(RC[-1]+1)*1000 -> 0
A1157: 0 | B1157: =LOG(RC[-1]+1)*1000 -> 0
A1158: 0 | B1158: =LOG(RC[-1]+1)*1000 -> 0
A1159: 0 | B1159: =LOG(RC[-1]+1)*1000 -> 0
A1160: 0 | B1160: =LOG(RC[-1]+1)*1000 -> 0
A1161: 0 | B1161: =LOG(RC[-1]+1)*1000 -> 0
A1162: 0 | B1162: =LOG(RC[-1]+1)*1000 -> 0
A1163: 0 | B1163: =LOG(RC[-1]+1)*1000 -> 0
A1164: 0 | B1164: =LOG(RC[-1]+1)*1000 -> 0
A1165: 0 | B1165: =LOG(RC[-1]+1)*1000 -> 0
A1166: 0 | B1166: =LOG(RC[-1]+1)*1000 -> 0
A1167: 0 | B1167: =LOG(RC[-1]+1)*1000 -> 0
A1168: 0 | B1168: =LOG(RC[-1]+1)*1000 -> 0
A1169: 0 | B1169: =LOG(RC[-1]+1)*1000 -> 0
A1170: 0 | B1170: =LOG(RC[-1]+1)*1000 -> 0
A1171: 0 | B1171: =LOG(RC[-1]+1)*1000 -> 0
A1172: 0 | B1172: =LOG(RC[-1]+1)*1000 -> 0
A1173: 0 | B1173: =LOG(RC[-1]+1)*1000 -> 0
A1174: 0 | B1174: =LOG(RC[-1]+1)*1000 -> 0
A1175: 0 | B1175: =LOG(RC[-1]+1)*1000 -> 0
A1176: 0 | B1176: =LOG(RC[-1]+1)*1000 -> 0
A1177: 0 | B1177: =LOG(RC[-1]+1)*1000 -> 0
A1178: 0 | B1178: =LOG(RC[-1]+1)*1000 -> 0
A1179: 0 | B1179: =LOG(RC[-1]+1)*1000 -> 0
A1180: 0 | B1180: =LOG(RC[-1]+1)*1000 -> 0
A1181: 0 | B1181: =LOG(RC[-1]+1)*1000 -> 0
A1182: 0 | B1182: =LOG(RC[-1]+1)*1000 -> 0
A1183: 0 | B1183: =LOG(RC[-1]+1)*1000 -> 0
A1184: 0 | B1184: =LOG(RC[-1]+1)*1000 -> 0
A1185: 0 | B1185: =LOG(RC[-1]+1)*1000 -> 0
A1186: 0 | B1186: =LOG(RC[-1]+1)*1000 -> 0
A1187: 0 | B1187: =LOG(RC[-1]+1)*1000 -> 0
A1188: 0 | B1188: =LOG(RC[-1]+1)*1000 -> 0
A1189: 0 | B1189: =LOG(RC[-1]+1)*1000 -> 0
A1190: 0 | B1190: =LOG(RC[-1]+1)*1000 -> 0
A1191: 0 | B1191: =LOG(RC[-1]+1)*1000 -> 0
A1192: 0 | B1192: =LOG(RC[-1]+1)*1000 -> 0
A1193: 0 | B1193: =LOG(RC[-1]+1)*1000 -> 0
A1194: 0 | B1194: =LOG(RC[-1]+1)*1000 -> 0
A1195: 0 | B1195: =LOG(RC[-1]+1)*1000 -> 0
A1196: 0 | B1196: =LOG(RC[-1]+1)*1000 -> 0
A1197: 0 | B1197: =LOG(RC[-1]+1)*1000 -> 0
A1198: 0 | B1198: =LOG(RC[-1]+1)*1000 -> 0
A1199: 0 | B1199: =LOG(RC[-1]+1)*1000 -> 0
A1200: 0 | B1200: =LOG(RC[-1]+1)*1000 -> 0
A1201: 0 | B1201: =LOG(RC[-1]+1)*1000 -> 0
A1202: 0 | B1202: =LOG(RC[-1]+1)*1000 -> 0
A1203: 0 | B1203: =LOG(RC[-1]+1)*1000 -> 0
A1204: 0 | B1204: =LOG(RC[-1]+1)*1000 -> 0
A1205: 0 | B1205: =LOG(RC[-1]+1)*1000 -> 0
A1206: 0 | B1206: =LOG(RC[-1]+1)*1000 -> 0
A1207: 0 | B1207: =LOG(RC[-1]+1)*1000 -> 0
A1208: 0 | B1208: =LOG(RC[-1]+1)*1000 -> 0
A1209: 0 | B1209: =LOG(RC[-1]+1)*1000 -> 0
A1210: 0 | B1210: =LOG(RC[-1]+1)*1000 -> 0
A1211: 0 | B1211: =LOG(RC[-1]+1)*1000 -> 0
A1212: 0 | B1212: =LOG(RC[-1]+1)*1000 -> 0
A1213: 0 | B1213: =LOG(RC[-1]+1)*1000 -> 0
A1214: 0 | B1214: =LOG(RC[-1]+1)*1000 -> 0
A1215: 0 | B1215: =LOG(RC[-1]+1)*1000 -> 0
A1216: 0 | B1216: =LOG(RC[-1]+1)*1000 -> 0
A1217: 0 | B1217: =LOG(RC[-1]+1)*1000 -> 0
A1218: 0 | B1218: =LOG(RC[-1]+1)*1000 -> 0
A1219: 0 | B1219: =LOG(RC[-1]+1)*1000 -> 0
A1220: 0 | B1220: =LOG(RC[-1]+1)*1000 -> 0
A1221: 0 | B1221: =LOG(RC[-1]+1)*1000 -> 0
A1222: 0 | B1222: =LOG(RC[-1]+1)*1000 -> 0
A1223: 0 | B1223: =LOG(RC[-1]+1)*1000 -> 0
A1224: 0 | B1224: =LOG(RC[-1]+1)*1000 -> 0
A1225: 0 | B1225: =LOG(RC[-1]+1)*1000 -> 0
A1226: 0 | B1226: =LOG(RC[-1]+1)*1000 -> 0
A1227: 0 | B1227: =LOG(RC[-1]+1)*1000 -> 0
A1228: 0 | B1228: =LOG(RC[-1]+1)*1000 -> 0
A1229: 0 | B1229: =LOG(RC[-1]+1)*1000 -> 0
A1230: 0 | B1230: =LOG(RC[-1]+1)*1000 -> 0
A1231: 0 | B1231: =LOG(RC[-1]+1)*1000 -> 0
A1232: 0 | B1232: =LOG(RC[-1]+1)*1000 -> 0
A1233: 0 | B1233: =LOG(RC[-1]+1)*1000 -> 0
A1234: 0 | B1234: =LOG(RC[-1]+1)*1000 -> 0
A1235: 0 | B1235: =LOG(RC[-1]+1)*1000 -> 0
A1236: 0 | B1236: =LOG(RC[-1]+1)*1000 -> 0
A1237: 0 | B1237: =LOG(RC[-1]+1)*1000 -> 0
A1238: 0 | B1238: =LOG(RC[-1]+1)*1000 -> 0
A1239: 0 | B1239: =LOG(RC[-1]+1)*1000 -> 0
A1240: 0 | B1240: =LOG(RC[-1]+1)*1000 -> 0
A1241: 0 | B1241: =LOG(RC[-1]+1)*1000 -> 0
A1242: 0 | B1242: =LOG(RC[-1]+1)*1000 -> 0
A1243: 0 | B1243: =LOG(RC[-1]+1)*1000 -> 0
A1244: 0 | B1244: =LOG(RC[-1]+1)*1000 -> 0
A1245: 0 | B1245: =LOG(RC[-1]+1)*1000 -> 0
A1246: 0 | B1246: =LOG(RC[-1]+1)*1000 -> 0
A1247: 0 | B1247: =LOG(RC[-1]+1)*1000 -> 0
A1248: 0 | B1248: =LOG(RC[-1]+1)*1000 -> 0
A1249: 0 | B1249: =LOG(RC[-1]+1)*1000 -> 0
A1250: 0 | B1250: =LOG(RC[-1]+1)*1000 -> 0
A1251: 0 | B1251: =LOG(RC[-1]+1)*1000 -> 0
A1252: 0 | B1252: =LOG(RC[-1]+1)*1000 -> 0
A1253: 0 | B1253: =LOG(RC[-1]+1)*1000 -> 0
A1254: 0 | B1254: =LOG(RC[-1]+1)*1000 -> 0
A1255: 0 | B1255: =LOG(RC[-1]+1)*1000 -> 0
A1256: 0 | B1256: =LOG(RC[-1]+1)*1000 -> 0
A1257: 0 | B1257: =LOG(RC[-1]+1)*1000 -> 0
A1258: 0 | B1258: =LOG(RC[-1]+1)*1000 -> 0
A1259: 0 | B1259: =LOG(RC[-1]+1)*1000 -> 0
A1260: 0 | B1260: =LOG(RC[-1]+1)*1000 -> 0
A1261: 0 | B1261: =LOG(RC[-1]+1)*1000 -> 0
A1262: 0 | B1262: =LOG(RC[-1]+1)*1000 -> 0
A1263: 0 | B1263: =LOG(RC[-1]+1)*1000 -> 0
A1264: 0 | B1264: =LOG(RC[-1]+1)*1000 -> 0
A1265: 0 | B1265: =LOG(RC[-1]+1)*1000 -> 0
A1266: 0 | B1266: =LOG(RC[-1]+1)*1000 -> 0
A1267: 0 | B1267: =LOG(RC[-1]+1)*1000 -> 0
A1268: 0 | B1268: =LOG(RC[-1]+1)*1000 -> 0
A1269: 0 | B1269: =LOG(RC[-1]+1)*1000 -> 0
A1270: 0 | B1270: =LOG(RC[-1]+1)*1000 -> 0
A1271: 0 | B1271: =LOG(RC[-1]+1)*1000 -> 0
A1272: 0 | B1272: =LOG(RC[-1]+1)*1000 -> 0
A1273: 0 | B1273: =LOG(RC[-1]+1)*1000 -> 0
A1274: 0 | B1274: =LOG(RC[-1]+1)*1000 -> 0
A1275: 0 | B1275: =LOG(RC[-1]+1)*1000 -> 0
A1276: 0 | B1276: =LOG(RC[-1]+1)*1000 -> 0
A1277: 0 | B1277: =LOG(RC[-1]+1)*1000 -> 0
A1278: 0 | B1278: =LOG(RC[-1]+1)*1000 -> 0
A1279: 0 | B1279: =LOG(RC[-1]+1)*1000 -> 0
A1280: 0 | B1280: =LOG(RC[-1]+1)*1000 -> 0
A1281: 0 | B1281: =LOG(RC[-1]+1)*1000 -> 0
A1282: 0 | B1282: =LOG(RC[-1]+1)*1000 -> 0
A1283: 0 | B1283: =LOG(RC[-1]+1)*1000 -> 0
A1284: 0 | B1284: =LOG(RC[-1]+1)*1000 -> 0
A1285: 0 | B1285: =LOG(RC[-1]+1)*1000 -> 0
A1286: 0 | B1286: =LOG(RC[-1]+1)*1000 -> 0
A1287: 0 | B1287: =LOG(RC[-1]+1)*1000 -> 0
A1288: 0 | B1288: =LOG(RC[-1]+1)*1000 -> 0
A1289: 0 | B1289: =LOG(RC[-1]+1)*1000 -> 0
A1290: 0 | B1290: =LOG(RC[-1]+1)*1000 -> 0
A1291: 0 | B1291: =LOG(RC[-1]+1)*1000 -> 0
A1292: 0 | B1292: =LOG(RC[-1]+1)*1000 -> 0
A1293: 0 | B1293: =LOG(RC[-1]+1)*1000 -> 0
A1294: 0 | B1294: =LOG(RC[-1]+1)*1000 -> 0
A1295: 0 | B1295: =LOG(RC[-1]+1)*1000 -> 0
A1296: 0 | B1296: =LOG(RC[-1]+1)*1000 -> 0
A1297: 0 | B1297: =LOG(RC[-1]+1)*1000 -> 0
A1298: 0 | B1298: =LOG(RC[-1]+1)*1000 -> 0
A1299: 0 | B1299: =LOG(RC[-1]+1)*1000 -> 0
A1300: 0 | B1300: =LOG(RC[-1]+1)*1000 -> 0
A1301: 0 | B1301: =LOG(RC[-1]+1)*1000 -> 0
A1302: 0 | B1302: =LOG(RC[-1]+1)*1000 -> 0
A1303: 0 | B1303: =LOG(RC[-1]+1)*1000 -> 0
A1304: 0 | B1304: =LOG(RC[-1]+1)*1000 -> 0
A1305: 0 | B1305: =LOG(RC[-1]+1)*1000 -> 0
A1306: 0 | B1306: =LOG(RC[-1]+1)*1000 -> 0
A1307: 0 | B1307: =LOG(RC[-1]+1)*1000 -> 0
A1308: 0 | B1308: =LOG(RC[-1]+1)*1000 -> 0
A1309: 0 | B1309: =LOG(RC[-1]+1)*1000 -> 0
A1310: 0 | B1310: =LOG(RC[-1]+1)*1000 -> 0
A1311: 0 | B1311: =LOG(RC[-1]+1)*1000 -> 0
A1312: 0 | B1312: =LOG(RC[-1]+1)*1000 -> 0
A1313: 0 | B1313: =LOG(RC[-1]+1)*1000 -> 0
A1314: 0 | B1314: =LOG(RC[-1]+1)*1000 -> 0
A1315: 0 | B1315: =LOG(RC[-1]+1)*1000 -> 0
A1316: 0 | B1316: =LOG(RC[-1]+1)*1000 -> 0
A1317: 0 | B1317: =LOG(RC[-1]+1)*1000 -> 0
A1318: 0 | B1318: =LOG(RC[-1]+1)*1000 -> 0
A1319: 0 | B1319: =LOG(RC[-1]+1)*1000 -> 0
A1320: 0 | B1320: =LOG(RC[-1]+1)*1000 -> 0
A1321: 0 | B1321: =LOG(RC[-1]+1)*1000 -> 0
A1322: 0 | B1322: =LOG(RC[-1]+1)*1000 -> 0
A1323: 0 | B1323: =LOG(RC[-1]+1)*1000 -> 0
A1324: 0 | B1324: =LOG(RC[-1]+1)*1000 -> 0
A1325: 0 | B1325: =LOG(RC[-1]+1)*1000 -> 0
A1326: 0 | B1326: =LOG(RC[-1]+1)*1000 -> 0
A1327: 0 | B1327: =LOG(RC[-1]+1)*1000 -> 0
A1328: 0 | B1328: =LOG(RC[-1]+1)*1000 -> 0
A1329: 0 | B1329: =LOG(RC[-1]+1)*1000 -> 0
A1330: 0 | B1330: =LOG(RC[-1]+1)*1000 -> 0
A1331: 0 | B1331: =LOG(RC[-1]+1)*1000 -> 0
A1332: 0 | B1332: =LOG(RC[-1]+1)*1000 -> 0
A1333: 0 | B1333: =LOG(RC[-1]+1)*1000 -> 0
A1334: 0 | B1334: =LOG(RC[-1]+1)*1000 -> 0
A1335: 0 | B1335: =LOG(RC[-1]+1)*1000 -> 0
A1336: 0 | B1336: =LOG(RC[-1]+1)*1000 -> 0
A1337: 0 | B1337: =LOG(RC[-1]+1)*1000 -> 0
A1338: 0 | B1338: =LOG(RC[-1]+1)*1000 -> 0
A1339: 0 | B1339: =LOG(RC[-1]+1)*1000 -> 0
A1340: 0 | B1340: =LOG(RC[-1]+1)*1000 -> 0
A1341: 0 | B1341: =LOG(RC[-1]+1)*1000 -> 0
A1342: 0 | B1342: =LOG(RC[-1]+1)*1000 -> 0
A1343: 0 | B1343: =LOG(RC[-1]+1)*1000 -> 0
A1344: 0 | B1344: =LOG(RC[-1]+1)*1000 -> 0
A1345: 0 | B1345: =LOG(RC[-1]+1)*1000 -> 0
A1346: 0 | B1346: =LOG(RC[-1]+1)*1000 -> 0
A1347: 0 | B1347: =LOG(RC[-1]+1)*1000 -> 0
A1348: 0 | B1348: =LOG(RC[-1]+1)*1000 -> 0
A1349: 0 | B1349: =LOG(RC[-1]+1)*1000 -> 0
A1350: 0 | B1350: =LOG(RC[-1]+1)*1000 -> 0
A1351: 0 | B1351: =LOG(RC[-1]+1)*1000 -> 0
A1352: 0 | B1352: =LOG(RC[-1]+1)*1000 -> 0
A1353: 0 | B1353: =LOG(RC[-1]+1)*1000 -> 0
A1354: 0 | B1354: =LOG(RC[-1]+1)*1000 -> 0
A1355: 0 | B1355: =LOG(RC[-1]+1)*1000 -> 0
A1356: 0 | B1356: =LOG(RC[-1]+1)*1000 -> 0
A1357: 0 | B1357: =LOG(RC[-1]+1)*1000 -> 0
A1358: 0 | B1358: =LOG(RC[-1]+1)*1000 -> 0
A1359: 0 | B1359: =LOG(RC[-1]+1)*1000 -> 0
A1360: 0 | B1360: =LOG(RC[-1]+1)*1000 -> 0
A1361: 0 | B1361: =LOG(RC[-1]+1)*1000 -> 0
A1362: 0 | B1362: =LOG(RC[-1]+1)*1000 -> 0
A1363: 0 | B1363: =LOG(RC[-1]+1)*1000 -> 0
A1364: 0 | B1364: =LOG(RC[-1]+1)*1000 -> 0
A1365: 0 | B1365: =LOG(RC[-1]+1)*1000 -> 0
A1366: 0 | B1366: =LOG(RC[-1]+1)*1000 -> 0
A1367: 0 | B1367: =LOG(RC[-1]+1)*1000 -> 0
A1368: 0 | B1368: =LOG(RC[-1]+1)*1000 -> 0
A1369: 0 | B1369: =LOG(RC[-1]+1)*1000 -> 0
A1370: 0 | B1370: =LOG(RC[-1]+1)*1000 -> 0
A1371: 0 | B1371: =LOG(RC[-1]+1)*1000 -> 0
A1372: 0 | B1372: =LOG(RC[-1]+1)*1000 -> 0
A1373: 0 | B1373: =LOG(RC[-1]+1)*1000 -> 0
A1374: 0 | B1374: =LOG(RC[-1]+1)*1000 -> 0
A1375: 0 | B1375: =LOG(RC[-1]+1)*1000 -> 0
A1376: 0 | B1376: =LOG(RC[-1]+1)*1000 -> 0
A1377: 0 | B1377: =LOG(RC[-1]+1)*1000 -> 0
A1378: 0 | B1378: =LOG(RC[-1]+1)*1000 -> 0
A1379: 0 | B1379: =LOG(RC[-1]+1)*1000 -> 0
A1380: 0 | B1380: =LOG(RC[-1]+1)*1000 -> 0
A1381: 0 | B1381: =LOG(RC[-1]+1)*1000 -> 0
A1382: 0 | B1382: =LOG(RC[-1]+1)*1000 -> 0
A1383: 0 | B1383: =LOG(RC[-1]+1)*1000 -> 0
A1384: 0 | B1384: =LOG(RC[-1]+1)*1000 -> 0
A1385: 0 | B1385: =LOG(RC[-1]+1)*1000 -> 0
A1386: 0 | B1386: =LOG(RC[-1]+1)*1000 -> 0
A1387: 0 | B1387: =LOG(RC[-1]+1)*1000 -> 0
A1388: 0 | B1388: =LOG(RC[-1]+1)*1000 -> 0
A1389: 0 | B1389: =LOG(RC[-1]+1)*1000 -> 0
A1390: 0 | B1390: =LOG(RC[-1]+1)*1000 -> 0
A1391: 0 | B1391: =LOG(RC[-1]+1)*1000 -> 0
A1392: 0 | B1392: =LOG(RC[-1]+1)*1000 -> 0
A1393: 0 | B1393: =LOG(RC[-1]+1)*1000 -> 0
A1394: 0 | B1394: =LOG(RC[-1]+1)*1000 -> 0
A1395: 0 | B1395: =LOG(RC[-1]+1)*1000 -> 0
A1396: 0 | B1396: =LOG(RC[-1]+1)*1000 -> 0
A1397: 0 | B1397: =LOG(RC[-1]+1)*1000 -> 0
A1398: 0 | B1398: =LOG(RC[-1]+1)*1000 -> 0
A1399: 0 | B1399: =LOG(RC[-1]+1)*1000 -> 0
A1400: 0 | B1400: =LOG(RC[-1]+1)*1000 -> 0
A1401: 0 | B1401: =LOG(RC[-1]+1)*1000 -> 0
A1402: 0 | B1402: =LOG(RC[-1]+1)*1000 -> 0
A1403: 0 | B1403: =LOG(RC[-1]+1)*1000 -> 0
A1404: 0 | B1404: =LOG(RC[-1]+1)*1000 -> 0
A1405: 0 | B1405: =LOG(RC[-1]+1)*1000 -> 0
A1406: 0 | B1406: =LOG(RC[-1]+1)*1000 -> 0
A1407: 0 | B1407: =LOG(RC[-1]+1)*1000 -> 0
A1408: 0 | B1408: =LOG(RC[-1]+1)*1000 -> 0
A1409: 0 | B1409: =LOG(RC[-1]+1)*1000 -> 0
A1410: 0 | B1410: =LOG(RC[-1]+1)*1000 -> 0
A1411: 0 | B1411: =LOG(RC[-1]+1)*1000 -> 0
A1412: 0 | B1412: =LOG(RC[-1]+1)*1000 -> 0
A1413: 0 | B1413: =LOG(RC[-1]+1)*1000 -> 0
A1414: 0 | B1414: =LOG(RC[-1]+1)*1000 -> 0
A1415: 0 | B1415: =LOG(RC[-1]+1)*1000 -> 0
A1416: 0 | B1416: =LOG(RC[-1]+1)*1000 -> 0
A1417: 0 | B1417: =LOG(RC[-1]+1)*1000 -> 0
A1418: 0 | B1418: =LOG(RC[-1]+1)*1000 -> 0
A1419: 0 | B1419: =LOG(RC[-1]+1)*1000 -> 0
A1420: 0 | B1420: =LOG(RC[-1]+1)*1000 -> 0
A1421: 0 | B1421: =LOG(RC[-1]+1)*1000 -> 0
A1422: 0 | B1422: =LOG(RC[-1]+1)*1000 -> 0
A1423: 0 | B1423: =LOG(RC[-1]+1)*1000 -> 0
A1424: 0 | B1424: =LOG(RC[-1]+1)*1000 -> 0
A1425: 0 | B1425: =LOG(RC[-1]+1)*1000 -> 0
A1426: 0 | B1426: =LOG(RC[-1]+1)*1000 -> 0
A1427: 0 | B1427: =LOG(RC[-1]+1)*1000 -> 0
A1428: 0 | B1428: =LOG(RC[-1]+1)*1000 -> 0
A1429: 0 | B1429: =LOG(RC[-1]+1)*1000 -> 0
A1430: 0 | B1430: =LOG(RC[-1]+1)*1000 -> 0
A1431: 0 | B1431: =LOG(RC[-1]+1)*1000 -> 0
A1432: 0 | B1432: =LOG(RC[-1]+1)*1000 -> 0
A1433: 0 | B1433: =LOG(RC[-1]+1)*1000 -> 0
A1434: 0 | B1434: =LOG(RC[-1]+1)*1000 -> 0
A1435: 0 | B1435: =LOG(RC[-1]+1)*1000 -> 0
A1436: 0 | B1436: =LOG(RC[-1]+1)*1000 -> 0
A1437: 0 | B1437: =LOG(RC[-1]+1)*1000 -> 0
A1438: 0 | B1438: =LOG(RC[-1]+1)*1000 -> 0
A1439: 0 | B1439: =LOG(RC[-1]+1)*1000 -> 0
A1440: 0 | B1440: =LOG(RC[-1]+1)*1000 -> 0
A1441: 0 | B1441: =LOG(RC[-1]+1)*1000 -> 0
A1442: 0 | B1442: =LOG(RC[-1]+1)*1000 -> 0
A1443: 0 | B1443: =LOG(RC[-1]+1)*1000 -> 0
A1444: 0 | B1444: =LOG(RC[-1]+1)*1000 -> 0
A1445: 0 | B1445: =LOG(RC[-1]+1)*1000 -> 0
A1446: 0 | B1446: =LOG(RC[-1]+1)*1000 -> 0
A1447: 0 | B1447: =LOG(RC[-1]+1)*1000 -> 0
A1448: 0 | B1448: =LOG(RC[-1]+1)*1000 -> 0
A1449: 0 | B1449: =LOG(RC[-1]+1)*1000 -> 0
A1450: 0 | B1450: =LOG(RC[-1]+1)*1000 -> 0
A1451: 0 | B1451: =LOG(RC[-1]+1)*1000 -> 0
A1452: 0 | B1452: =LOG(RC[-1]+1)*1000 -> 0
A1453: 0 | B1453: =LOG(RC[-1]+1)*1000 -> 0
A1454: 0 | B1454: =LOG(RC[-1]+1)*1000 -> 0
A1455: 0 | B1455: =LOG(RC[-1]+1)*1000 -> 0
A1456: 0 | B1456: =LOG(RC[-1]+1)*1000 -> 0
A1457: 0 | B1457: =LOG(RC[-1]+1)*1000 -> 0
A1458: 0 | B1458: =LOG(RC[-1]+1)*1000 -> 0
A1459: 0 | B1459: =LOG(RC[-1]+1)*1000 -> 0
A1460: 0 | B1460: =LOG(RC[-1]+1)*1000 -> 0
A1461: 0 | B1461: =LOG(RC[-1]+1)*1000 -> 0
A1462: 0 | B1462: =LOG(RC[-1]+1)*1000 -> 0
A1463: 0 | B1463: =LOG(RC[-1]+1)*1000 -> 0
A1464: 0 | B1464: =LOG(RC[-1]+1)*1000 -> 0
A1465: 0 | B1465: =LOG(RC[-1]+1)*1000 -> 0
A1466: 0 | B1466: =LOG(RC[-1]+1)*1000 -> 0
A1467: 0 | B1467: =LOG(RC[-1]+1)*1000 -> 0
A1468: 0 | B1468: =LOG(RC[-1]+1)*1000 -> 0
A1469: 0 | B1469: =LOG(RC[-1]+1)*1000 -> 0
A1470: 0 | B1470: =LOG(RC[-1]+1)*1000 -> 0
A1471: 0 | B1471: =LOG(RC[-1]+1)*1000 -> 0
A1472: 0 | B1472: =LOG(RC[-1]+1)*1000 -> 0
A1473: 0 | B1473: =LOG(RC[-1]+1)*1000 -> 0
A1474: 0 | B1474: =LOG(RC[-1]+1)*1000 -> 0
A1475: 0 | B1475: =LOG(RC[-1]+1)*1000 -> 0
A1476: 0 | B1476: =LOG(RC[-1]+1)*1000 -> 0
A1477: 0 | B1477: =LOG(RC[-1]+1)*1000 -> 0
A1478: 0 | B1478: =LOG(RC[-1]+1)*1000 -> 0
A1479: 0 | B1479: =LOG(RC[-1]+1)*1000 -> 0
A1480: 0 | B1480: =LOG(RC[-1]+1)*1000 -> 0
A1481: 0 | B1481: =LOG(RC[-1]+1)*1000 -> 0
A1482: 0 | B1482: =LOG(RC[-1]+1)*1000 -> 0
A1483: 0 | B1483: =LOG(RC[-1]+1)*1000 -> 0
A1484: 0 | B1484: =LOG(RC[-1]+1)*1000 -> 0
A1485: 0 | B1485: =LOG(RC[-1]+1)*1000 -> 0
A1486: 0 | B1486: =LOG(RC[-1]+1)*1000 -> 0
A1487: 0 | B1487: =LOG(RC[-1]+1)*1000 -> 0
A1488: 0 | B1488: =LOG(RC[-1]+1)*1000 -> 0
A1489: 0 | B1489: =LOG(RC[-1]+1)*1000 -> 0
A1490: 0 | B1490: =LOG(RC[-1]+1)*1000 -> 0
A1491: 0 | B1491: =LOG(RC[-1]+1)*1000 -> 0
A1492: 0 | B1492: =LOG(RC[-1]+1)*1000 -> 0
A1493: 0 | B1493: =LOG(RC[-1]+1)*1000 -> 0
A1494: 0 | B1494: =LOG(RC[-1]+1)*1000 -> 0
A1495: 0 | B1495: =LOG(RC[-1]+1)*1000 -> 0
A1496: 0 | B1496: =LOG(RC[-1]+1)*1000 -> 0
A1497: 0 | B1497: =LOG(RC[-1]+1)*1000 -> 0
A1498: 0 | B1498: =LOG(RC[-1]+1)*1000 -> 0
A1499: 0 | B1499: =LOG(RC[-1]+1)*1000 -> 0
A1500: 0 | B1500: =LOG(RC[-1]+1)*1000 -> 0
A1501: 0 | B1501: =LOG(RC[-1]+1)*1000 -> 0
A1502: 0 | B1502: =LOG(RC[-1]+1)*1000 -> 0
A1503: 0 | B1503: =LOG(RC[-1]+1)*1000 -> 0
A1504: 0 | B1504: =LOG(RC[-1]+1)*1000 -> 0
A1505: 0 | B1505: =LOG(RC[-1]+1)*1000 -> 0
A1506: 0 | B1506: =LOG(RC[-1]+1)*1000 -> 0
A1507: 0 | B1507: =LOG(RC[-1]+1)*1000 -> 0
A1508: 0 | B1508: =LOG(RC[-1]+1)*1000 -> 0
A1509: 0 | B1509: =LOG(RC[-1]+1)*1000 -> 0
A1510: 0 | B1510: =LOG(RC[-1]+1)*1000 -> 0
A1511: 0 | B1511: =LOG(RC[-1]+1)*1000 -> 0
A1512: 0 | B1512: =LOG(RC[-1]+1)*1000 -> 0
A1513: 0 | B1513: =LOG(RC[-1]+1)*1000 -> 0
A1514: 0 | B1514: =LOG(RC[-1]+1)*1000 -> 0
A1515: 0 | B1515: =LOG(RC[-1]+1)*1000 -> 0
A1516: 0 | B1516: =LOG(RC[-1]+1)*1000 -> 0
A1517: 0 | B1517: =LOG(RC[-1]+1)*1000 -> 0
A1518: 0 | B1518: =LOG(RC[-1]+1)*1000 -> 0
A1519: 0 | B1519: =LOG(RC[-1]+1)*1000 -> 0
A1520: 0 | B1520: =LOG(RC[-1]+1)*1000 -> 0
A1521: 0 | B1521: =LOG(RC[-1]+1)*1000 -> 0
A1522: 0 | B1522: =LOG(RC[-1]+1)*1000 -> 0
A1523: 0 | B1523: =LOG(RC[-1]+1)*1000 -> 0
A1524: 0 | B1524: =LOG(RC[-1]+1)*1000 -> 0
A1525: 0 | B1525: =LOG(RC[-1]+1)*1000 -> 0
A1526: 0 | B1526: =LOG(RC[-1]+1)*1000 -> 0
A1527: 0 | B1527: =LOG(RC[-1]+1)*1000 -> 0
A1528: 0 | B1528: =LOG(RC[-1]+1)*1000 -> 0
A1529: 0 | B1529: =LOG(RC[-1]+1)*1000 -> 0
A1530: 0 | B1530: =LOG(RC[-1]+1)*1000 -> 0
A1531: 0 | B1531: =LOG(RC[-1]+1)*1000 -> 0
A1532: 0 | B1532: =LOG(RC[-1]+1)*1000 -> 0
A1533: 0 | B1533: =LOG(RC[-1]+1)*1000 -> 0
A1534: 0 | B1534: =LOG(RC[-1]+1)*1000 -> 0
A1535: 0 | B1535: =LOG(RC[-1]+1)*1000 -> 0
A1536: 0 | B1536: =LOG(RC[-1]+1)*1000 -> 0
A1537: 0 | B1537: =LOG(RC[-1]+1)*1000 -> 0
A1538: 0 | B1538: =LOG(RC[-1]+1)*1000 -> 0
A1539: 0 | B1539: =LOG(RC[-1]+1)*1000 -> 0
A1540: 0 | B1540: =LOG(RC[-1]+1)*1000 -> 0
A1541: 0 | B1541: =LOG(RC[-1]+1)*1000 -> 0
A1542: 0 | B1542: =LOG(RC[-1]+1)*1000 -> 0
A1543: 0 | B1543: =LOG(RC[-1]+1)*1000 -> 0
A1544: 0 | B1544: =LOG(RC[-1]+1)*1000 -> 0
A1545: 0 | B1545: =LOG(RC[-1]+1)*1000 -> 0
A1546: 0 | B1546: =LOG(RC[-1]+1)*1000 -> 0
A1547: 0 | B1547: =LOG(RC[-1]+1)*1000 -> 0
A1548: 0 | B1548: =LOG(RC[-1]+1)*1000 -> 0
A1549: 0 | B1549: =LOG(RC[-1]+1)*1000 -> 0
A1550: 0 | B1550: =LOG(RC[-1]+1)*1000 -> 0
A1551: 0 | B1551: =LOG(RC[-1]+1)*1000 -> 0
A1552: 0 | B1552: =LOG(RC[-1]+1)*1000 -> 0
A1553: 0 | B1553: =LOG(RC[-1]+1)*1000 -> 0
A1554: 0 | B1554: =LOG(RC[-1]+1)*1000 -> 0
A1555: 0 | B1555: =LOG(RC[-1]+1)*1000 -> 0
A1556: 0 | B1556: =LOG(RC[-1]+1)*1000 -> 0
A1557: 0 | B1557: =LOG(RC[-1]+1)*1000 -> 0
A1558: 0 | B1558: =LOG(RC[-1]+1)*1000 -> 0
A1559: 0 | B1559: =LOG(RC[-1]+1)*1000 -> 0
A1560: 0 | B1560: =LOG(RC[-1]+1)*1000 -> 0
A1561: 0 | B1561: =LOG(RC[-1]+1)*1000 -> 0
A1562: 0 | B1562: =LOG(RC[-1]+1)*1000 -> 0
A1563: 0 | B1563: =LOG(RC[-1]+1)*1000 -> 0
A1564: 0 | B1564: =LOG(RC[-1]+1)*1000 -> 0
A1565: 0 | B1565: =LOG(RC[-1]+1)*1000 -> 0
A1566: 0 | B1566: =LOG(RC[-1]+1)*1000 -> 0
A1567: 0 | B1567: =LOG(RC[-1]+1)*1000 -> 0
A1568: 0 | B1568: =LOG(RC[-1]+1)*1000 -> 0
A1569: 0 | B1569: =LOG(RC[-1]+1)*1000 -> 0
A1570: 0 | B1570: =LOG(RC[-1]+1)*1000 -> 0
A1571: 0 | B1571: =LOG(RC[-1]+1)*1000 -> 0
A1572: 0 | B1572: =LOG(RC[-1]+1)*1000 -> 0
A1573: 0 | B1573: =LOG(RC[-1]+1)*1000 -> 0
A1574: 0 | B1574: =LOG(RC[-1]+1)*1000 -> 0
A1575: 0 | B1575: =LOG(RC[-1]+1)*1000 -> 0
A1576: 0 | B1576: =LOG(RC[-1]+1)*1000 -> 0
A1577: 0 | B1577: =LOG(RC[-1]+1)*1000 -> 0
A1578: 0 | B1578: =LOG(RC[-1]+1)*1000 -> 0
A1579: 0 | B1579: =LOG(RC[-1]+1)*1000 -> 0
A1580: 0 | B1580: =LOG(RC[-1]+1)*1000 -> 0
A1581: 0 | B1581: =LOG(RC[-1]+1)*1000 -> 0
A1582: 0 | B1582: =LOG(RC[-1]+1)*1000 -> 0
A1583: 0 | B1583: =LOG(RC[-1]+1)*1000 -> 0
A1584: 0 | B1584: =LOG(RC[-1]+1)*1000 -> 0
A1585: 0 | B1585: =LOG(RC[-1]+1)*1000 -> 0
A1586: 0 | B1586: =LOG(RC[-1]+1)*1000 -> 0
A1587: 0 | B1587: =LOG(RC[-1]+1)*1000 -> 0
A1588: 0 | B1588: =LOG(RC[-1]+1)*1000 -> 0
A1589: 0 | B1589: =LOG(RC[-1]+1)*1000 -> 0
A1590: 0 | B1590: =LOG(RC[-1]+1)*1000 -> 0
A1591: 0 | B1591: =LOG(RC[-1]+1)*1000 -> 0
A1592: 0 | B1592: =LOG(RC[-1]+1)*1000 -> 0
A1593: 0 | B1593: =LOG(RC[-1]+1)*1000 -> 0
A1594: 0 | B1594: =LOG(RC[-1]+1)*1000 -> 0
A1595: 0 | B1595: =LOG(RC[-1]+1)*1000 -> 0
A1596: 0 | B1596: =LOG(RC[-1]+1)*1000 -> 0
A1597: 0 | B1597: =LOG(RC[-1]+1)*1000 -> 0
A1598: 0 | B1598: =LOG(RC[-1]+1)*1000 -> 0
A1599: 0 | B1599: =LOG(RC[-1]+1)*1000 -> 0
A1600: 0 | B1600: =LOG(RC[-1]+1)*1000 -> 0
A1601: 0 | B1601: =LOG(RC[-1]+1)*1000 -> 0
A1602: 0 | B1602: =LOG(RC[-1]+1)*1000 -> 0
A1603: 0 | B1603: =LOG(RC[-1]+1)*1000 -> 0
A1604: 0 | B1604: =LOG(RC[-1]+1)*1000 -> 0
A1605: 0 | B1605: =LOG(RC[-1]+1)*1000 -> 0
A1606: 0 | B1606: =LOG(RC[-1]+1)*1000 -> 0
A1607: 0 | B1607: =LOG(RC[-1]+1)*1000 -> 0
A1608: 0 | B1608: =LOG(RC[-1]+1)*1000 -> 0
A1609: 0 | B1609: =LOG(RC[-1]+1)*1000 -> 0
A1610: 0 | B1610: =LOG(RC[-1]+1)*1000 -> 0
A1611: 0 | B1611: =LOG(RC[-1]+1)*1000 -> 0
A1612: 0 | B1612: =LOG(RC[-1]+1)*1000 -> 0
A1613: 0 | B1613: =LOG(RC[-1]+1)*1000 -> 0
A1614: 0 | B1614: =LOG(RC[-1]+1)*1000 -> 0
A1615: 0 | B1615: =LOG(RC[-1]+1)*1000 -> 0
A1616: 0 | B1616: =LOG(RC[-1]+1)*1000 -> 0
A1617: 0 | B1617: =LOG(RC[-1]+1)*1000 -> 0
A1618: 0 | B1618: =LOG(RC[-1]+1)*1000 -> 0
A1619: 0 | B1619: =LOG(RC[-1]+1)*1000 -> 0
A1620: 0 | B1620: =LOG(RC[-1]+1)*1000 -> 0
A1621: 0 | B1621: =LOG(RC[-1]+1)*1000 -> 0
A1622: 0 | B1622: =LOG(RC[-1]+1)*1000 -> 0
A1623: 0 | B1623: =LOG(RC[-1]+1)*1000 -> 0
A1624: 0 | B1624: =LOG(RC[-1]+1)*1000 -> 0
A1625: 0 | B1625: =LOG(RC[-1]+1)*1000 -> 0
A1626: 0 | B1626: =LOG(RC[-1]+1)*1000 -> 0
A1627: 0 | B1627: =LOG(RC[-1]+1)*1000 -> 0
A1628: 0 | B1628: =LOG(RC[-1]+1)*1000 -> 0
A1629: 0 | B1629: =LOG(RC[-1]+1)*1000 -> 0
A1630: 0 | B1630: =LOG(RC[-1]+1)*1000 -> 0
A1631: 0 | B1631: =LOG(RC[-1]+1)*1000 -> 0
A1632: 0 | B1632: =LOG(RC[-1]+1)*1000 -> 0
A1633: 0 | B1633: =LOG(RC[-1]+1)*1000 -> 0
A1634: 0 | B1634: =LOG(RC[-1]+1)*1000 -> 0
A1635: 0 | B1635: =LOG(RC[-1]+1)*1000 -> 0
A1636: 0 | B1636: =LOG(RC[-1]+1)*1000 -> 0
A1637: 0 | B1637: =LOG(RC[-1]+1)*1000 -> 0
A1638: 0 | B1638: =LOG(RC[-1]+1)*1000 -> 0
A1639: 0 | B1639: =LOG(RC[-1]+1)*1000 -> 0
A1640: 0 | B1640: =LOG(RC[-1]+1)*1000 -> 0
A1641: 0 | B1641: =LOG(RC[-1]+1)*1000 -> 0
A1642: 0 | B1642: =LOG(RC[-1]+1)*1000 -> 0
A1643: 0 | B1643: =LOG(RC[-1]+1)*1000 -> 0
A1644: 0 | B1644: =LOG(RC[-1]+1)*1000 -> 0
A1645: 0 | B1645: =LOG(RC[-1]+1)*1000 -> 0
A1646: 0 | B1646: =LOG(RC[-1]+1)*1000 -> 0
A1647: 0 | B1647: =LOG(RC[-1]+1)*1000 -> 0
A1648: 0 | B1648: =LOG(RC[-1]+1)*1000 -> 0
A1649: 0 | B1649: =LOG(RC[-1]+1)*1000 -> 0
A1650: 0 | B1650: =LOG(RC[-1]+1)*1000 -> 0
A1651: 0 | B1651: =LOG(RC[-1]+1)*1000 -> 0
A1652: 0 | B1652: =LOG(RC[-1]+1)*1000 -> 0
A1653: 0 | B1653: =LOG(RC[-1]+1)*1000 -> 0
A1654: 0 | B1654: =LOG(RC[-1]+1)*1000 -> 0
A1655: 0 | B1655: =LOG(RC[-1]+1)*1000 -> 0
A1656: 0 | B1656: =LOG(RC[-1]+1)*1000 -> 0
A1657: 0 | B1657: =LOG(RC[-1]+1)*1000 -> 0
A1658: 0 | B1658: =LOG(RC[-1]+1)*1000 -> 0
A1659: 0 | B1659: =LOG(RC[-1]+1)*1000 -> 0
A1660: 0 | B1660: =LOG(RC[-1]+1)*1000 -> 0
A1661: 0 | B1661: =LOG(RC[-1]+1)*1000 -> 0
A1662: 0 | B1662: =LOG(RC[-1]+1)*1000 -> 0
A1663: 0 | B1663: =LOG(RC[-1]+1)*1000 -> 0
A1664: 0 | B1664: =LOG(RC[-1]+1)*1000 -> 0
A1665: 0 | B1665: =LOG(RC[-1]+1)*1000 -> 0
A1666: 0 | B1666: =LOG(RC[-1]+1)*1000 -> 0
A1667: 0 | B1667: =LOG(RC[-1]+1)*1000 -> 0
A1668: 0 | B1668: =LOG(RC[-1]+1)*1000 -> 0
A1669: 0 | B1669: =LOG(RC[-1]+1)*1000 -> 0
A1670: 0 | B1670: =LOG(RC[-1]+1)*1000 -> 0
A1671: 0 | B1671: =LOG(RC[-1]+1)*1000 -> 0
A1672: 0 | B1672: =LOG(RC[-1]+1)*1000 -> 0
A1673: 0 | B1673: =LOG(RC[-1]+1)*1000 -> 0
A1674: 0 | B1674: =LOG(RC[-1]+1)*1000 -> 0
A1675: 0 | B1675: =LOG(RC[-1]+1)*1000 -> 0
A1676: 0 | B1676: =LOG(RC[-1]+1)*1000 -> 0
A1677: 0 | B1677: =LOG(RC[-1]+1)*1000 -> 0
A1678: 0 | B1678: =LOG(RC[-1]+1)*1000 -> 0
A1679: 0 | B1679: =LOG(RC[-1]+1)*1000 -> 0
A1680: 0 | B1680: =LOG(RC[-1]+1)*1000 -> 0
A1681: 0 | B1681: =LOG(RC[-1]+1)*1000 -> 0
A1682: 0 | B1682: =LOG(RC[-1]+1)*1000 -> 0
A1683: 0 | B1683: =LOG(RC[-1]+1)*1000 -> 0
A1684: 0 | B1684: =LOG(RC[-1]+1)*1000 -> 0
A1685: 0 | B1685: =LOG(RC[-1]+1)*1000 -> 0
A1686: 0 | B1686: =LOG(RC[-1]+1)*1000 -> 0
A1687: 0 | B1687: =LOG(RC[-1]+1)*1000 -> 0
A1688: 0 | B1688: =LOG(RC[-1]+1)*1000 -> 0
A1689: 0 | B1689: =LOG(RC[-1]+1)*1000 -> 0
A1690: 0 | B1690: =LOG(RC[-1]+1)*1000 -> 0
A1691: 0 | B1691: =LOG(RC[-1]+1)*1000 -> 0
A1692: 0 | B1692: =LOG(RC[-1]+1)*1000 -> 0
A1693: 0 | B1693: =LOG(RC[-1]+1)*1000 -> 0
A1694: 0 | B1694: =LOG(RC[-1]+1)*1000 -> 0
A1695: 0 | B1695: =LOG(RC[-1]+1)*1000 -> 0
A1696: 0 | B1696: =LOG(RC[-1]+1)*1000 -> 0
A1697: 0 | B1697: =LOG(RC[-1]+1)*1000 -> 0
A1698: 0 | B1698: =LOG(RC[-1]+1)*1000 -> 0
A1699: 0 | B1699: =LOG(RC[-1]+1)*1000 -> 0
A1700: 0 | B1700: =LOG(RC[-1]+1)*1000 -> 0
A1701: 0 | B1701: =LOG(RC[-1]+1)*1000 -> 0
A1702: 0 | B1702: =LOG(RC[-1]+1)*1000 -> 0
A1703: 0 | B1703: =LOG(RC[-1]+1)*1000 -> 0
A1704: 0 | B1704: =LOG(RC[-1]+1)*1000 -> 0
A1705: 0 | B1705: =LOG(RC[-1]+1)*1000 -> 0
A1706: 0 | B1706: =LOG(RC[-1]+1)*1000 -> 0
A1707: 0 | B1707: =LOG(RC[-1]+1)*1000 -> 0
A1708: 0 | B1708: =LOG(RC[-1]+1)*1000 -> 0
A1709: 0 | B1709: =LOG(RC[-1]+1)*1000 -> 0
A1710: 0 | B1710: =LOG(RC[-1]+1)*1000 -> 0
A1711: 0 | B1711: =LOG(RC[-1]+1)*1000 -> 0
A1712: 0 | B1712: =LOG(RC[-1]+1)*1000 -> 0
A1713: 0 | B1713: =LOG(RC[-1]+1)*1000 -> 0
A1714: 0 | B1714: =LOG(RC[-1]+1)*1000 -> 0
A1715: 0 | B1715: =LOG(RC[-1]+1)*1000 -> 0
A1716: 0 | B1716: =LOG(RC[-1]+1)*1000 -> 0
A1717: 0 | B1717: =LOG(RC[-1]+1)*1000 -> 0
A1718: 0 | B1718: =LOG(RC[-1]+1)*1000 -> 0
A1719: 0 | B1719: =LOG(RC[-1]+1)*1000 -> 0
A1720: 0 | B1720: =LOG(RC[-1]+1)*1000 -> 0
A1721: 0 | B1721: =LOG(RC[-1]+1)*1000 -> 0
A1722: 0 | B1722: =LOG(RC[-1]+1)*1000 -> 0
A1723: 0 | B1723: =LOG(RC[-1]+1)*1000 -> 0
A1724: 0 | B1724: =LOG(RC[-1]+1)*1000 -> 0
A1725: 0 | B1725: =LOG(RC[-1]+1)*1000 -> 0
A1726: 0 | B1726: =LOG(RC[-1]+1)*1000 -> 0
A1727: 0 | B1727: =LOG(RC[-1]+1)*1000 -> 0
A1728: 0 | B1728: =LOG(RC[-1]+1)*1000 -> 0
A1729: 0 | B1729: =LOG(RC[-1]+1)*1000 -> 0
A1730: 0 | B1730: =LOG(RC[-1]+1)*1000 -> 0
A1731: 0 | B1731: =LOG(RC[-1]+1)*1000 -> 0
A1732: 0 | B1732: =LOG(RC[-1]+1)*1000 -> 0
A1733: 0 | B1733: =LOG(RC[-1]+1)*1000 -> 0
A1734: 0 | B1734: =LOG(RC[-1]+1)*1000 -> 0
A1735: 0 | B1735: =LOG(RC[-1]+1)*1000 -> 0
A1736: 0 | B1736: =LOG(RC[-1]+1)*1000 -> 0
A1737: 0 | B1737: =LOG(RC[-1]+1)*1000 -> 0
A1738: 0 | B1738: =LOG(RC[-1]+1)*1000 -> 0
A1739: 0 | B1739: =LOG(RC[-1]+1)*1000 -> 0
A1740: 0 | B1740: =LOG(RC[-1]+1)*1000 -> 0
A1741: 0 | B1741: =LOG(RC[-1]+1)*1000 -> 0
A1742: 0 | B1742: =LOG(RC[-1]+1)*1000 -> 0
A1743: 0 | B1743: =LOG(RC[-1]+1)*1000 -> 0
A1744: 0 | B1744: =LOG(RC[-1]+1)*1000 -> 0
A1745: 0 | B1745: =LOG(RC[-1]+1)*1000 -> 0
A1746: 0 | B1746: =LOG(RC[-1]+1)*1000 -> 0
A1747: 0 | B1747: =LOG(RC[-1]+1)*1000 -> 0
A1748: 0 | B1748: =LOG(RC[-1]+1)*1000 -> 0
A1749: 0 | B1749: =LOG(RC[-1]+1)*1000 -> 0
A1750: 0 | B1750: =LOG(RC[-1]+1)*1000 -> 0
A1751: 0 | B1751: =LOG(RC[-1]+1)*1000 -> 0
A1752: 0 | B1752: =LOG(RC[-1]+1)*1000 -> 0
A1753: 0 | B1753: =LOG(RC[-1]+1)*1000 -> 0
A1754: 0 | B1754: =LOG(RC[-1]+1)*1000 -> 0
A1755: 0 | B1755: =LOG(RC[-1]+1)*1000 -> 0
A1756: 0 | B1756: =LOG(RC[-1]+1)*1000 -> 0
A1757: 0 | B1757: =LOG(RC[-1]+1)*1000 -> 0
A1758: 0 | B1758: =LOG(RC[-1]+1)*1000 -> 0
A1759: 0 | B1759: =LOG(RC[-1]+1)*1000 -> 0
A1760: 0 | B1760: =LOG(RC[-1]+1)*1000 -> 0
A1761: 0 | B1761: =LOG(RC[-1]+1)*1000 -> 0
A1762: 0 | B1762: =LOG(RC[-1]+1)*1000 -> 0
A1763: 0 | B1763: =LOG(RC[-1]+1)*1000 -> 0
A1764: 0 | B1764: =LOG(RC[-1]+1)*1000 -> 0
A1765: 0 | B1765: =LOG(RC[-1]+1)*1000 -> 0
A1766: 0 | B1766: =LOG(RC[-1]+1)*1000 -> 0
A1767: 0 | B1767: =LOG(RC[-1]+1)*1000 -> 0
A1768: 0 | B1768: =LOG(RC[-1]+1)*1000 -> 0
A1769: 0 | B1769: =LOG(RC[-1]+1)*1000 -> 0
A1770: 0 | B1770: =LOG(RC[-1]+1)*1000 -> 0
A1771: 0 | B1771: =LOG(RC[-1]+1)*1000 -> 0
A1772: 0 | B1772: =LOG(RC[-1]+1)*1000 -> 0
A1773: 0 | B1773: =LOG(RC[-1]+1)*1000 -> 0
A1774: 0 | B1774: =LOG(RC[-1]+1)*1000 -> 0
A1775: 0 | B1775: =LOG(RC[-1]+1)*1000 -> 0
A1776: 0 | B1776: =LOG(RC[-1]+1)*1000 -> 0
A1777: 0 | B1777: =LOG(RC[-1]+1)*1000 -> 0
A1778: 0 | B1778: =LOG(RC[-1]+1)*1000 -> 0
A1779: 0 | B1779: =LOG(RC[-1]+1)*1000 -> 0
A1780: 0 | B1780: =LOG(RC[-1]+1)*1000 -> 0
A1781: 0 | B1781: =LOG(RC[-1]+1)*1000 -> 0
A1782: 0 | B1782: =LOG(RC[-1]+1)*1000 -> 0
A1783: 0 | B1783: =LOG(RC[-1]+1)*1000 -> 0
A1784: 0 | B1784: =LOG(RC[-1]+1)*1000 -> 0
A1785: 0 | B1785: =LOG(RC[-1]+1)*1000 -> 0
A1786: 0 | B1786: =LOG(RC[-1]+1)*1000 -> 0
A1787: 0 | B1787: =LOG(RC[-1]) -> #NUM!
A1788: 0 | B1788: =LOG(RC[-1]) -> #NUM!
A1789: 0 | B1789: =LOG(RC[-1]) -> #NUM!
A1790: 0 | B1790: =LOG(RC[-1]) -> #NUM!
A1791: 0 | B1791: =LOG(RC[-1]) -> #NUM!
A1792: 0 | B1792: =LOG(RC[-1]) -> #NUM!
A1793: 0 | B1793: =LOG(RC[-1]) -> #NUM!
A1794: 0 | B1794: =LOG(RC[-1]) -> #NUM!
A1795: 0 | B1795: =LOG(RC[-1]) -> #NUM!
A1796: 0 | B1796: =LOG(RC[-1]) -> #NUM!
A1797: 0 | B1797: =LOG(RC[-1]) -> #NUM!
A1798: 0 | B1798: =LOG(RC[-1]) -> #NUM!
A1799: 0 | B1799: =LOG(RC[-1]) -> #NUM!
A1800: 0 | B1800: =LOG(RC[-1]) -> #NUM!
A1801: 0 | B1801: =LOG(RC[-1]) -> #NUM!
A1802: 0 | B1802: =LOG(RC[-1]) -> #NUM!
A1803: 0 | B1803: =LOG(RC[-1]) -> #NUM!
A1804: 0 | B1804: =LOG(RC[-1]) -> #NUM!
A1805: 0 | B1805: =LOG(RC[-1]) -> #NUM!
A1806: 0 | B1806: =LOG(RC[-1]) -> #NUM!
A1807: 0 | B1807: =LOG(RC[-1]) -> #NUM!
A1808: 0 | B1808: =LOG(RC[-1]) -> #NUM!
A1809: 0 | B1809: =LOG(RC[-1]) -> #NUM!
A1810: 0 | B1810: =LOG(RC[-1]) -> #NUM!
A1811: 0 | B1811: =LOG(RC[-1]) -> #NUM!
A1812: 0 | B1812: =LOG(RC[-1]) -> #NUM!
A1813: 0 | B1813: =LOG(RC[-1]) -> #NUM!
A1814: 0 | B1814: =LOG(RC[-1]) -> #NUM!
A1815: 0 | B1815: =LOG(RC[-1]) -> #NUM!
A1816: 0 | B1816: =LOG(RC[-1]) -> #NUM!
A1817: 0 | B1817: =LOG(RC[-1]) -> #NUM!
A1818: 0 | B1818: =LOG(RC[-1]) -> #NUM!
A1819: 0 | B1819: =LOG(RC[-1]) -> #NUM!
A1820: 0 | B1820: =LOG(RC[-1]) -> #NUM!
A1821: 0 | B1821: =LOG(RC[-1]) -> #NUM!
A1822: 0 | B1822: =LOG(RC[-1]) -> #NUM!
A1823: 0 | B1823: =LOG(RC[-1]) -> #NUM!
A1824: 0 | B1824: =LOG(RC[-1]) -> #NUM!
A1825: 0 | B1825: =LOG(RC[-1]) -> #NUM!
A1826: 0 | B1826: =LOG(RC[-1]) -> #NUM!
A1827: 0 | B1827: =LOG(RC[-1]) -> #NUM!
A1828: 0 | B1828: =LOG(RC[-1]) -> #NUM!
A1829: 0 | B1829: =LOG(RC[-1]) -> #NUM!
A1830: 0 | B1830: =LOG(RC[-1]) -> #NUM!
A1831: 0 | B1831: =LOG(RC[-1]) -> #NUM!
A1832: 0 | B1832: =LOG(RC[-1]) -> #NUM!
A1833: 0 | B1833: =LOG(RC[-1]) -> #NUM!
A1834: 0 | B1834: =LOG(RC[-1]) -> #NUM!
A1835: 0 | B1835: =LOG(RC[-1]) -> #NUM!
A1836: 0 | B1836: =LOG(RC[-1]) -> #NUM!
A1837: 0 | B1837: =LOG(RC[-1]) -> #NUM!
A1838: 0 | B1838: =LOG(RC[-1]) -> #NUM!
A1839: 0 | B1839: =LOG(RC[-1]) -> #NUM!
A1840: 0 | B1840: =LOG(RC[-1]) -> #NUM!
A1841: 0 | B1841: =LOG(RC[-1]) -> #NUM!
A1842: 0 | B1842: =LOG(RC[-1]) -> #NUM!
A1843: 0 | B1843: =LOG(RC[-1]) -> #NUM!
A1844: 0 | B1844: =LOG(RC[-1]) -> #NUM!
A1845: 0 | B1845: =LOG(RC[-1]) -> #NUM!
A1846: 0 | B1846: =LOG(RC[-1]) -> #NUM!
A1847: 0 | B1847: =LOG(RC[-1]) -> #NUM!
A1848: 0 | B1848: =LOG(RC[-1]) -> #NUM!
A1849: 0 | B1849: =LOG(RC[-1]) -> #NUM!
A1850: 0 | B1850: =LOG(RC[-1]) -> #NUM!
A1851: 0 | B1851: =LOG(RC[-1]) -> #NUM!
A1852: 0 | B1852: =LOG(RC[-1]) -> #NUM!
A1853: 0 | B1853: =LOG(RC[-1]) -> #NUM!
A1854: 0 | B1854: =LOG(RC[-1]) -> #NUM!
A1855: 0 | B1855: =LOG(RC[-1]) -> #NUM!
A1856: 0 | B1856: =LOG(RC[-1]) -> #NUM!
A1857: 0 | B1857: =LOG(RC[-1]) -> #NUM!
A1858: 0 | B1858: =LOG(RC[-1]) -> #NUM!
A1859: 0 | B1859: =LOG(RC[-1]) -> #NUM!
A1860: 0 | B1860: =LOG(RC[-1]) -> #NUM!
A1861: 0 | B1861: =LOG(RC[-1]) -> #NUM!
A1862: 0 | B1862: =LOG(RC[-1]) -> #NUM!
A1863: 0 | B1863: =LOG(RC[-1]) -> #NUM!
A1864: 0 | B1864: =LOG(RC[-1]) -> #NUM!
A1865: 0 | B1865: =LOG(RC[-1]) -> #NUM!
A1866: 0 | B1866: =LOG(RC[-1]) -> #NUM!
A1867: 0 | B1867: =LOG(RC[-1]) -> #NUM!
A1868: 0 | B1868: =LOG(RC[-1]) -> #NUM!
A1869: 0 | B1869: =LOG(RC[-1]) -> #NUM!
A1870: 0 | B1870: =LOG(RC[-1]) -> #NUM!
A1871: 0 | B1871: =LOG(RC[-1]) -> #NUM!
A1872: 0 | B1872: =LOG(RC[-1]) -> #NUM!
A1873: 0 | B1873: =LOG(RC[-1]) -> #NUM!
A1874: 0 | B1874: =LOG(RC[-1]) -> #NUM!
A1875: 0 | B1875: =LOG(RC[-1]) -> #NUM!
A1876: 0 | B1876: =LOG(RC[-1]) -> #NUM!
A1877: 0 | B1877: =LOG(RC[-1]) -> #NUM!
A1878: 0 | B1878: =LOG(RC[-1]) -> #NUM!
A1879: 0 | B1879: =LOG(RC[-1]) -> #NUM!
A1880: 0 | B1880: =LOG(RC[-1]) -> #NUM!
A1881: 0 | B1881: =LOG(RC[-1]) -> #NUM!
A1882: 0 | B1882: =LOG(RC[-1]) -> #NUM!
A1883: 0 | B1883: =LOG(RC[-1]) -> #NUM!
A1884: 0 | B1884: =LOG(RC[-1]) -> #NUM!
A1885: 0 | B1885: =LOG(RC[-1]) -> #NUM!
A1886: 0 | B1886: =LOG(RC[-1]) -> #NUM!
A1887: 0 | B1887: =LOG(RC[-1]) -> #NUM!
A1888: 0 | B1888: =LOG(RC[-1]) -> #NUM!
A1889: 0 | B1889: =LOG(RC[-1]) -> #NUM!
A1890: 0 | B1890: =LOG(RC[-1]) -> #NUM!
A1891: 0 | B1891: =LOG(RC[-1]) -> #NUM!
A1892: 0 | B1892: =LOG(RC[-1]) -> #NUM!
A1893: 0 | B1893: =LOG(RC[-1]) -> #NUM!
A1894: 0 | B1894: =LOG(RC[-1]) -> #NUM!
A1895: 0 | B1895: =LOG(RC[-1]) -> #NUM!
A1896: 0 | B1896: =LOG(RC[-1]) -> #NUM!
A1897: 0 | B1897: =LOG(RC[-1]) -> #NUM!
A1898: 0 | B1898: =LOG(RC[-1]) -> #NUM!
A1899: 0 | B1899: =LOG(RC[-1]) -> #NUM!
A1900: 0 | B1900: =LOG(RC[-1]) -> #NUM!
A1901: 0 | B1901: =LOG(RC[-1]) -> #NUM!
A1902: 0 | B1902: =LOG(RC[-1]) -> #NUM!
A1903: 0 | B1903: =LOG(RC[-1]) -> #NUM!
A1904: 0 | B1904: =LOG(RC[-1]) -> #NUM!
A1905: 0 | B1905: =LOG(RC[-1]) -> #NUM!
A1906: 0 | B1906: =LOG(RC[-1]) -> #NUM!
A1907: 0 | B1907: =LOG(RC[-1]) -> #NUM!
A1908: 0 | B1908: =LOG(RC[-1]) -> #NUM!
A1909: 0 | B1909: =LOG(RC[-1]) -> #NUM!
A1910: 0 | B1910: =LOG(RC[-1]) -> #NUM!
A1911: 0 | B1911: =LOG(RC[-1]) -> #NUM!
A1912: 0 | B1912: =LOG(RC[-1]) -> #NUM!
A1913: 0 | B1913: =LOG(RC[-1]) -> #NUM!
A1914: 0 | B1914: =LOG(RC[-1]) -> #NUM!
A1915: 0 | B1915: =LOG(RC[-1]) -> #NUM!
A1916: 0 | B1916: =LOG(RC[-1]) -> #NUM!
A1917: 0 | B1917: =LOG(RC[-1]) -> #NUM!
A1918: 0 | B1918: =LOG(RC[-1]) -> #NUM!
A1919: 0 | B1919: =LOG(RC[-1]) -> #NUM!
A1920: 0 | B1920: =LOG(RC[-1]) -> #NUM!
A1921: 0 | B1921: =LOG(RC[-1]) -> #NUM!
A1922: 0 | B1922: =LOG(RC[-1]) -> #NUM!
A1923: 0 | B1923: =LOG(RC[-1]) -> #NUM!
A1924: 0 | B1924: =LOG(RC[-1]) -> #NUM!
A1925: 0 | B1925: =LOG(RC[-1]) -> #NUM!
A1926: 0 | B1926: =LOG(RC[-1]) -> #NUM!
A1927: 0 | B1927: =LOG(RC[-1]) -> #NUM!
A1928: 0 | B1928: =LOG(RC[-1]) -> #NUM!
A1929: 0 | B1929: =LOG(RC[-1]) -> #NUM!
A1930: 0 | B1930: =LOG(RC[-1]) -> #NUM!
A1931: 0 | B1931: =LOG(RC[-1]) -> #NUM!
A1932: 0 | B1932: =LOG(RC[-1]) -> #NUM!
A1933: 0 | B1933: =LOG(RC[-1]) -> #NUM!
A1934: 0 | B1934: =LOG(RC[-1]) -> #NUM!
A1935: 0 | B1935: =LOG(RC[-1]) -> #NUM!
A1936: 0 | B1936: =LOG(RC[-1]) -> #NUM!
A1937: 0 | B1937: =LOG(RC[-1]) -> #NUM!
A1938: 0 | B1938: =LOG(RC[-1]) -> #NUM!
A1939: 0 | B1939: =LOG(RC[-1]) -> #NUM!
A1940: 0 | B1940: =LOG(RC[-1]) -> #NUM!
A1941: 0 | B1941: =LOG(RC[-1]) -> #NUM!
A1942: 0 | B1942: =LOG(RC[-1]) -> #NUM!
A1943: 0 | B1943: =LOG(RC[-1]) -> #NUM!
A1944: 0 | B1944: =LOG(RC[-1]) -> #NUM!
A1945: 0 | B1945: =LOG(RC[-1]) -> #NUM!
A1946: 0 | B1946: =LOG(RC[-1]) -> #NUM!
A1947: 0 | B1947: =LOG(RC[-1]) -> #NUM!
A1948: 0 | B1948: =LOG(RC[-1]) -> #NUM!
A1949: 0 | B1949: =LOG(RC[-1]) -> #NUM!
A1950: 0 | B1950: =LOG(RC[-1]) -> #NUM!
A1951: 0 | B1951: =LOG(RC[-1]) -> #NUM!
A1952: 0 | B1952: =LOG(RC[-1]) -> #NUM!
A1953: 0 | B1953: =LOG(RC[-1]) -> #NUM!
A1954: 0 | B1954: =LOG(RC[-1]) -> #NUM!
A1955: 0 | B1955: =LOG(RC[-1]) -> #NUM!
A1956: 0 | B1956: =LOG(RC[-1]) -> #NUM!
A1957: 0 | B1957: =LOG(RC[-1]) -> #NUM!
A1958: 0 | B1958: =LOG(RC[-1]) -> #NUM!
A1959: 0 | B1959: =LOG(RC[-1]) -> #NUM!
A1960: 0 | B1960: =LOG(RC[-1]) -> #NUM!
A1961: 0 | B1961: =LOG(RC[-1]) -> #NUM!
A1962: 0 | B1962: =LOG(RC[-1]) -> #NUM!
A1963: 0 | B1963: =LOG(RC[-1]) -> #NUM!
A1964: 0 | B1964: =LOG(RC[-1]) -> #NUM!
A1965: 0 | B1965: =LOG(RC[-1]) -> #NUM!
A1966: 0 | B1966: =LOG(RC[-1]) -> #NUM!
A1967: 0 | B1967: =LOG(RC[-1]) -> #NUM!
A1968: 0 | B1968: =LOG(RC[-1]) -> #NUM!
A1969: 0 | B1969: =LOG(RC[-1]) -> #NUM!
A1970: 0 | B1970: =LOG(RC[-1]) -> #NUM!
A1971: 0 | B1971: =LOG(RC[-1]) -> #NUM!
A1972: 0 | B1972: =LOG(RC[-1]) -> #NUM!
A1973: 0 | B1973: =LOG(RC[-1]) -> #NUM!
A1974: 0 | B1974: =LOG(RC[-1]) -> #NUM!
A1975: 0 | B1975: =LOG(RC[-1]) -> #NUM!
A1976: 0 | B1976: =LOG(RC[-1]) -> #NUM!
A1977: 0 | B1977: =LOG(RC[-1]) -> #NUM!
A1978: 0 | B1978: =LOG(RC[-1]) -> #NUM!
A1979: 0 | B1979: =LOG(RC[-1]) -> #NUM!
A1980: 0 | B1980: =LOG(RC[-1]) -> #NUM!
A1981: 0 | B1981: =LOG(RC[-1]) -> #NUM!
A1982: 0 | B1982: =LOG(RC[-1]) -> #NUM!
A1983: 0 | B1983: =LOG(RC[-1]) -> #NUM!
A1984: 0 | B1984: =LOG(RC[-1]) -> #NUM!
A1985: 0 | B1985: =LOG(RC[-1]) -> #NUM!
A1986: 0 | B1986: =LOG(RC[-1]) -> #NUM!
A1987: 0 | B1987: =LOG(RC[-1]) -> #NUM!
A1988: 0 | B1988: =LOG(RC[-1]) -> #NUM!
A1989: 0 | B1989: =LOG(RC[-1]) -> #NUM!
A1990: 0 | B1990: =LOG(RC[-1]) -> #NUM!
A1991: 0 | B1991: =LOG(RC[-1]) -> #NUM!
A1992: 0 | B1992: =LOG(RC[-1]) -> #NUM!
A1993: 0 | B1993: =LOG(RC[-1]) -> #NUM!
A1994: 0 | B1994: =LOG(RC[-1]) -> #NUM!
A1995: 0 | B1995: =LOG(RC[-1]) -> #NUM!
A1996: 0 | B1996: =LOG(RC[-1]) -> #NUM!
A1997: 0 | B1997: =LOG(RC[-1]) -> #NUM!
A1998: 0 | B1998: =LOG(RC[-1]) -> #NUM!
A1999: 0 | B1999: =LOG(RC[-1]) -> #NUM!
A2000: 0 | B2000: =LOG(RC[-1]) -> #NUM!
A2001: 0 | B2001: =LOG(RC[-1]) -> #NUM!
A2002: 0 | B2002: =LOG(RC[-1]) -> #NUM!
A2003: 0 | B2003: =LOG(RC[-1]) -> #NUM!
A2004: 0 | B2004: =LOG(RC[-1]) -> #NUM!
A2005: 0 | B2005: =LOG(RC[-1]) -> #NUM!
A2006: 0 | B2006: =LOG(RC[-1]) -> #NUM!
A2007: 0 | B2007: =LOG(RC[-1]) -> #NUM!
A2008: 0 | B2008: =LOG(RC[-1]) -> #NUM!
A2009: 0 | B2009: =LOG(RC[-1]) -> #NUM!
A2010: 0 | B2010: =LOG(RC[-1]) -> #NUM!
A2011: 0 | B2011: =LOG(RC[-1]) -> #NUM!
A2012: 0 | B2012: =LOG(RC[-1]) -> #NUM!
A2013: 0 | B2013: =LOG(RC[-1]) -> #NUM!
A2014: 0 | B2014: =LOG(RC[-1]) -> #NUM!
A2015: 0 | B2015: =LOG(RC[-1]) -> #NUM!
A2016: 0 | B2016: =LOG(RC[-1]) -> #NUM!
A2017: 0 | B2017: =LOG(RC[-1]) -> #NUM!
A2018: 0 | B2018: =LOG(RC[-1]) -> #NUM!
A2019: 0 | B2019: =LOG(RC[-1]) -> #NUM!
A2020: 0 | B2020: =LOG(RC[-1]) -> #NUM!
A2021: 0 | B2021: =LOG(RC[-1]) -> #NUM!
A2022: 0 | B2022: =LOG(RC[-1]) -> #NUM!
A2023: 0 | B2023: =LOG(RC[-1]) -> #NUM!
A2024: 0 | B2024: =LOG(RC[-1]) -> #NUM!
A2025: 0 | B2025: =LOG(RC[-1]) -> #NUM!
A2026: 0 | B2026: =LOG(RC[-1]) -> #NUM!
A2027: 0 | B2027: =LOG(RC[-1]) -> #NUM!
A2028: 0 | B2028: =LOG(RC[-1]) -> #NUM!
A2029: 0 | B2029: =LOG(RC[-1]) -> #NUM!
A2030: 0 | B2030: =LOG(RC[-1]) -> #NUM!
A2031: 0 | B2031: =LOG(RC[-1]) -> #NUM!
A2032: 0 | B2032: =LOG(RC[-1]) -> #NUM!
A2033: 0 | B2033: =LOG(RC[-1]) -> #NUM!
A2034: 0 | B2034: =LOG(RC[-1]) -> #NUM!
A2035: 0 | B2035: =LOG(RC[-1]) -> #NUM!
A2036: 0 | B2036: =LOG(RC[-1]) -> #NUM!
A2037: 0 | B2037: =LOG(RC[-1]) -> #NUM!
A2038: 0 | B2038: =LOG(RC[-1]) -> #NUM!
A2039: 0 | B2039: =LOG(RC[-1]) -> #NUM!
A2040: 0 | B2040: =LOG(RC[-1]) -> #NUM!
A2041: 0 | B2041: =LOG(RC[-1]) -> #NUM!
A2042: 0 | B2042: =LOG(RC[-1]) -> #NUM!
A2043: 0 | B2043: =LOG(RC[-1]) -> #NUM!
A2044: 0 | B2044: =LOG(RC[-1]) -> #NUM!
A2045: 0 | B2045: =LOG(RC[-1]) -> #NUM!
A2046: 0 | B2046: =LOG(RC[-1]) -> #NUM!
A2047: 0 | B2047: =LOG(RC[-1]) -> #NUM!
A2048: 0 | B2048: =LOG(RC[-1]) -> #NUM!
A2049: 0 | B2049: =LOG(RC[-1]) -> #NUM!
A2050: 0 | B2050: =LOG(RC[-1]) -> #NUM!
A2051: 0 | B2051: =LOG(RC[-1]) -> #NUM!
A2052: 0 | B2052: =LOG(RC[-1]) -> #NUM!
A2053: 0 | B2053: =LOG(RC[-1]) -> #NUM!
A2054: 0 | B2054: =LOG(RC[-1]) -> #NUM!
A2055: 0 | B2055: =LOG(RC[-1]) -> #NUM!
A2056: 0 | B2056: =LOG(RC[-1]) -> #NUM!
A2057: 0 | B2057: =LOG(RC[-1]) -> #NUM!
A2058: 0 | B2058: =LOG(RC[-1]) -> #NUM!
A2059: 0 | B2059: =LOG(RC[-1]) -> #NUM!
A2060: 0 | B2060: =LOG(RC[-1]) -> #NUM!
A2061: 0 | B2061: =LOG(RC[-1]) -> #NUM!
A2062: 0 | B2062: =LOG(RC[-1]) -> #NUM!
A2063: 0 | B2063: =LOG(RC[-1]) -> #NUM!
A2064: 0 | B2064: =LOG(RC[-1]) -> #NUM!
A2065: 0 | B2065: =LOG(RC[-1]) -> #NUM!
A2066: 0 | B2066: =LOG(RC[-1]) -> #NUM!
A2067: 0 | B2067: =LOG(RC[-1]) -> #NUM!
A2068: 0 | B2068: =LOG(RC[-1]) -> #NUM!
A2069: 0 | B2069: =LOG(RC[-1]) -> #NUM!
A2070: 0 | B2070: =LOG(RC[-1]) -> #NUM!
A2071: 0 | B2071: =LOG(RC[-1]) -> #NUM!
A2072: 0 | B2072: =LOG(RC[-1]) -> #NUM!
A2073: 0 | B2073: =LOG(RC[-1]) -> #NUM!
A2074: 0 | B2074: =LOG(RC[-1]) -> #NUM!
A2075: 0 | B2075: =LOG(RC[-1]) -> #NUM!
A2076: 0 | B2076: =LOG(RC[-1]) -> #NUM!
A2077: 0 | B2077: =LOG(RC[-1]) -> #NUM!
A2078: 0 | B2078: =LOG(RC[-1]) -> #NUM!
A2079: 0 | B2079: =LOG(RC[-1]) -> #NUM!
A2080: 0 | B2080: =LOG(RC[-1]) -> #NUM!
A2081: 0 | B2081: =LOG(RC[-1]) -> #NUM!
A2082: 0 | B2082: =LOG(RC[-1]) -> #NUM!
A2083: 0 | B2083: =LOG(RC[-1]) -> #NUM!
A2084: 0 | B2084: =LOG(RC[-1]) -> #NUM!
A2085: 0 | B2085: =LOG(RC[-1]) -> #NUM!
A2086: 0 | B2086: =LOG(RC[-1]) -> #NUM!
A2087: 0 | B2087: =LOG(RC[-1]) -> #NUM!
A2088: 0 | B2088: =LOG(RC[-1]) -> #NUM!
A2089: 0 | B2089: =LOG(RC[-1]) -> #NUM!
A2090: 0 | B2090: =LOG(RC[-1]) -> #NUM!
A2091: 0 | B2091: =LOG(RC[-1]) -> #NUM!
A2092: 0 | B2092: =LOG(RC[-1]) -> #NUM!
A2093: 0 | B2093: =LOG(RC[-1]) -> #NUM!
A2094: 0 | B2094: =LOG(RC[-1]) -> #NUM!
A2095: 0 | B2095: =LOG(RC[-1]) -> #NUM!
A2096: 0 | B2096: =LOG(RC[-1]) -> #NUM!
A2097: 0 | B2097: =LOG(RC[-1]) -> #NUM!
A2098: 0 | B2098: =LOG(RC[-1]) -> #NUM!
A2099: 0 | B2099: =LOG(RC[-1]) -> #NUM!
A2100: 0 | B2100: =LOG(RC[-1]) -> #NUM!
A2101: 0 | B2101: =LOG(RC[-1]) -> #NUM!
A2102: 0 | B2102: =LOG(RC[-1]) -> #NUM!
A2103: 0 | B2103: =LOG(RC[-1]) -> #NUM!
A2104: 0 | B2104: =LOG(RC[-1]) -> #NUM!
A2105: 0 | B2105: =LOG(RC[-1]) -> #NUM!
A2106: 0 | B2106: =LOG(RC[-1]) -> #NUM!
A2107: 0 | B2107: =LOG(RC[-1]) -> #NUM!
A2108: 0 | B2108: =LOG(RC[-1]) -> #NUM!
A2109: 0 | B2109: =LOG(RC[-1]) -> #NUM!
A2110: 0 | B2110: =LOG(RC[-1]) -> #NUM!
A2111: 0 | B2111: =LOG(RC[-1]) -> #NUM!
A2112: 0 | B2112: =LOG(RC[-1]) -> #NUM!
A2113: 0 | B2113: =LOG(RC[-1]) -> #NUM!
A2114: 0 | B2114: =LOG(RC[-1]) -> #NUM!
A2115: 0 | B2115: =LOG(RC[-1]) -> #NUM!
A2116: 0 | B2116: =LOG(RC[-1]) -> #NUM!
A2117: 0 | B2117: =LOG(RC[-1]) -> #NUM!
A2118: 0 | B2118: =LOG(RC[-1]) -> #NUM!
A2119: 0 | B2119: =LOG(RC[-1]) -> #NUM!
A2120: 0 | B2120: =LOG(RC[-1]) -> #NUM!
A2121: 0 | B2121: =LOG(RC[-1]) -> #NUM!
A2122: 0 | B2122: =LOG(RC[-1]) -> #NUM!
A2123: 0 | B2123: =LOG(RC[-1]) -> #NUM!
A2124: 0 | B2124: =LOG(RC[-1]) -> #NUM!
A2125: 0 | B2125: =LOG(RC[-1]) -> #NUM!
A2126: 0 | B2126: =LOG(RC[-1]) -> #NUM!
A2127: 0 | B2127: =LOG(RC[-1]) -> #NUM!
A2128: 0 | B2128: =LOG(RC[-1]) -> #NUM!
A2129: 0 | B2129: =LOG(RC[-1]) -> #NUM!
A2130: 0 | B2130: =LOG(RC[-1]) -> #NUM!
A2131: 0 | B2131: =LOG(RC[-1]) -> #NUM!
A2132: 0 | B2132: =LOG(RC[-1]) -> #NUM!
A2133: 0 | B2133: =LOG(RC[-1]) -> #NUM!
A2134: 0 | B2134: =LOG(RC[-1]) -> #NUM!
A2135: 0 | B2135: =LOG(RC[-1]) -> #NUM!
A2136: 0 | B2136: =LOG(RC[-1]) -> #NUM!
A2137: 0 | B2137: =LOG(RC[-1]) -> #NUM!
A2138: 0 | B2138: =LOG(RC[-1]) -> #NUM!
A2139: 0 | B2139: =LOG(RC[-1]) -> #NUM!
A2140: 0 | B2140: =LOG(RC[-1]) -> #NUM!
A2141: 0 | B2141: =LOG(RC[-1]) -> #NUM!
A2142: 0 | B2142: =LOG(RC[-1]) -> #NUM!
A2143: 0 | B2143: =LOG(RC[-1]) -> #NUM!
A2144: 0 | B2144: =LOG(RC[-1]) -> #NUM!
A2145: 0 | B2145: =LOG(RC[-1]) -> #NUM!
A2146: 0 | B2146: =LOG(RC[-1]) -> #NUM!
A2147: 0 | B2147: =LOG(RC[-1]) -> #NUM!
A2148: 0 | B2148: =LOG(RC[-1]) -> #NUM!
A2149: 0 | B2149: =LOG(RC[-1]) -> #NUM!
A2150: 0 | B2150: =LOG(RC[-1]) -> #NUM!
A2151: 0 | B2151: =LOG(RC[-1]) -> #NUM!
A2152: 0 | B2152: =LOG(RC[-1]) -> #NUM!
A2153: 0 | B2153: =LOG(RC[-1]) -> #NUM!
A2154: 0 | B2154: =LOG(RC[-1]) -> #NUM!
A2155: 0 | B2155: =LOG(RC[-1]) -> #NUM!
A2156: 0 | B2156: =LOG(RC[-1]) -> #NUM!
A2157: 0 | B2157: =LOG(RC[-1]) -> #NUM!
A2158: 0 | B2158: =LOG(RC[-1]) -> #NUM!
A2159: 0 | B2159: =LOG(RC[-1]) -> #NUM!
A2160: 0 | B2160: =LOG(RC[-1]) -> #NUM!
A2161: 0 | B2161: =LOG(RC[-1]) -> #NUM!
A2162: 0 | B2162: =LOG(RC[-1]) -> #NUM!
A2163: 0 | B2163: =LOG(RC[-1]) -> #NUM!
A2164: 0 | B2164: =LOG(RC[-1]) -> #NUM!
A2165: 0 | B2165: =LOG(RC[-1]) -> #NUM!
A2166: 0 | B2166: =LOG(RC[-1]) -> #NUM!
A2167: 0 | B2167: =LOG(RC[-1]) -> #NUM!
A2168: 0 | B2168: =LOG(RC[-1]) -> #NUM!
A2169: 0 | B2169: =LOG(RC[-1]) -> #NUM!
A2170: 0 | B2170: =LOG(RC[-1]) -> #NUM!
A2171: 0 | B2171: =LOG(RC[-1]) -> #NUM!
A2172: 0 | B2172: =LOG(RC[-1]) -> #NUM!
A2173: 0 | B2173: =LOG(RC[-1]) -> #NUM!
A2174: 0 | B2174: =LOG(RC[-1]) -> #NUM!
A2175: 0 | B2175: =LOG(RC[-1]) -> #NUM!
A2176: 0 | B2176: =LOG(RC[-1]) -> #NUM!
A2177: 0 | B2177: =LOG(RC[-1]) -> #NUM!
A2178: 0 | B2178: =LOG(RC[-1]) -> #NUM!
A2179: 0 | B2179: =LOG(RC[-1]) -> #NUM!
A2180: 0 | B2180: =LOG(RC[-1]) -> #NUM!
A2181: 0 | B2181: =LOG(RC[-1]) -> #NUM!
A2182: 0 | B2182: =LOG(RC[-1]) -> #NUM!
A2183: 0 | B2183: =LOG(RC[-1]) -> #NUM!
A2184: 0 | B2184: =LOG(RC[-1]) -> #NUM!
A2185: 0 | B2185: =LOG(RC[-1]) -> #NUM!
A2186: 0 | B2186: =LOG(RC[-1]) -> #NUM!
A2187: 0 | B2187: =LOG(RC[-1]) -> #NUM!
A2188: 0 | B2188: =LOG(RC[-1]) -> #NUM!
A2189: 0 | B2189: =LOG(RC[-1]) -> #NUM!
A2190: 0 | B2190: =LOG(RC[-1]) -> #NUM!
A2191: 0 | B2191: =LOG(RC[-1]) -> #NUM!
A2192: 0 | B2192: =LOG(RC[-1]) -> #NUM!
A2193: 0 | B2193: =LOG(RC[-1]) -> #NUM!
A2194: 0 | B2194: =LOG(RC[-1]) -> #NUM!
A2195: 0 | B2195: =LOG(RC[-1]) -> #NUM!
A2196: 0 | B2196: =LOG(RC[-1]) -> #NUM!
A2197: 0 | B2197: =LOG(RC[-1]) -> #NUM!
A2198: 0 | B2198: =LOG(RC[-1]) -> #NUM!
A2199: 0 | B2199: =LOG(RC[-1]) -> #NUM!
A2200: 0 | B2200: =LOG(RC[-1]) -> #NUM!
A2201: 0 | B2201: =LOG(RC[-1]) -> #NUM!
A2202: 0 | B2202: =LOG(RC[-1]) -> #NUM!
A2203: 0 | B2203: =LOG(RC[-1]) -> #NUM!
A2204: 0 | B2204: =LOG(RC[-1]) -> #NUM!
A2205: 0 | B2205: =LOG(RC[-1]) -> #NUM!
A2206: 0 | B2206: =LOG(RC[-1]) -> #NUM!
A2207: 0 | B2207: =LOG(RC[-1]) -> #NUM!
A2208: 0 | B2208: =LOG(RC[-1]) -> #NUM!
A2209: 0 | B2209: =LOG(RC[-1]) -> #NUM!
A2210: 0 | B2210: =LOG(RC[-1]) -> #NUM!
A2211: 0 | B2211: =LOG(RC[-1]) -> #NUM!
A2212: 0 | B2212: =LOG(RC[-1]) -> #NUM!
A2213: 0 | B2213: =LOG(RC[-1]) -> #NUM!
A2214: 0 | B2214: =LOG(RC[-1]) -> #NUM!
A2215: 0 | B2215: =LOG(RC[-1]) -> #NUM!
A2216: 0 | B2216: =LOG(RC[-1]) -> #NUM!
A2217: 0 | B2217: =LOG(RC[-1]) -> #NUM!
A2218: 0 | B2218: =LOG(RC[-1]) -> #NUM!
A2219: 0 | B2219: =LOG(RC[-1]) -> #NUM!
A2220: 0 | B2220: =LOG(RC[-1]) -> #NUM!
A2221: 0 | B2221: =LOG(RC[-1]) -> #NUM!
A2222: 0 | B2222: =LOG(RC[-1]) -> #NUM!
A2223: 0 | B2223: =LOG(RC[-1]) -> #NUM!
A2224: 0 | B2224: =LOG(RC[-1]) -> #NUM!
A2225: 0 | B2225: =LOG(RC[-1]) -> #NUM!
A2226: 0 | B2226: =LOG(RC[-1]) -> #NUM!
A2227: 0 | B2227: =LOG(RC[-1]) -> #NUM!
A2228: 0 | B2228: =LOG(RC[-1]) -> #NUM!
A2229: 0 | B2229: =LOG(RC[-1]) -> #NUM!
A2230: 0 | B2230: =LOG(RC[-1]) -> #NUM!
A2231: 0 | B2231: =LOG(RC[-1]) -> #NUM!
A2232: 0 | B2232: =LOG(RC[-1]) -> #NUM!
A2233: 0 | B2233: =LOG(RC[-1]) -> #NUM!
A2234: 0 | B2234: =LOG(RC[-1]) -> #NUM!
A2235: 0 | B2235: =LOG(RC[-1]) -> #NUM!
A2236: 0 | B2236: =LOG(RC[-1]) -> #NUM!
A2237: 0 | B2237: =LOG(RC[-1]) -> #NUM!
A2238: 0 | B2238: =LOG(RC[-1]) -> #NUM!
A2239: 0 | B2239: =LOG(RC[-1]) -> #NUM!
A2240: 0 | B2240: =LOG(RC[-1]) -> #NUM!
A2241: 0 | B2241: =LOG(RC[-1]) -> #NUM!
A2242: 0 | B2242: =LOG(RC[-1]) -> #NUM!
A2243: 0 | B2243: =LOG(RC[-1]) -> #NUM!
A2244: 0 | B2244: =LOG(RC[-1]) -> #NUM!
A2245: 0 | B2245: =LOG(RC[-1]) -> #NUM!
A2246: 0 | B2246: =LOG(RC[-1]) -> #NUM!
A2247: 0 | B2247: =LOG(RC[-1]) -> #NUM!
A2248: 0 | B2248: =LOG(RC[-1]) -> #NUM!
A2249: 0 | B2249: =LOG(RC[-1]) -> #NUM!
A2250: 0 | B2250: =LOG(RC[-1]) -> #NUM!
A2251: 0 | B2251: =LOG(RC[-1]) -> #NUM!
A2252: 0 | B2252: =LOG(RC[-1]) -> #NUM!
A2253: 0 | B2253: =LOG(RC[-1]) -> #NUM!
A2254: 0 | B2254: =LOG(RC[-1]) -> #NUM!
A2255: 0 | B2255: =LOG(RC[-1]) -> #NUM!
A2256: 0 | B2256: =LOG(RC[-1]) -> #NUM!
A2257: 0 | B2257: =LOG(RC[-1]) -> #NUM!
A2258: 0 | B2258: =LOG(RC[-1]) -> #NUM!
A2259: 0 | B2259: =LOG(RC[-1]) -> #NUM!
A2260: 0 | B2260: =LOG(RC[-1]) -> #NUM!
A2261: 0 | B2261: =LOG(RC[-1]) -> #NUM!
A2262: 0 | B2262: =LOG(RC[-1]) -> #NUM!
A2263: 0 | B2263: =LOG(RC[-1]) -> #NUM!
A2264: 0 | B2264: =LOG(RC[-1]) -> #NUM!
A2265: 0 | B2265: =LOG(RC[-1]) -> #NUM!
A2266: 0 | B2266: =LOG(RC[-1]) -> #NUM!
A2267: 0 | B2267: =LOG(RC[-1]) -> #NUM!
A2268: 0 | B2268: =LOG(RC[-1]) -> #NUM!
A2269: 0 | B2269: =LOG(RC[-1]) -> #NUM!
A2270: 0 | B2270: =LOG(RC[-1]) -> #NUM!
A2271: 0 | B2271: =LOG(RC[-1]) -> #NUM!
A2272: 0 | B2272: =LOG(RC[-1]) -> #NUM!
A2273: 0 | B2273: =LOG(RC[-1]) -> #NUM!
A2274: 0 | B2274: =LOG(RC[-1]) -> #NUM!
A2275: 0 | B2275: =LOG(RC[-1]) -> #NUM!
A2276: 0 | B2276: =LOG(RC[-1]) -> #NUM!
A2277: 0 | B2277: =LOG(RC[-1]) -> #NUM!
A2278: 0 | B2278: =LOG(RC[-1]) -> #NUM!
A2279: 0 | B2279: =LOG(RC[-1]) -> #NUM!
A2280: 0 | B2280: =LOG(RC[-1]) -> #NUM!
A2281: 0 | B2281: =LOG(RC[-1]) -> #NUM!
A2282: 0 | B2282: =LOG(RC[-1]) -> #NUM!
A2283: 0 | B2283: =LOG(RC[-1]) -> #NUM!
A2284: 0 | B2284: =LOG(RC[-1]) -> #NUM!
A2285: 0 | B2285: =LOG(RC[-1]) -> #NUM!
A2286: 0 | B2286: =LOG(RC[-1]) -> #NUM!
A2287: 0 | B2287: =LOG(RC[-1]) -> #NUM!
A2288: 0 | B2288: =LOG(RC[-1]) -> #NUM!
A2289: 0 | B2289: =LOG(RC[-1]) -> #NUM!
A2290: 0 | B2290: =LOG(RC[-1]) -> #NUM!
A2291: 0 | B2291: =LOG(RC[-1]) -> #NUM!
A2292: 0 | B2292: =LOG(RC[-1]) -> #NUM!
A2293: 0 | B2293: =LOG(RC[-1]) -> #NUM!
A2294: 0 | B2294: =LOG(RC[-1]) -> #NUM!
A2295: 0 | B2295: =LOG(RC[-1]) -> #NUM!
A2296: 0 | B2296: =LOG(RC[-1]) -> #NUM!
A2297: 0 | B2297: =LOG(RC[-1]) -> #NUM!
A2298: 0 | B2298: =LOG(RC[-1]) -> #NUM!
A2299: 0 | B2299: =LOG(RC[-1]) -> #NUM!
A2300: 0 | B2300: =LOG(RC[-1]) -> #NUM!
A2301: 0 | B2301: =LOG(RC[-1]) -> #NUM!
A2302: 0 | B2302: =LOG(RC[-1]) -> #NUM!
A2303: 0 | B2303: =LOG(RC[-1]) -> #NUM!
A2304: 0 | B2304: =LOG(RC[-1]) -> #NUM!
A2305: 0 | B2305: =LOG(RC[-1]) -> #NUM!
A2306: 0 | B2306: =LOG(RC[-1]) -> #NUM!
A2307: 0 | B2307: =LOG(RC[-1]) -> #NUM!
A2308: 0 | B2308: =LOG(RC[-1]) -> #NUM!
A2309: 0 | B2309: =LOG(RC[-1]) -> #NUM!
A2310: 0 | B2310: =LOG(RC[-1]) -> #NUM!
A2311: 0 | B2311: =LOG(RC[-1]) -> #NUM!
A2312: 0 | B2312: =LOG(RC[-1]) -> #NUM!
A2313: 0 | B2313: =LOG(RC[-1]) -> #NUM!
A2314: 0 | B2314: =LOG(RC[-1]) -> #NUM!
A2315: 0 | B2315: =LOG(RC[-1]) -> #NUM!
A2316: 0 | B2316: =LOG(RC[-1]) -> #NUM!
A2317: 0 | B2317: =LOG(RC[-1]) -> #NUM!
A2318: 0 | B2318: =LOG(RC[-1]) -> #NUM!
A2319: 0 | B2319: =LOG(RC[-1]) -> #NUM!
A2320: 0 | B2320: =LOG(RC[-1]) -> #NUM!
A2321: 0 | B2321: =LOG(RC[-1]) -> #NUM!
A2322: 0 | B2322: =LOG(RC[-1]) -> #NUM!
A2323: 0 | B2323: =LOG(RC[-1]) -> #NUM!
A2324: 0 | B2324: =LOG(RC[-1]) -> #NUM!
A2325: 0 | B2325: =LOG(RC[-1]) -> #NUM!
A2326: 0 | B2326: =LOG(RC[-1]) -> #NUM!
A2327: 0 | B2327: =LOG(RC[-1]) -> #NUM!
A2328: 0 | B2328: =LOG(RC[-1]) -> #NUM!
A2329: 0 | B2329: =LOG(RC[-1]) -> #NUM!
A2330: 0 | B2330: =LOG(RC[-1]) -> #NUM!
A2331: 0 | B2331: =LOG(RC[-1]) -> #NUM!
A2332: 0 | B2332: =LOG(RC[-1]) -> #NUM!
A2333: 0 | B2333: =LOG(RC[-1]) -> #NUM!
A2334: 0 | B2334: =LOG(RC[-1]) -> #NUM!
A2335: 0 | B2335: =LOG(RC[-1]) -> #NUM!
A2336: 0 | B2336: =LOG(RC[-1]) -> #NUM!
A2337: 0 | B2337: =LOG(RC[-1]) -> #NUM!
A2338: 0 | B2338: =LOG(RC[-1]) -> #NUM!
A2339: 0 | B2339: =LOG(RC[-1]) -> #NUM!
A2340: 0 | B2340: =LOG(RC[-1]) -> #NUM!
A2341: 0 | B2341: =LOG(RC[-1]) -> #NUM!
A2342: 0 | B2342: =LOG(RC[-1]) -> #NUM!
A2343: 0 | B2343: =LOG(RC[-1]) -> #NUM!
A2344: 0 | B2344: =LOG(RC[-1]) -> #NUM!
A2345: 0 | B2345: =LOG(RC[-1]) -> #NUM!
A2346: 0 | B2346: =LOG(RC[-1]) -> #NUM!
A2347: 0 | B2347: =LOG(RC[-1]) -> #NUM!
A2348: 0 | B2348: =LOG(RC[-1]) -> #NUM!
A2349: 0 | B2349: =LOG(RC[-1]) -> #NUM!
A2350: 0 | B2350: =LOG(RC[-1]) -> #NUM!
A2351: 0 | B2351: =LOG(RC[-1]) -> #NUM!
A2352: 0 | B2352: =LOG(RC[-1]) -> #NUM!
A2353: 0 | B2353: =LOG(RC[-1]) -> #NUM!
A2354: 0 | B2354: =LOG(RC[-1]) -> #NUM!
A2355: 0 | B2355: =LOG(RC[-1]) -> #NUM!
A2356: 0 | B2356: =LOG(RC[-1]) -> #NUM!
A2357: 0 | B2357: =LOG(RC[-1]) -> #NUM!
A2358: 0 | B2358: =LOG(RC[-1]) -> #NUM!
A2359: 0 | B2359: =LOG(RC[-1]) -> #NUM!
A2360: 0 | B2360: =LOG(RC[-1]) -> #NUM!
A2361: 0 | B2361: =LOG(RC[-1]) -> #NUM!
A2362: 0 | B2362: =LOG(RC[-1]) -> #NUM!
A2363: 0 | B2363: =LOG(RC[-1]) -> #NUM!
A2364: 0 | B2364: =LOG(RC[-1]) -> #NUM!
A2365: 0 | B2365: =LOG(RC[-1]) -> #NUM!
A2366: 0 | B2366: =LOG(RC[-1]) -> #NUM!
A2367: 0 | B2367: =LOG(RC[-1]) -> #NUM!
A2368: 0 | B2368: =LOG(RC[-1]) -> #NUM!
A2369: 0 | B2369: =LOG(RC[-1]) -> #NUM!
A2370: 0 | B2370: =LOG(RC[-1]) -> #NUM!
A2371: 0 | B2371: =LOG(RC[-1]) -> #NUM!
A2372: 0 | B2372: =LOG(RC[-1]) -> #NUM!
A2373: 0 | B2373: =LOG(RC[-1]) -> #NUM!
A2374: 0 | B2374: =LOG(RC[-1]) -> #NUM!
A2375: 0 | B2375: =LOG(RC[-1]) -> #NUM!
A2376: 0 | B2376: =LOG(RC[-1]) -> #NUM!
A2377: 0 | B2377: =LOG(RC[-1]) -> #NUM!
A2378: 0 | B2378: =LOG(RC[-1]) -> #NUM!
A2379: 0 | B2379: =LOG(RC[-1]) -> #NUM!
A2380: 0 | B2380: =LOG(RC[-1]) -> #NUM!
A2381: 0 | B2381: =LOG(RC[-1]) -> #NUM!
A2382: 0 | B2382: =LOG(RC[-1]) -> #NUM!
A2383: 0 | B2383: =LOG(RC[-1]) -> #NUM!
A2384: 0 | B2384: =LOG(RC[-1]) -> #NUM!
A2385: 0 | B2385: =LOG(RC[-1]) -> #NUM!
A2386: 0 | B2386: =LOG(RC[-1]) -> #NUM!
A2387: 0 | B2387: =LOG(RC[-1]) -> #NUM!
A2388: 0 | B2388: =LOG(RC[-1]) -> #NUM!
A2389: 0 | B2389: =LOG(RC[-1]) -> #NUM!
A2390: 0 | B2390: =LOG(RC[-1]) -> #NUM!
A2391: 0 | B2391: =LOG(RC[-1]) -> #NUM!
A2392: 0 | B2392: =LOG(RC[-1]) -> #NUM!
A2393: 0 | B2393: =LOG(RC[-1]) -> #NUM!
A2394: 0 | B2394: =LOG(RC[-1]) -> #NUM!
A2395: 0 | B2395: =LOG(RC[-1]) -> #NUM!
A2396: 0 | B2396: =LOG(RC[-1]) -> #NUM!
A2397: 0 | B2397: =LOG(RC[-1]) -> #NUM!
A2398: 0 | B2398: =LOG(RC[-1]) -> #NUM!
A2399: 0 | B2399: =LOG(RC[-1]) -> #NUM!
A2400: 0 | B2400: =LOG(RC[-1]) -> #NUM!
A2401: 0 | B2401: =LOG(RC[-1]) -> #NUM!
A2402: 0 | B2402: =LOG(RC[-1]) -> #NUM!
A2403: 0 | B2403: =LOG(RC[-1]) -> #NUM!
A2404: 0 | B2404: =LOG(RC[-1]) -> #NUM!
A2405: 0 | B2405: =LOG(RC[-1]) -> #NUM!
A2406: 0 | B2406: =LOG(RC[-1]) -> #NUM!
A2407: 0 | B2407: =LOG(RC[-1]) -> #NUM!
A2408: 0 | B2408: =LOG(RC[-1]) -> #NUM!
A2409: 0 | B2409: =LOG(RC[-1]) -> #NUM!
A2410: 0 | B2410: =LOG(RC[-1]) -> #NUM!
A2411: 0 | B2411: =LOG(RC[-1]) -> #NUM!
A2412: 0 | B2412: =LOG(RC[-1]) -> #NUM!
A2413: 0 | B2413: =LOG(RC[-1]) -> #NUM!
A2414: 0 | B2414: =LOG(RC[-1]) -> #NUM!
A2415: 0 | B2415: =LOG(RC[-1]) -> #NUM!
A2416: 0 | B2416: =LOG(RC[-1]) -> #NUM!
A2417: 0 | B2417: =LOG(RC[-1]) -> #NUM!
A2418: 0 | B2418: =LOG(RC[-1]) -> #NUM!
A2419: 0 | B2419: =LOG(RC[-1]) -> #NUM!
A2420: 0 | B2420: =LOG(RC[-1]) -> #NUM!
A2421: 0 | B2421: =LOG(RC[-1]) -> #NUM!
A2422: 0 | B2422: =LOG(RC[-1]) -> #NUM!
A2423: 0 | B2423: =LOG(RC[-1]) -> #NUM!
A2424: 0 | B2424: =LOG(RC[-1]) -> #NUM!
A2425: 0 | B2425: =LOG(RC[-1]) -> #NUM!
A2426: 0 | B2426: =LOG(RC[-1]) -> #NUM!
A2427: 0 | B2427: =LOG(RC[-1]) -> #NUM!
A2428: 0 | B2428: =LOG(RC[-1]) -> #NUM!
A2429: 0 | B2429: =LOG(RC[-1]) -> #NUM!
A2430: 0 | B2430: =LOG(RC[-1]) -> #NUM!
A2431: 0 | B2431: =LOG(RC[-1]) -> #NUM!
A2432: 0 | B2432: =LOG(RC[-1]) -> #NUM!
A2433: 0 | B2433: =LOG(RC[-1]) -> #NUM!
A2434: 0 | B2434: =LOG(RC[-1]) -> #NUM!
A2435: 0 | B2435: =LOG(RC[-1]) -> #NUM!
A2436: 0 | B2436: =LOG(RC[-1]) -> #NUM!
A2437: 0 | B2437: =LOG(RC[-1]) -> #NUM!
A2438: 0 | B2438: =LOG(RC[-1]) -> #NUM!
A2439: 0 | B2439: =LOG(RC[-1]) -> #NUM!
A2440: 0 | B2440: =LOG(RC[-1]) -> #NUM!
A2441: 0 | B2441: =LOG(RC[-1]) -> #NUM!
A2442: 0 | B2442: =LOG(RC[-1]) -> #NUM!
A2443: 0 | B2443: =LOG(RC[-1]) -> #NUM!
A2444: 0 | B2444: =LOG(RC[-1]) -> #NUM!
A2445: 0 | B2445: =LOG(RC[-1]) -> #NUM!
A2446: 0 | B2446: =LOG(RC[-1]) -> #NUM!
A2447: 0 | B2447: =LOG(RC[-1]) -> #NUM!
A2448: 0 | B2448: =LOG(RC[-1]) -> #NUM!
A2449: 0 | B2449: =LOG(RC[-1]) -> #NUM!
A2450: 0 | B2450: =LOG(RC[-1]) -> #NUM!
A2451: 0 | B2451: =LOG(RC[-1]) -> #NUM!
A2452: 0 | B2452: =LOG(RC[-1]) -> #NUM!
A2453: 0 | B2453: =LOG(RC[-1]) -> #NUM!
A2454: 0 | B2454: =LOG(RC[-1]) -> #NUM!
A2455: 0 | B2455: =LOG(RC[-1]) -> #NUM!
A2456: 0 | B2456: =LOG(RC[-1]) -> #NUM!
A2457: 0 | B2457: =LOG(RC[-1]) -> #NUM!
A2458: 0 | B2458: =LOG(RC[-1]) -> #NUM!
A2459: 0 | B2459: =LOG(RC[-1]) -> #NUM!
A2460: 0 | B2460: =LOG(RC[-1]) -> #NUM!
A2461: 0 | B2461: =LOG(RC[-1]) -> #NUM!
A2462: 0 | B2462: =LOG(RC[-1]) -> #NUM!
A2463: 0 | B2463: =LOG(RC[-1]) -> #NUM!
A2464: 0 | B2464: =LOG(RC[-1]) -> #NUM!
A2465: 0 | B2465: =LOG(RC[-1]) -> #NUM!
A2466: 0 | B2466: =LOG(RC[-1]) -> #NUM!
A2467: 0 | B2467: =LOG(RC[-1]) -> #NUM!
A2468: 0 | B2468: =LOG(RC[-1]) -> #NUM!
A2469: 0 | B2469: =LOG(RC[-1]) -> #NUM!
A2470: 0 | B2470: =LOG(RC[-1]) -> #NUM!
A2471: 0 | B2471: =LOG(RC[-1]) -> #NUM!
A2472: 0 | B2472: =LOG(RC[-1]) -> #NUM!
A2473: 0 | B2473: =LOG(RC[-1]) -> #NUM!
A2474: 0 | B2474: =LOG(RC[-1]) -> #NUM!
A2475: 0 | B2475: =LOG(RC[-1]) -> #NUM!
A2476: 0 | B2476: =LOG(RC[-1]) -> #NUM!
A2477: 0 | B2477: =LOG(RC[-1]) -> #NUM!
A2478: 0 | B2478: =LOG(RC[-1]) -> #NUM!
A2479: 0 | B2479: =LOG(RC[-1]) -> #NUM!
A2480: 0 | B2480: =LOG(RC[-1]) -> #NUM!
A2481: 0 | B2481: =LOG(RC[-1]) -> #NUM!
A2482: 0 | B2482: =LOG(RC[-1]) -> #NUM!
A2483: 0 | B2483: =LOG(RC[-1]) -> #NUM!
A2484: 0 | B2484: =LOG(RC[-1]) -> #NUM!
A2485: 0 | B2485: =LOG(RC[-1]) -> #NUM!
A2486: 0 | B2486: =LOG(RC[-1]) -> #NUM!
A2487: 0 | B2487: =LOG(RC[-1]) -> #NUM!
A2488: 0 | B2488: =LOG(RC[-1]) -> #NUM!
A2489: 0 | B2489: =LOG(RC[-1]) -> #NUM!
A2490: 0 | B2490: =LOG(RC[-1]) -> #NUM!
A2491: 0 | B2491: =LOG(RC[-1]) -> #NUM!
A2492: 0 | B2492: =LOG(RC[-1]) -> #NUM!
A2493: 0 | B2493: =LOG(RC[-1]) -> #NUM!
A2494: 0 | B2494: =LOG(RC[-1]) -> #NUM!
A2495: 0 | B2495: =LOG(RC[-1]) -> #NUM!
A2496: 0 | B2496: =LOG(RC[-1]) -> #NUM!
A2497: 0 | B2497: =LOG(RC[-1]) -> #NUM!
A2498: 0 | B2498: =LOG(RC[-1]) -> #NUM!
A2499: 0 | B2499: =LOG(RC[-1]) -> #NUM!
A2500: 0 | B2500: =LOG(RC[-1]) -> #NUM!
A2501: 0 | B2501: =LOG(RC[-1]) -> #NUM!
A2502: 0 | B2502: =LOG(RC[-1]) -> #NUM!
A2503: 0 | B2503: =LOG(RC[-1]) -> #NUM!
A2504: 0 | B2504: =LOG(RC[-1]) -> #NUM!
A2505: 0 | B2505: =LOG(RC[-1]) -> #NUM!
A2506: 0 | B2506: =LOG(RC[-1]) -> #NUM!
A2507: 0 | B2507: =LOG(RC[-1]) -> #NUM!
A2508: 0 | B2508: =LOG(RC[-1]) -> #NUM!
A2509: 0 | B2509: =LOG(RC[-1]) -> #NUM!
A2510: 0 | B2510: =LOG(RC[-1]) -> #NUM!
A2511: 0 | B2511: =LOG(RC[-1]) -> #NUM!
A2512: 0 | B2512: =LOG(RC[-1]) -> #NUM!
A2513: 0 | B2513: =LOG(RC[-1]) -> #NUM!
A2514: 0 | B2514: =LOG(RC[-1]) -> #NUM!
A2515: 0 | B2515: =LOG(RC[-1]) -> #NUM!
A2516: 0 | B2516: =LOG(RC[-1]) -> #NUM!
A2517: 0 | B2517: =LOG(RC[-1]) -> #NUM!
A2518: 0 | B2518: =LOG(RC[-1]) -> #NUM!
A2519: 0 | B2519: =LOG(RC[-1]) -> #NUM!
A2520: 0 | B2520: =LOG(RC[-1]) -> #NUM!
A2521: 0 | B2521: =LOG(RC[-1]) -> #NUM!
A2522: 0 | B2522: =LOG(RC[-1]) -> #NUM!
A2523: 0 | B2523: =LOG(RC[-1]) -> #NUM!
A2524: 0 | B2524: =LOG(RC[-1]) -> #NUM!
A2525: 0 | B2525: =LOG(RC[-1]) -> #NUM!
A2526: 0 | B2526: =LOG(RC[-1]) -> #NUM!
A2527: 0 | B2527: =LOG(RC[-1]) -> #NUM!
A2528: 0 | B2528: =LOG(RC[-1]) -> #NUM!
A2529: 0 | B2529: =LOG(RC[-1]) -> #NUM!
A2530: 0 | B2530: =LOG(RC[-1]) -> #NUM!
A2531: 0 | B2531: =LOG(RC[-1]) -> #NUM!
A2532: 0 | B2532: =LOG(RC[-1]) -> #NUM!
A2533: 0 | B2533: =LOG(RC[-1]) -> #NUM!
A2534: 0 | B2534: =LOG(RC[-1]) -> #NUM!
A2535: 0 | B2535: =LOG(RC[-1]) -> #NUM!
A2536: 0 | B2536: =LOG(RC[-1]) -> #NUM!
A2537: 0 | B2537: =LOG(RC[-1]) -> #NUM!
A2538: 0 | B2538: =LOG(RC[-1]) -> #NUM!
A2539: 0 | B2539: =LOG(RC[-1]) -> #NUM!
A2540: 0 | B2540: =LOG(RC[-1]) -> #NUM!
A2541: 0 | B2541: =LOG(RC[-1]) -> #NUM!
A2542: 0 | B2542: =LOG(RC[-1]) -> #NUM!
A2543: 0 | B2543: =LOG(RC[-1]) -> #NUM!
A2544: 0 | B2544: =LOG(RC[-1]) -> #NUM!
A2545: 0 | B2545: =LOG(RC[-1]) -> #NUM!
A2546: 0 | B2546: =LOG(RC[-1]) -> #NUM!
A2547: 0 | B2547: =LOG(RC[-1]) -> #NUM!
A2548: 0 | B2548: =LOG(RC[-1]) -> #NUM!
A2549: 0 | B2549: =LOG(RC[-1]) -> #NUM!
A2550: 0 | B2550: =LOG(RC[-1]) -> #NUM!
A2551: 0 | B2551: =LOG(RC[-1]) -> #NUM!
A2552: 0 | B2552: =LOG(RC[-1]) -> #NUM!
A2553: 0 | B2553: =LOG(RC[-1]) -> #NUM!
A2554: 0 | B2554: =LOG(RC[-1]) -> #NUM!
A2555: 0 | B2555: =LOG(RC[-1]) -> #NUM!
A2556: 0 | B2556: =LOG(RC[-1]) -> #NUM!
A2557: 0 | B2557: =LOG(RC[-1]) -> #NUM!
A2558: 0 | B2558: =LOG(RC[-1]) -> #NUM!
A2559: 0 | B2559: =LOG(RC[-1]) -> #NUM!
A2560: 0 | B2560: =LOG(RC[-1]) -> #NUM!
A2561: 0 | B2561: =LOG(RC[-1]) -> #NUM!
A2562: 0 | B2562: =LOG(RC[-1]) -> #NUM!
A2563: 0 | B2563: =LOG(RC[-1]) -> #NUM!
A2564: 0 | B2564: =LOG(RC[-1]) -> #NUM!
A2565: 0 | B2565: =LOG(RC[-1]) -> #NUM!
A2566: 0 | B2566: =LOG(RC[-1]) -> #NUM!
A2567: 0 | B2567: =LOG(RC[-1]) -> #NUM!
A2568: 0 | B2568: =LOG(RC[-1]) -> #NUM!
A2569: 0 | B2569: =LOG(RC[-1]) -> #NUM!
A2570: 0 | B2570: =LOG(RC[-1]) -> #NUM!
A2571: 0 | B2571: =LOG(RC[-1]) -> #NUM!
A2572: 0 | B2572: =LOG(RC[-1]) -> #NUM!
A2573: 0 | B2573: =LOG(RC[-1]) -> #NUM!
A2574: 0 | B2574: =LOG(RC[-1]) -> #NUM!
A2575: 0 | B2575: =LOG(RC[-1]) -> #NUM!
A2576: 0 | B2576: =LOG(RC[-1]) -> #NUM!
A2577: 0 | B2577: =LOG(RC[-1]) -> #NUM!
A2578: 0 | B2578: =LOG(RC[-1]) -> #NUM!
A2579: 0 | B2579: =LOG(RC[-1]) -> #NUM!
A2580: 0 | B2580: =LOG(RC[-1]) -> #NUM!
A2581: 0 | B2581: =LOG(RC[-1]) -> #NUM!
A2582: 0 | B2582: =LOG(RC[-1]) -> #NUM!
A2583: 0 | B2583: =LOG(RC[-1]) -> #NUM!
A2584: 0 | B2584: =LOG(RC[-1]) -> #NUM!
A2585: 0 | B2585: =LOG(RC[-1]) -> #NUM!
A2586: 0 | B2586: =LOG(RC[-1]) -> #NUM!
A2587: 0 | B2587: =LOG(RC[-1]) -> #NUM!
A2588: 0 | B2588: =LOG(RC[-1]) -> #NUM!
A2589: 0 | B2589: =LOG(RC[-1]) -> #NUM!
A2590: 0 | B2590: =LOG(RC[-1]) -> #NUM!
A2591: 0 | B2591: =LOG(RC[-1]) -> #NUM!
A2592: 0 | B2592: =LOG(RC[-1]) -> #NUM!
A2593: 0 | B2593: =LOG(RC[-1]) -> #NUM!
A2594: 0 | B2594: =LOG(RC[-1]) -> #NUM!
A2595: 0 | B2595: =LOG(RC[-1]) -> #NUM!
A2596: 0 | B2596: =LOG(RC[-1]) -> #NUM!
A2597: 0 | B2597: =LOG(RC[-1]) -> #NUM!
A2598: 0 | B2598: =LOG(RC[-1]) -> #NUM!
A2599: 0 | B2599: =LOG(RC[-1]) -> #NUM!
A2600: 0 | B2600: =LOG(RC[-1]) -> #NUM!
A2601: 0 | B2601: =LOG(RC[-1]) -> #NUM!
A2602: 0 | B2602: =LOG(RC[-1]) -> #NUM!
A2603: 0 | B2603: =LOG(RC[-1]) -> #NUM!
A2604: 0 | B2604: =LOG(RC[-1]) -> #NUM!
A2605: 0 | B2605: =LOG(RC[-1]) -> #NUM!
A2606: 0 | B2606: =LOG(RC[-1]) -> #NUM!
A2607: 0 | B2607: =LOG(RC[-1]) -> #NUM!
A2608: 0 | B2608: =LOG(RC[-1]) -> #NUM!
A2609: 0 | B2609: =LOG(RC[-1]) -> #NUM!
A2610: 0 | B2610: =LOG(RC[-1]) -> #NUM!
A2611: 0 | B2611: =LOG(RC[-1]) -> #NUM!
A2612: 0 | B2612: =LOG(RC[-1]) -> #NUM!
A2613: 0 | B2613: =LOG(RC[-1]) -> #NUM!
A2614: 0 | B2614: =LOG(RC[-1]) -> #NUM!
A2615: 0 | B2615: =LOG(RC[-1]) -> #NUM!
A2616: 0 | B2616: =LOG(RC[-1]) -> #NUM!
A2617: 0 | B2617: =LOG(RC[-1]) -> #NUM!
A2618: 0 | B2618: =LOG(RC[-1]) -> #NUM!
A2619: 0 | B2619: =LOG(RC[-1]) -> #NUM!
A2620: 0 | B2620: =LOG(RC[-1]) -> #NUM!
A2621: 0 | B2621: =LOG(RC[-1]) -> #NUM!
A2622: 0 | B2622: =LOG(RC[-1]) -> #NUM!
A2623: 0 | B2623: =LOG(RC[-1]) -> #NUM!
A2624: 0 | B2624: =LOG(RC[-1]) -> #NUM!
A2625: 0 | B2625: =LOG(RC[-1]) -> #NUM!
A2626: 0 | B2626: =LOG(RC[-1]) -> #NUM!
A2627: 0 | B2627: =LOG(RC[-1]) -> #NUM!
A2628: 0 | B2628: =LOG(RC[-1]) -> #NUM!
A2629: 0 | B2629: =LOG(RC[-1]) -> #NUM!
A2630: 0 | B2630: =LOG(RC[-1]) -> #NUM!
A2631: 0 | B2631: =LOG(RC[-1]) -> #NUM!
A2632: 0 | B2632: =LOG(RC[-1]) -> #NUM!
A2633: 0 | B2633: =LOG(RC[-1]) -> #NUM!
A2634: 0 | B2634: =LOG(RC[-1]) -> #NUM!
A2635: 0 | B2635: =LOG(RC[-1]) -> #NUM!
A2636: 0 | B2636: =LOG(RC[-1]) -> #NUM!
A2637: 0 | B2637: =LOG(RC[-1]) -> #NUM!
A2638: 0 | B2638: =LOG(RC[-1]) -> #NUM!
A2639: 0 | B2639: =LOG(RC[-1]) -> #NUM!
A2640: 0 | B2640: =LOG(RC[-1]) -> #NUM!
A2641: 0 | B2641: =LOG(RC[-1]) -> #NUM!
A2642: 0 | B2642: =LOG(RC[-1]) -> #NUM!
A2643: 0 | B2643: =LOG(RC[-1]) -> #NUM!
A2644: 0 | B2644: =LOG(RC[-1]) -> #NUM!
A2645: 0 | B2645: =LOG(RC[-1]) -> #NUM!
A2646: 0 | B2646: =LOG(RC[-1]) -> #NUM!
A2647: 0 | B2647: =LOG(RC[-1]) -> #NUM!
A2648: 0 | B2648: =LOG(RC[-1]) -> #NUM!
A2649: 0 | B2649: =LOG(RC[-1]) -> #NUM!
A2650: 0 | B2650: =LOG(RC[-1]) -> #NUM!
A2651: 0 | B2651: =LOG(RC[-1]) -> #NUM!
A2652: 0 | B2652: =LOG(RC[-1]) -> #NUM!
A2653: 0 | B2653: =LOG(RC[-1]) -> #NUM!
A2654: 0 | B2654: =LOG(RC[-1]) -> #NUM!
A2655: 0 | B2655: =LOG(RC[-1]) -> #NUM!
A2656: 0 | B2656: =LOG(RC[-1]) -> #NUM!
A2657: 0 | B2657: =LOG(RC[-1]) -> #NUM!
A2658: 0 | B2658: =LOG(RC[-1]) -> #NUM!
A2659: 0 | B2659: =LOG(RC[-1]) -> #NUM!
A2660: 0 | B2660: =LOG(RC[-1]) -> #NUM!
A2661: 0 | B2661: =LOG(RC[-1]) -> #NUM!
A2662: 0 | B2662: =LOG(RC[-1]) -> #NUM!
A2663: 0 | B2663: =LOG(RC[-1]) -> #NUM!
A2664: 0 | B2664: =LOG(RC[-1]) -> #NUM!
A2665: 0 | B2665: =LOG(RC[-1]) -> #NUM!
A2666: 0 | B2666: =LOG(RC[-1]) -> #NUM!
A2667: 0 | B2667: =LOG(RC[-1]) -> #NUM!
A2668: 0 | B2668: =LOG(RC[-1]) -> #NUM!
A2669: 0 | B2669: =LOG(RC[-1]) -> #NUM!
A2670: 0 | B2670: =LOG(RC[-1]) -> #NUM!
A2671: 0 | B2671: =LOG(RC[-1]) -> #NUM!
A2672: 0 | B2672: =LOG(RC[-1]) -> #NUM!
A2673: 0 | B2673: =LOG(RC[-1]) -> #NUM!
A2674: 0 | B2674: =LOG(RC[-1]) -> #NUM!
A2675: 0 | B2675: =LOG(RC[-1]) -> #NUM!
A2676: 0 | B2676: =LOG(RC[-1]) -> #NUM!
A2677: 0 | B2677: =LOG(RC[-1]) -> #NUM!
A2678: 0 | B2678: =LOG(RC[-1]) -> #NUM!
A2679: 0 | B2679: =LOG(RC[-1]) -> #NUM!
A2680: 0 | B2680: =LOG(RC[-1]) -> #NUM!
A2681: 0 | B2681: =LOG(RC[-1]) -> #NUM!
A2682: 0 | B2682: =LOG(RC[-1]) -> #NUM!
A2683: 0 | B2683: =LOG(RC[-1]) -> #NUM!
A2684: 0 | B2684: =LOG(RC[-1]) -> #NUM!
A2685: 0 | B2685: =LOG(RC[-1]) -> #NUM!
A2686: 0 | B2686: =LOG(RC[-1]) -> #NUM!
A2687: 0 | B2687: =LOG(RC[-1]) -> #NUM!
A2688: 0 | B2688: =LOG(RC[-1]) -> #NUM!
A2689: 0 | B2689: =LOG(RC[-1]) -> #NUM!
A2690: 0 | B2690: =LOG(RC[-1]) -> #NUM!
A2691: 0 | B2691: =LOG(RC[-1]) -> #NUM!
A2692: 0 | B2692: =LOG(RC[-1]) -> #NUM!
A2693: 0 | B2693: =LOG(RC[-1]) -> #NUM!
A2694: 0 | B2694: =LOG(RC[-1]) -> #NUM!
A2695: 0 | B2695: =LOG(RC[-1]) -> #NUM!
A2696: 0 | B2696: =LOG(RC[-1]) -> #NUM!
A2697: 0 | B2697: =LOG(RC[-1]) -> #NUM!
A2698: 0 | B2698: =LOG(RC[-1]) -> #NUM!
A2699: 0 | B2699: =LOG(RC[-1]) -> #NUM!
A2700: 0 | B2700: =LOG(RC[-1]) -> #NUM!
A2701: 0 | B2701: =LOG(RC[-1]) -> #NUM!
A2702: 0 | B2702: =LOG(RC[-1]) -> #NUM!
A2703: 0 | B2703: =LOG(RC[-1]) -> #NUM!
A2704: 0 | B2704: =LOG(RC[-1]) -> #NUM!
A2705: 0 | B2705: =LOG(RC[-1]) -> #NUM!
A2706: 0 | B2706: =LOG(RC[-1]) -> #NUM!
A2707: 0 | B2707: =LOG(RC[-1]) -> #NUM!
A2708: 0 | B2708: =LOG(RC[-1]) -> #NUM!
A2709: 0 | B2709: =LOG(RC[-1]) -> #NUM!
A2710: 0 | B2710: =LOG(RC[-1]) -> #NUM!
A2711: 0 | B2711: =LOG(RC[-1]) -> #NUM!
A2712: 0 | B2712: =LOG(RC[-1]) -> #NUM!
A2713: 0 | B2713: =LOG(RC[-1]) -> #NUM!
A2714: 0 | B2714: =LOG(RC[-1]) -> #NUM!
A2715: 0 | B2715: =LOG(RC[-1]) -> #NUM!
A2716: 0 | B2716: =LOG(RC[-1]) -> #NUM!
A2717: 0 | B2717: =LOG(RC[-1]) -> #NUM!
A2718: 0 | B2718: =LOG(RC[-1]) -> #NUM!
A2719: 0 | B2719: =LOG(RC[-1]) -> #NUM!
A2720: 0 | B2720: =LOG(RC[-1]) -> #NUM!
A2721: 0 | B2721: =LOG(RC[-1]) -> #NUM!
A2722: 0 | B2722: =LOG(RC[-1]) -> #NUM!
A2723: 0 | B2723: =LOG(RC[-1]) -> #NUM!
A2724: 0 | B2724: =LOG(RC[-1]) -> #NUM!
A2725: 0 | B2725: =LOG(RC[-1]) -> #NUM!
A2726: 0 | B2726: =LOG(RC[-1]) -> #NUM!
A2727: 0 | B2727: =LOG(RC[-1]) -> #NUM!
A2728: 0 | B2728: =LOG(RC[-1]) -> #NUM!
A2729: 0 | B2729: =LOG(RC[-1]) -> #NUM!
A2730: 0 | B2730: =LOG(RC[-1]) -> #NUM!
A2731: 0 | B2731: =LOG(RC[-1]) -> #NUM!
A2732: 0 | B2732: =LOG(RC[-1]) -> #NUM!
A2733: 0 | B2733: =LOG(RC[-1]) -> #NUM!
A2734: 0 | B2734: =LOG(RC[-1]) -> #NUM!
A2735: 0 | B2735: =LOG(RC[-1]) -> #NUM!
A2736: 0 | B2736: =LOG(RC[-1]) -> #NUM!
A2737: 0 | B2737: =LOG(RC[-1]) -> #NUM!
A2738: 0 | B2738: =LOG(RC[-1]) -> #NUM!
A2739: 0 | B2739: =LOG(RC[-1]) -> #NUM!
A2740: 0 | B2740: =LOG(RC[-1]) -> #NUM!
A2741: 0 | B2741: =LOG(RC[-1]) -> #NUM!
A2742: 0 | B2742: =LOG(RC[-1]) -> #NUM!
A2743: 0 | B2743: =LOG(RC[-1]) -> #NUM!
A2744: 0 | B2744: =LOG(RC[-1]) -> #NUM!
A2745: 0 | B2745: =LOG(RC[-1]) -> #NUM!
A2746: 0 | B2746: =LOG(RC[-1]) -> #NUM!
A2747: 0 | B2747: =LOG(RC[-1]) -> #NUM!
A2748: 0 | B2748: =LOG(RC[-1]) -> #NUM!
A2749: 0 | B2749: =LOG(RC[-1]) -> #NUM!
A2750: 0 | B2750: =LOG(RC[-1]) -> #NUM!
A2751: 0 | B2751: =LOG(RC[-1]) -> #NUM!
A2752: 0 | B2752: =LOG(RC[-1]) -> #NUM!
A2753: 0 | B2753: =LOG(RC[-1]) -> #NUM!
A2754: 0 | B2754: =LOG(RC[-1]) -> #NUM!
A2755: 0 | B2755: =LOG(RC[-1]) -> #NUM!
A2756: 0 | B2756: =LOG(RC[-1]) -> #NUM!
A2757: 0 | B2757: =LOG(RC[-1]) -> #NUM!
A2758: 0 | B2758: =LOG(RC[-1]) -> #NUM!
A2759: 0 | B2759: =LOG(RC[-1]) -> #NUM!
A2760: 0 | B2760: =LOG(RC[-1]) -> #NUM!
A2761: 0 | B2761: =LOG(RC[-1]) -> #NUM!
A2762: 0 | B2762: =LOG(RC[-1]) -> #NUM!
A2763: 0 | B2763: =LOG(RC[-1]) -> #NUM!
A2764: 0 | B2764: =LOG(RC[-1]) -> #NUM!
A2765: 0 | B2765: =LOG(RC[-1]) -> #NUM!
A2766: 0 | B2766: =LOG(RC[-1]) -> #NUM!
A2767: 0 | B2767: =LOG(RC[-1]) -> #NUM!
A2768: 0 | B2768: =LOG(RC[-1]) -> #NUM!
A2769: 0 | B2769: =LOG(RC[-1]) -> #NUM!
A2770: 0 | B2770: =LOG(RC[-1]) -> #NUM!
A2771: 0 | B2771: =LOG(RC[-1]) -> #NUM!
A2772: 0 | B2772: =LOG(RC[-1]) -> #NUM!
A2773: 0 | B2773: =LOG(RC[-1]) -> #NUM!
A2774: 0 | B2774: =LOG(RC[-1]) -> #NUM!
A2775: 0 | B2775: =LOG(RC[-1]) -> #NUM!
A2776: 0 | B2776: =LOG(RC[-1]) -> #NUM!
A2777: 0 | B2777: =LOG(RC[-1]) -> #NUM!
A2778: 0 | B2778: =LOG(RC[-1]) -> #NUM!
A2779: 0 | B2779: =LOG(RC[-1]) -> #NUM!
A2780: 0 | B2780: =LOG(RC[-1]) -> #NUM!
A2781: 0 | B2781: =LOG(RC[-1]) -> #NUM!
A2782: 0 | B2782: =LOG(RC[-1]) -> #NUM!
A2783: 0 | B2783: =LOG(RC[-1]) -> #NUM!
A2784: 0 | B2784: =LOG(RC[-1]) -> #NUM!
A2785: 0 | B2785: =LOG(RC[-1]) -> #NUM!
A2786: 0 | B2786: =LOG(RC[-1]) -> #NUM!
A2787: 0 | B2787: =LOG(RC[-1]) -> #NUM!
A2788: 0 | B2788: =LOG(RC[-1]) -> #NUM!
A2789: 0 | B2789: =LOG(RC[-1]) -> #NUM!
A2790: 0 | B2790: =LOG(RC[-1]) -> #NUM!
A2791: 0 | B2791: =LOG(RC[-1]) -> #NUM!
A2792: 0 | B2792: =LOG(RC[-1]) -> #NUM!
A2793: 0 | B2793: =LOG(RC[-1]) -> #NUM!
A2794: 0 | B2794: =LOG(RC[-1]) -> #NUM!
A2795: 0 | B2795: =LOG(RC[-1]) -> #NUM!
A2796: 0 | B2796: =LOG(RC[-1]) -> #NUM!
A2797: 0 | B2797: =LOG(RC[-1]) -> #NUM!
A2798: 0 | B2798: =LOG(RC[-1]) -> #NUM!
A2799: 0 | B2799: =LOG(RC[-1]) -> #NUM!
A2800: 0 | B2800: =LOG(RC[-1]) -> #NUM!
A2801: 0 | B2801: =LOG(RC[-1]) -> #NUM!
A2802: 0 | B2802: =LOG(RC[-1]) -> #NUM!
A2803: 0 | B2803: =LOG(RC[-1]) -> #NUM!
A2804: 0 | B2804: =LOG(RC[-1]) -> #NUM!
A2805: 0 | B2805: =LOG(RC[-1]) -> #NUM!
A2806: 0 | B2806: =LOG(RC[-1]) -> #NUM!
A2807: 0 | B2807: =LOG(RC[-1]) -> #NUM!
A2808: 0 | B2808: =LOG(RC[-1]) -> #NUM!
A2809: 0 | B2809: =LOG(RC[-1]) -> #NUM!
A2810: 0 | B2810: =LOG(RC[-1]) -> #NUM!
A2811: 0 | B2811: =LOG(RC[-1]) -> #NUM!
A2812: 0 | B2812: =LOG(RC[-1]) -> #NUM!
A2813: 0 | B2813: =LOG(RC[-1]) -> #NUM!
A2814: 0 | B2814: =LOG(RC[-1]) -> #NUM!
A2815: 0 | B2815: =LOG(RC[-1]) -> #NUM!
A2816: 0 | B2816: =LOG(RC[-1]) -> #NUM!
A2817: 0 | B2817: =LOG(RC[-1]) -> #NUM!
A2818: 0 | B2818: =LOG(RC[-1]) -> #NUM!
A2819: 0 | B2819: =LOG(RC[-1]) -> #NUM!
A2820: 0 | B2820: =LOG(RC[-1]) -> #NUM!
A2821: 0 | B2821: =LOG(RC[-1]) -> #NUM!
A2822: 0 | B2822: =LOG(RC[-1]) -> #NUM!
A2823: 0 | B2823: =LOG(RC[-1]) -> #NUM!
A2824: 0 | B2824: =LOG(RC[-1]) -> #NUM!
A2825: 0 | B2825: =LOG(RC[-1]) -> #NUM!
A2826: 0 | B2826: =LOG(RC[-1]) -> #NUM!
A2827: 0 | B2827: =LOG(RC[-1]) -> #NUM!
A2828: 0 | B2828: =LOG(RC[-1]) -> #NUM!
A2829: 0 | B2829: =LOG(RC[-1]) -> #NUM!
A2830: 0 | B2830: =LOG(RC[-1]) -> #NUM!
A2831: 0 | B2831: =LOG(RC[-1]) -> #NUM!
A2832: 0 | B2832: =LOG(RC[-1]) -> #NUM!
A2833: 0 | B2833: =LOG(RC[-1]) -> #NUM!
A2834: 0 | B2834: =LOG(RC[-1]) -> #NUM!
A2835: 0 | B2835: =LOG(RC[-1]) -> #NUM!
A2836: 0 | B2836: =LOG(RC[-1]) -> #NUM!
A2837: 0 | B2837: =LOG(RC[-1]) -> #NUM!
A2838: 0 | B2838: =LOG(RC[-1]) -> #NUM!
A2839: 0 | B2839: =LOG(RC[-1]) -> #NUM!
A2840: 0 | B2840: =LOG(RC[-1]) -> #NUM!
A2841: 0 | B2841: =LOG(RC[-1]) -> #NUM!
A2842: 0 | B2842: =LOG(RC[-1]) -> #NUM!
A2843: 0 | B2843: =LOG(RC[-1]) -> #NUM!
A2844: 0 | B2844: =LOG(RC[-1]) -> #NUM!
A2845: 0 | B2845: =LOG(RC[-1]) -> #NUM!
A2846: 0 | B2846: =LOG(RC[-1]) -> #NUM!
A2847: 0 | B2847: =LOG(RC[-1]) -> #NUM!
A2848: 0 | B2848: =LOG(RC[-1]) -> #NUM!
A2849: 0 | B2849: =LOG(RC[-1]) -> #NUM!
A2850: 0 | B2850: =LOG(RC[-1]) -> #NUM!
A2851: 0 | B2851: =LOG(RC[-1]) -> #NUM!
A2852: 0 | B2852: =LOG(RC[-1]) -> #NUM!
A2853: 0 | B2853: =LOG(RC[-1]) -> #NUM!
A2854: 0 | B2854: =LOG(RC[-1]) -> #NUM!
A2855: 0 | B2855: =LOG(RC[-1]) -> #NUM!
A2856: 0 | B2856: =LOG(RC[-1]) -> #NUM!
A2857: 0 | B2857: =LOG(RC[-1]) -> #NUM!
A2858: 0 | B2858: =LOG(RC[-1]) -> #NUM!
A2859: 0 | B2859: =LOG(RC[-1]) -> #NUM!
A2860: 0 | B2860: =LOG(RC[-1]) -> #NUM!
A2861: 0 | B2861: =LOG(RC[-1]) -> #NUM!
A2862: 0 | B2862: =LOG(RC[-1]) -> #NUM!
A2863: 0 | B2863: =LOG(RC[-1]) -> #NUM!
A2864: 0 | B2864: =LOG(RC[-1]) -> #NUM!
A2865: 0 | B2865: =LOG(RC[-1]) -> #NUM!
A2866: 0 | B2866: =LOG(RC[-1]) -> #NUM!
A2867: 0 | B2867: =LOG(RC[-1]) -> #NUM!
A2868: 0 | B2868: =LOG(RC[-1]) -> #NUM!
A2869: 0 | B2869: =LOG(RC[-1]) -> #NUM!
A2870: 0 | B2870: =LOG(RC[-1]) -> #NUM!
A2871: 0 | B2871: =LOG(RC[-1]) -> #NUM!
A2872: 0 | B2872: =LOG(RC[-1]) -> #NUM!
A2873: 0 | B2873: =LOG(RC[-1]) -> #NUM!
A2874: 0 | B2874: =LOG(RC[-1]) -> #NUM!
A2875: 0 | B2875: =LOG(RC[-1]) -> #NUM!
A2876: 0 | B2876: =LOG(RC[-1]) -> #NUM!
A2877: 0 | B2877: =LOG(RC[-1]) -> #NUM!
A2878: 0 | B2878: =LOG(RC[-1]) -> #NUM!
A2879: 0 | B2879: =LOG(RC[-1]) -> #NUM!
A2880: 0 | B2880: =LOG(RC[-1]) -> #NUM!
A2881: 0 | B2881: =LOG(RC[-1]) -> #NUM!
A2882: 0 | B2882: =LOG(RC[-1]) -> #NUM!
A2883: 0 | B2883: =LOG(RC[-1]) -> #NUM!
A2884: 0 | B2884: =LOG(RC[-1]) -> #NUM!
A2885: 0 | B2885: =LOG(RC[-1]) -> #NUM!
A2886: 0 | B2886: =LOG(RC[-1]) -> #NUM!
A2887: 0 | B2887: =LOG(RC[-1]) -> #NUM!
A2888: 0 | B2888: =LOG(RC[-1]) -> #NUM!
A2889: 0 | B2889: =LOG(RC[-1]) -> #NUM!
A2890: 0 | B2890: =LOG(RC[-1]) -> #NUM!
A2891: 0 | B2891: =LOG(RC[-1]) -> #NUM!
A2892: 0 | B2892: =LOG(RC[-1]) -> #NUM!
A2893: 0 | B2893: =LOG(RC[-1]) -> #NUM!
A2894: 0 | B2894: =LOG(RC[-1]) -> #NUM!
A2895: 0 | B2895: =LOG(RC[-1]) -> #NUM!
A2896: 0 | B2896: =LOG(RC[-1]) -> #NUM!
A2897: 0 | B2897: =LOG(RC[-1]) -> #NUM!
A2898: 0 | B2898: =LOG(RC[-1]) -> #NUM!
A2899: 0 | B2899: =LOG(RC[-1]) -> #NUM!
A2900: 0 | B2900: =LOG(RC[-1]) -> #NUM!
A2901: 0 | B2901: =LOG(RC[-1]) -> #NUM!
A2902: 0 | B2902: =LOG(RC[-1]) -> #NUM!
A2903: 0 | B2903: =LOG(RC[-1]) -> #NUM!
A2904: 0 | B2904: =LOG(RC[-1]) -> #NUM!
A2905: 0 | B2905: =LOG(RC[-1]) -> #NUM!
A2906: 0 | B2906: =LOG(RC[-1]) -> #NUM!
A2907: 0 | B2907: =LOG(RC[-1]) -> #NUM!
A2908: 0 | B2908: =LOG(RC[-1]) -> #NUM!
A2909: 0 | B2909: =LOG(RC[-1]) -> #NUM!
A2910: 0 | B2910: =LOG(RC[-1]) -> #NUM!
A2911: 0 | B2911: =LOG(RC[-1]) -> #NUM!
A2912: 0 | B2912: =LOG(RC[-1]) -> #NUM!
A2913: 0 | B2913: =LOG(RC[-1]) -> #NUM!
A2914: 0 | B2914: =LOG(RC[-1]) -> #NUM!
A2915: 0 | B2915: =LOG(RC[-1]) -> #NUM!
A2916: 0 | B2916: =LOG(RC[-1]) -> #NUM!
A2917: 0 | B2917: =LOG(RC[-1]) -> #NUM!
A2918: 0 | B2918: =LOG(RC[-1]) -> #NUM!
A2919: 0 | B2919: =LOG(RC[-1]) -> #NUM!
A2920: 0 | B2920: =LOG(RC[-1]) -> #NUM!
A2921: 0 | B2921: =LOG(RC[-1]) -> #NUM!
A2922: 0 | B2922: =LOG(RC[-1]) -> #NUM!
A2923: 0 | B2923: =LOG(RC[-1]) -> #NUM!
A2924: 0 | B2924: =LOG(RC[-1]) -> #NUM!
A2925: 0 | B2925: =LOG(RC[-1]) -> #NUM!
A2926: 0 | B2926: =LOG(RC[-1]) -> #NUM!
A2927: 0 | B2927: =LOG(RC[-1]) -> #NUM!
A2928: 0 | B2928: =LOG(RC[-1]) -> #NUM!
A2929: 0 | B2929: =LOG(RC[-1]) -> #NUM!
A2930: 0 | B2930: =LOG(RC[-1]) -> #NUM!
A2931: 0 | B2931: =LOG(RC[-1]) -> #NUM!
A2932: 0 | B2932: =LOG(RC[-1]) -> #NUM!
A2933: 0 | B2933: =LOG(RC[-1]) -> #NUM!
A2934: 0 | B2934: =LOG(RC[-1]) -> #NUM!
A2935: 0 | B2935: =LOG(RC[-1]) -> #NUM!
A2936: 0 | B2936: =LOG(RC[-1]) -> #NUM!
A2937: 0 | B2937: =LOG(RC[-1]) -> #NUM!
A2938: 0 | B2938: =LOG(RC[-1]) -> #NUM!
A2939: 0 | B2939: =LOG(RC[-1]) -> #NUM!
A2940: 0 | B2940: =LOG(RC[-1]) -> #NUM!
A2941: 0 | B2941: =LOG(RC[-1]) -> #NUM!
A2942: 0 | B2942: =LOG(RC[-1]) -> #NUM!
A2943: 0 | B2943: =LOG(RC[-1]) -> #NUM!
A2944: 0 | B2944: =LOG(RC[-1]) -> #NUM!
A2945: 0 | B2945: =LOG(RC[-1]) -> #NUM!
A2946: 0 | B2946: =LOG(RC[-1]) -> #NUM!
A2947: 0 | B2947: =LOG(RC[-1]) -> #NUM!
A2948: 0 | B2948: =LOG(RC[-1]) -> #NUM!
A2949: 0 | B2949: =LOG(RC[-1]) -> #NUM!
A2950: 0 | B2950: =LOG(RC[-1]) -> #NUM!
A2951: 0 | B2951: =LOG(RC[-1]) -> #NUM!
A2952: 0 | B2952: =LOG(RC[-1]) -> #NUM!
A2953: 0 | B2953: =LOG(RC[-1]) -> #NUM!
A2954: 0 | B2954: =LOG(RC[-1]) -> #NUM!
A2955: 0 | B2955: =LOG(RC[-1]) -> #NUM!
A2956: 0 | B2956: =LOG(RC[-1]) -> #NUM!
A2957: 0 | B2957: =LOG(RC[-1]) -> #NUM!
A2958: 0 | B2958: =LOG(RC[-1]) -> #NUM!
A2959: 0 | B2959: =LOG(RC[-1]) -> #NUM!
A2960: 0 | B2960: =LOG(RC[-1]) -> #NUM!
A2961: 0 | B2961: =LOG(RC[-1]) -> #NUM!
A2962: 0 | B2962: =LOG(RC[-1]) -> #NUM!
A2963: 0 | B2963: =LOG(RC[-1]) -> #NUM!
A2964: 0 | B2964: =LOG(RC[-1]) -> #NUM!
A2965: 0 | B2965: =LOG(RC[-1]) -> #NUM!
A2966: 0 | B2966: =LOG(RC[-1]) -> #NUM!
A2967: 0 | B2967: =LOG(RC[-1]) -> #NUM!
A2968: 0 | B2968: =LOG(RC[-1]) -> #NUM!
A2969: 0 | B2969: =LOG(RC[-1]) -> #NUM!
A2970: 0 | B2970: =LOG(RC[-1]) -> #NUM!
A2971: 0 | B2971: =LOG(RC[-1]) -> #NUM!
A2972: 0 | B2972: =LOG(RC[-1]) -> #NUM!
A2973: 0 | B2973: =LOG(RC[-1]) -> #NUM!
A2974: 0 | B2974: =LOG(RC[-1]) -> #NUM!
A2975: 0 | B2975: =LOG(RC[-1]) -> #NUM!
A2976: 0 | B2976: =LOG(RC[-1]) -> #NUM!
A2977: 0 | B2977: =LOG(RC[-1]) -> #NUM!
A2978: 0 | B2978: =LOG(RC[-1]) -> #NUM!
A2979: 0 | B2979: =LOG(RC[-1]) -> #NUM!
A2980: 0 | B2980: =LOG(RC[-1]) -> #NUM!
A2981: 0 | B2981: =LOG(RC[-1]) -> #NUM!
A2982: 0 | B2982: =LOG(RC[-1]) -> #NUM!
A2983: 0 | B2983: =LOG(RC[-1]) -> #NUM!
A2984: 0 | B2984: =LOG(RC[-1]) -> #NUM!
A2985: 0 | B2985: =LOG(RC[-1]) -> #NUM!
A2986: 0 | B2986: =LOG(RC[-1]) -> #NUM!
A2987: 0 | B2987: =LOG(RC[-1]) -> #NUM!
A2988: 0 | B2988: =LOG(RC[-1]) -> #NUM!
A2989: 0 | B2989: =LOG(RC[-1]) -> #NUM!
A2990: 0 | B2990: =LOG(RC[-1]) -> #NUM!
A2991: 0 | B2991: =LOG(RC[-1]) -> #NUM!
A2992: 0 | B2992: =LOG(RC[-1]) -> #NUM!
A2993: 0 | B2993: =LOG(RC[-1]) -> #NUM!
A2994: 0 | B2994: =LOG(RC[-1]) -> #NUM!
A2995: 0 | B2995: =LOG(RC[-1]) -> #NUM!
A2996: 0 | B2996: =LOG(RC[-1]) -> #NUM!
A2997: 0 | B2997: =LOG(RC[-1]) -> #NUM!
A2998: 0 | B2998: =LOG(RC[-1]) -> #NUM!
A2999: 0 | B2999: =LOG(RC[-1]) -> #NUM!
A3000: 0 | B3000: =LOG(RC[-1]) -> #NUM!
A3001: 0 | B3001: =LOG(RC[-1]) -> #NUM!
A3002: 0 | B3002: =LOG(RC[-1]) -> #NUM!
A3003: 0 | B3003: =LOG(RC[-1]) -> #NUM!
A3004: 0 | B3004: =LOG(RC[-1]) -> #NUM!
A3005: 0 | B3005: =LOG(RC[-1]) -> #NUM!
A3006: 0 | B3006: =LOG(RC[-1]) -> #NUM!
A3007: 0 | B3007: =LOG(RC[-1]) -> #NUM!
A3008: 0 | B3008: =LOG(RC[-1]) -> #NUM!
A3009: 0 | B3009: =LOG(RC[-1]) -> #NUM!
A3010: 0 | B3010: =LOG(RC[-1]) -> #NUM!
A3011: 0 | B3011: =LOG(RC[-1]) -> #NUM!
A3012: 0 | B3012: =LOG(RC[-1]) -> #NUM!
A3013: 0 | B3013: =LOG(RC[-1]) -> #NUM!
A3014: 0 | B3014: =LOG(RC[-1]) -> #NUM!
A3015: 0 | B3015: =LOG(RC[-1]) -> #NUM!
A3016: 0 | B3016: =LOG(RC[-1]) -> #NUM!
A3017: 0 | B3017: =LOG(RC[-1]) -> #NUM!
A3018: 0 | B3018: =LOG(RC[-1]) -> #NUM!
A3019: 0 | B3019: =LOG(RC[-1]) -> #NUM!
A3020: 0 | B3020: =LOG(RC[-1]) -> #NUM!
A3021: 0 | B3021: =LOG(RC[-1]) -> #NUM!
A3022: 0 | B3022: =LOG(RC[-1]) -> #NUM!
A3023: 0 | B3023: =LOG(RC[-1]) -> #NUM!
A3024: 0 | B3024: =LOG(RC[-1]) -> #NUM!
A3025: 0 | B3025: =LOG(RC[-1]) -> #NUM!
A3026: 0 | B3026: =LOG(RC[-1]) -> #NUM!
A3027: 0 | B3027: =LOG(RC[-1]) -> #NUM!
A3028: 0 | B3028: =LOG(RC[-1]) -> #NUM!
A3029: 0 | B3029: =LOG(RC[-1]) -> #NUM!
A3030: 0 | B3030: =LOG(RC[-1]) -> #NUM!
A3031: 0 | B3031: =LOG(RC[-1]) -> #NUM!
A3032: 0 | B3032: =LOG(RC[-1]) -> #NUM!
A3033: 0 | B3033: =LOG(RC[-1]) -> #NUM!
A3034: 0 | B3034: =LOG(RC[-1]) -> #NUM!
A3035: 0 | B3035: =LOG(RC[-1]) -> #NUM!
A3036: 0 | B3036: =LOG(RC[-1]) -> #NUM!
A3037: 0 | B3037: =LOG(RC[-1]) -> #NUM!
A3038: 0 | B3038: =LOG(RC[-1]) -> #NUM!
A3039: 0 | B3039: =LOG(RC[-1]) -> #NUM!
A3040: 0 | B3040: =LOG(RC[-1]) -> #NUM!
A3041: 0 | B3041: =LOG(RC[-1]) -> #NUM!
A3042: 0 | B3042: =LOG(RC[-1]) -> #NUM!
A3043: 0 | B3043: =LOG(RC[-1]) -> #NUM!
A3044: 0 | B3044: =LOG(RC[-1]) -> #NUM!
A3045: 0 | B3045: =LOG(RC[-1]) -> #NUM!
A3046: 0 | B3046: =LOG(RC[-1]) -> #NUM!
A3047: 0 | B3047: =LOG(RC[-1]) -> #NUM!
A3048: 0 | B3048: =LOG(RC[-1]) -> #NUM!
A3049: 0 | B3049: =LOG(RC[-1]) -> #NUM!
A3050: 0 | B3050: =LOG(RC[-1]) -> #NUM!
A3051: 0 | B3051: =LOG(RC[-1]) -> #NUM!
A3052: 0 | B3052: =LOG(RC[-1]) -> #NUM!
A3053: 0 | B3053: =LOG(RC[-1]) -> #NUM!
A3054: 0 | B3054: =LOG(RC[-1]) -> #NUM!
A3055: 0 | B3055: =LOG(RC[-1]) -> #NUM!
A3056: 0 | B3056: =LOG(RC[-1]) -> #NUM!
A3057: 0 | B3057: =LOG(RC[-1]) -> #NUM!
A3058: 0 | B3058: =LOG(RC[-1]) -> #NUM!
A3059: 0 | B3059: =LOG(RC[-1]) -> #NUM!
A3060: 0 | B3060: =LOG(RC[-1]) -> #NUM!
A3061: 0 | B3061: =LOG(RC[-1]) -> #NUM!
A3062: 0 | B3062: =LOG(RC[-1]) -> #NUM!
A3063: 0 | B3063: =LOG(RC[-1]) -> #NUM!
A3064: 0 | B3064: =LOG(RC[-1]) -> #NUM!
A3065: 0 | B3065: =LOG(RC[-1]) -> #NUM!
A3066: 0 | B3066: =LOG(RC[-1]) -> #NUM!
A3067: 0 | B3067: =LOG(RC[-1]) -> #NUM!
A3068: 0 | B3068: =LOG(RC[-1]) -> #NUM!
A3069: 0 | B3069: =LOG(RC[-1]) -> #NUM!
A3070: 0 | B3070: =LOG(RC[-1]) -> #NUM!
A3071: 0 | B3071: =LOG(RC[-1]) -> #NUM!
A3072: 0 | B3072: =LOG(RC[-1]) -> #NUM!
A3073: 0 | B3073: =LOG(RC[-1]) -> #NUM!
A3074: 0 | B3074: =LOG(RC[-1]) -> #NUM!
A3075: 0 | B3075: =LOG(RC[-1]) -> #NUM!
A3076: 0 | B3076: =LOG(RC[-1]) -> #NUM!
A3077: 0 | B3077: =LOG(RC[-1]) -> #NUM!
A3078: 0 | B3078: =LOG(RC[-1]) -> #NUM!
A3079: 0 | B3079: =LOG(RC[-1]) -> #NUM!
A3080: 0 | B3080: =LOG(RC[-1]) -> #NUM!
A3081: 0 | B3081: =LOG(RC[-1]) -> #NUM!
A3082: 0 | B3082: =LOG(RC[-1]) -> #NUM!
A3083: 0 | B3083: =LOG(RC[-1]) -> #NUM!
A3084: 0 | B3084: =LOG(RC[-1]) -> #NUM!
A3085: 0 | B3085: =LOG(RC[-1]) -> #NUM!
A3086: 0 | B3086: =LOG(RC[-1]) -> #NUM!
A3087: 0 | B3087: =LOG(RC[-1]) -> #NUM!
A3088: 0 | B3088: =LOG(RC[-1]) -> #NUM!
A3089: 0 | B3089: =LOG(RC[-1]) -> #NUM!
A3090: 0 | B3090: =LOG(RC[-1]) -> #NUM!
A3091: 0 | B3091: =LOG(RC[-1]) -> #NUM!
A3092: 0 | B3092: =LOG(RC[-1]) -> #NUM!
A3093: 0 | B3093: =LOG(RC[-1]) -> #NUM!
A3094: 0 | B3094: =LOG(RC[-1]) -> #NUM!
A3095: 0 | B3095: =LOG(RC[-1]) -> #NUM!
A3096: 0 | B3096: =LOG(RC[-1]) -> #NUM!
A3097: 0 | B3097: =LOG(RC[-1]) -> #NUM!
A3098: 0 | B3098: =LOG(RC[-1]) -> #NUM!
A3099: 0 | B3099: =LOG(RC[-1]) -> #NUM!
A3100: 0 | B3100: =LOG(RC[-1]) -> #NUM!
A3101: 0 | B3101: =LOG(RC[-1]) -> #NUM!
A3102: 0 | B3102: =LOG(RC[-1]) -> #NUM!
A3103: 0 | B3103: =LOG(RC[-1]) -> #NUM!
A3104: 0 | B3104: =LOG(RC[-1]) -> #NUM!
A3105: 0 | B3105: =LOG(RC[-1]) -> #NUM!
A3106: 0 | B3106: =LOG(RC[-1]) -> #NUM!
A3107: 0 | B3107: =LOG(RC[-1]) -> #NUM!
A3108: 0 | B3108: =LOG(RC[-1]) -> #NUM!
A3109: 0 | B3109: =LOG(RC[-1]) -> #NUM!
A3110: 0 | B3110: =LOG(RC[-1]) -> #NUM!
A3111: 0 | B3111: =LOG(RC[-1]) -> #NUM!
A3112: 0 | B3112: =LOG(RC[-1]) -> #NUM!
A3113: 0 | B3113: =LOG(RC[-1]) -> #NUM!
A3114: 0 | B3114: =LOG(RC[-1]) -> #NUM!
A3115: 0 | B3115: =LOG(RC[-1]) -> #NUM!
A3116: 0 | B3116: =LOG(RC[-1]) -> #NUM!
A3117: 0 | B3117: =LOG(RC[-1]) -> #NUM!
A3118: 0 | B3118: =LOG(RC[-1]) -> #NUM!
A3119: 0 | B3119: =LOG(RC[-1]) -> #NUM!
A3120: 0 | B3120: =LOG(RC[-1]) -> #NUM!
A3121: 0 | B3121: =LOG(RC[-1]) -> #NUM!
A3122: 0 | B3122: =LOG(RC[-1]) -> #NUM!
A3123: 0 | B3123: =LOG(RC[-1]) -> #NUM!
A3124: 0 | B3124: =LOG(RC[-1]) -> #NUM!
A3125: 0 | B3125: =LOG(RC[-1]) -> #NUM!
A3126: 0 | B3126: =LOG(RC[-1]) -> #NUM!
A3127: 0 | B3127: =LOG(RC[-1]) -> #NUM!
A3128: 0 | B3128: =LOG(RC[-1]) -> #NUM!
A3129: 0 | B3129: =LOG(RC[-1]) -> #NUM!
A3130: 0 | B3130: =LOG(RC[-1]) -> #NUM!
A3131: 0 | B3131: =LOG(RC[-1]) -> #NUM!
A3132: 0 | B3132: =LOG(RC[-1]) -> #NUM!
A3133: 0 | B3133: =LOG(RC[-1]) -> #NUM!
A3134: 0 | B3134: =LOG(RC[-1]) -> #NUM!
A3135: 0 | B3135: =LOG(RC[-1]) -> #NUM!
A3136: 0 | B3136: =LOG(RC[-1]) -> #NUM!
A3137: 0 | B3137: =LOG(RC[-1]) -> #NUM!
A3138: 0 | B3138: =LOG(RC[-1]) -> #NUM!
A3139: 0 | B3139: =LOG(RC[-1]) -> #NUM!
A3140: 0 | B3140: =LOG(RC[-1]) -> #NUM!
A3141: 0 | B3141: =LOG(RC[-1]) -> #NUM!
A3142: 0 | B3142: =LOG(RC[-1]) -> #NUM!
A3143: 0 | B3143: =LOG(RC[-1]) -> #NUM!
A3144: 0 | B3144: =LOG(RC[-1]) -> #NUM!
A3145: 0 | B3145: =LOG(RC[-1]) -> #NUM!
A3146: 0 | B3146: =LOG(RC[-1]) -> #NUM!
A3147: 0 | B3147: =LOG(RC[-1]) -> #NUM!
A3148: 0 | B3148: =LOG(RC[-1]) -> #NUM!
A3149: 0 | B3149: =LOG(RC[-1]) -> #NUM!
A3150: 0 | B3150: =LOG(RC[-1]) -> #NUM!
A3151: 0 | B3151: =LOG(RC[-1]) -> #NUM!
A3152: 0 | B3152: =LOG(RC[-1]) -> #NUM!
A3153: 0 | B3153: =LOG(RC[-1]) -> #NUM!
A3154: 0 | B3154: =LOG(RC[-1]) -> #NUM!
A3155: 0 | B3155: =LOG(RC[-1]) -> #NUM!
A3156: 0 | B3156: =LOG(RC[-1]) -> #NUM!
A3157: 0 | B3157: =LOG(RC[-1]) -> #NUM!
A3158: 0 | B3158: =LOG(RC[-1]) -> #NUM!
A3159: 0 | B3159: =LOG(RC[-1]) -> #NUM!
A3160: 0 | B3160: =LOG(RC[-1]) -> #NUM!
A3161: 0 | B3161: =LOG(RC[-1]) -> #NUM!
A3162: 0 | B3162: =LOG(RC[-1]) -> #NUM!
A3163: 0 | B3163: =LOG(RC[-1]) -> #NUM!
A3164: 0 | B3164: =LOG(RC[-1]) -> #NUM!
A3165: 0 | B3165: =LOG(RC[-1]) -> #NUM!
A3166: 0 | B3166: =LOG(RC[-1]) -> #NUM!
A3167: 0 | B3167: =LOG(RC[-1]) -> #NUM!
A3168: 0 | B3168: =LOG(RC[-1]) -> #NUM!
A3169: 0 | B3169: =LOG(RC[-1]) -> #NUM!
A3170: 0 | B3170: =LOG(RC[-1]) -> #NUM!
A3171: 0 | B3171: =LOG(RC[-1]) -> #NUM!
A3172: 0 | B3172: =LOG(RC[-1]) -> #NUM!
A3173: 0 | B3173: =LOG(RC[-1]) -> #NUM!
A3174: 0 | B3174: =LOG(RC[-1]) -> #NUM!
A3175: 0 | B3175: =LOG(RC[-1]) -> #NUM!
A3176: 0 | B3176: =LOG(RC[-1]) -> #NUM!
A3177: 0 | B3177: =LOG(RC[-1]) -> #NUM!
A3178: 0 | B3178: =LOG(RC[-1]) -> #NUM!
A3179: 0 | B3179: =LOG(RC[-1]) -> #NUM!
A3180: 0 | B3180: =LOG(RC[-1]) -> #NUM!
A3181: 0 | B3181: =LOG(RC[-1]) -> #NUM!
A3182: 0 | B3182: =LOG(RC[-1]) -> #NUM!
A3183: 0 | B3183: =LOG(RC[-1]) -> #NUM!
A3184: 0 | B3184: =LOG(RC[-1]) -> #NUM!
A3185: 0 | B3185: =LOG(RC[-1]) -> #NUM!
A3186: 0 | B3186: =LOG(RC[-1]) -> #NUM!
A3187: 0 | B3187: =LOG(RC[-1]) -> #NUM!
A3188: 0 | B3188: =LOG(RC[-1]) -> #NUM!
A3189: 0 | B3189: =LOG(RC[-1]) -> #NUM!
A3190: 0 | B3190: =LOG(RC[-1]) -> #NUM!
A3191: 0 | B3191: =LOG(RC[-1]) -> #NUM!
A3192: 0 | B3192: =LOG(RC[-1]) -> #NUM!
A3193: 0 | B3193: =LOG(RC[-1]) -> #NUM!
A3194: 0 | B3194: =LOG(RC[-1]) -> #NUM!
A3195: 0 | B3195: =LOG(RC[-1]) -> #NUM!
A3196: 0 | B3196: =LOG(RC[-1]) -> #NUM!
A3197: 0 | B3197: =LOG(RC[-1]) -> #NUM!
A3198: 0 | B3198: =LOG(RC[-1]) -> #NUM!
A3199: 0 | B3199: =LOG(RC[-1]) -> #NUM!
A3200: 0 | B3200: =LOG(RC[-1]) -> #NUM!
A3201: 0 | B3201: =LOG(RC[-1]) -> #NUM!
A3202: 0 | B3202: =LOG(RC[-1]) -> #NUM!
A3203: 0 | B3203: =LOG(RC[-1]) -> #NUM!
A3204: 0 | B3204: =LOG(RC[-1]) -> #NUM!
A3205: 0 | B3205: =LOG(RC[-1]) -> #NUM!
A3206: 0 | B3206: =LOG(RC[-1]) -> #NUM!
A3207: 0 | B3207: =LOG(RC[-1]) -> #NUM!
A3208: 0 | B3208: =LOG(RC[-1]) -> #NUM!
A3209: 0 | B3209: =LOG(RC[-1]) -> #NUM!
A3210: 0 | B3210: =LOG(RC[-1]) -> #NUM!
A3211: 0 | B3211: =LOG(RC[-1]) -> #NUM!
A3212: 0 | B3212: =LOG(RC[-1]) -> #NUM!
A3213: 0 | B3213: =LOG(RC[-1]) -> #NUM!
A3214: 0 | B3214: =LOG(RC[-1]) -> #NUM!
A3215: 0 | B3215: =LOG(RC[-1]) -> #NUM!
A3216: 0 | B3216: =LOG(RC[-1]) -> #NUM!
A3217: 0 | B3217: =LOG(RC[-1]) -> #NUM!
A3218: 0 | B3218: =LOG(RC[-1]) -> #NUM!
A3219: 0 | B3219: =LOG(RC[-1]) -> #NUM!
A3220: 0 | B3220: =LOG(RC[-1]) -> #NUM!
A3221: 0 | B3221: =LOG(RC[-1]) -> #NUM!
A3222: 0 | B3222: =LOG(RC[-1]) -> #NUM!
A3223: 0 | B3223: =LOG(RC[-1]) -> #NUM!
A3224: 0 | B3224: =LOG(RC[-1]) -> #NUM!
A3225: 0 | B3225: =LOG(RC[-1]) -> #NUM!
A3226: 0 | B3226: =LOG(RC[-1]) -> #NUM!
A3227: 0 | B3227: =LOG(RC[-1]) -> #NUM!
A3228: 0 | B3228: =LOG(RC[-1]) -> #NUM!
A3229: 0 | B3229: =LOG(RC[-1]) -> #NUM!
A3230: 0 | B3230: =LOG(RC[-1]) -> #NUM!
A3231: 0 | B3231: =LOG(RC[-1]) -> #NUM!
A3232: 0 | B3232: =LOG(RC[-1]) -> #NUM!
A3233: 0 | B3233: =LOG(RC[-1]) -> #NUM!
A3234: 0 | B3234: =LOG(RC[-1]) -> #NUM!
A3235: 0 | B3235: =LOG(RC[-1]) -> #NUM!
A3236: 0 | B3236: =LOG(RC[-1]) -> #NUM!
A3237: 0 | B3237: =LOG(RC[-1]) -> #NUM!
A3238: 0 | B3238: =LOG(RC[-1]) -> #NUM!
A3239: 0 | B3239: =LOG(RC[-1]) -> #NUM!
A3240: 0 | B3240: =LOG(RC[-1]) -> #NUM!
A3241: 0 | B3241: =LOG(RC[-1]) -> #NUM!
A3242: 0 | B3242: =LOG(RC[-1]) -> #NUM!
A3243: 0 | B3243: =LOG(RC[-1]) -> #NUM!
A3244: 0 | B3244: =LOG(RC[-1]) -> #NUM!
A3245: 0 | B3245: =LOG(RC[-1]) -> #NUM!
A3246: 0 | B3246: =LOG(RC[-1]) -> #NUM!
A3247: 0 | B3247: =LOG(RC[-1]) -> #NUM!
A3248: 0 | B3248: =LOG(RC[-1]) -> #NUM!
A3249: 0 | B3249: =LOG(RC[-1]) -> #NUM!
A3250: 0 | B3250: =LOG(RC[-1]) -> #NUM!
A3251: 0 | B3251: =LOG(RC[-1]) -> #NUM!
A3252: 0 | B3252: =LOG(RC[-1]) -> #NUM!
A3253: 0 | B3253: =LOG(RC[-1]) -> #NUM!
A3254: 0 | B3254: =LOG(RC[-1]) -> #NUM!
A3255: 0 | B3255: =LOG(RC[-1]) -> #NUM!
A3256: 0 | B3256: =LOG(RC[-1]) -> #NUM!
A3257: 0 | B3257: =LOG(RC[-1]) -> #NUM!
A3258: 0 | B3258: =LOG(RC[-1]) -> #NUM!
A3259: 0 | B3259: =LOG(RC[-1]) -> #NUM!
A3260: 0 | B3260: =LOG(RC[-1]) -> #NUM!
A3261: 0 | B3261: =LOG(RC[-1]) -> #NUM!
A3262: 0 | B3262: =LOG(RC[-1]) -> #NUM!
A3263: 0 | B3263: =LOG(RC[-1]) -> #NUM!
A3264: 0 | B3264: =LOG(RC[-1]) -> #NUM!
A3265: 0 | B3265: =LOG(RC[-1]) -> #NUM!
A3266: 0 | B3266: =LOG(RC[-1]) -> #NUM!
A3267: 0 | B3267: =LOG(RC[-1]) -> #NUM!
A3268: 0 | B3268: =LOG(RC[-1]) -> #NUM!
A3269: 0 | B3269: =LOG(RC[-1]) -> #NUM!
A3270: 0 | B3270: =LOG(RC[-1]) -> #NUM!
A3271: 0 | B3271: =LOG(RC[-1]) -> #NUM!
A3272: 0 | B3272: =LOG(RC[-1]) -> #NUM!
A3273: 0 | B3273: =LOG(RC[-1]) -> #NUM!
A3274: 0 | B3274: =LOG(RC[-1]) -> #NUM!
A3275: 0 | B3275: =LOG(RC[-1]) -> #NUM!
A3276: 0 | B3276: =LOG(RC[-1]) -> #NUM!
A3277: 0 | B3277: =LOG(RC[-1]) -> #NUM!
A3278: 0 | B3278: =LOG(RC[-1]) -> #NUM!
A3279: 0 | B3279: =LOG(RC[-1]) -> #NUM!
A3280: 0 | B3280: =LOG(RC[-1]) -> #NUM!
A3281: 0 | B3281: =LOG(RC[-1]) -> #NUM!
A3282: 0 | B3282: =LOG(RC[-1]) -> #NUM!
A3283: 0 | B3283: =LOG(RC[-1]) -> #NUM!
A3284: 0 | B3284: =LOG(RC[-1]) -> #NUM!
A3285: 0 | B3285: =LOG(RC[-1]) -> #NUM!
A3286: 0 | B3286: =LOG(RC[-1]) -> #NUM!
A3287: 0 | B3287: =LOG(RC[-1]) -> #NUM!
A3288: 0 | B3288: =LOG(RC[-1]) -> #NUM!
A3289: 0 | B3289: =LOG(RC[-1]) -> #NUM!
A3290: 0 | B3290: =LOG(RC[-1]) -> #NUM!
A3291: 0 | B3291: =LOG(RC[-1]) -> #NUM!
A3292: 0 | B3292: =LOG(RC[-1]) -> #NUM!
A3293: 0 | B3293: =LOG(RC[-1]) -> #NUM!
A3294: 0 | B3294: =LOG(RC[-1]) -> #NUM!
A3295: 0 | B3295: =LOG(RC[-1]) -> #NUM!
A3296: 0 | B3296: =LOG(RC[-1]) -> #NUM!
A3297: 0 | B3297: =LOG(RC[-1]) -> #NUM!
A3298: 0 | B3298: =LOG(RC[-1]) -> #NUM!
A3299: 0 | B3299: =LOG(RC[-1]) -> #NUM!
A3300: 0 | B3300: =LOG(RC[-1]) -> #NUM!
A3301: 0 | B3301: =LOG(RC[-1]) -> #NUM!
A3302: 0 | B3302: =LOG(RC[-1]) -> #NUM!
A3303: 0 | B3303: =LOG(RC[-1]) -> #NUM!
A3304: 0 | B3304: =LOG(RC[-1]) -> #NUM!
A3305: 0 | B3305: =LOG(RC[-1]) -> #NUM!
A3306: 0 | B3306: =LOG(RC[-1]) -> #NUM!
A3307: 0 | B3307: =LOG(RC[-1]) -> #NUM!
A3308: 0 | B3308: =LOG(RC[-1]) -> #NUM!
A3309: 0 | B3309: =LOG(RC[-1]) -> #NUM!
A3310: 0 | B3310: =LOG(RC[-1]) -> #NUM!
A3311: 0 | B3311: =LOG(RC[-1]) -> #NUM!
A3312: 0 | B3312: =LOG(RC[-1]) -> #NUM!
A3313: 0 | B3313: =LOG(RC[-1]) -> #NUM!
A3314: 0 | B3314: =LOG(RC[-1]) -> #NUM!
A3315: 0 | B3315: =LOG(RC[-1]) -> #NUM!
A3316: 0 | B3316: =LOG(RC[-1]) -> #NUM!
A3317: 0 | B3317: =LOG(RC[-1]) -> #NUM!
A3318: 0 | B3318: =LOG(RC[-1]) -> #NUM!
A3319: 0 | B3319: =LOG(RC[-1]) -> #NUM!
A3320: 0 | B3320: =LOG(RC[-1]) -> #NUM!
A3321: 0 | B3321: =LOG(RC[-1]) -> #NUM!
A3322: 0 | B3322: =LOG(RC[-1]) -> #NUM!
A3323: 0 | B3323: =LOG(RC[-1]) -> #NUM!
A3324: 0 | B3324: =LOG(RC[-1]) -> #NUM!
A3325: 0 | B3325: =LOG(RC[-1]) -> #NUM!
A3326: 0 | B3326: =LOG(RC[-1]) -> #NUM!
A3327: 0 | B3327: =LOG(RC[-1]) -> #NUM!
A3328: 0 | B3328: =LOG(RC[-1]) -> #NUM!
A3329: 0 | B3329: =LOG(RC[-1]) -> #NUM!
A3330: 0 | B3330: =LOG(RC[-1]) -> #NUM!
A3331: 0 | B3331: =LOG(RC[-1]) -> #NUM!
A3332: 0 | B3332: =LOG(RC[-1]) -> #NUM!
A3333: 0 | B3333: =LOG(RC[-1]) -> #NUM!
A3334: 0 | B3334: =LOG(RC[-1]) -> #NUM!
A3335: 0 | B3335: =LOG(RC[-1]) -> #NUM!
A3336: 0 | B3336: =LOG(RC[-1]) -> #NUM!
A3337: 0 | B3337: =LOG(RC[-1]) -> #NUM!
A3338: 0 | B3338: =LOG(RC[-1]) -> #NUM!
A3339: 0 | B3339: =LOG(RC[-1]) -> #NUM!
A3340: 0 | B3340: =LOG(RC[-1]) -> #NUM!
A3341: 0 | B3341: =LOG(RC[-1]) -> #NUM!
A3342: 0 | B3342: =LOG(RC[-1]) -> #NUM!
A3343: 0 | B3343: =LOG(RC[-1]) -> #NUM!
A3344: 0 | B3344: =LOG(RC[-1]) -> #NUM!
A3345: 0 | B3345: =LOG(RC[-1]) -> #NUM!
A3346: 0 | B3346: =LOG(RC[-1]) -> #NUM!
A3347: 0 | B3347: =LOG(RC[-1]) -> #NUM!
A3348: 0 | B3348: =LOG(RC[-1]) -> #NUM!
A3349: 0 | B3349: =LOG(RC[-1]) -> #NUM!
A3350: 0 | B3350: =LOG(RC[-1]) -> #NUM!
A3351: 0 | B3351: =LOG(RC[-1]) -> #NUM!
A3352: 0 | B3352: =LOG(RC[-1]) -> #NUM!
A3353: 0 | B3353: =LOG(RC[-1]) -> #NUM!
A3354: 0 | B3354: =LOG(RC[-1]) -> #NUM!
A3355: 0 | B3355: =LOG(RC[-1]) -> #NUM!
A3356: 0 | B3356: =LOG(RC[-1]) -> #NUM!
A3357: 0 | B3357: =LOG(RC[-1]) -> #NUM!
A3358: 0 | B3358: =LOG(RC[-1]) -> #NUM!
A3359: 0 | B3359: =LOG(RC[-1]) -> #NUM!
A3360: 0 | B3360: =LOG(RC[-1]) -> #NUM!
A3361: 0 | B3361: =LOG(RC[-1]) -> #NUM!
A3362: 0 | B3362: =LOG(RC[-1]) -> #NUM!
A3363: 0 | B3363: =LOG(RC[-1]) -> #NUM!
A3364: 0 | B3364: =LOG(RC[-1]) -> #NUM!
A3365: 0 | B3365: =LOG(RC[-1]) -> #NUM!
A3366: 0 | B3366: =LOG(RC[-1]) -> #NUM!
A3367: 0 | B3367: =LOG(RC[-1]) -> #NUM!
A3368: 0 | B3368: =LOG(RC[-1]) -> #NUM!
A3369: 0 | B3369: =LOG(RC[-1]) -> #NUM!
A3370: 0 | B3370: =LOG(RC[-1]) -> #NUM!
A3371: 0 | B3371: =LOG(RC[-1]) -> #NUM!
A3372: 0 | B3372: =LOG(RC[-1]) -> #NUM!
A3373: 0 | B3373: =LOG(RC[-1]) -> #NUM!
A3374: 0 | B3374: =LOG(RC[-1]) -> #NUM!
A3375: 0 | B3375: =LOG(RC[-1]) -> #NUM!
A3376: 0 | B3376: =LOG(RC[-1]) -> #NUM!
A3377: 0 | B3377: =LOG(RC[-1]) -> #NUM!
A3378: 0 | B3378: =LOG(RC[-1]) -> #NUM!
A3379: 0 | B3379: =LOG(RC[-1]) -> #NUM!
A3380: 0 | B3380: =LOG(RC[-1]) -> #NUM!
A3381: 0 | B3381: =LOG(RC[-1]) -> #NUM!
A3382: 0 | B3382: =LOG(RC[-1]) -> #NUM!
A3383: 0 | B3383: =LOG(RC[-1]) -> #NUM!
A3384: 0 | B3384: =LOG(RC[-1]) -> #NUM!
A3385: 0 | B3385: =LOG(RC[-1]) -> #NUM!
A3386: 0 | B3386: =LOG(RC[-1]) -> #NUM!
A3387: 0 | B3387: =LOG(RC[-1]) -> #NUM!
A3388: 0 | B3388: =LOG(RC[-1]) -> #NUM!
A3389: 0 | B3389: =LOG(RC[-1]) -> #NUM!
A3390: 0 | B3390: =LOG(RC[-1]) -> #NUM!
A3391: 0 | B3391: =LOG(RC[-1]) -> #NUM!
A3392: 0 | B3392: =LOG(RC[-1]) -> #NUM!
A3393: 0 | B3393: =LOG(RC[-1]) -> #NUM!
A3394: 0 | B3394: =LOG(RC[-1]) -> #NUM!
A3395: 0 | B3395: =LOG(RC[-1]) -> #NUM!
A3396: 0 | B3396: =LOG(RC[-1]) -> #NUM!
A3397: 0 | B3397: =LOG(RC[-1]) -> #NUM!
A3398: 0 | B3398: =LOG(RC[-1]) -> #NUM!
A3399: 0 | B3399: =LOG(RC[-1]) -> #NUM!
A3400: 0 | B3400: =LOG(RC[-1]) -> #NUM!
A3401: 0 | B3401: =LOG(RC[-1]) -> #NUM!
A3402: 0 | B3402: =LOG(RC[-1]) -> #NUM!
A3403: 0 | B3403: =LOG(RC[-1]) -> #NUM!
A3404: 0 | B3404: =LOG(RC[-1]) -> #NUM!
A3405: 0 | B3405: =LOG(RC[-1]) -> #NUM!
A3406: 0 | B3406: =LOG(RC[-1]) -> #NUM!
A3407: 0 | B3407: =LOG(RC[-1]) -> #NUM!
A3408: 0 | B3408: =LOG(RC[-1]) -> #NUM!
A3409: 0 | B3409: =LOG(RC[-1]) -> #NUM!
A3410: 0 | B3410: =LOG(RC[-1]) -> #NUM!
A3411: 0 | B3411: =LOG(RC[-1]) -> #NUM!
A3412: 0 | B3412: =LOG(RC[-1]) -> #NUM!
A3413: 0 | B3413: =LOG(RC[-1]) -> #NUM!
A3414: 0 | B3414: =LOG(RC[-1]) -> #NUM!
A3415: 0 | B3415: =LOG(RC[-1]) -> #NUM!
A3416: 0 | B3416: =LOG(RC[-1]) -> #NUM!
A3417: 0 | B3417: =LOG(RC[-1]) -> #NUM!
A3418: 0 | B3418: =LOG(RC[-1]) -> #NUM!
A3419: 0 | B3419: =LOG(RC[-1]) -> #NUM!
A3420: 0 | B3420: =LOG(RC[-1]) -> #NUM!
A3421: 0 | B3421: =LOG(RC[-1]) -> #NUM!
A3422: 0 | B3422: =LOG(RC[-1]) -> #NUM!
A3423: 0 | B3423: =LOG(RC[-1]) -> #NUM!
A3424: 0 | B3424: =LOG(RC[-1]) -> #NUM!
A3425: 0 | B3425: =LOG(RC[-1]) -> #NUM!
A3426: 0 | B3426: =LOG(RC[-1]) -> #NUM!
A3427: 0 | B3427: =LOG(RC[-1]) -> #NUM!
A3428: 0 | B3428: =LOG(RC[-1]) -> #NUM!
A3429: 0 | B3429: =LOG(RC[-1]) -> #NUM!
A3430: 0 | B3430: =LOG(RC[-1]) -> #NUM!
A3431: 0 | B3431: =LOG(RC[-1]) -> #NUM!
A3432: 0 | B3432: =LOG(RC[-1]) -> #NUM!
A3433: 0 | B3433: =LOG(RC[-1]) -> #NUM!
A3434: 0 | B3434: =LOG(RC[-1]) -> #NUM!
A3435: 0 | B3435: =LOG(RC[-1]) -> #NUM!
A3436: 0 | B3436: =LOG(RC[-1]) -> #NUM!
A3437: 0 | B3437: =LOG(RC[-1]) -> #NUM!
A3438: 0 | B3438: =LOG(RC[-1]) -> #NUM!
A3439: 0 | B3439: =LOG(RC[-1]) -> #NUM!
A3440: 0 | B3440: =LOG(RC[-1]) -> #NUM!
A3441: 0 | B3441: =LOG(RC[-1]) -> #NUM!
A3442: 0 | B3442: =LOG(RC[-1]) -> #NUM!
A3443: 0 | B3443: =LOG(RC[-1]) -> #NUM!
A3444: 0 | B3444: =LOG(RC[-1]) -> #NUM!
A3445: 0 | B3445: =LOG(RC[-1]) -> #NUM!
A3446: 0 | B3446: =LOG(RC[-1]) -> #NUM!
A3447: 0 | B3447: =LOG(RC[-1]) -> #NUM!
A3448: 0 | B3448: =LOG(RC[-1]) -> #NUM!
A3449: 0 | B3449: =LOG(RC[-1]) -> #NUM!
A3450: 0 | B3450: =LOG(RC[-1]) -> #NUM!
A3451: 0 | B3451: =LOG(RC[-1]) -> #NUM!
A3452: 0 | B3452: =LOG(RC[-1]) -> #NUM!
A3453: 0 | B3453: =LOG(RC[-1]) -> #NUM!
A3454: 0 | B3454: =LOG(RC[-1]) -> #NUM!
A3455: 0 | B3455: =LOG(RC[-1]) -> #NUM!
A3456: 0 | B3456: =LOG(RC[-1]) -> #NUM!
A3457: 0 | B3457: =LOG(RC[-1]) -> #NUM!
A3458: 0 | B3458: =LOG(RC[-1]) -> #NUM!
A3459: 0 | B3459: =LOG(RC[-1]) -> #NUM!
A3460: 0 | B3460: =LOG(RC[-1]) -> #NUM!
A3461: 0 | B3461: =LOG(RC[-1]) -> #NUM!
A3462: 0 | B3462: =LOG(RC[-1]) -> #NUM!
A3463: 0 | B3463: =LOG(RC[-1]) -> #NUM!
A3464: 0 | B3464: =LOG(RC[-1]) -> #NUM!
A3465: 0 | B3465: =LOG(RC[-1]) -> #NUM!
A3466: 0 | B3466: =LOG(RC[-1]) -> #NUM!
A3467: 0 | B3467: =LOG(RC[-1]) -> #NUM!
A3468: 0 | B3468: =LOG(RC[-1]) -> #NUM!
A3469: 0 | B3469: =LOG(RC[-1]) -> #NUM!
A3470: 0 | B3470: =LOG(RC[-1]) -> #NUM!
A3471: 0 | B3471: =LOG(RC[-1]) -> #NUM!
A3472: 0 | B3472: =LOG(RC[-1]) -> #NUM!
A3473: 0 | B3473: =LOG(RC[-1]) -> #NUM!
A3474: 0 | B3474: =LOG(RC[-1]) -> #NUM!
A3475: 0 | B3475: =LOG(RC[-1]) -> #NUM!
A3476: 0 | B3476: =LOG(RC[-1]) -> #NUM!
A3477: 0 | B3477: =LOG(RC[-1]) -> #NUM!
A3478: 0 | B3478: =LOG(RC[-1]) -> #NUM!
A3479: 0 | B3479: =LOG(RC[-1]) -> #NUM!
A3480: 0 | B3480: =LOG(RC[-1]) -> #NUM!
A3481: 0 | B3481: =LOG(RC[-1]) -> #NUM!
A3482: 0 | B3482: =LOG(RC[-1]) -> #NUM!
A3483: 0 | B3483: =LOG(RC[-1]) -> #NUM!
A3484: 0 | B3484: =LOG(RC[-1]) -> #NUM!
A3485: 0 | B3485: =LOG(RC[-1]) -> #NUM!
A3486: 0 | B3486: =LOG(RC[-1]) -> #NUM!
A3487: 0 | B3487: =LOG(RC[-1]) -> #NUM!
A3488: 0 | B3488: =LOG(RC[-1]) -> #NUM!
A3489: 0 | B3489: =LOG(RC[-1]) -> #NUM!
A3490: 0 | B3490: =LOG(RC[-1]) -> #NUM!
A3491: 0 | B3491: =LOG(RC[-1]) -> #NUM!
A3492: 0 | B3492: =LOG(RC[-1]) -> #NUM!
A3493: 0 | B3493: =LOG(RC[-1]) -> #NUM!
A3494: 0 | B3494: =LOG(RC[-1]) -> #NUM!
A3495: 0 | B3495: =LOG(RC[-1]) -> #NUM!
A3496: 0 | B3496: =LOG(RC[-1]) -> #NUM!
A3497: 0 | B3497: =LOG(RC[-1]) -> #NUM!
A3498: 0 | B3498: =LOG(RC[-1]) -> #NUM!
A3499: 0 | B3499: =LOG(RC[-1]) -> #NUM!
A3500: 0 | B3500: =LOG(RC[-1]) -> #NUM!
A3501: 0 | B3501: =LOG(RC[-1]) -> #NUM!
A3502: 0 | B3502: =LOG(RC[-1]) -> #NUM!
A3503: 0 | B3503: =LOG(RC[-1]) -> #NUM!
A3504: 0 | B3504: =LOG(RC[-1]) -> #NUM!
A3505: 0 | B3505: =LOG(RC[-1]) -> #NUM!
A3506: 0 | B3506: =LOG(RC[-1]) -> #NUM!
A3507: 0 | B3507: =LOG(RC[-1]) -> #NUM!
A3508: 0 | B3508: =LOG(RC[-1]) -> #NUM!
A3509: 0 | B3509: =LOG(RC[-1]) -> #NUM!
A3510: 0 | B3510: =LOG(RC[-1]) -> #NUM!
A3511: 0 | B3511: =LOG(RC[-1]) -> #NUM!
A3512: 0 | B3512: =LOG(RC[-1]) -> #NUM!
A3513: 0 | B3513: =LOG(RC[-1]) -> #NUM!
A3514: 0 | B3514: =LOG(RC[-1]) -> #NUM!
A3515: 0 | B3515: =LOG(RC[-1]) -> #NUM!
A3516: 0 | B3516: =LOG(RC[-1]) -> #NUM!
A3517: 0 | B3517: =LOG(RC[-1]) -> #NUM!
A3518: 0 | B3518: =LOG(RC[-1]) -> #NUM!
A3519: 0 | B3519: =LOG(RC[-1]) -> #NUM!
A3520: 0 | B3520: =LOG(RC[-1]) -> #NUM!
A3521: 0 | B3521: =LOG(RC[-1]) -> #NUM!
A3522: 0 | B3522: =LOG(RC[-1]) -> #NUM!
A3523: 0 | B3523: =LOG(RC[-1]) -> #NUM!
A3524: 0 | B3524: =LOG(RC[-1]) -> #NUM!
A3525: 0 | B3525: =LOG(RC[-1]) -> #NUM!
A3526: 0 | B3526: =LOG(RC[-1]) -> #NUM!
A3527: 0 | B3527: =LOG(RC[-1]) -> #NUM!
A3528: 0 | B3528: =LOG(RC[-1]) -> #NUM!
A3529: 0 | B3529: =LOG(RC[-1]) -> #NUM!
A3530: 0 | B3530: =LOG(RC[-1]) -> #NUM!
A3531: 0 | B3531: =LOG(RC[-1]) -> #NUM!
A3532: 0 | B3532: =LOG(RC[-1]) -> #NUM!
A3533: 0 | B3533: =LOG(RC[-1]) -> #NUM!
A3534: 0 | B3534: =LOG(RC[-1]) -> #NUM!
A3535: 0 | B3535: =LOG(RC[-1]) -> #NUM!
A3536: 0 | B3536: =LOG(RC[-1]) -> #NUM!
A3537: 0 | B3537: =LOG(RC[-1]) -> #NUM!
A3538: 0 | B3538: =LOG(RC[-1]) -> #NUM!
A3539: 0 | B3539: =LOG(RC[-1]) -> #NUM!
A3540: 0 | B3540: =LOG(RC[-1]) -> #NUM!
A3541: 0 | B3541: =LOG(RC[-1]) -> #NUM!
A3542: 0 | B3542: =LOG(RC[-1]) -> #NUM!
A3543: 0 | B3543: =LOG(RC[-1]) -> #NUM!
A3544: 0 | B3544: =LOG(RC[-1]) -> #NUM!
A3545: 0 | B3545: =LOG(RC[-1]) -> #NUM!
A3546: 0 | B3546: =LOG(RC[-1]) -> #NUM!
A3547: 0 | B3547: =LOG(RC[-1]) -> #NUM!
A3548: 0 | B3548: =LOG(RC[-1]) -> #NUM!
A3549: 0 | B3549: =LOG(RC[-1]) -> #NUM!
A3550: 0 | B3550: =LOG(RC[-1]) -> #NUM!
A3551: 0 | B3551: =LOG(RC[-1]) -> #NUM!
A3552: 0 | B3552: =LOG(RC[-1]) -> #NUM!
A3553: 0 | B3553: =LOG(RC[-1]) -> #NUM!
A3554: 0 | B3554: =LOG(RC[-1]) -> #NUM!
A3555: 0 | B3555: =LOG(RC[-1]) -> #NUM!
A3556: 0 | B3556: =LOG(RC[-1]) -> #NUM!
A3557: 0 | B3557: =LOG(RC[-1]) -> #NUM!
A3558: 0 | B3558: =LOG(RC[-1]) -> #NUM!
A3559: 0 | B3559: =LOG(RC[-1]) -> #NUM!
A3560: 0 | B3560: =LOG(RC[-1]) -> #NUM!
A3561: 0 | B3561: =LOG(RC[-1]) -> #NUM!
A3562: 0 | B3562: =LOG(RC[-1]) -> #NUM!
A3563: 0 | B3563: =LOG(RC[-1]) -> #NUM!
A3564: 0 | B3564: =LOG(RC[-1]) -> #NUM!
A3565: 0 | B3565: =LOG(RC[-1]) -> #NUM!
A3566: 0 | B3566: =LOG(RC[-1]) -> #NUM!
A3567: 0 | B3567: =LOG(RC[-1]) -> #NUM!
A3568: 0 | B3568: =LOG(RC[-1]) -> #NUM!
A3569: 0 | B3569: =LOG(RC[-1]) -> #NUM!
A3570: 0 | B3570: =LOG(RC[-1]) -> #NUM!
A3571: 0 | B3571: =LOG(RC[-1]) -> #NUM!
A3572: 0 | B3572: =LOG(RC[-1]) -> #NUM!
A3573: 0 | B3573: =LOG(RC[-1]) -> #NUM!
A3574: 0 | B3574: =LOG(RC[-1]) -> #NUM!
A3575: 0 | B3575: =LOG(RC[-1]) -> #NUM!
A3576: 0 | B3576: =LOG(RC[-1]) -> #NUM!
A3577: 0 | B3577: =LOG(RC[-1]) -> #NUM!
A3578: 0 | B3578: =LOG(RC[-1]) -> #NUM!
A3579: 0 | B3579: =LOG(RC[-1]) -> #NUM!
A3580: 0 | B3580: =LOG(RC[-1]) -> #NUM!
A3581: 0 | B3581: =LOG(RC[-1]) -> #NUM!
A3582: 0 | B3582: =LOG(RC[-1]) -> #NUM!
A3583: 0 | B3583: =LOG(RC[-1]) -> #NUM!
A3584: 0 | B3584: =LOG(RC[-1]) -> #NUM!
A3585: 0 | B3585: =LOG(RC[-1]) -> #NUM!
A3586: 0 | B3586: =LOG(RC[-1]) -> #NUM!
A3587: 0 | B3587: =LOG(RC[-1]) -> #NUM!
A3588: 0 | B3588: =LOG(RC[-1]) -> #NUM!
A3589: 0 | B3589: =LOG(RC[-1]) -> #NUM!
A3590: 0 | B3590: =LOG(RC[-1]) -> #NUM!
A3591: 0 | B3591: =LOG(RC[-1]) -> #NUM!
A3592: 0 | B3592: =LOG(RC[-1]) -> #NUM!
A3593: 0 | B3593: =LOG(RC[-1]) -> #NUM!
A3594: 0 | B3594: =LOG(RC[-1]) -> #NUM!
A3595: 0 | B3595: =LOG(RC[-1]) -> #NUM!
A3596: 0 | B3596: =LOG(RC[-1]) -> #NUM!
A3597: 0 | B3597: =LOG(RC[-1]) -> #NUM!
A3598: 0 | B3598: =LOG(RC[-1]) -> #NUM!
A3599: 0 | B3599: =LOG(RC[-1]) -> #NUM!
A3600: 0 | B3600: =LOG(RC[-1]) -> #NUM!
A3601: 0 | B3601: =LOG(RC[-1]) -> #NUM!
A3602: 0 | B3602: =LOG(RC[-1]) -> #NUM!
A3603: 0 | B3603: =LOG(RC[-1]) -> #NUM!
A3604: 0 | B3604: =LOG(RC[-1]) -> #NUM!
A3605: 0 | B3605: =LOG(RC[-1]) -> #NUM!
A3606: 0 | B3606: =LOG(RC[-1]) -> #NUM!
A3607: 0 | B3607: =LOG(RC[-1]) -> #NUM!
A3608: 0 | B3608: =LOG(RC[-1]) -> #NUM!
A3609: 0 | B3609: =LOG(RC[-1]) -> #NUM!
A3610: 0 | B3610: =LOG(RC[-1]) -> #NUM!
A3611: 0 | B3611: =LOG(RC[-1]) -> #NUM!
A3612: 0 | B3612: =LOG(RC[-1]) -> #NUM!
A3613: 0 | B3613: =LOG(RC[-1]) -> #NUM!
A3614: 0 | B3614: =LOG(RC[-1]) -> #NUM!
A3615: 0 | B3615: =LOG(RC[-1]) -> #NUM!
A3616: 0 | B3616: =LOG(RC[-1]) -> #NUM!
A3617: 0 | B3617: =LOG(RC[-1]) -> #NUM!
A3618: 0 | B3618: =LOG(RC[-1]) -> #NUM!
A3619: 0 | B3619: =LOG(RC[-1]) -> #NUM!
A3620: 0 | B3620: =LOG(RC[-1]) -> #NUM!
A3621: 0 | B3621: =LOG(RC[-1]) -> #NUM!
A3622: 0 | B3622: =LOG(RC[-1]) -> #NUM!
A3623: 0 | B3623: =LOG(RC[-1]) -> #NUM!
A3624: 0 | B3624: =LOG(RC[-1]) -> #NUM!
A3625: 0 | B3625: =LOG(RC[-1]) -> #NUM!
A3626: 0 | B3626: =LOG(RC[-1]) -> #NUM!
A3627: 0 | B3627: =LOG(RC[-1]) -> #NUM!
A3628: 0 | B3628: =LOG(RC[-1]) -> #NUM!
A3629: 0 | B3629: =LOG(RC[-1]) -> #NUM!
A3630: 0 | B3630: =LOG(RC[-1]) -> #NUM!
A3631: 0 | B3631: =LOG(RC[-1]) -> #NUM!
A3632: 0 | B3632: =LOG(RC[-1]) -> #NUM!
A3633: 0 | B3633: =LOG(RC[-1]) -> #NUM!
A3634: 0 | B3634: =LOG(RC[-1]) -> #NUM!
A3635: 0 | B3635: =LOG(RC[-1]) -> #NUM!
A3636: 0 | B3636: =LOG(RC[-1]) -> #NUM!
A3637: 0 | B3637: =LOG(RC[-1]) -> #NUM!
A3638: 0 | B3638: =LOG(RC[-1]) -> #NUM!
A3639: 0 | B3639: =LOG(RC[-1]) -> #NUM!
A3640: 0 | B3640: =LOG(RC[-1]) -> #NUM!
A3641: 0 | B3641: =LOG(RC[-1]) -> #NUM!
A3642: 0 | B3642: =LOG(RC[-1]) -> #NUM!
A3643: 0 | B3643: =LOG(RC[-1]) -> #NUM!
A3644: 0 | B3644: =LOG(RC[-1]) -> #NUM!
A3645: 0 | B3645: =LOG(RC[-1]) -> #NUM!
A3646: 0 | B3646: =LOG(RC[-1]) -> #NUM!
A3647: 0 | B3647: =LOG(RC[-1]) -> #NUM!
A3648: 0 | B3648: =LOG(RC[-1]) -> #NUM!
A3649: 0 | B3649: =LOG(RC[-1]) -> #NUM!
A3650: 0 | B3650: =LOG(RC[-1]) -> #NUM!
A3651: 0 | B3651: =LOG(RC[-1]) -> #NUM!
A3652: 0 | B3652: =LOG(RC[-1]) -> #NUM!
A3653: 0 | B3653: =LOG(RC[-1]) -> #NUM!
A3654: 0 | B3654: =LOG(RC[-1]) -> #NUM!
A3655: 0 | B3655: =LOG(RC[-1]) -> #NUM!
A3656: 0 | B3656: =LOG(RC[-1]) -> #NUM!
A3657: 0 | B3657: =LOG(RC[-1]) -> #NUM!
A3658: 0 | B3658: =LOG(RC[-1]) -> #NUM!
A3659: 0 | B3659: =LOG(RC[-1]) -> #NUM!
A3660: 0 | B3660: =LOG(RC[-1]) -> #NUM!
A3661: 0 | B3661: =LOG(RC[-1]) -> #NUM!
A3662: 0 | B3662: =LOG(RC[-1]) -> #NUM!
A3663: 0 | B3663: =LOG(RC[-1]) -> #NUM!
A3664: 0 | B3664: =LOG(RC[-1]) -> #NUM!
A3665: 0 | B3665: =LOG(RC[-1]) -> #NUM!
A3666: 0 | B3666: =LOG(RC[-1]) -> #NUM!
A3667: 0 | B3667: =LOG(RC[-1]) -> #NUM!
A3668: 0 | B3668: =LOG(RC[-1]) -> #NUM!
A3669: 0 | B3669: =LOG(RC[-1]) -> #NUM!
A3670: 0 | B3670: =LOG(RC[-1]) -> #NUM!
A3671: 0 | B3671: =LOG(RC[-1]) -> #NUM!
A3672: 0 | B3672: =LOG(RC[-1]) -> #NUM!
A3673: 0 | B3673: =LOG(RC[-1]) -> #NUM!
A3674: 0 | B3674: =LOG(RC[-1]) -> #NUM!
A3675: 0 | B3675: =LOG(RC[-1]) -> #NUM!
A3676: 0 | B3676: =LOG(RC[-1]) -> #NUM!
A3677: 0 | B3677: =LOG(RC[-1]) -> #NUM!
A3678: 0 | B3678: =LOG(RC[-1]) -> #NUM!
A3679: 0 | B3679: =LOG(RC[-1]) -> #NUM!
A3680: 0 | B3680: =LOG(RC[-1]) -> #NUM!
A3681: 0 | B3681: =LOG(RC[-1]) -> #NUM!
A3682: 0 | B3682: =LOG(RC[-1]) -> #NUM!
A3683: 0 | B3683: =LOG(RC[-1]) -> #NUM!
A3684: 0 | B3684: =LOG(RC[-1]) -> #NUM!
A3685: 0 | B3685: =LOG(RC[-1]) -> #NUM!
A3686: 0 | B3686: =LOG(RC[-1]) -> #NUM!
A3687: 0 | B3687: =LOG(RC[-1]) -> #NUM!
A3688: 0 | B3688: =LOG(RC[-1]) -> #NUM!
A3689: 0 | B3689: =LOG(RC[-1]) -> #NUM!
A3690: 0 | B3690: =LOG(RC[-1]) -> #NUM!
A3691: 0 | B3691: =LOG(RC[-1]) -> #NUM!
A3692: 0 | B3692: =LOG(RC[-1]) -> #NUM!
A3693: 0 | B3693: =LOG(RC[-1]) -> #NUM!
A3694: 0 | B3694: =LOG(RC[-1]) -> #NUM!
A3695: 0 | B3695: =LOG(RC[-1]) -> #NUM!
A3696: 0 | B3696: =LOG(RC[-1]) -> #NUM!
A3697: 0 | B3697: =LOG(RC[-1]) -> #NUM!
A3698: 0 | B3698: =LOG(RC[-1]) -> #NUM!
A3699: 0 | B3699: =LOG(RC[-1]) -> #NUM!
A3700: 0 | B3700: =LOG(RC[-1]) -> #NUM!
A3701: 0 | B3701: =LOG(RC[-1]) -> #NUM!
A3702: 0 | B3702: =LOG(RC[-1]) -> #NUM!
A3703: 0 | B3703: =LOG(RC[-1]) -> #NUM!
A3704: 0 | B3704: =LOG(RC[-1]) -> #NUM!
A3705: 0 | B3705: =LOG(RC[-1]) -> #NUM!
A3706: 0 | B3706: =LOG(RC[-1]) -> #NUM!
A3707: 0 | B3707: =LOG(RC[-1]) -> #NUM!
A3708: 0 | B3708: =LOG(RC[-1]) -> #NUM!
A3709: 0 | B3709: =LOG(RC[-1]) -> #NUM!
A3710: 0 | B3710: =LOG(RC[-1]) -> #NUM!
A3711: 0 | B3711: =LOG(RC[-1]) -> #NUM!
A3712: 0 | B3712: =LOG(RC[-1]) -> #NUM!
A3713: 0 | B3713: =LOG(RC[-1]) -> #NUM!
A3714: 0 | B3714: =LOG(RC[-1]) -> #NUM!
A3715: 0 | B3715: =LOG(RC[-1]) -> #NUM!
A3716: 0 | B3716: =LOG(RC[-1]) -> #NUM!
A3717: 0 | B3717: =LOG(RC[-1]) -> #NUM!
A3718: 0 | B3718: =LOG(RC[-1]) -> #NUM!
A3719: 0 | B3719: =LOG(RC[-1]) -> #NUM!
A3720: 0 | B3720: =LOG(RC[-1]) -> #NUM!
A3721: 0 | B3721: =LOG(RC[-1]) -> #NUM!
A3722: 0 | B3722: =LOG(RC[-1]) -> #NUM!
A3723: 0 | B3723: =LOG(RC[-1]) -> #NUM!
A3724: 0 | B3724: =LOG(RC[-1]) -> #NUM!
A3725: 0 | B3725: =LOG(RC[-1]) -> #NUM!
A3726: 0 | B3726: =LOG(RC[-1]) -> #NUM!
A3727: 0 | B3727: =LOG(RC[-1]) -> #NUM!
A3728: 0 | B3728: =LOG(RC[-1]) -> #NUM!
A3729: 0 | B3729: =LOG(RC[-1]) -> #NUM!
A3730: 0 | B3730: =LOG(RC[-1]) -> #NUM!
A3731: 0 | B3731: =LOG(RC[-1]) -> #NUM!
A3732: 0 | B3732: =LOG(RC[-1]) -> #NUM!
A3733: 0 | B3733: =LOG(RC[-1]) -> #NUM!
A3734: 0 | B3734: =LOG(RC[-1]) -> #NUM!
A3735: 0 | B3735: =LOG(RC[-1]) -> #NUM!
A3736: 0 | B3736: =LOG(RC[-1]) -> #NUM!
A3737: 0 | B3737: =LOG(RC[-1]) -> #NUM!
A3738: 0 | B3738: =LOG(RC[-1]) -> #NUM!
A3739: 0 | B3739: =LOG(RC[-1]) -> #NUM!
A3740: 0 | B3740: =LOG(RC[-1]) -> #NUM!
A3741: 0 | B3741: =LOG(RC[-1]) -> #NUM!
A3742: 0 | B3742: =LOG(RC[-1]) -> #NUM!
A3743: 0 | B3743: =LOG(RC[-1]) -> #NUM!
A3744: 0 | B3744: =LOG(RC[-1]) -> #NUM!
A3745: 0 | B3745: =LOG(RC[-1]) -> #NUM!
A3746: 0 | B3746: =LOG(RC[-1]) -> #NUM!
A3747: 0 | B3747: =LOG(RC[-1]) -> #NUM!
A3748: 0 | B3748: =LOG(RC[-1]) -> #NUM!
A3749: 0 | B3749: =LOG(RC[-1]) -> #NUM!
A3750: 0 | B3750: =LOG(RC[-1]) -> #NUM!
A3751: 0 | B3751: =LOG(RC[-1]) -> #NUM!
A3752: 0 | B3752: =LOG(RC[-1]) -> #NUM!
A3753: 0 | B3753: =LOG(RC[-1]) -> #NUM!
A3754: 0 | B3754: =LOG(RC[-1]) -> #NUM!
A3755: 0 | B3755: =LOG(RC[-1]) -> #NUM!
A3756: 0 | B3756: =LOG(RC[-1]) -> #NUM!
A3757: 0 | B3757: =LOG(RC[-1]) -> #NUM!
A3758: 0 | B3758: =LOG(RC[-1]) -> #NUM!
A3759: 0 | B3759: =LOG(RC[-1]) -> #NUM!
A3760: 0 | B3760: =LOG(RC[-1]) -> #NUM!
A3761: 0 | B3761: =LOG(RC[-1]) -> #NUM!
A3762: 0 | B3762: =LOG(RC[-1]) -> #NUM!
A3763: 0 | B3763: =LOG(RC[-1]) -> #NUM!
A3764: 0 | B3764: =LOG(RC[-1]) -> #NUM!
A3765: 0 | B3765: =LOG(RC[-1]) -> #NUM!
A3766: 0 | B3766: =LOG(RC[-1]) -> #NUM!
A3767: 0 | B3767: =LOG(RC[-1]) -> #NUM!
A3768: 0 | B3768: =LOG(RC[-1]) -> #NUM!
A3769: 0 | B3769: =LOG(RC[-1]) -> #NUM!
A3770: 0 | B3770: =LOG(RC[-1]) -> #NUM!
A3771: 0 | B3771: =LOG(RC[-1]) -> #NUM!
A3772: 0 | B3772: =LOG(RC[-1]) -> #NUM!
A3773: 0 | B3773: =LOG(RC[-1]) -> #NUM!
A3774: 0 | B3774: =LOG(RC[-1]) -> #NUM!
A3775: 0 | B3775: =LOG(RC[-1]) -> #NUM!
A3776: 0 | B3776: =LOG(RC[-1]) -> #NUM!
A3777: 0 | B3777: =LOG(RC[-1]) -> #NUM!
A3778: 0 | B3778: =LOG(RC[-1]) -> #NUM!
A3779: 0 | B3779: =LOG(RC[-1]) -> #NUM!
A3780: 0 | B3780: =LOG(RC[-1]) -> #NUM!
A3781: 0 | B3781: =LOG(RC[-1]) -> #NUM!
A3782: 0 | B3782: =LOG(RC[-1]) -> #NUM!
A3783: 0 | B3783: =LOG(RC[-1]) -> #NUM!
A3784: 0 | B3784: =LOG(RC[-1]) -> #NUM!
A3785: 0 | B3785: =LOG(RC[-1]) -> #NUM!
A3786: 0 | B3786: =LOG(RC[-1]) -> #NUM!
A3787: 0 | B3787: =LOG(RC[-1]) -> #NUM!
A3788: 0 | B3788: =LOG(RC[-1]) -> #NUM!
A3789: 0 | B3789: =LOG(RC[-1]) -> #NUM!
A3790: 0 | B3790: =LOG(RC[-1]) -> #NUM!
A3791: 0 | B3791: =LOG(RC[-1]) -> #NUM!
A3792: 0 | B3792: =LOG(RC[-1]) -> #NUM!
A3793: 0 | B3793: =LOG(RC[-1]) -> #NUM!
A3794: 0 | B3794: =LOG(RC[-1]) -> #NUM!
A3795: 0 | B3795: =LOG(RC[-1]) -> #NUM!
A3796: 0 | B3796: =LOG(RC[-1]) -> #NUM!
A3797: 0 | B3797: =LOG(RC[-1]) -> #NUM!
A3798: 0 | B3798: =LOG(RC[-1]) -> #NUM!
A3799: 0 | B3799: =LOG(RC[-1]) -> #NUM!
A3800: 0 | B3800: =LOG(RC[-1]) -> #NUM!
A3801: 0 | B3801: =LOG(RC[-1]) -> #NUM!
A3802: 0 | B3802: =LOG(RC[-1]) -> #NUM!
A3803: 0 | B3803: =LOG(RC[-1]) -> #NUM!
A3804: 0 | B3804: =LOG(RC[-1]) -> #NUM!
A3805: 0 | B3805: =LOG(RC[-1]) -> #NUM!
A3806: 0 | B3806: =LOG(RC[-1]) -> #NUM!
A3807: 0 | B3807: =LOG(RC[-1]) -> #NUM!
A3808: 0 | B3808: =LOG(RC[-1]) -> #NUM!
A3809: 0 | B3809: =LOG(RC[-1]) -> #NUM!
A3810: 0 | B3810: =LOG(RC[-1]) -> #NUM!
A3811: 0 | B3811: =LOG(RC[-1]) -> #NUM!
A3812: 0 | B3812: =LOG(RC[-1]) -> #NUM!
A3813: 0 | B3813: =LOG(RC[-1]) -> #NUM!
A3814: 0 | B3814: =LOG(RC[-1]) -> #NUM!
A3815: 0 | B3815: =LOG(RC[-1]) -> #NUM!
A3816: 0 | B3816: =LOG(RC[-1]) -> #NUM!
A3817: 0 | B3817: =LOG(RC[-1]) -> #NUM!
A3818: 0 | B3818: =LOG(RC[-1]) -> #NUM!
A3819: 0 | B3819: =LOG(RC[-1]) -> #NUM!
A3820: 0 | B3820: =LOG(RC[-1]) -> #NUM!
A3821: 0 | B3821: =LOG(RC[-1]) -> #NUM!
A3822: 0 | B3822: =LOG(RC[-1]) -> #NUM!
A3823: 0 | B3823: =LOG(RC[-1]) -> #NUM!
A3824: 0 | B3824: =LOG(RC[-1]) -> #NUM!
A3825: 0 | B3825: =LOG(RC[-1]) -> #NUM!
A3826: 0 | B3826: =LOG(RC[-1]) -> #NUM!
A3827: 0 | B3827: =LOG(RC[-1]) -> #NUM!
A3828: 0 | B3828: =LOG(RC[-1]) -> #NUM!
A3829: 0 | B3829: =LOG(RC[-1]) -> #NUM!
A3830: 0 | B3830: =LOG(RC[-1]) -> #NUM!
A3831: 0 | B3831: =LOG(RC[-1]) -> #NUM!
A3832: 0 | B3832: =LOG(RC[-1]) -> #NUM!
A3833: 0 | B3833: =LOG(RC[-1]) -> #NUM!
A3834: 0 | B3834: =LOG(RC[-1]) -> #NUM!
A3835: 0 | B3835: =LOG(RC[-1]) -> #NUM!
A3836: 0 | B3836: =LOG(RC[-1]) -> #NUM!
A3837: 0 | B3837: =LOG(RC[-1]) -> #NUM!
A3838: 0 | B3838: =LOG(RC[-1]) -> #NUM!
A3839: 0 | B3839: =LOG(RC[-1]) -> #NUM!
A3840: 0 | B3840: =LOG(RC[-1]) -> #NUM!
A3841: 0 | B3841: =LOG(RC[-1]) -> #NUM!
A3842: 0 | B3842: =LOG(RC[-1]) -> #NUM!
A3843: 0 | B3843: =LOG(RC[-1]) -> #NUM!
A3844: 0 | B3844: =LOG(RC[-1]) -> #NUM!
A3845: 0 | B3845: =LOG(RC[-1]) -> #NUM!
A3846: 0 | B3846: =LOG(RC[-1]) -> #NUM!
A3847: 0 | B3847: =LOG(RC[-1]) -> #NUM!
A3848: 0 | B3848: =LOG(RC[-1]) -> #NUM!
A3849: 0 | B3849: =LOG(RC[-1]) -> #NUM!
A3850: 0 | B3850: =LOG(RC[-1]) -> #NUM!
A3851: 0 | B3851: =LOG(RC[-1]) -> #NUM!
A3852: 0 | B3852: =LOG(RC[-1]) -> #NUM!
A3853: 0 | B3853: =LOG(RC[-1]) -> #NUM!
A3854: 0 | B3854: =LOG(RC[-1]) -> #NUM!
A3855: 0 | B3855: =LOG(RC[-1]) -> #NUM!
A3856: 0 | B3856: =LOG(RC[-1]) -> #NUM!
A3857: 0 | B3857: =LOG(RC[-1]) -> #NUM!
A3858: 0 | B3858: =LOG(RC[-1]) -> #NUM!
A3859: 0 | B3859: =LOG(RC[-1]) -> #NUM!
A3860: 0 | B3860: =LOG(RC[-1]) -> #NUM!
A3861: 0 | B3861: =LOG(RC[-1]) -> #NUM!
A3862: 0 | B3862: =LOG(RC[-1]) -> #NUM!
A3863: 0 | B3863: =LOG(RC[-1]) -> #NUM!
A3864: 0 | B3864: =LOG(RC[-1]) -> #NUM!
A3865: 0 | B3865: =LOG(RC[-1]) -> #NUM!
A3866: 0 | B3866: =LOG(RC[-1]) -> #NUM!
A3867: 0 | B3867: =LOG(RC[-1]) -> #NUM!
A3868: 0 | B3868: =LOG(RC[-1]) -> #NUM!
A3869: 0 | B3869: =LOG(RC[-1]) -> #NUM!
A3870: 0 | B3870: =LOG(RC[-1]) -> #NUM!
A3871: 0 | B3871: =LOG(RC[-1]) -> #NUM!
A3872: 0 | B3872: =LOG(RC[-1]) -> #NUM!
A3873: 0 | B3873: =LOG(RC[-1]) -> #NUM!
A3874: 0 | B3874: =LOG(RC[-1]) -> #NUM!
A3875: 0 | B3875: =LOG(RC[-1]) -> #NUM!
A3876: 0 | B3876: =LOG(RC[-1]) -> #NUM!
A3877: 0 | B3877: =LOG(RC[-1]) -> #NUM!
A3878: 0 | B3878: =LOG(RC[-1]) -> #NUM!
A3879: 0 | B3879: =LOG(RC[-1]) -> #NUM!
A3880: 0 | B3880: =LOG(RC[-1]) -> #NUM!
A3881: 0 | B3881: =LOG(RC[-1]) -> #NUM!
A3882: 0 | B3882: =LOG(RC[-1]) -> #NUM!
A3883: 0 | B3883: =LOG(RC[-1]) -> #NUM!
A3884: 0 | B3884: =LOG(RC[-1]) -> #NUM!
A3885: 0 | B3885: =LOG(RC[-1]) -> #NUM!
A3886: 0 | B3886: =LOG(RC[-1]) -> #NUM!
A3887: 0 | B3887: =LOG(RC[-1]) -> #NUM!
A3888: 0 | B3888: =LOG(RC[-1]) -> #NUM!
A3889: 0 | B3889: =LOG(RC[-1]) -> #NUM!
A3890: 0 | B3890: =LOG(RC[-1]) -> #NUM!
A3891: 0 | B3891: =LOG(RC[-1]) -> #NUM!
A3892: 0 | B3892: =LOG(RC[-1]) -> #NUM!
A3893: 0 | B3893: =LOG(RC[-1]) -> #NUM!
A3894: 0 | B3894: =LOG(RC[-1]) -> #NUM!
A3895: 0 | B3895: =LOG(RC[-1]) -> #NUM!
A3896: 0 | B3896: =LOG(RC[-1]) -> #NUM!
A3897: 0 | B3897: =LOG(RC[-1]) -> #NUM!
A3898: 0 | B3898: =LOG(RC[-1]) -> #NUM!
A3899: 0 | B3899: =LOG(RC[-1]) -> #NUM!
A3900: 0 | B3900: =LOG(RC[-1]) -> #NUM!
A3901: 0 | B3901: =LOG(RC[-1]) -> #NUM!
A3902: 0 | B3902: =LOG(RC[-1]) -> #NUM!
A3903: 0 | B3903: =LOG(RC[-1]) -> #NUM!
A3904: 0 | B3904: =LOG(RC[-1]) -> #NUM!
A3905: 0 | B3905: =LOG(RC[-1]) -> #NUM!
A3906: 0 | B3906: =LOG(RC[-1]) -> #NUM!
A3907: 0 | B3907: =LOG(RC[-1]) -> #NUM!
A3908: 0 | B3908: =LOG(RC[-1]) -> #NUM!
A3909: 0 | B3909: =LOG(RC[-1]) -> #NUM!
A3910: 0 | B3910: =LOG(RC[-1]) -> #NUM!
A3911: 0 | B3911: =LOG(RC[-1]) -> #NUM!
A3912: 0 | B3912: =LOG(RC[-1]) -> #NUM!
A3913: 0 | B3913: =LOG(RC[-1]) -> #NUM!
A3914: 0 | B3914: =LOG(RC[-1]) -> #NUM!
A3915: 0 | B3915: =LOG(RC[-1]) -> #NUM!
A3916: 0 | B3916: =LOG(RC[-1]) -> #NUM!
A3917: 0 | B3917: =LOG(RC[-1]) -> #NUM!
A3918: 0 | B3918: =LOG(RC[-1]) -> #NUM!
A3919: 0 | B3919: =LOG(RC[-1]) -> #NUM!
A3920: 0 | B3920: =LOG(RC[-1]) -> #NUM!
A3921: 0 | B3921: =LOG(RC[-1]) -> #NUM!
A3922: 0 | B3922: =LOG(RC[-1]) -> #NUM!
A3923: 0 | B3923: =LOG(RC[-1]) -> #NUM!
A3924: 0 | B3924: =LOG(RC[-1]) -> #NUM!
A3925: 0 | B3925: =LOG(RC[-1]) -> #NUM!
A3926: 0 | B3926: =LOG(RC[-1]) -> #NUM!
A3927: 0 | B3927: =LOG(RC[-1]) -> #NUM!
A3928: 0 | B3928: =LOG(RC[-1]) -> #NUM!
A3929: 0 | B3929: =LOG(RC[-1]) -> #NUM!
A3930: 0 | B3930: =LOG(RC[-1]) -> #NUM!
A3931: 0 | B3931: =LOG(RC[-1]) -> #NUM!
A3932: 0 | B3932: =LOG(RC[-1]) -> #NUM!
A3933: 0 | B3933: =LOG(RC[-1]) -> #NUM!
A3934: 0 | B3934: =LOG(RC[-1]) -> #NUM!
A3935: 0 | B3935: =LOG(RC[-1]) -> #NUM!
A3936: 0 | B3936: =LOG(RC[-1]) -> #NUM!
A3937: 0 | B3937: =LOG(RC[-1]) -> #NUM!
A3938: 0 | B3938: =LOG(RC[-1]) -> #NUM!
A3939: 0 | B3939: =LOG(RC[-1]) -> #NUM!
A3940: 0 | B3940: =LOG(RC[-1]) -> #NUM!
A3941: 0 | B3941: =LOG(RC[-1]) -> #NUM!
A3942: 0 | B3942: =LOG(RC[-1]) -> #NUM!
A3943: 0 | B3943: =LOG(RC[-1]) -> #NUM!
A3944: 0 | B3944: =LOG(RC[-1]) -> #NUM!
A3945: 0 | B3945: =LOG(RC[-1]) -> #NUM!
A3946: 0 | B3946: =LOG(RC[-1]) -> #NUM!
A3947: 0 | B3947: =LOG(RC[-1]) -> #NUM!
A3948: 0 | B3948: =LOG(RC[-1]) -> #NUM!
A3949: 0 | B3949: =LOG(RC[-1]) -> #NUM!
A3950: 0 | B3950: =LOG(RC[-1]) -> #NUM!
A3951: 0 | B3951: =LOG(RC[-1]) -> #NUM!
A3952: 0 | B3952: =LOG(RC[-1]) -> #NUM!
A3953: 0 | B3953: =LOG(RC[-1]) -> #NUM!
A3954: 0 | B3954: =LOG(RC[-1]) -> #NUM!
A3955: 0 | B3955: =LOG(RC[-1]) -> #NUM!
A3956: 0 | B3956: =LOG(RC[-1]) -> #NUM!
A3957: 0 | B3957: =LOG(RC[-1]) -> #NUM!
A3958: 0 | B3958: =LOG(RC[-1]) -> #NUM!
A3959: 0 | B3959: =LOG(RC[-1]) -> #NUM!
A3960: 0 | B3960: =LOG(RC[-1]) -> #NUM!
A3961: 0 | B3961: =LOG(RC[-1]) -> #NUM!
A3962: 0 | B3962: =LOG(RC[-1]) -> #NUM!
A3963: 0 | B3963: =LOG(RC[-1]) -> #NUM!
A3964: 0 | B3964: =LOG(RC[-1]) -> #NUM!
A3965: 0 | B3965: =LOG(RC[-1]) -> #NUM!
A3966: 0 | B3966: =LOG(RC[-1]) -> #NUM!
A3967: 0 | B3967: =LOG(RC[-1]) -> #NUM!
A3968: 0 | B3968: =LOG(RC[-1]) -> #NUM!
A3969: 0 | B3969: =LOG(RC[-1]) -> #NUM!
A3970: 0 | B3970: =LOG(RC[-1]) -> #NUM!
A3971: 0 | B3971: =LOG(RC[-1]) -> #NUM!
A3972: 0 | B3972: =LOG(RC[-1]) -> #NUM!
A3973: 0 | B3973: =LOG(RC[-1]) -> #NUM!
A3974: 0 | B3974: =LOG(RC[-1]) -> #NUM!
A3975: 0 | B3975: =LOG(RC[-1]) -> #NUM!
A3976: 0 | B3976: =LOG(RC[-1]) -> #NUM!
A3977: 0 | B3977: =LOG(RC[-1]) -> #NUM!
A3978: 0 | B3978: =LOG(RC[-1]) -> #NUM!
A3979: 0 | B3979: =LOG(RC[-1]) -> #NUM!
A3980: 0 | B3980: =LOG(RC[-1]) -> #NUM!
A3981: 0 | B3981: =LOG(RC[-1]) -> #NUM!
A3982: 0 | B3982: =LOG(RC[-1]) -> #NUM!
A3983: 0 | B3983: =LOG(RC[-1]) -> #NUM!
A3984: 0 | B3984: =LOG(RC[-1]) -> #NUM!
A3985: 0 | B3985: =LOG(RC[-1]) -> #NUM!
A3986: 0 | B3986: =LOG(RC[-1]) -> #NUM!
A3987: 0 | B3987: =LOG(RC[-1]) -> #NUM!
A3988: 0 | B3988: =LOG(RC[-1]) -> #NUM!
A3989: 0 | B3989: =LOG(RC[-1]) -> #NUM!
A3990: 0 | B3990: =LOG(RC[-1]) -> #NUM!
A3991: 0 | B3991: =LOG(RC[-1]) -> #NUM!
A3992: 0 | B3992: =LOG(RC[-1]) -> #NUM!
A3993: 0 | B3993: =LOG(RC[-1]) -> #NUM!
A3994: 0 | B3994: =LOG(RC[-1]) -> #NUM!
A3995: 0 | B3995: =LOG(RC[-1]) -> #NUM!
A3996: 0 | B3996: =LOG(RC[-1]) -> #NUM!
A3997: 0 | B3997: =LOG(RC[-1]) -> #NUM!
A3998: 0 | B3998: =LOG(RC[-1]) -> #NUM!
A3999: 0 | B3999: =LOG(RC[-1]) -> #NUM!
A4000: 0 | B4000: =LOG(RC[-1]) -> #NUM!
A4001: 0 | B4001: =LOG(RC[-1]) -> #NUM!
A4002: 0 | B4002: =LOG(RC[-1]) -> #NUM!
A4003: 0 | B4003: =LOG(RC[-1]) -> #NUM!
A4004: 0 | B4004: =LOG(RC[-1]) -> #NUM!
A4005: 0 | B4005: =LOG(RC[-1]) -> #NUM!
A4006: 0 | B4006: =LOG(RC[-1]) -> #NUM!
A4007: 0 | B4007: =LOG(RC[-1]) -> #NUM!
A4008: 0 | B4008: =LOG(RC[-1]) -> #NUM!
A4009: 0 | B4009: =LOG(RC[-1]) -> #NUM!
A4010: 0 | B4010: =LOG(RC[-1]) -> #NUM!
A4011: 0 | B4011: =LOG(RC[-1]) -> #NUM!
A4012: 0 | B4012: =LOG(RC[-1]) -> #NUM!
A4013: 0 | B4013: =LOG(RC[-1]) -> #NUM!
A4014: 0 | B4014: =LOG(RC[-1]) -> #NUM!
A4015: 0 | B4015: =LOG(RC[-1]) -> #NUM!
A4016: 0 | B4016: =LOG(RC[-1]) -> #NUM!
A4017: 0 | B4017: =LOG(RC[-1]) -> #NUM!
A4018: 0 | B4018: =LOG(RC[-1]) -> #NUM!
A4019: 0 | B4019: =LOG(RC[-1]) -> #NUM!
A4020: 0 | B4020: =LOG(RC[-1]) -> #NUM!
A4021: 0 | B4021: =LOG(RC[-1]) -> #NUM!
A4022: 0 | B4022: =LOG(RC[-1]) -> #NUM!
A4023: 0 | B4023: =LOG(RC[-1]) -> #NUM!
A4024: 0 | B4024: =LOG(RC[-1]) -> #NUM!
A4025: 0 | B4025: =LOG(RC[-1]) -> #NUM!
A4026: 0 | B4026: =LOG(RC[-1]) -> #NUM!
A4027: 0 | B4027: =LOG(RC[-1]) -> #NUM!
A4028: 0 | B4028: =LOG(RC[-1]) -> #NUM!
A4029: 0 | B4029: =LOG(RC[-1]) -> #NUM!
A4030: 0 | B4030: =LOG(RC[-1]) -> #NUM!
A4031: 0 | B4031: =LOG(RC[-1]) -> #NUM!
A4032: 0 | B4032: =LOG(RC[-1]) -> #NUM!
A4033: 0 | B4033: =LOG(RC[-1]) -> #NUM!
A4034: 0 | B4034: =LOG(RC[-1]) -> #NUM!
A4035: 0 | B4035: =LOG(RC[-1]) -> #NUM!
A4036: 0 | B4036: =LOG(RC[-1]) -> #NUM!
A4037: 0 | B4037: =LOG(RC[-1]) -> #NUM!
A4038: 0 | B4038: =LOG(RC[-1]) -> #NUM!
A4039: 0 | B4039: =LOG(RC[-1]) -> #NUM!
A4040: 0 | B4040: =LOG(RC[-1]) -> #NUM!
A4041: 0 | B4041: =LOG(RC[-1]) -> #NUM!
A4042: 0 | B4042: =LOG(RC[-1]) -> #NUM!
A4043: 0 | B4043: =LOG(RC[-1]) -> #NUM!
A4044: 0 | B4044: =LOG(RC[-1]) -> #NUM!
A4045: 0 | B4045: =LOG(RC[-1]) -> #NUM!
A4046: 0 | B4046: =LOG(RC[-1]) -> #NUM!
A4047: 0 | B4047: =LOG(RC[-1]) -> #NUM!
A4048: 0 | B4048: =LOG(RC[-1]) -> #NUM!
A4049: 0 | B4049: =LOG(RC[-1]) -> #NUM!
A4050: 0 | B4050: =LOG(RC[-1]) -> #NUM!
A4051: 0 | B4051: =LOG(RC[-1]) -> #NUM!
A4052: 0 | B4052: =LOG(RC[-1]) -> #NUM!
A4053: 0 | B4053: =LOG(RC[-1]) -> #NUM!
A4054: 0 | B4054: =LOG(RC[-1]) -> #NUM!
A4055: 0 | B4055: =LOG(RC[-1]) -> #NUM!
A4056: 0 | B4056: =LOG(RC[-1]) -> #NUM!
A4057: 0 | B4057: =LOG(RC[-1]) -> #NUM!
A4058: 0 | B4058: =LOG(RC[-1]) -> #NUM!
A4059: 0 | B4059: =LOG(RC[-1]) -> #NUM!
A4060: 0 | B4060: =LOG(RC[-1]) -> #NUM!
A4061: 0 | B4061: =LOG(RC[-1]) -> #NUM!
A4062: 0 | B4062: =LOG(RC[-1]) -> #NUM!
A4063: 0 | B4063: =LOG(RC[-1]) -> #NUM!
A4064: 0 | B4064: =LOG(RC[-1]) -> #NUM!
A4065: 0 | B4065: =LOG(RC[-1]) -> #NUM!
A4066: 0 | B4066: =LOG(RC[-1]) -> #NUM!
A4067: 0 | B4067: =LOG(RC[-1]) -> #NUM!
A4068: 0 | B4068: =LOG(RC[-1]) -> #NUM!
A4069: 0 | B4069: =LOG(RC[-1]) -> #NUM!
A4070: 0 | B4070: =LOG(RC[-1]) -> #NUM!
A4071: 0 | B4071: =LOG(RC[-1]) -> #NUM!
A4072: 0 | B4072: =LOG(RC[-1]) -> #NUM!
A4073: 0 | B4073: =LOG(RC[-1]) -> #NUM!
A4074: 0 | B4074: =LOG(RC[-1]) -> #NUM!
A4075: 0 | B4075: =LOG(RC[-1]) -> #NUM!
A4076: 0 | B4076: =LOG(RC[-1]) -> #NUM!
A4077: 0 | B4077: =LOG(RC[-1]) -> #NUM!
A4078: 0 | B4078: =LOG(RC[-1]) -> #NUM!
A4079: 0 | B4079: =LOG(RC[-1]) -> #NUM!
A4080: 0 | B4080: =LOG(RC[-1]) -> #NUM!
A4081: 0 | B4081: =LOG(RC[-1]) -> #NUM!
A4082: 0 | B4082: =LOG(RC[-1]) -> #NUM!
A4083: 0 | B4083: =LOG(RC[-1]) -> #NUM!
A4084: 0 | B4084: =LOG(RC[-1]) -> #NUM!
A4085: 0 | B4085: =LOG(RC[-1]) -> #NUM!
A4086: 0 | B4086: =LOG(RC[-1]) -> #NUM!
A4087: 0 | B4087: =LOG(RC[-1]) -> #NUM!
A4088: 0 | B4088: =LOG(RC[-1]) -> #NUM!
A4089: 0 | B4089: =LOG(RC[-1]) -> #NUM!
A4090: 0 | B4090: =LOG(RC[-1]) -> #NUM!
A4091: 0 | B4091: =LOG(RC[-1]) -> #NUM!
A4092: 0 | B4092: =LOG(RC[-1]) -> #NUM!
A4093: 0 | B4093: =LOG(RC[-1]) -> #NUM!
A4094: 0 | B4094: =LOG(RC[-1]) -> #NUM!
A4095: 0 | B4095: =LOG(RC[-1]) -> #NUM!
A4096: 0 | B4096: =LOG(RC[-1]) -> #NUM!
A4097: 0 | B4097: =LOG(RC[-1]) -> #NUM!
A4098: 0 | B4098: =LOG(RC[-1]) -> #NUM!
A4099: 0 | B4099: =LOG(RC[-1]) -> #NUM!
A4100: 0 | B4100: =LOG(RC[-1]) -> #NUM!
A4101: 0 | B4101: =LOG(RC[-1]) -> #NUM!
A4102: 0 | B4102: =LOG(RC[-1]) -> #NUM!
A4103: 0 | B4103: =LOG(RC[-1]) -> #NUM!
A4104: 0 | B4104: =LOG(RC[-1]) -> #NUM!
A4105: 0 | B4105: =LOG(RC[-1]) -> #NUM!
A4106: 0 | B4106: =LOG(RC[-1]) -> #NUM!
A4107: 0 | B4107: =LOG(RC[-1]) -> #NUM!
A4108: 0 | B4108: =LOG(RC[-1]) -> #NUM!
A4109: 0 | B4109: =LOG(RC[-1]) -> #NUM!
A4110: 0 | B4110: =LOG(RC[-1]) -> #NUM!
A4111: 0 | B4111: =LOG(RC[-1]) -> #NUM!
A4112: 0 | B4112: =LOG(RC[-1]) -> #NUM!
A4113: 0 | B4113: =LOG(RC[-1]) -> #NUM!
A4114: 0 | B4114: =LOG(RC[-1]) -> #NUM!
A4115: 0 | B4115: =LOG(RC[-1]) -> #NUM!
A4116: 0 | B4116: =LOG(RC[-1]) -> #NUM!
A4117: 0 | B4117: =LOG(RC[-1]) -> #NUM!
A4118: 0 | B4118: =LOG(RC[-1]) -> #NUM!
A4119: 0 | B4119: =LOG(RC[-1]) -> #NUM!
A4120: 0 | B4120: =LOG(RC[-1]) -> #NUM!
A4121: 0 | B4121: =LOG(RC[-1]) -> #NUM!
A4122: 0 | B4122: =LOG(RC[-1]) -> #NUM!
A4123: 0 | B4123: =LOG(RC[-1]) -> #NUM!
A4124: 0 | B4124: =LOG(RC[-1]) -> #NUM!
A4125: 0 | B4125: =LOG(RC[-1]) -> #NUM!
A4126: 0 | B4126: =LOG(RC[-1]) -> #NUM!
A4127: 0 | B4127: =LOG(RC[-1]) -> #NUM!
A4128: 0 | B4128: =LOG(RC[-1]) -> #NUM!
A4129: 0 | B4129: =LOG(RC[-1]) -> #NUM!
A4130: 0 | B4130: =LOG(RC[-1]) -> #NUM!
A4131: 0 | B4131: =LOG(RC[-1]) -> #NUM!
A4132: 0 | B4132: =LOG(RC[-1]) -> #NUM!
A4133: 0 | B4133: =LOG(RC[-1]) -> #NUM!
A4134: 0 | B4134: =LOG(RC[-1]) -> #NUM!
A4135: 0 | B4135: =LOG(RC[-1]) -> #NUM!
A4136: 0 | B4136: =LOG(RC[-1]) -> #NUM!
A4137: 0 | B4137: =LOG(RC[-1]) -> #NUM!
A4138: 0 | B4138: =LOG(RC[-1]) -> #NUM!
A4139: 0 | B4139: =LOG(RC[-1]) -> #NUM!
A4140: 0 | B4140: =LOG(RC[-1]) -> #NUM!
A4141: 0 | B4141: =LOG(RC[-1]) -> #NUM!
A4142: 0 | B4142: =LOG(RC[-1]) -> #NUM!
A4143: 0 | B4143: =LOG(RC[-1]) -> #NUM!
A4144: 0 | B4144: =LOG(RC[-1]) -> #NUM!
A4145: 0 | B4145: =LOG(RC[-1]) -> #NUM!
A4146: 0 | B4146: =LOG(RC[-1]) -> #NUM!
A4147: 0 | B4147: =LOG(RC[-1]) -> #NUM!
A4148: 0 | B4148: =LOG(RC[-1]) -> #NUM!
A4149: 0 | B4149: =LOG(RC[-1]) -> #NUM!
A4150: 0 | B4150: =LOG(RC[-1]) -> #NUM!
A4151: 0 | B4151: =LOG(RC[-1]) -> #NUM!
A4152: 0 | B4152: =LOG(RC[-1]) -> #NUM!
A4153: 0 | B4153: =LOG(RC[-1]) -> #NUM!
A4154: 0 | B4154: =LOG(RC[-1]) -> #NUM!
A4155: 0 | B4155: =LOG(RC[-1]) -> #NUM!
A4156: 0 | B4156: =LOG(RC[-1]) -> #NUM!
A4157: 0 | B4157: =LOG(RC[-1]) -> #NUM!
A4158: 0 | B4158: =LOG(RC[-1]) -> #NUM!
A4159: 0 | B4159: =LOG(RC[-1]) -> #NUM!
A4160: 0 | B4160: =LOG(RC[-1]) -> #NUM!
A4161: 0 | B4161: =LOG(RC[-1]) -> #NUM!
A4162: 0 | B4162: =LOG(RC[-1]) -> #NUM!
A4163: 0 | B4163: =LOG(RC[-1]) -> #NUM!
A4164: 0 | B4164: =LOG(RC[-1]) -> #NUM!
A4165: 0 | B4165: =LOG(RC[-1]) -> #NUM!
A4166: 0 | B4166: =LOG(RC[-1]) -> #NUM!
A4167: 0 | B4167: =LOG(RC[-1]) -> #NUM!
A4168: 0 | B4168: =LOG(RC[-1]) -> #NUM!
A4169: 0 | B4169: =LOG(RC[-1]) -> #NUM!
A4170: 0 | B4170: =LOG(RC[-1]) -> #NUM!
A4171: 0 | B4171: =LOG(RC[-1]) -> #NUM!
A4172: 0 | B4172: =LOG(RC[-1]) -> #NUM!
A4173: 0 | B4173: =LOG(RC[-1]) -> #NUM!
A4174: 0 | B4174: =LOG(RC[-1]) -> #NUM!
A4175: 0 | B4175: =LOG(RC[-1]) -> #NUM!
A4176: 0 | B4176: =LOG(RC[-1]) -> #NUM!
A4177: 0 | B4177: =LOG(RC[-1]) -> #NUM!
A4178: 0 | B4178: =LOG(RC[-1]) -> #NUM!
A4179: 0 | B4179: =LOG(RC[-1]) -> #NUM!
A4180: 0 | B4180: =LOG(RC[-1]) -> #NUM!
A4181: 0 | B4181: =LOG(RC[-1]) -> #NUM!
A4182: 0 | B4182: =LOG(RC[-1]) -> #NUM!
A4183: 0 | B4183: =LOG(RC[-1]) -> #NUM!
A4184: 0 | B4184: =LOG(RC[-1]) -> #NUM!
A4185: 0 | B4185: =LOG(RC[-1]) -> #NUM!
A4186: 0 | B4186: =LOG(RC[-1]) -> #NUM!
A4187: 0 | B4187: =LOG(RC[-1]) -> #NUM!
A4188: 0 | B4188: =LOG(RC[-1]) -> #NUM!
A4189: 0 | B4189: =LOG(RC[-1]) -> #NUM!
A4190: 0 | B4190: =LOG(RC[-1]) -> #NUM!
A4191: 0 | B4191: =LOG(RC[-1]) -> #NUM!
A4192: 0 | B4192: =LOG(RC[-1]) -> #NUM!
A4193: 0 | B4193: =LOG(RC[-1]) -> #NUM!
A4194: 0 | B4194: =LOG(RC[-1]) -> #NUM!
A4195: 0 | B4195: =LOG(RC[-1]) -> #NUM!
A4196: 0 | B4196: =LOG(RC[-1]) -> #NUM!
A4197: 0 | B4197: =LOG(RC[-1]) -> #NUM!
A4198: 0 | B4198: =LOG(RC[-1]) -> #NUM!
A4199: 0 | B4199: =LOG(RC[-1]) -> #NUM!
A4200: 0 | B4200: =LOG(RC[-1]) -> #NUM!
A4201: 0 | B4201: =LOG(RC[-1]) -> #NUM!
A4202: 0 | B4202: =LOG(RC[-1]) -> #NUM!
A4203: 0 | B4203: =LOG(RC[-1]) -> #NUM!
A4204: 0 | B4204: =LOG(RC[-1]) -> #NUM!
A4205: 0 | B4205: =LOG(RC[-1]) -> #NUM!
A4206: 0 | B4206: =LOG(RC[-1]) -> #NUM!
A4207: 0 | B4207: =LOG(RC[-1]) -> #NUM!
A4208: 0 | B4208: =LOG(RC[-1]) -> #NUM!
A4209: 0 | B4209: =LOG(RC[-1]) -> #NUM!
A4210: 0 | B4210: =LOG(RC[-1]) -> #NUM!
A4211: 0 | B4211: =LOG(RC[-1]) -> #NUM!
A4212: 0 | B4212: =LOG(RC[-1]) -> #NUM!
A4213: 0 | B4213: =LOG(RC[-1]) -> #NUM!
A4214: 0 | B4214: =LOG(RC[-1]) -> #NUM!
A4215: 0 | B4215: =LOG(RC[-1]) -> #NUM!
A4216: 0 | B4216: =LOG(RC[-1]) -> #NUM!
A4217: 0 | B4217: =LOG(RC[-1]) -> #NUM!
A4218: 0 | B4218: =LOG(RC[-1]) -> #NUM!
A4219: 0 | B4219: =LOG(RC[-1]) -> #NUM!
A4220: 0 | B4220: =LOG(RC[-1]) -> #NUM!
A4221: 0 | B4221: =LOG(RC[-1]) -> #NUM!
A4222: 0 | B4222: =LOG(RC[-1]) -> #NUM!
A4223: 0 | B4223: =LOG(RC[-1]) -> #NUM!
A4224: 0 | B4224: =LOG(RC[-1]) -> #NUM!
A4225: 0 | B4225: =LOG(RC[-1]) -> #NUM!
A4226: 0 | B4226: =LOG(RC[-1]) -> #NUM!
A4227: 0 | B4227: =LOG(RC[-1]) -> #NUM!
A4228: 0 | B4228: =LOG(RC[-1]) -> #NUM!
A4229: 0 | B4229: =LOG(RC[-1]) -> #NUM!
A4230: 0 | B4230: =LOG(RC[-1]) -> #NUM!
A4231: 0 | B4231: =LOG(RC[-1]) -> #NUM!
A4232: 0 | B4232: =LOG(RC[-1]) -> #NUM!
A4233: 0 | B4233: =LOG(RC[-1]) -> #NUM!
A4234: 0 | B4234: =LOG(RC[-1]) -> #NUM!
A4235: 0 | B4235: =LOG(RC[-1]) -> #NUM!
A4236: 0 | B4236: =LOG(RC[-1]) -> #NUM!
A4237: 0 | B4237: =LOG(RC[-1]) -> #NUM!
A4238: 0 | B4238: =LOG(RC[-1]) -> #NUM!
A4239: 0 | B4239: =LOG(RC[-1]) -> #NUM!
A4240: 0 | B4240: =LOG(RC[-1]) -> #NUM!
A4241: 0 | B4241: =LOG(RC[-1]) -> #NUM!
A4242: 0 | B4242: =LOG(RC[-1]) -> #NUM!
A4243: 0 | B4243: =LOG(RC[-1]) -> #NUM!
A4244: 0 | B4244: =LOG(RC[-1]) -> #NUM!
A4245: 0 | B4245: =LOG(RC[-1]) -> #NUM!
A4246: 0 | B4246: =LOG(RC[-1]) -> #NUM!
A4247: 0 | B4247: =LOG(RC[-1]) -> #NUM!
A4248: 0 | B4248: =LOG(RC[-1]) -> #NUM!
A4249: 0 | B4249: =LOG(RC[-1]) -> #NUM!
A4250: 0 | B4250: =LOG(RC[-1]) -> #NUM!
A4251: 0 | B4251: =LOG(RC[-1]) -> #NUM!
A4252: 0 | B4252: =LOG(RC[-1]) -> #NUM!
A4253: 0 | B4253: =LOG(RC[-1]) -> #NUM!
A4254: 0 | B4254: =LOG(RC[-1]) -> #NUM!
A4255: 0 | B4255: =LOG(RC[-1]) -> #NUM!
A4256: 0 | B4256: =LOG(RC[-1]) -> #NUM!
A4257: 0 | B4257: =LOG(RC[-1]) -> #NUM!
A4258: 0 | B4258: =LOG(RC[-1]) -> #NUM!
A4259: 0 | B4259: =LOG(RC[-1]) -> #NUM!
A4260: 0 | B4260: =LOG(RC[-1]) -> #NUM!
A4261: 0 | B4261: =LOG(RC[-1]) -> #NUM!
A4262: 0 | B4262: =LOG(RC[-1]) -> #NUM!
A4263: 0 | B4263: =LOG(RC[-1]) -> #NUM!
A4264: 0 | B4264: =LOG(RC[-1]) -> #NUM!
A4265: 0 | B4265: =LOG(RC[-1]) -> #NUM!
A4266: 0 | B4266: =LOG(RC[-1]) -> #NUM!
A4267: 0 | B4267: =LOG(RC[-1]) -> #NUM!
A4268: 0 | B4268: =LOG(RC[-1]) -> #NUM!
A4269: 0 | B4269: =LOG(RC[-1]) -> #NUM!
A4270: 0 | B4270: =LOG(RC[-1]) -> #NUM!
A4271: 0 | B4271: =LOG(RC[-1]) -> #NUM!
A4272: 0 | B4272: =LOG(RC[-1]) -> #NUM!
A4273: 0 | B4273: =LOG(RC[-1]) -> #NUM!
A4274: 0 | B4274: =LOG(RC[-1]) -> #NUM!
A4275: 0 | B4275: =LOG(RC[-1]) -> #NUM!
A4276: 0 | B4276: =LOG(RC[-1]) -> #NUM!
A4277: 0 | B4277: =LOG(RC[-1]) -> #NUM!
A4278: 0 | B4278: =LOG(RC[-1]) -> #NUM!
A4279: 0 | B4279: =LOG(RC[-1]) -> #NUM!
A4280: 0 | B4280: =LOG(RC[-1]) -> #NUM!
A4281: 0 | B4281: =LOG(RC[-1]) -> #NUM!
A4282: 0 | B4282: =LOG(RC[-1]) -> #NUM!
A4283: 0 | B4283: =LOG(RC[-1]) -> #NUM!
A4284: 0 | B4284: =LOG(RC[-1]) -> #NUM!
A4285: 0 | B4285: =LOG(RC[-1]) -> #NUM!
A4286: 0 | B4286: =LOG(RC[-1]) -> #NUM!
A4287: 0 | B4287: =LOG(RC[-1]) -> #NUM!
A4288: 0 | B4288: =LOG(RC[-1]) -> #NUM!
A4289: 0 | B4289: =LOG(RC[-1]) -> #NUM!
A4290: 0 | B4290: =LOG(RC[-1]) -> #NUM!
A4291: 0 | B4291: =LOG(RC[-1]) -> #NUM!
A4292: 0 | B4292: =LOG(RC[-1]) -> #NUM!
A4293: 0 | B4293: =LOG(RC[-1]) -> #NUM!
A4294: 0 | B4294: =LOG(RC[-1]) -> #NUM!
A4295: 0 | B4295: =LOG(RC[-1]) -> #NUM!
A4296: 0 | B4296: =LOG(RC[-1]) -> #NUM!
A4297: 0 | B4297: =LOG(RC[-1]) -> #NUM!
A4298: 0 | B4298: =LOG(RC[-1]) -> #NUM!
A4299: 0 | B4299: =LOG(RC[-1]) -> #NUM!
A4300: 0 | B4300: =LOG(RC[-1]) -> #NUM!
A4301: 0 | B4301: =LOG(RC[-1]) -> #NUM!
A4302: 0 | B4302: =LOG(RC[-1]) -> #NUM!
A4303: 0 | B4303: =LOG(RC[-1]) -> #NUM!
A4304: 0 | B4304: =LOG(RC[-1]) -> #NUM!
A4305: 0 | B4305: =LOG(RC[-1]) -> #NUM!
A4306: 0 | B4306: =LOG(RC[-1]) -> #NUM!
A4307: 0 | B4307: =LOG(RC[-1]) -> #NUM!
A4308: 0 | B4308: =LOG(RC[-1]) -> #NUM!
A4309: 0 | B4309: =LOG(RC[-1]) -> #NUM!
A4310: 0 | B4310: =LOG(RC[-1]) -> #NUM!
A4311: 0 | B4311: =LOG(RC[-1]) -> #NUM!
A4312: 0 | B4312: =LOG(RC[-1]) -> #NUM!
A4313: 0 | B4313: =LOG(RC[-1]) -> #NUM!
A4314: 0 | B4314: =LOG(RC[-1]) -> #NUM!
A4315: 0 | B4315: =LOG(RC[-1]) -> #NUM!
A4316: 0 | B4316: =LOG(RC[-1]) -> #NUM!
A4317: 0 | B4317: =LOG(RC[-1]) -> #NUM!
A4318: 0 | B4318: =LOG(RC[-1]) -> #NUM!
A4319: 0 | B4319: =LOG(RC[-1]) -> #NUM!
A4320: 0 | B4320: =LOG(RC[-1]) -> #NUM!
A4321: 0 | B4321: =LOG(RC[-1]) -> #NUM!
A4322: 0 | B4322: =LOG(RC[-1]) -> #NUM!
A4323: 0 | B4323: =LOG(RC[-1]) -> #NUM!
A4324: 0 | B4324: =LOG(RC[-1]) -> #NUM!
A4325: 0 | B4325: =LOG(RC[-1]) -> #NUM!
A4326: 0 | B4326: =LOG(RC[-1]) -> #NUM!
A4327: 0 | B4327: =LOG(RC[-1]) -> #NUM!
A4328: 0 | B4328: =LOG(RC[-1]) -> #NUM!
A4329: 0 | B4329: =LOG(RC[-1]) -> #NUM!
A4330: 0 | B4330: =LOG(RC[-1]) -> #NUM!
A4331: 0 | B4331: =LOG(RC[-1]) -> #NUM!
A4332: 0 | B4332: =LOG(RC[-1]) -> #NUM!
A4333: 0 | B4333: =LOG(RC[-1]) -> #NUM!
A4334: 0 | B4334: =LOG(RC[-1]) -> #NUM!
A4335: 0 | B4335: =LOG(RC[-1]) -> #NUM!
A4336: 0 | B4336: =LOG(RC[-1]) -> #NUM!
A4337: 0 | B4337: =LOG(RC[-1]) -> #NUM!
A4338: 0 | B4338: =LOG(RC[-1]) -> #NUM!
A4339: 0 | B4339: =LOG(RC[-1]) -> #NUM!
A4340: 0 | B4340: =LOG(RC[-1]) -> #NUM!
A4341: 0 | B4341: =LOG(RC[-1]) -> #NUM!
A4342: 0 | B4342: =LOG(RC[-1]) -> #NUM!
A4343: 0 | B4343: =LOG(RC[-1]) -> #NUM!
A4344: 0 | B4344: =LOG(RC[-1]) -> #NUM!
A4345: 0 | B4345: =LOG(RC[-1]) -> #NUM!
A4346: 0 | B4346: =LOG(RC[-1]) -> #NUM!
A4347: 0 | B4347: =LOG(RC[-1]) -> #NUM!
A4348: 0 | B4348: =LOG(RC[-1]) -> #NUM!
A4349: 0 | B4349: =LOG(RC[-1]) -> #NUM!
A4350: 0 | B4350: =LOG(RC[-1]) -> #NUM!
A4351: 0 | B4351: =LOG(RC[-1]) -> #NUM!
A4352: 0 | B4352: =LOG(RC[-1]) -> #NUM!
A4353: 0 | B4353: =LOG(RC[-1]) -> #NUM!
A4354: 0 | B4354: =LOG(RC[-1]) -> #NUM!
A4355: 0 | B4355: =LOG(RC[-1]) -> #NUM!
A4356: 0 | B4356: =LOG(RC[-1]) -> #NUM!
A4357: 0 | B4357: =LOG(RC[-1]) -> #NUM!
A4358: 0 | B4358: =LOG(RC[-1]) -> #NUM!
A4359: 0 | B4359: =LOG(RC[-1]) -> #NUM!
A4360: 0 | B4360: =LOG(RC[-1]) -> #NUM!
A4361: 0 | B4361: =LOG(RC[-1]) -> #NUM!
A4362: 0 | B4362: =LOG(RC[-1]) -> #NUM!
A4363: 0 | B4363: =LOG(RC[-1]) -> #NUM!
A4364: 0 | B4364: =LOG(RC[-1]) -> #NUM!
A4365: 0 | B4365: =LOG(RC[-1]) -> #NUM!
A4366: 0 | B4366: =LOG(RC[-1]) -> #NUM!
A4367: 0 | B4367: =LOG(RC[-1]) -> #NUM!
A4368: 0 | B4368: =LOG(RC[-1]) -> #NUM!
A4369: 0 | B4369: =LOG(RC[-1]) -> #NUM!
A4370: 0 | B4370: =LOG(RC[-1]) -> #NUM!
A4371: 0 | B4371: =LOG(RC[-1]) -> #NUM!
A4372: 0 | B4372: =LOG(RC[-1]) -> #NUM!
A4373: 0 | B4373: =LOG(RC[-1]) -> #NUM!
A4374: 0 | B4374: =LOG(RC[-1]) -> #NUM!
A4375: 0 | B4375: =LOG(RC[-1]) -> #NUM!
A4376: 0 | B4376: =LOG(RC[-1]) -> #NUM!
A4377: 0 | B4377: =LOG(RC[-1]) -> #NUM!
A4378: 0 | B4378: =LOG(RC[-1]) -> #NUM!
A4379: 0 | B4379: =LOG(RC[-1]) -> #NUM!
A4380: 0 | B4380: =LOG(RC[-1]) -> #NUM!
A4381: 0 | B4381: =LOG(RC[-1]) -> #NUM!
A4382: 0 | B4382: =LOG(RC[-1]) -> #NUM!
A4383: 0 | B4383: =LOG(RC[-1]) -> #NUM!
A4384: 0 | B4384: =LOG(RC[-1]) -> #NUM!
A4385: 0 | B4385: =LOG(RC[-1]) -> #NUM!
A4386: 0 | B4386: =LOG(RC[-1]) -> #NUM!
A4387: 0 | B4387: =LOG(RC[-1]) -> #NUM!
A4388: 0 | B4388: =LOG(RC[-1]) -> #NUM!
A4389: 0 | B4389: =LOG(RC[-1]) -> #NUM!
A4390: 0 | B4390: =LOG(RC[-1]) -> #NUM!
A4391: 0 | B4391: =LOG(RC[-1]) -> #NUM!
A4392: 0 | B4392: =LOG(RC[-1]) -> #NUM!
A4393: 0 | B4393: =LOG(RC[-1]) -> #NUM!
A4394: 0 | B4394: =LOG(RC[-1]) -> #NUM!
A4395: 0 | B4395: =LOG(RC[-1]) -> #NUM!
A4396: 0 | B4396: =LOG(RC[-1]) -> #NUM!
A4397: 0 | B4397: =LOG(RC[-1]) -> #NUM!
A4398: 0 | B4398: =LOG(RC[-1]) -> #NUM!
A4399: 0 | B4399: =LOG(RC[-1]) -> #NUM!
A4400: 0 | B4400: =LOG(RC[-1]) -> #NUM!
A4401: 0 | B4401: =LOG(RC[-1]) -> #NUM!
A4402: 0 | B4402: =LOG(RC[-1]) -> #NUM!
A4403: 0 | B4403: =LOG(RC[-1]) -> #NUM!
A4404: 0 | B4404: =LOG(RC[-1]) -> #NUM!
A4405: 0 | B4405: =LOG(RC[-1]) -> #NUM!
A4406: 0 | B4406: =LOG(RC[-1]) -> #NUM!
A4407: 0 | B4407: =LOG(RC[-1]) -> #NUM!
A4408: 0 | B4408: =LOG(RC[-1]) -> #NUM!
A4409: 0 | B4409: =LOG(RC[-1]) -> #NUM!
A4410: 0 | B4410: =LOG(RC[-1]) -> #NUM!
A4411: 0 | B4411: =LOG(RC[-1]) -> #NUM!
A4412: 0 | B4412: =LOG(RC[-1]) -> #NUM!
A4413: 0 | B4413: =LOG(RC[-1]) -> #NUM!
A4414: 0 | B4414: =LOG(RC[-1]) -> #NUM!
A4415: 0 | B4415: =LOG(RC[-1]) -> #NUM!
A4416: 0 | B4416: =LOG(RC[-1]) -> #NUM!
A4417: 0 | B4417: =LOG(RC[-1]) -> #NUM!
A4418: 0 | B4418: =LOG(RC[-1]) -> #NUM!
A4419: 0 | B4419: =LOG(RC[-1]) -> #NUM!
A4420: 0 | B4420: =LOG(RC[-1]) -> #NUM!
A4421: 0 | B4421: =LOG(RC[-1]) -> #NUM!
A4422: 0 | B4422: =LOG(RC[-1]) -> #NUM!
A4423: 0 | B4423: =LOG(RC[-1]) -> #NUM!
A4424: 0 | B4424: =LOG(RC[-1]) -> #NUM!
A4425: 0 | B4425: =LOG(RC[-1]) -> #NUM!
A4426: 0 | B4426: =LOG(RC[-1]) -> #NUM!
A4427: 0 | B4427: =LOG(RC[-1]) -> #NUM!
A4428: 0 | B4428: =LOG(RC[-1]) -> #NUM!
A4429: 0 | B4429: =LOG(RC[-1]) -> #NUM!
A4430: 0 | B4430: =LOG(RC[-1]) -> #NUM!
A4431: 0 | B4431: =LOG(RC[-1]) -> #NUM!
A4432: 0 | B4432: =LOG(RC[-1]) -> #NUM!
A4433: 0 | B4433: =LOG(RC[-1]) -> #NUM!
A4434: 0 | B4434: =LOG(RC[-1]) -> #NUM!
A4435: 0 | B4435: =LOG(RC[-1]) -> #NUM!
A4436: 0 | B4436: =LOG(RC[-1]) -> #NUM!
A4437: 0 | B4437: =LOG(RC[-1]) -> #NUM!
A4438: 0 | B4438: =LOG(RC[-1]) -> #NUM!
A4439: 0 | B4439: =LOG(RC[-1]) -> #NUM!
A4440: 0 | B4440: =LOG(RC[-1]) -> #NUM!
A4441: 0 | B4441: =LOG(RC[-1]) -> #NUM!
A4442: 0 | B4442: =LOG(RC[-1]) -> #NUM!
A4443: 0 | B4443: =LOG(RC[-1]) -> #NUM!
A4444: 0 | B4444: =LOG(RC[-1]) -> #NUM!
A4445: 0 | B4445: =LOG(RC[-1]) -> #NUM!
A4446: 0 | B4446: =LOG(RC[-1]) -> #NUM!
A4447: 0 | B4447: =LOG(RC[-1]) -> #NUM!
A4448: 0 | B4448: =LOG(RC[-1]) -> #NUM!
A4449: 0 | B4449: =LOG(RC[-1]) -> #NUM!
A4450: 0 | B4450: =LOG(RC[-1]) -> #NUM!
A4451: 0 | B4451: =LOG(RC[-1]) -> #NUM!
A4452: 0 | B4452: =LOG(RC[-1]) -> #NUM!
A4453: 0 | B4453: =LOG(RC[-1]) -> #NUM!
A4454: 0 | B4454: =LOG(RC[-1]) -> #NUM!
A4455: 0 | B4455: =LOG(RC[-1]) -> #NUM!
A4456: 0 | B4456: =LOG(RC[-1]) -> #NUM!
A4457: 0 | B4457: =LOG(RC[-1]) -> #NUM!
A4458: 0 | B4458: =LOG(RC[-1]) -> #NUM!
A4459: 0 | B4459: =LOG(RC[-1]) -> #NUM!
A4460: 0 | B4460: =LOG(RC[-1]) -> #NUM!
A4461: 0 | B4461: =LOG(RC[-1]) -> #NUM!
A4462: 0 | B4462: =LOG(RC[-1]) -> #NUM!
A4463: 0 | B4463: =LOG(RC[-1]) -> #NUM!
A4464: 0 | B4464: =LOG(RC[-1]) -> #NUM!
A4465: 0 | B4465: =LOG(RC[-1]) -> #NUM!
A4466: 0 | B4466: =LOG(RC[-1]) -> #NUM!
A4467: 0 | B4467: =LOG(RC[-1]) -> #NUM!
A4468: 0 | B4468: =LOG(RC[-1]) -> #NUM!
A4469: 0 | B4469: =LOG(RC[-1]) -> #NUM!
A4470: 0 | B4470: =LOG(RC[-1]) -> #NUM!
A4471: 0 | B4471: =LOG(RC[-1]) -> #NUM!
A4472: 0 | B4472: =LOG(RC[-1]) -> #NUM!
A4473: 0 | B4473: =LOG(RC[-1]) -> #NUM!
A4474: 0 | B4474: =LOG(RC[-1]) -> #NUM!
A4475: 0 | B4475: =LOG(RC[-1]) -> #NUM!
A4476: 0 | B4476: =LOG(RC[-1]) -> #NUM!
A4477: 0 | B4477: =LOG(RC[-1]) -> #NUM!
A4478: 0 | B4478: =LOG(RC[-1]) -> #NUM!
A4479: 0 | B4479: =LOG(RC[-1]) -> #NUM!
A4480: 0 | B4480: =LOG(RC[-1]) -> #NUM!
A4481: 0 | B4481: =LOG(RC[-1]) -> #NUM!
A4482: 0 | B4482: =LOG(RC[-1]) -> #NUM!
A4483: 0 | B4483: =LOG(RC[-1]) -> #NUM!
A4484: 0 | B4484: =LOG(RC[-1]) -> #NUM!
A4485: 0 | B4485: =LOG(RC[-1]) -> #NUM!
A4486: 0 | B4486: =LOG(RC[-1]) -> #NUM!
A4487: 0 | B4487: =LOG(RC[-1]) -> #NUM!
A4488: 0 | B4488: =LOG(RC[-1]) -> #NUM!
A4489: 0 | B4489: =LOG(RC[-1]) -> #NUM!
A4490: 0 | B4490: =LOG(RC[-1]) -> #NUM!
A4491: 0 | B4491: =LOG(RC[-1]) -> #NUM!
A4492: 0 | B4492: =LOG(RC[-1]) -> #NUM!
A4493: 0 | B4493: =LOG(RC[-1]) -> #NUM!
A4494: 0 | B4494: =LOG(RC[-1]) -> #NUM!
A4495: 0 | B4495: =LOG(RC[-1]) -> #NUM!
A4496: 0 | B4496: =LOG(RC[-1]) -> #NUM!
A4497: 0 | B4497: =LOG(RC[-1]) -> #NUM!
A4498: 0 | B4498: =LOG(RC[-1]) -> #NUM!
A4499: 0 | B4499: =LOG(RC[-1]) -> #NUM!
A4500: 0 | B4500: =LOG(RC[-1]) -> #NUM!
A4501: 0 | B4501: =LOG(RC[-1]) -> #NUM!
A4502: 0 | B4502: =LOG(RC[-1]) -> #NUM!
A4503: 0 | B4503: =LOG(RC[-1]) -> #NUM!
A4504: 0 | B4504: =LOG(RC[-1]) -> #NUM!
A4505: 0 | B4505: =LOG(RC[-1]) -> #NUM!
A4506: 0 | B4506: =LOG(RC[-1]) -> #NUM!
A4507: 0 | B4507: =LOG(RC[-1]) -> #NUM!
A4508: 0 | B4508: =LOG(RC[-1]) -> #NUM!
A4509: 0 | B4509: =LOG(RC[-1]) -> #NUM!
A4510: 0 | B4510: =LOG(RC[-1]) -> #NUM!
A4511: 0 | B4511: =LOG(RC[-1]) -> #NUM!
A4512: 0 | B4512: =LOG(RC[-1]) -> #NUM!
A4513: 0 | B4513: =LOG(RC[-1]) -> #NUM!
A4514: 0 | B4514: =LOG(RC[-1]) -> #NUM!
A4515: 0 | B4515: =LOG(RC[-1]) -> #NUM!
A4516: 0 | B4516: =LOG(RC[-1]) -> #NUM!
A4517: 0 | B4517: =LOG(RC[-1]) -> #NUM!
A4518: 0 | B4518: =LOG(RC[-1]) -> #NUM!
A4519: 0 | B4519: =LOG(RC[-1]) -> #NUM!
A4520: 0 | B4520: =LOG(RC[-1]) -> #NUM!
A4521: 0 | B4521: =LOG(RC[-1]) -> #NUM!
A4522: 0 | B4522: =LOG(RC[-1]) -> #NUM!
A4523: 0 | B4523: =LOG(RC[-1]) -> #NUM!
A4524: 0 | B4524: =LOG(RC[-1]) -> #NUM!
A4525: 0 | B4525: =LOG(RC[-1]) -> #NUM!
A4526: 0 | B4526: =LOG(RC[-1]) -> #NUM!
A4527: 0 | B4527: =LOG(RC[-1]) -> #NUM!
A4528: 0 | B4528: =LOG(RC[-1]) -> #NUM!
A4529: 0 | B4529: =LOG(RC[-1]) -> #NUM!
A4530: 0 | B4530: =LOG(RC[-1]) -> #NUM!
A4531: 0 | B4531: =LOG(RC[-1]) -> #NUM!
A4532: 0 | B4532: =LOG(RC[-1]) -> #NUM!
A4533: 0 | B4533: =LOG(RC[-1]) -> #NUM!
A4534: 0 | B4534: =LOG(RC[-1]) -> #NUM!
A4535: 0 | B4535: =LOG(RC[-1]) -> #NUM!
A4536: 0 | B4536: =LOG(RC[-1]) -> #NUM!
A4537: 0 | B4537: =LOG(RC[-1]) -> #NUM!
A4538: 0 | B4538: =LOG(RC[-1]) -> #NUM!
A4539: 0 | B4539: =LOG(RC[-1]) -> #NUM!
A4540: 0 | B4540: =LOG(RC[-1]) -> #NUM!
A4541: 0 | B4541: =LOG(RC[-1]) -> #NUM!
A4542: 0 | B4542: =LOG(RC[-1]) -> #NUM!
A4543: 0 | B4543: =LOG(RC[-1]) -> #NUM!
A4544: 0 | B4544: =LOG(RC[-1]) -> #NUM!
A4545: 0 | B4545: =LOG(RC[-1]) -> #NUM!
A4546: 0 | B4546: =LOG(RC[-1]) -> #NUM!
A4547: 0 | B4547: =LOG(RC[-1]) -> #NUM!
A4548: 0 | B4548: =LOG(RC[-1]) -> #NUM!
A4549: 0 | B4549: =LOG(RC[-1]) -> #NUM!
A4550: 0 | B4550: =LOG(RC[-1]) -> #NUM!
A4551: 0 | B4551: =LOG(RC[-1]) -> #NUM!
A4552: 0 | B4552: =LOG(RC[-1]) -> #NUM!
A4553: 0 | B4553: =LOG(RC[-1]) -> #NUM!
A4554: 0 | B4554: =LOG(RC[-1]) -> #NUM!
A4555: 0 | B4555: =LOG(RC[-1]) -> #NUM!
A4556: 0 | B4556: =LOG(RC[-1]) -> #NUM!
A4557: 0 | B4557: =LOG(RC[-1]) -> #NUM!
A4558: 0 | B4558: =LOG(RC[-1]) -> #NUM!
A4559: 0 | B4559: =LOG(RC[-1]) -> #NUM!
A4560: 0 | B4560: =LOG(RC[-1]) -> #NUM!
A4561: 0 | B4561: =LOG(RC[-1]) -> #NUM!
A4562: 0 | B4562: =LOG(RC[-1]) -> #NUM!
A4563: 0 | B4563: =LOG(RC[-1]) -> #NUM!
A4564: 0 | B4564: =LOG(RC[-1]) -> #NUM!
A4565: 0 | B4565: =LOG(RC[-1]) -> #NUM!
A4566: 0 | B4566: =LOG(RC[-1]) -> #NUM!
A4567: 0 | B4567: =LOG(RC[-1]) -> #NUM!
A4568: 0 | B4568: =LOG(RC[-1]) -> #NUM!
A4569: 0 | B4569: =LOG(RC[-1]) -> #NUM!
A4570: 0 | B4570: =LOG(RC[-1]) -> #NUM!
A4571: 0 | B4571: =LOG(RC[-1]) -> #NUM!
A4572: 0 | B4572: =LOG(RC[-1]) -> #NUM!
A4573: 0 | B4573: =LOG(RC[-1]) -> #NUM!
A4574: 0 | B4574: =LOG(RC[-1]) -> #NUM!
A4575: 0 | B4575: =LOG(RC[-1]) -> #NUM!
A4576: 0 | B4576: =LOG(RC[-1]) -> #NUM!
A4577: 0 | B4577: =LOG(RC[-1]) -> #NUM!
A4578: 0 | B4578: =LOG(RC[-1]) -> #NUM!
A4579: 0 | B4579: =LOG(RC[-1]) -> #NUM!
A4580: 0 | B4580: =LOG(RC[-1]) -> #NUM!
A4581: 0 | B4581: =LOG(RC[-1]) -> #NUM!
A4582: 0 | B4582: =LOG(RC[-1]) -> #NUM!
A4583: 0 | B4583: =LOG(RC[-1]) -> #NUM!
A4584: 0 | B4584: =LOG(RC[-1]) -> #NUM!
A4585: 0 | B4585: =LOG(RC[-1]) -> #NUM!
A4586: 0 | B4586: =LOG(RC[-1]) -> #NUM!
A4587: 0 | B4587: =LOG(RC[-1]) -> #NUM!
A4588: 0 | B4588: =LOG(RC[-1]) -> #NUM!
A4589: 0 | B4589: =LOG(RC[-1]) -> #NUM!
A4590: 0 | B4590: =LOG(RC[-1]) -> #NUM!
A4591: 0 | B4591: =LOG(RC[-1]) -> #NUM!
A4592: 0 | B4592: =LOG(RC[-1]) -> #NUM!
A4593: 0 | B4593: =LOG(RC[-1]) -> #NUM!
A4594: 0 | B4594: =LOG(RC[-1]) -> #NUM!
A4595: 0 | B4595: =LOG(RC[-1]) -> #NUM!
A4596: 0 | B4596: =LOG(RC[-1]) -> #NUM!
A4597: 0 | B4597: =LOG(RC[-1]) -> #NUM!
A4598: 0 | B4598: =LOG(RC[-1]) -> #NUM!
A4599: 0 | B4599: =LOG(RC[-1]) -> #NUM!
A4600: 0 | B4600: =LOG(RC[-1]) -> #NUM!
A4601: 0 | B4601: =LOG(RC[-1]) -> #NUM!
A4602: 0 | B4602: =LOG(RC[-1]) -> #NUM!
A4603: 0 | B4603: =LOG(RC[-1]) -> #NUM!
A4604: 0 | B4604: =LOG(RC[-1]) -> #NUM!
A4605: 0 | B4605: =LOG(RC[-1]) -> #NUM!
A4606: 0 | B4606: =LOG(RC[-1]) -> #NUM!
A4607: 0 | B4607: =LOG(RC[-1]) -> #NUM!
A4608: 0 | B4608: =LOG(RC[-1]) -> #NUM!
A4609: 0 | B4609: =LOG(RC[-1]) -> #NUM!
A4610: 0 | B4610: =LOG(RC[-1]) -> #NUM!
A4611: 0 | B4611: =LOG(RC[-1]) -> #NUM!
A4612: 0 | B4612: =LOG(RC[-1]) -> #NUM!
A4613: 0 | B4613: =LOG(RC[-1]) -> #NUM!
A4614: 0 | B4614: =LOG(RC[-1]) -> #NUM!
A4615: 0 | B4615: =LOG(RC[-1]) -> #NUM!
A4616: 0 | B4616: =LOG(RC[-1]) -> #NUM!
A4617: 0 | B4617: =LOG(RC[-1]) -> #NUM!
A4618: 0 | B4618: =LOG(RC[-1]) -> #NUM!
A4619: 0 | B4619: =LOG(RC[-1]) -> #NUM!
A4620: 0 | B4620: =LOG(RC[-1]) -> #NUM!
A4621: 0 | B4621: =LOG(RC[-1]) -> #NUM!
A4622: 0 | B4622: =LOG(RC[-1]) -> #NUM!
A4623: 0 | B4623: =LOG(RC[-1]) -> #NUM!
A4624: 0 | B4624: =LOG(RC[-1]) -> #NUM!
A4625: 0 | B4625: =LOG(RC[-1]) -> #NUM!
A4626: 0 | B4626: =LOG(RC[-1]) -> #NUM!
A4627: 0 | B4627: =LOG(RC[-1]) -> #NUM!
A4628: 0 | B4628: =LOG(RC[-1]) -> #NUM!
A4629: 0 | B4629: =LOG(RC[-1]) -> #NUM!
A4630: 0 | B4630: =LOG(RC[-1]) -> #NUM!
A4631: 0 | B4631: =LOG(RC[-1]) -> #NUM!
A4632: 0 | B4632: =LOG(RC[-1]) -> #NUM!
A4633: 0 | B4633: =LOG(RC[-1]) -> #NUM!
A4634: 0 | B4634: =LOG(RC[-1]) -> #NUM!
A4635: 0 | B4635: =LOG(RC[-1]) -> #NUM!
A4636: 0 | B4636: =LOG(RC[-1]) -> #NUM!
A4637: 0 | B4637: =LOG(RC[-1]) -> #NUM!
A4638: 0 | B4638: =LOG(RC[-1]) -> #NUM!
A4639: 0 | B4639: =LOG(RC[-1]) -> #NUM!
A4640: 0 | B4640: =LOG(RC[-1]) -> #NUM!
A4641: 0 | B4641: =LOG(RC[-1]) -> #NUM!
A4642: 0 | B4642: =LOG(RC[-1]) -> #NUM!
A4643: 0 | B4643: =LOG(RC[-1]) -> #NUM!
A4644: 0 | B4644: =LOG(RC[-1]) -> #NUM!
A4645: 0 | B4645: =LOG(RC[-1]) -> #NUM!
A4646: 0 | B4646: =LOG(RC[-1]) -> #NUM!
A4647: 0 | B4647: =LOG(RC[-1]) -> #NUM!
A4648: 0 | B4648: =LOG(RC[-1]) -> #NUM!
A4649: 0 | B4649: =LOG(RC[-1]) -> #NUM!
A4650: 0 | B4650: =LOG(RC[-1]) -> #NUM!
A4651: 0 | B4651: =LOG(RC[-1]) -> #NUM!
A4652: 0 | B4652: =LOG(RC[-1]) -> #NUM!
A4653: 0 | B4653: =LOG(RC[-1]) -> #NUM!
A4654: 0 | B4654: =LOG(RC[-1]) -> #NUM!
A4655: 0 | B4655: =LOG(RC[-1]) -> #NUM!
A4656: 0 | B4656: =LOG(RC[-1]) -> #NUM!
A4657: 0 | B4657: =LOG(RC[-1]) -> #NUM!
A4658: 0 | B4658: =LOG(RC[-1]) -> #NUM!
A4659: 0 | B4659: =LOG(RC[-1]) -> #NUM!
A4660: 0 | B4660: =LOG(RC[-1]) -> #NUM!
A4661: 0 | B4661: =LOG(RC[-1]) -> #NUM!
A4662: 0 | B4662: =LOG(RC[-1]) -> #NUM!
A4663: 0 | B4663: =LOG(RC[-1]) -> #NUM!
A4664: 0 | B4664: =LOG(RC[-1]) -> #NUM!
A4665: 0 | B4665: =LOG(RC[-1]) -> #NUM!
A4666: 0 | B4666: =LOG(RC[-1]) -> #NUM!
A4667: 0 | B4667: =LOG(RC[-1]) -> #NUM!
A4668: 0 | B4668: =LOG(RC[-1]) -> #NUM!
A4669: 0 | B4669: =LOG(RC[-1]) -> #NUM!
A4670: 0 | B4670: =LOG(RC[-1]) -> #NUM!
A4671: 0 | B4671: =LOG(RC[-1]) -> #NUM!
A4672: 0 | B4672: =LOG(RC[-1]) -> #NUM!
A4673: 0 | B4673: =LOG(RC[-1]) -> #NUM!
A4674: 0 | B4674: =LOG(RC[-1]) -> #NUM!
A4675: 0 | B4675: =LOG(RC[-1]) -> #NUM!
A4676: 0 | B4676: =LOG(RC[-1]) -> #NUM!
A4677: 0 | B4677: =LOG(RC[-1]) -> #NUM!
A4678: 0 | B4678: =LOG(RC[-1]) -> #NUM!
A4679: 0 | B4679: =LOG(RC[-1]) -> #NUM!
A4680: 0 | B4680: =LOG(RC[-1]) -> #NUM!
A4681: 0 | B4681: =LOG(RC[-1]) -> #NUM!
A4682: 0 | B4682: =LOG(RC[-1]) -> #NUM!
A4683: 0 | B4683: =LOG(RC[-1]) -> #NUM!
A4684: 0 | B4684: =LOG(RC[-1]) -> #NUM!
A4685: 0 | B4685: =LOG(RC[-1]) -> #NUM!
A4686: 0 | B4686: =LOG(RC[-1]) -> #NUM!
A4687: 0 | B4687: =LOG(RC[-1]) -> #NUM!
A4688: 0 | B4688: =LOG(RC[-1]) -> #NUM!
A4689: 0 | B4689: =LOG(RC[-1]) -> #NUM!
A4690: 0 | B4690: =LOG(RC[-1]) -> #NUM!
A4691: 0 | B4691: =LOG(RC[-1]) -> #NUM!
A4692: 0 | B4692: =LOG(RC[-1]) -> #NUM!
A4693: 0 | B4693: =LOG(RC[-1]) -> #NUM!
A4694: 0 | B4694: =LOG(RC[-1]) -> #NUM!
A4695: 0 | B4695: =LOG(RC[-1]) -> #NUM!
A4696: 0 | B4696: =LOG(RC[-1]) -> #NUM!
A4697: 0 | B4697: =LOG(RC[-1]) -> #NUM!
A4698: 0 | B4698: =LOG(RC[-1]) -> #NUM!
A4699: 0 | B4699: =LOG(RC[-1]) -> #NUM!
A4700: 0 | B4700: =LOG(RC[-1]) -> #NUM!
A4701: 0 | B4701: =LOG(RC[-1]) -> #NUM!
A4702: 0 | B4702: =LOG(RC[-1]) -> #NUM!
A4703: 0 | B4703: =LOG(RC[-1]) -> #NUM!
A4704: 0 | B4704: =LOG(RC[-1]) -> #NUM!
A4705: 0 | B4705: =LOG(RC[-1]) -> #NUM!
A4706: 0 | B4706: =LOG(RC[-1]) -> #NUM!
A4707: 0 | B4707: =LOG(RC[-1]) -> #NUM!
A4708: 0 | B4708: =LOG(RC[-1]) -> #NUM!
A4709: 0 | B4709: =LOG(RC[-1]) -> #NUM!
A4710: 0 | B4710: =LOG(RC[-1]) -> #NUM!
A4711: 0 | B4711: =LOG(RC[-1]) -> #NUM!
A4712: 0 | B4712: =LOG(RC[-1]) -> #NUM!
A4713: 0 | B4713: =LOG(RC[-1]) -> #NUM!
A4714: 0 | B4714: =LOG(RC[-1]) -> #NUM!
A4715: 0 | B4715: =LOG(RC[-1]) -> #NUM!
A4716: 0 | B4716: =LOG(RC[-1]) -> #NUM!
A4717: 0 | B4717: =LOG(RC[-1]) -> #NUM!
A4718: 0 | B4718: =LOG(RC[-1]) -> #NUM!
A4719: 0 | B4719: =LOG(RC[-1]) -> #NUM!
A4720: 0 | B4720: =LOG(RC[-1]) -> #NUM!
A4721: 0 | B4721: =LOG(RC[-1]) -> #NUM!
A4722: 0 | B4722: =LOG(RC[-1]) -> #NUM!
A4723: 0 | B4723: =LOG(RC[-1]) -> #NUM!
A4724: 0 | B4724: =LOG(RC[-1]) -> #NUM!
A4725: 0 | B4725: =LOG(RC[-1]) -> #NUM!
A4726: 0 | B4726: =LOG(RC[-1]) -> #NUM!
A4727: 0 | B4727: =LOG(RC[-1]) -> #NUM!
A4728: 0 | B4728: =LOG(RC[-1]) -> #NUM!
A4729: 0 | B4729: =LOG(RC[-1]) -> #NUM!
A4730: 0 | B4730: =LOG(RC[-1]) -> #NUM!
A4731: 0 | B4731: =LOG(RC[-1]) -> #NUM!
A4732: 0 | B4732: =LOG(RC[-1]) -> #NUM!
A4733: 0 | B4733: =LOG(RC[-1]) -> #NUM!
A4734: 0 | B4734: =LOG(RC[-1]) -> #NUM!
A4735: 0 | B4735: =LOG(RC[-1]) -> #NUM!
A4736: 0 | B4736: =LOG(RC[-1]) -> #NUM!
A4737: 0 | B4737: =LOG(RC[-1]) -> #NUM!
A4738: 0 | B4738: =LOG(RC[-1]) -> #NUM!
A4739: 0 | B4739: =LOG(RC[-1]) -> #NUM!
A4740: 0 | B4740: =LOG(RC[-1]) -> #NUM!
A4741: 0 | B4741: =LOG(RC[-1]) -> #NUM!
A4742: 0 | B4742: =LOG(RC[-1]) -> #NUM!
A4743: 0 | B4743: =LOG(RC[-1]) -> #NUM!
A4744: 0 | B4744: =LOG(RC[-1]) -> #NUM!
A4745: 0 | B4745: =LOG(RC[-1]) -> #NUM!
A4746: 0 | B4746: =LOG(RC[-1]) -> #NUM!
A4747: 0 | B4747: =LOG(RC[-1]) -> #NUM!
A4748: 0 | B4748: =LOG(RC[-1]) -> #NUM!
A4749: 0 | B4749: =LOG(RC[-1]) -> #NUM!
A4750: 0 | B4750: =LOG(RC[-1]) -> #NUM!
A4751: 0 | B4751: =LOG(RC[-1]) -> #NUM!
A4752: 0 | B4752: =LOG(RC[-1]) -> #NUM!
A4753: 0 | B4753: =LOG(RC[-1]) -> #NUM!
A4754: 0 | B4754: =LOG(RC[-1]) -> #NUM!
A4755: 0 | B4755: =LOG(RC[-1]) -> #NUM!
A4756: 0 | B4756: =LOG(RC[-1]) -> #NUM!
A4757: 0 | B4757: =LOG(RC[-1]) -> #NUM!
A4758: 0 | B4758: =LOG(RC[-1]) -> #NUM!
A4759: 0 | B4759: =LOG(RC[-1]) -> #NUM!
A4760: 0 | B4760: =LOG(RC[-1]) -> #NUM!
A4761: 0 | B4761: =LOG(RC[-1]) -> #NUM!
A4762: 0 | B4762: =LOG(RC[-1]) -> #NUM!
A4763: 0 | B4763: =LOG(RC[-1]) -> #NUM!
A4764: 0 | B4764: =LOG(RC[-1]) -> #NUM!
A4765: 0 | B4765: =LOG(RC[-1]) -> #NUM!
A4766: 0 | B4766: =LOG(RC[-1]) -> #NUM!
A4767: 0 | B4767: =LOG(RC[-1]) -> #NUM!
A4768: 0 | B4768: =LOG(RC[-1]) -> #NUM!
A4769: 0 | B4769: =LOG(RC[-1]) -> #NUM!
A4770: 0 | B4770: =LOG(RC[-1]) -> #NUM!
A4771: 0 | B4771: =LOG(RC[-1]) -> #NUM!
A4772: 0 | B4772: =LOG(RC[-1]) -> #NUM!
A4773: 0 | B4773: =LOG(RC[-1]) -> #NUM!
A4774: 0 | B4774: =LOG(RC[-1]) -> #NUM!
A4775: 0 | B4775: =LOG(RC[-1]) -> #NUM!
A4776: 0 | B4776: =LOG(RC[-1]) -> #NUM!
A4777: 0 | B4777: =LOG(RC[-1]) -> #NUM!
A4778: 0 | B4778: =LOG(RC[-1]) -> #NUM!
A4779: 0 | B4779: =LOG(RC[-1]) -> #NUM!
A4780: 0 | B4780: =LOG(RC[-1]) -> #NUM!
A4781: 0 | B4781: =LOG(RC[-1]) -> #NUM!
A4782: 0 | B4782: =LOG(RC[-1]) -> #NUM!
A4783: 0 | B4783: =LOG(RC[-1]) -> #NUM!
A4784: 0 | B4784: =LOG(RC[-1]) -> #NUM!
A4785: 0 | B4785: =LOG(RC[-1]) -> #NUM!
A4786: 0 | B4786: =LOG(RC[-1]) -> #NUM!
A4787: 0 | B4787: =LOG(RC[-1]) -> #NUM!
A4788: 0 | B4788: =LOG(RC[-1]) -> #NUM!
A4789: 0 | B4789: =LOG(RC[-1]) -> #NUM!
A4790: 0 | B4790: =LOG(RC[-1]) -> #NUM!
A4791: 0 | B4791: =LOG(RC[-1]) -> #NUM!
A4792: 0 | B4792: =LOG(RC[-1]) -> #NUM!
A4793: 0 | B4793: =LOG(RC[-1]) -> #NUM!
A4794: 0 | B4794: =LOG(RC[-1]) -> #NUM!
A4795: 0 | B4795: =LOG(RC[-1]) -> #NUM!
A4796: 0 | B4796: =LOG(RC[-1]) -> #NUM!
A4797: 0 | B4797: =LOG(RC[-1]) -> #NUM!
A4798: 0 | B4798: =LOG(RC[-1]) -> #NUM!
A4799: 0 | B4799: =LOG(RC[-1]) -> #NUM!
A4800: 0 | B4800: =LOG(RC[-1]) -> #NUM!
A4801: 0 | B4801: =LOG(RC[-1]) -> #NUM!
A4802: 0 | B4802: =LOG(RC[-1]) -> #NUM!
A4803: 0 | B4803: =LOG(RC[-1]) -> #NUM!
A4804: 0 | B4804: =LOG(RC[-1]) -> #NUM!
A4805: 0 | B4805: =LOG(RC[-1]) -> #NUM!
A4806: 0 | B4806: =LOG(RC[-1]) -> #NUM!
A4807: 0 | B4807: =LOG(RC[-1]) -> #NUM!
A4808: 0 | B4808: =LOG(RC[-1]) -> #NUM!
A4809: 0 | B4809: =LOG(RC[-1]) -> #NUM!
A4810: 0 | B4810: =LOG(RC[-1]) -> #NUM!
A4811: 0 | B4811: =LOG(RC[-1]) -> #NUM!
A4812: 0 | B4812: =LOG(RC[-1]) -> #NUM!
A4813: 0 | B4813: =LOG(RC[-1]) -> #NUM!
A4814: 0 | B4814: =LOG(RC[-1]) -> #NUM!
A4815: 0 | B4815: =LOG(RC[-1]) -> #NUM!
A4816: 0 | B4816: =LOG(RC[-1]) -> #NUM!
A4817: 0 | B4817: =LOG(RC[-1]) -> #NUM!
A4818: 0 | B4818: =LOG(RC[-1]) -> #NUM!
A4819: 0 | B4819: =LOG(RC[-1]) -> #NUM!
A4820: 0 | B4820: =LOG(RC[-1]) -> #NUM!
A4821: 0 | B4821: =LOG(RC[-1]) -> #NUM!
A4822: 0 | B4822: =LOG(RC[-1]) -> #NUM!
A4823: 0 | B4823: =LOG(RC[-1]) -> #NUM!
A4824: 0 | B4824: =LOG(RC[-1]) -> #NUM!
A4825: 0 | B4825: =LOG(RC[-1]) -> #NUM!
A4826: 0 | B4826: =LOG(RC[-1]) -> #NUM!
A4827: 0 | B4827: =LOG(RC[-1]) -> #NUM!
A4828: 0 | B4828: =LOG(RC[-1]) -> #NUM!
A4829: 0 | B4829: =LOG(RC[-1]) -> #NUM!
A4830: 0 | B4830: =LOG(RC[-1]) -> #NUM!
A4831: 0 | B4831: =LOG(RC[-1]) -> #NUM!
A4832: 0 | B4832: =LOG(RC[-1]) -> #NUM!
A4833: 0 | B4833: =LOG(RC[-1]) -> #NUM!
A4834: 0 | B4834: =LOG(RC[-1]) -> #NUM!
A4835: 0 | B4835: =LOG(RC[-1]) -> #NUM!
A4836: 0 | B4836: =LOG(RC[-1]) -> #NUM!
A4837: 0 | B4837: =LOG(RC[-1]) -> #NUM!
A4838: 0 | B4838: =LOG(RC[-1]) -> #NUM!
A4839: 0 | B4839: =LOG(RC[-1]) -> #NUM!
A4840: 0 | B4840: =LOG(RC[-1]) -> #NUM!
A4841: 0 | B4841: =LOG(RC[-1]) -> #NUM!
A4842: 0 | B4842: =LOG(RC[-1]) -> #NUM!
A4843: 0 | B4843: =LOG(RC[-1]) -> #NUM!
A4844: 0 | B4844: =LOG(RC[-1]) -> #NUM!
A4845: 0 | B4845: =LOG(RC[-1]) -> #NUM!
A4846: 0 | B4846: =LOG(RC[-1]) -> #NUM!
A4847: 0 | B4847: =LOG(RC[-1]) -> #NUM!
A4848: 0 | B4848: =LOG(RC[-1]) -> #NUM!
A4849: 0 | B4849: =LOG(RC[-1]) -> #NUM!
A4850: 0 | B4850: =LOG(RC[-1]) -> #NUM!
A4851: 0 | B4851: =LOG(RC[-1]) -> #NUM!
A4852: 0 | B4852: =LOG(RC[-1]) -> #NUM!
A4853: 0 | B4853: =LOG(RC[-1]) -> #NUM!
A4854: 0 | B4854: =LOG(RC[-1]) -> #NUM!
A4855: 0 | B4855: =LOG(RC[-1]) -> #NUM!
A4856: 0 | B4856: =LOG(RC[-1]) -> #NUM!
A4857: 0 | B4857: =LOG(RC[-1]) -> #NUM!
A4858: 0 | B4858: =LOG(RC[-1]) -> #NUM!
A4859: 0 | B4859: =LOG(RC[-1]) -> #NUM!
A4860: 0 | B4860: =LOG(RC[-1]) -> #NUM!
A4861: 0 | B4861: =LOG(RC[-1]) -> #NUM!
A4862: 0 | B4862: =LOG(RC[-1]) -> #NUM!
A4863: 0 | B4863: =LOG(RC[-1]) -> #NUM!
A4864: 0 | B4864: =LOG(RC[-1]) -> #NUM!
A4865: 0 | B4865: =LOG(RC[-1]) -> #NUM!
A4866: 0 | B4866: =LOG(RC[-1]) -> #NUM!
A4867: 0 | B4867: =LOG(RC[-1]) -> #NUM!
A4868: 0 | B4868: =LOG(RC[-1]) -> #NUM!
A4869: 0 | B4869: =LOG(RC[-1]) -> #NUM!
A4870: 0 | B4870: =LOG(RC[-1]) -> #NUM!
A4871: 0 | B4871: =LOG(RC[-1]) -> #NUM!
A4872: 0 | B4872: =LOG(RC[-1]) -> #NUM!
A4873: 0 | B4873: =LOG(RC[-1]) -> #NUM!
A4874: 0 | B4874: =LOG(RC[-1]) -> #NUM!
A4875: 0 | B4875: =LOG(RC[-1]) -> #NUM!
A4876: 0 | B4876: =LOG(RC[-1]) -> #NUM!
A4877: 0 | B4877: =LOG(RC[-1]) -> #NUM!
A4878: 0 | B4878: =LOG(RC[-1]) -> #NUM!
A4879: 0 | B4879: =LOG(RC[-1]) -> #NUM!
A4880: 0 | B4880: =LOG(RC[-1]) -> #NUM!
A4881: 0 | B4881: =LOG(RC[-1]) -> #NUM!
A4882: 0 | B4882: =LOG(RC[-1]) -> #NUM!
A4883: 0 | B4883: =LOG(RC[-1]) -> #NUM!
A4884: 0 | B4884: =LOG(RC[-1]) -> #NUM!
A4885: 0 | B4885: =LOG(RC[-1]) -> #NUM!
A4886: 0 | B4886: =LOG(RC[-1]) -> #NUM!
A4887: 0 | B4887: =LOG(RC[-1]) -> #NUM!
A4888: 0 | B4888: =LOG(RC[-1]) -> #NUM!
A4889: 0 | B4889: =LOG(RC[-1]) -> #NUM!
A4890: 0 | B4890: =LOG(RC[-1]) -> #NUM!
A4891: 0 | B4891: =LOG(RC[-1]) -> #NUM!
A4892: 0 | B4892: =LOG(RC[-1]) -> #NUM!
A4893: 0 | B4893: =LOG(RC[-1]) -> #NUM!
A4894: 0 | B4894: =LOG(RC[-1]) -> #NUM!
A4895: 0 | B4895: =LOG(RC[-1]) -> #NUM!
A4896: 0 | B4896: =LOG(RC[-1]) -> #NUM!
A4897: 0 | B4897: =LOG(RC[-1]) -> #NUM!
A4898: 0 | B4898: =LOG(RC[-1]) -> #NUM!
A4899: 0 | B4899: =LOG(RC[-1]) -> #NUM!
A4900: 0 | B4900: =LOG(RC[-1]) -> #NUM!
A4901: 0 | B4901: =LOG(RC[-1]) -> #NUM!
A4902: 0 | B4902: =LOG(RC[-1]) -> #NUM!
A4903: 0 | B4903: =LOG(RC[-1]) -> #NUM!
A4904: 0 | B4904: =LOG(RC[-1]) -> #NUM!
A4905: 0 | B4905: =LOG(RC[-1]) -> #NUM!
A4906: 0 | B4906: =LOG(RC[-1]) -> #NUM!
A4907: 0 | B4907: =LOG(RC[-1]) -> #NUM!
A4908: 0 | B4908: =LOG(RC[-1]) -> #NUM!
A4909: 0 | B4909: =LOG(RC[-1]) -> #NUM!
A4910: 0 | B4910: =LOG(RC[-1]) -> #NUM!
A4911: 0 | B4911: =LOG(RC[-1]) -> #NUM!
A4912: 0 | B4912: =LOG(RC[-1]) -> #NUM!
A4913: 0 | B4913: =LOG(RC[-1]) -> #NUM!
A4914: 0 | B4914: =LOG(RC[-1]) -> #NUM!
A4915: 0 | B4915: =LOG(RC[-1]) -> #NUM!
A4916: 0 | B4916: =LOG(RC[-1]) -> #NUM!
A4917: 0 | B4917: =LOG(RC[-1]) -> #NUM!
A4918: 0 | B4918: =LOG(RC[-1]) -> #NUM!
A4919: 0 | B4919: =LOG(RC[-1]) -> #NUM!
A4920: 0 | B4920: =LOG(RC[-1]) -> #NUM!
A4921: 0 | B4921: =LOG(RC[-1]) -> #NUM!
A4922: 0 | B4922: =LOG(RC[-1]) -> #NUM!
A4923: 0 | B4923: =LOG(RC[-1]) -> #NUM!
A4924: 0 | B4924: =LOG(RC[-1]) -> #NUM!
A4925: 0 | B4925: =LOG(RC[-1]) -> #NUM!
A4926: 0 | B4926: =LOG(RC[-1]) -> #NUM!
A4927: 0 | B4927: =LOG(RC[-1]) -> #NUM!
A4928: 0 | B4928: =LOG(RC[-1]) -> #NUM!
A4929: 0 | B4929: =LOG(RC[-1]) -> #NUM!
A4930: 0 | B4930: =LOG(RC[-1]) -> #NUM!
A4931: 0 | B4931: =LOG(RC[-1]) -> #NUM!
A4932: 0 | B4932: =LOG(RC[-1]) -> #NUM!
A4933: 0 | B4933: =LOG(RC[-1]) -> #NUM!
A4934: 0 | B4934: =LOG(RC[-1]) -> #NUM!
A4935: 0 | B4935: =LOG(RC[-1]) -> #NUM!
A4936: 0 | B4936: =LOG(RC[-1]) -> #NUM!
A4937: 0 | B4937: =LOG(RC[-1]) -> #NUM!
A4938: 0 | B4938: =LOG(RC[-1]) -> #NUM!
A4939: 0 | B4939: =LOG(RC[-1]) -> #NUM!
A4940: 0 | B4940: =LOG(RC[-1]) -> #NUM!
A4941: 0 | B4941: =LOG(RC[-1]) -> #NUM!
A4942: 0 | B4942: =LOG(RC[-1]) -> #NUM!
A4943: 0 | B4943: =LOG(RC[-1]) -> #NUM!
A4944: 0 | B4944: =LOG(RC[-1]) -> #NUM!
A4945: 0 | B4945: =LOG(RC[-1]) -> #NUM!
A4946: 0 | B4946: =LOG(RC[-1]) -> #NUM!
A4947: 0 | B4947: =LOG(RC[-1]) -> #NUM!
A4948: 0 | B4948: =LOG(RC[-1]) -> #NUM!
A4949: 0 | B4949: =LOG(RC[-1]) -> #NUM!
A4950: 0 | B4950: =LOG(RC[-1]) -> #NUM!
A4951: 0 | B4951: =LOG(RC[-1]) -> #NUM!
A4952: 0 | B4952: =LOG(RC[-1]) -> #NUM!
A4953: 0 | B4953: =LOG(RC[-1]) -> #NUM!
A4954: 0 | B4954: =LOG(RC[-1]) -> #NUM!
A4955: 0 | B4955: =LOG(RC[-1]) -> #NUM!
A4956: 0 | B4956: =LOG(RC[-1]) -> #NUM!
A4957: 0 | B4957: =LOG(RC[-1]) -> #NUM!
A4958: 0 | B4958: =LOG(RC[-1]) -> #NUM!
A4959: 0 | B4959: =LOG(RC[-1]) -> #NUM!
A4960: 0 | B4960: =LOG(RC[-1]) -> #NUM!
A4961: 0 | B4961: =LOG(RC[-1]) -> #NUM!
A4962: 0 | B4962: =LOG(RC[-1]) -> #NUM!
A4963: 0 | B4963: =LOG(RC[-1]) -> #NUM!
A4964: 0 | B4964: =LOG(RC[-1]) -> #NUM!
A4965: 0 | B4965: =LOG(RC[-1]) -> #NUM!
A4966: 0 | B4966: =LOG(RC[-1]) -> #NUM!
A4967: 0 | B4967: =LOG(RC[-1]) -> #NUM!
A4968: 0 | B4968: =LOG(RC[-1]) -> #NUM!
A4969: 0 | B4969: =LOG(RC[-1]) -> #NUM!
A4970: 0 | B4970: =LOG(RC[-1]) -> #NUM!
A4971: 0 | B4971: =LOG(RC[-1]) -> #NUM!
A4972: 0 | B4972: =LOG(RC[-1]) -> #NUM!
A4973: 0 | B4973: =LOG(RC[-1]) -> #NUM!
A4974: 0 | B4974: =LOG(RC[-1]) -> #NUM!
A4975: 0 | B4975: =LOG(RC[-1]) -> #NUM!
A4976: 0 | B4976: =LOG(RC[-1]) -> #NUM!
A4977: 0 | B4977: =LOG(RC[-1]) -> #NUM!
A4978: 0 | B4978: =LOG(RC[-1]) -> #NUM!
A4979: 0 | B4979: =LOG(RC[-1]) -> #NUM!
A4980: 0 | B4980: =LOG(RC[-1]) -> #NUM!
A4981: 0 | B4981: =LOG(RC[-1]) -> #NUM!
A4982: 0 | B4982: =LOG(RC[-1]) -> #NUM!
A4983: 0 | B4983: =LOG(RC[-1]) -> #NUM!
A4984: 0 | B4984: =LOG(RC[-1]) -> #NUM!
A4985: 0 | B4985: =LOG(RC[-1]) -> #NUM!
A4986: 0 | B4986: =LOG(RC[-1]) -> #NUM!
A4987: 0 | B4987: =LOG(RC[-1]) -> #NUM!
A4988: 0 | B4988: =LOG(RC[-1]) -> #NUM!
A4989: 0 | B4989: =LOG(RC[-1]) -> #NUM!
A4990: 0 | B4990: =LOG(RC[-1]) -> #NUM!
A4991: 0 | B4991: =LOG(RC[-1]) -> #NUM!
A4992: 0 | B4992: =LOG(RC[-1]) -> #NUM!
A4993: 0 | B4993: =LOG(RC[-1]) -> #NUM!
A4994: 0 | B4994: =LOG(RC[-1]) -> #NUM!
A4995: 0 | B4995: =LOG(RC[-1]) -> #NUM!
A4996: 0 | B4996: =LOG(RC[-1]) -> #NUM!
A4997: 0 | B4997: =LOG(RC[-1]) -> #NUM!
A4998: 0 | B4998: =LOG(RC[-1]) -> #NUM!
A4999: 0 | B4999: =LOG(RC[-1]) -> #NUM!
A5000: 0 | B5000: =LOG(RC[-1]) -> #NUM!
A5001: 0 | B5001: =LOG(RC[-1]) -> #NUM!
A5002: 0 | B5002: =LOG(RC[-1]) -> #NUM!
A5003: 0 | B5003: =LOG(RC[-1]) -> #NUM!
A5004: 0 | B5004: =LOG(RC[-1]) -> #NUM!
A5005: 0 | B5005: =LOG(RC[-1]) -> #NUM!
A5006: 0 | B5006: =LOG(RC[-1]) -> #NUM!
A5007: 0 | B5007: =LOG(RC[-1]) -> #NUM!
A5008: 0 | B5008: =LOG(RC[-1]) -> #NUM!
A5009: 0 | B5009: =LOG(RC[-1]) -> #NUM!
A5010: 0 | B5010: =LOG(RC[-1]) -> #NUM!
A5011: 0 | B5011: =LOG(RC[-1]) -> #NUM!
A5012: 0 | B5012: =LOG(RC[-1]) -> #NUM!
A5013: 0 | B5013: =LOG(RC[-1]) -> #NUM!
A5014: 0 | B5014: =LOG(RC[-1]) -> #NUM!
A5015: 0 | B5015: =LOG(RC[-1]) -> #NUM!
A5016: 0 | B5016: =LOG(RC[-1]) -> #NUM!
A5017: 0 | B5017: =LOG(RC[-1]) -> #NUM!
A5018: 0 | B5018: =LOG(RC[-1]) -> #NUM!
A5019: 0 | B5019: =LOG(RC[-1]) -> #NUM!
A5020: 0 | B5020: =LOG(RC[-1]) -> #NUM!
A5021: 0 | B5021: =LOG(RC[-1]) -> #NUM!
A5022: 0 | B5022: =LOG(RC[-1]) -> #NUM!
A5023: 0 | B5023: =LOG(RC[-1]) -> #NUM!
A5024: 0 | B5024: =LOG(RC[-1]) -> #NUM!
A5025: 0 | B5025: =LOG(RC[-1]) -> #NUM!
A5026: 0 | B5026: =LOG(RC[-1]) -> #NUM!
A5027: 0 | B5027: =LOG(RC[-1]) -> #NUM!
A5028: 0 | B5028: =LOG(RC[-1]) -> #NUM!
A5029: 0 | B5029: =LOG(RC[-1]) -> #NUM!
A5030: 0 | B5030: =LOG(RC[-1]) -> #NUM!
A5031: 0 | B5031: =LOG(RC[-1]) -> #NUM!
A5032: 0 | B5032: =LOG(RC[-1]) -> #NUM!
A5033: 0 | B5033: =LOG(RC[-1]) -> #NUM!
A5034: 0 | B5034: =LOG(RC[-1]) -> #NUM!
A5035: 0 | B5035: =LOG(RC[-1]) -> #NUM!
A5036: 0 | B5036: =LOG(RC[-1]) -> #NUM!
A5037: 0 | B5037: =LOG(RC[-1]) -> #NUM!
A5038: 0 | B5038: =LOG(RC[-1]) -> #NUM!
A5039: 0 | B5039: =LOG(RC[-1]) -> #NUM!
A5040: 0 | B5040: =LOG(RC[-1]) -> #NUM!
A5041: 0 | B5041: =LOG(RC[-1]) -> #NUM!
A5042: 0 | B5042: =LOG(RC[-1]) -> #NUM!
A5043: 0 | B5043: =LOG(RC[-1]) -> #NUM!
A5044: 0 | B5044: =LOG(RC[-1]) -> #NUM!
A5045: 0 | B5045: =LOG(RC[-1]) -> #NUM!
A5046: 0 | B5046: =LOG(RC[-1]) -> #NUM!
A5047: 0 | B5047: =LOG(RC[-1]) -> #NUM!
A5048: 0 | B5048: =LOG(RC[-1]) -> #NUM!
A5049: 0 | B5049: =LOG(RC[-1]) -> #NUM!
A5050: 0 | B5050: =LOG(RC[-1]) -> #NUM!
A5051: 0 | B5051: =LOG(RC[-1]) -> #NUM!
A5052: 0 | B5052: =LOG(RC[-1]) -> #NUM!
A5053: 0 | B5053: =LOG(RC[-1]) -> #NUM!
A5054: 0 | B5054: =LOG(RC[-1]) -> #NUM!
A5055: 0 | B5055: =LOG(RC[-1]) -> #NUM!
A5056: 0 | B5056: =LOG(RC[-1]) -> #NUM!
A5057: 0 | B5057: =LOG(RC[-1]) -> #NUM!
A5058: 0 | B5058: =LOG(RC[-1]) -> #NUM!
A5059: 0 | B5059: =LOG(RC[-1]) -> #NUM!
A5060: 0 | B5060: =LOG(RC[-1]) -> #NUM!
A5061: 0 | B5061: =LOG(RC[-1]) -> #NUM!
A5062: 0 | B5062: =LOG(RC[-1]) -> #NUM!
A5063: 0 | B5063: =LOG(RC[-1]) -> #NUM!
A5064: 0 | B5064: =LOG(RC[-1]) -> #NUM!
A5065: 0 | B5065: =LOG(RC[-1]) -> #NUM!
A5066: 0 | B5066: =LOG(RC[-1]) -> #NUM!
A5067: 0 | B5067: =LOG(RC[-1]) -> #NUM!
A5068: 0 | B5068: =LOG(RC[-1]) -> #NUM!
A5069: 0 | B5069: =LOG(RC[-1]) -> #NUM!
A5070: 0 | B5070: =LOG(RC[-1]) -> #NUM!
A5071: 0 | B5071: =LOG(RC[-1]) -> #NUM!
A5072: 0 | B5072: =LOG(RC[-1]) -> #NUM!
A5073: 0 | B5073: =LOG(RC[-1]) -> #NUM!
A5074: 0 | B5074: =LOG(RC[-1]) -> #NUM!
A5075: 0 | B5075: =LOG(RC[-1]) -> #NUM!
A5076: 0 | B5076: =LOG(RC[-1]) -> #NUM!
A5077: 0 | B5077: =LOG(RC[-1]) -> #NUM!
A5078: 0 | B5078: =LOG(RC[-1]) -> #NUM!
A5079: 0 | B5079: =LOG(RC[-1]) -> #NUM!
A5080: 0 | B5080: =LOG(RC[-1]) -> #NUM!
A5081: 0 | B5081: =LOG(RC[-1]) -> #NUM!
A5082: 0 | B5082: =LOG(RC[-1]) -> #NUM!
A5083: 0 | B5083: =LOG(RC[-1]) -> #NUM!
A5084: 0 | B5084: =LOG(RC[-1]) -> #NUM!
A5085: 0 | B5085: =LOG(RC[-1]) -> #NUM!
A5086: 0 | B5086: =LOG(RC[-1]) -> #NUM!
A5087: 0 | B5087: =LOG(RC[-1]) -> #NUM!
A5088: 0 | B5088: =LOG(RC[-1]) -> #NUM!
A5089: 0 | B5089: =LOG(RC[-1]) -> #NUM!
A5090: 0 | B5090: =LOG(RC[-1]) -> #NUM!
A5091: 0 | B5091: =LOG(RC[-1]) -> #NUM!
A5092: 0 | B5092: =LOG(RC[-1]) -> #NUM!
A5093: 0 | B5093: =LOG(RC[-1]) -> #NUM!
A5094: 0 | B5094: =LOG(RC[-1]) -> #NUM!
A5095: 0 | B5095: =LOG(RC[-1]) -> #NUM!
A5096: 0 | B5096: =LOG(RC[-1]) -> #NUM!
A5097: 0 | B5097: =LOG(RC[-1]) -> #NUM!
A5098: 0 | B5098: =LOG(RC[-1]) -> #NUM!
A5099: 0 | B5099: =LOG(RC[-1]) -> #NUM!
A5100: 0 | B5100: =LOG(RC[-1]) -> #NUM!
A5101: 0 | B5101: =LOG(RC[-1]) -> #NUM!
A5102: 0 | B5102: =LOG(RC[-1]) -> #NUM!
A5103: 0 | B5103: =LOG(RC[-1]) -> #NUM!
A5104: 0 | B5104: =LOG(RC[-1]) -> #NUM!
A5105: 0 | B5105: =LOG(RC[-1]) -> #NUM!
A5106: 0 | B5106: =LOG(RC[-1]) -> #NUM!
A5107: 0 | B5107: =LOG(RC[-1]) -> #NUM!
A5108: 0 | B5108: =LOG(RC[-1]) -> #NUM!
A5109: 0 | B5109: =LOG(RC[-1]) -> #NUM!
A5110: 0 | B5110: =LOG(RC[-1]) -> #NUM!
A5111: 0 | B5111: =LOG(RC[-1]) -> #NUM!
A5112: 0 | B5112: =LOG(RC[-1]) -> #NUM!
A5113: 0 | B5113: =LOG(RC[-1]) -> #NUM!
A5114: 0 | B5114: =LOG(RC[-1]) -> #NUM!
A5115: 0 | B5115: =LOG(RC[-1]) -> #NUM!
A5116: 0 | B5116: =LOG(RC[-1]) -> #NUM!
A5117: 0 | B5117: =LOG(RC[-1]) -> #NUM!
A5118: 0 | B5118: =LOG(RC[-1]) -> #NUM!
A5119: 0 | B5119: =LOG(RC[-1]) -> #NUM!
A5120: 0 | B5120: =LOG(RC[-1]) -> #NUM!
A5121: 0 | B5121: =LOG(RC[-1]) -> #NUM!
A5122: 0 | B5122: =LOG(RC[-1]) -> #NUM!
A5123: 0 | B5123: =LOG(RC[-1]) -> #NUM!
A5124: 0 | B5124: =LOG(RC[-1]) -> #NUM!
A5125: 0 | B5125: =LOG(RC[-1]) -> #NUM!
A5126: 0 | B5126: =LOG(RC[-1]) -> #NUM!
A5127: 0 | B5127: =LOG(RC[-1]) -> #NUM!
A5128: 0 | B5128: =LOG(RC[-1]) -> #NUM!
A5129: 0 | B5129: =LOG(RC[-1]) -> #NUM!
A5130: 0 | B5130: =LOG(RC[-1]) -> #NUM!
A5131: 0 | B5131: =LOG(RC[-1]) -> #NUM!
A5132: 0 | B5132: =LOG(RC[-1]) -> #NUM!
A5133: 0 | B5133: =LOG(RC[-1]) -> #NUM!
A5134: 0 | B5134: =LOG(RC[-1]) -> #NUM!
A5135: 0 | B5135: =LOG(RC[-1]) -> #NUM!
A5136: 0 | B5136: =LOG(RC[-1]) -> #NUM!
A5137: 0 | B5137: =LOG(RC[-1]) -> #NUM!
A5138: 0 | B5138: =LOG(RC[-1]) -> #NUM!
A5139: 0 | B5139: =LOG(RC[-1]) -> #NUM!
A5140: 0 | B5140: =LOG(RC[-1]) -> #NUM!
A5141: 0 | B5141: =LOG(RC[-1]) -> #NUM!
A5142: 0 | B5142: =LOG(RC[-1]) -> #NUM!
A5143: 0 | B5143: =LOG(RC[-1]) -> #NUM!
A5144: 0 | B5144: =LOG(RC[-1]) -> #NUM!
A5145: 0 | B5145: =LOG(RC[-1]) -> #NUM!
A5146: 0 | B5146: =LOG(RC[-1]) -> #NUM!
A5147: 0 | B5147: =LOG(RC[-1]) -> #NUM!
A5148: 0 | B5148: =LOG(RC[-1]) -> #NUM!
A5149: 0 | B5149: =LOG(RC[-1]) -> #NUM!
A5150: 0 | B5150: =LOG(RC[-1]) -> #NUM!
A5151: 0 | B5151: =LOG(RC[-1]) -> #NUM!
A5152: 0 | B5152: =LOG(RC[-1]) -> #NUM!
A5153: 0 | B5153: =LOG(RC[-1]) -> #NUM!
A5154: 0 | B5154: =LOG(RC[-1]) -> #NUM!
A5155: 0 | B5155: =LOG(RC[-1]) -> #NUM!
A5156: 0 | B5156: =LOG(RC[-1]) -> #NUM!
A5157: 0 | B5157: =LOG(RC[-1]) -> #NUM!
A5158: 0 | B5158: =LOG(RC[-1]) -> #NUM!
A5159: 0 | B5159: =LOG(RC[-1]) -> #NUM!
A5160: 0 | B5160: =LOG(RC[-1]) -> #NUM!
A5161: 0 | B5161: =LOG(RC[-1]) -> #NUM!
A5162: 0 | B5162: =LOG(RC[-1]) -> #NUM!
A5163: 0 | B5163: =LOG(RC[-1]) -> #NUM!
A5164: 0 | B5164: =LOG(RC[-1]) -> #NUM!
A5165: 0 | B5165: =LOG(RC[-1]) -> #NUM!
A5166: 0 | B5166: =LOG(RC[-1]) -> #NUM!
A5167: 0 | B5167: =LOG(RC[-1]) -> #NUM!
A5168: 0 | B5168: =LOG(RC[-1]) -> #NUM!
A5169: 0 | B5169: =LOG(RC[-1]) -> #NUM!
A5170: 0 | B5170: =LOG(RC[-1]) -> #NUM!
A5171: 0 | B5171: =LOG(RC[-1]) -> #NUM!
A5172: 0 | B5172: =LOG(RC[-1]) -> #NUM!
A5173: 0 | B5173: =LOG(RC[-1]) -> #NUM!
A5174: 0 | B5174: =LOG(RC[-1]) -> #NUM!
A5175: 0 | B5175: =LOG(RC[-1]) -> #NUM!
A5176: 0 | B5176: =LOG(RC[-1]) -> #NUM!
A5177: 0 | B5177: =LOG(RC[-1]) -> #NUM!
A5178: 0 | B5178: =LOG(RC[-1]) -> #NUM!
A5179: 0 | B5179: =LOG(RC[-1]) -> #NUM!
A5180: 0 | B5180: =LOG(RC[-1]) -> #NUM!
A5181: 0 | B5181: =LOG(RC[-1]) -> #NUM!
A5182: 0 | B5182: =LOG(RC[-1]) -> #NUM!
A5183: 0 | B5183: =LOG(RC[-1]) -> #NUM!
A5184: 0 | B5184: =LOG(RC[-1]) -> #NUM!
A5185: 0 | B5185: =LOG(RC[-1]) -> #NUM!
A5186: 0 | B5186: =LOG(RC[-1]) -> #NUM!
A5187: 0 | B5187: =LOG(RC[-1]) -> #NUM!
A5188: 0 | B5188: =LOG(RC[-1]) -> #NUM!
A5189: 0 | B5189: =LOG(RC[-1]) -> #NUM!
A5190: 0 | B5190: =LOG(RC[-1]) -> #NUM!
A5191: 0 | B5191: =LOG(RC[-1]) -> #NUM!
A5192: 0 | B5192: =LOG(RC[-1]) -> #NUM!
A5193: 0 | B5193: =LOG(RC[-1]) -> #NUM!
A5194: 0 | B5194: =LOG(RC[-1]) -> #NUM!
A5195: 0 | B5195: =LOG(RC[-1]) -> #NUM!
A5196: 0 | B5196: =LOG(RC[-1]) -> #NUM!
A5197: 0 | B5197: =LOG(RC[-1]) -> #NUM!
A5198: 0 | B5198: =LOG(RC[-1]) -> #NUM!
A5199: 0 | B5199: =LOG(RC[-1]) -> #NUM!
A5200: 0 | B5200: =LOG(RC[-1]) -> #NUM!
A5201: 0 | B5201: =LOG(RC[-1]) -> #NUM!
A5202: 0 | B5202: =LOG(RC[-1]) -> #NUM!
A5203: 0 | B5203: =LOG(RC[-1]) -> #NUM!
A5204: 0 | B5204: =LOG(RC[-1]) -> #NUM!
A5205: 0 | B5205: =LOG(RC[-1]) -> #NUM!
A5206: 0 | B5206: =LOG(RC[-1]) -> #NUM!
A5207: 0 | B5207: =LOG(RC[-1]) -> #NUM!
A5208: 0 | B5208: =LOG(RC[-1]) -> #NUM!
A5209: 0 | B5209: =LOG(RC[-1]) -> #NUM!
A5210: 0 | B5210: =LOG(RC[-1]) -> #NUM!
A5211: 0 | B5211: =LOG(RC[-1]) -> #NUM!
A5212: 0 | B5212: =LOG(RC[-1]) -> #NUM!
A5213: 0 | B5213: =LOG(RC[-1]) -> #NUM!
A5214: 0 | B5214: =LOG(RC[-1]) -> #NUM!
A5215: 0 | B5215: =LOG(RC[-1]) -> #NUM!
A5216: 0 | B5216: =LOG(RC[-1]) -> #NUM!
A5217: 0 | B5217: =LOG(RC[-1]) -> #NUM!
A5218: 0 | B5218: =LOG(RC[-1]) -> #NUM!
A5219: 0 | B5219: =LOG(RC[-1]) -> #NUM!
A5220: 0 | B5220: =LOG(RC[-1]) -> #NUM!
A5221: 0 | B5221: =LOG(RC[-1]) -> #NUM!
A5222: 0 | B5222: =LOG(RC[-1]) -> #NUM!
A5223: 0 | B5223: =LOG(RC[-1]) -> #NUM!
A5224: 0 | B5224: =LOG(RC[-1]) -> #NUM!
A5225: 0 | B5225: =LOG(RC[-1]) -> #NUM!
A5226: 0 | B5226: =LOG(RC[-1]) -> #NUM!
A5227: 0 | B5227: =LOG(RC[-1]) -> #NUM!
A5228: 0 | B5228: =LOG(RC[-1]) -> #NUM!
A5229: 0 | B5229: =LOG(RC[-1]) -> #NUM!
A5230: 0 | B5230: =LOG(RC[-1]) -> #NUM!
A5231: 0 | B5231: =LOG(RC[-1]) -> #NUM!
A5232: 0 | B5232: =LOG(RC[-1]) -> #NUM!
A5233: 0 | B5233: =LOG(RC[-1]) -> #NUM!
A5234: 0 | B5234: =LOG(RC[-1]) -> #NUM!
A5235: 0 | B5235: =LOG(RC[-1]) -> #NUM!
A5236: 0 | B5236: =LOG(RC[-1]) -> #NUM!
A5237: 0 | B5237: =LOG(RC[-1]) -> #NUM!
A5238: 0 | B5238: =LOG(RC[-1]) -> #NUM!
A5239: 0 | B5239: =LOG(RC[-1]) -> #NUM!
A5240: 0 | B5240: =LOG(RC[-1]) -> #NUM!
A5241: 0 | B5241: =LOG(RC[-1]) -> #NUM!
A5242: 0 | B5242: =LOG(RC[-1]) -> #NUM!
A5243: 0 | B5243: =LOG(RC[-1]) -> #NUM!
A5244: 0 | B5244: =LOG(RC[-1]) -> #NUM!
A5245: 0 | B5245: =LOG(RC[-1]) -> #NUM!
A5246: 0 | B5246: =LOG(RC[-1]) -> #NUM!
A5247: 0 | B5247: =LOG(RC[-1]) -> #NUM!
A5248: 0 | B5248: =LOG(RC[-1]) -> #NUM!
A5249: 0 | B5249: =LOG(RC[-1]) -> #NUM!
A5250: 0 | B5250: =LOG(RC[-1]) -> #NUM!
A5251: 0 | B5251: =LOG(RC[-1]) -> #NUM!
A5252: 0 | B5252: =LOG(RC[-1]) -> #NUM!
A5253: 0 | B5253: =LOG(RC[-1]) -> #NUM!
A5254: 0 | B5254: =LOG(RC[-1]) -> #NUM!
A5255: 0 | B5255: =LOG(RC[-1]) -> #NUM!
A5256: 0 | B5256: =LOG(RC[-1]) -> #NUM!
A5257: 0 | B5257: =LOG(RC[-1]) -> #NUM!
A5258: 0 | B5258: =LOG(RC[-1]) -> #NUM!
A5259: 0 | B5259: =LOG(RC[-1]) -> #NUM!
A5260: 0 | B5260: =LOG(RC[-1]) -> #NUM!
A5261: 0 | B5261: =LOG(RC[-1]) -> #NUM!
A5262: 0 | B5262: =LOG(RC[-1]) -> #NUM!
A5263: 0 | B5263: =LOG(RC[-1]) -> #NUM!
A5264: 0 | B5264: =LOG(RC[-1]) -> #NUM!
A5265: 0 | B5265: =LOG(RC[-1]) -> #NUM!
A5266: 0 | B5266: =LOG(RC[-1]) -> #NUM!
A5267: 0 | B5267: =LOG(RC[-1]) -> #NUM!
A5268: 0 | B5268: =LOG(RC[-1]) -> #NUM!
A5269: 0 | B5269: =LOG(RC[-1]) -> #NUM!
A5270: 0 | B5270: =LOG(RC[-1]) -> #NUM!
A5271: 0 | B5271: =LOG(RC[-1]) -> #NUM!
A5272: 0 | B5272: =LOG(RC[-1]) -> #NUM!
A5273: 0 | B5273: =LOG(RC[-1]) -> #NUM!
A5274: 0 | B5274: =LOG(RC[-1]) -> #NUM!
A5275: 0 | B5275: =LOG(RC[-1]) -> #NUM!
A5276: 0 | B5276: =LOG(RC[-1]) -> #NUM!
A5277: 0 | B5277: =LOG(RC[-1]) -> #NUM!
A5278: 0 | B5278: =LOG(RC[-1]) -> #NUM!
A5279: 0 | B5279: =LOG(RC[-1]) -> #NUM!
A5280: 0 | B5280: =LOG(RC[-1]) -> #NUM!
A5281: 0 | B5281: =LOG(RC[-1]) -> #NUM!
A5282: 0 | B5282: =LOG(RC[-1]) -> #NUM!
A5283: 0 | B5283: =LOG(RC[-1]) -> #NUM!
A5284: 0 | B5284: =LOG(RC[-1]) -> #NUM!
A5285: 0 | B5285: =LOG(RC[-1]) -> #NUM!
A5286: 0 | B5286: =LOG(RC[-1]) -> #NUM!
A5287: 0 | B5287: =LOG(RC[-1]) -> #NUM!
A5288: 0 | B5288: =LOG(RC[-1]) -> #NUM!
A5289: 0 | B5289: =LOG(RC[-1]) -> #NUM!
A5290: 0 | B5290: =LOG(RC[-1]) -> #NUM!
A5291: 0 | B5291: =LOG(RC[-1]) -> #NUM!
A5292: 0 | B5292: =LOG(RC[-1]) -> #NUM!
A5293: 0 | B5293: =LOG(RC[-1]) -> #NUM!
A5294: 0 | B5294: =LOG(RC[-1]) -> #NUM!
A5295: 0 | B5295: =LOG(RC[-1]) -> #NUM!
A5296: 0 | B5296: =LOG(RC[-1]) -> #NUM!
A5297: 0 | B5297: =LOG(RC[-1]) -> #NUM!
A5298: 0 | B5298: =LOG(RC[-1]) -> #NUM!
A5299: 0 | B5299: =LOG(RC[-1]) -> #NUM!
A5300: 0 | B5300: =LOG(RC[-1]) -> #NUM!
A5301: 0 | B5301: =LOG(RC[-1]) -> #NUM!
A5302: 0 | B5302: =LOG(RC[-1]) -> #NUM!
A5303: 0 | B5303: =LOG(RC[-1]) -> #NUM!
A5304: 0 | B5304: =LOG(RC[-1]) -> #NUM!
A5305: 0 | B5305: =LOG(RC[-1]) -> #NUM!
A5306: 0 | B5306: =LOG(RC[-1]) -> #NUM!
A5307: 0 | B5307: =LOG(RC[-1]) -> #NUM!
A5308: 0 | B5308: =LOG(RC[-1]) -> #NUM!
A5309: 0 | B5309: =LOG(RC[-1]) -> #NUM!
A5310: 0 | B5310: =LOG(RC[-1]) -> #NUM!
A5311: 0 | B5311: =LOG(RC[-1]) -> #NUM!
A5312: 0 | B5312: =LOG(RC[-1]) -> #NUM!
A5313: 0 | B5313: =LOG(RC[-1]) -> #NUM!
A5314: 0 | B5314: =LOG(RC[-1]) -> #NUM!
A5315: 0 | B5315: =LOG(RC[-1]) -> #NUM!
A5316: 0 | B5316: =LOG(RC[-1]) -> #NUM!
A5317: 0 | B5317: =LOG(RC[-1]) -> #NUM!
A5318: 0 | B5318: =LOG(RC[-1]) -> #NUM!
A5319: 0 | B5319: =LOG(RC[-1]) -> #NUM!
A5320: 0 | B5320: =LOG(RC[-1]) -> #NUM!
A5321: 0 | B5321: =LOG(RC[-1]) -> #NUM!
A5322: 0 | B5322: =LOG(RC[-1]) -> #NUM!
A5323: 0 | B5323: =LOG(RC[-1]) -> #NUM!
A5324: 0 | B5324: =LOG(RC[-1]) -> #NUM!
A5325: 0 | B5325: =LOG(RC[-1]) -> #NUM!
A5326: 0 | B5326: =LOG(RC[-1]) -> #NUM!
A5327: 0 | B5327: =LOG(RC[-1]) -> #NUM!
A5328: 0 | B5328: =LOG(RC[-1]) -> #NUM!
A5329: 0 | B5329: =LOG(RC[-1]) -> #NUM!
A5330: 0 | B5330: =LOG(RC[-1]) -> #NUM!
A5331: 0 | B5331: =LOG(RC[-1]) -> #NUM!
A5332: 0 | B5332: =LOG(RC[-1]) -> #NUM!
A5333: 0 | B5333: =LOG(RC[-1]) -> #NUM!
A5334: 0 | B5334: =LOG(RC[-1]) -> #NUM!
A5335: 0 | B5335: =LOG(RC[-1]) -> #NUM!
A5336: 0 | B5336: =LOG(RC[-1]) -> #NUM!
A5337: 0 | B5337: =LOG(RC[-1]) -> #NUM!
A5338: 0 | B5338: =LOG(RC[-1]) -> #NUM!
A5339: 0 | B5339: =LOG(RC[-1]) -> #NUM!
A5340: 0 | B5340: =LOG(RC[-1]) -> #NUM!
A5341: 0 | B5341: =LOG(RC[-1]) -> #NUM!
A5342: 0 | B5342: =LOG(RC[-1]) -> #NUM!
A5343: 0 | B5343: =LOG(RC[-1]) -> #NUM!
A5344: 0 | B5344: =LOG(RC[-1]) -> #NUM!
A5345: 0 | B5345: =LOG(RC[-1]) -> #NUM!
A5346: 0 | B5346: =LOG(RC[-1]) -> #NUM!
A5347: 0 | B5347: =LOG(RC[-1]) -> #NUM!
A5348: 0 | B5348: =LOG(RC[-1]) -> #NUM!
A5349: 0 | B5349: =LOG(RC[-1]) -> #NUM!
A5350: 0 | B5350: =LOG(RC[-1]) -> #NUM!
A5351: 0 | B5351: =LOG(RC[-1]) -> #NUM!
A5352: 0 | B5352: =LOG(RC[-1]) -> #NUM!
A5353: 0 | B5353: =LOG(RC[-1]) -> #NUM!
A5354: 0 | B5354: =LOG(RC[-1]) -> #NUM!
A5355: 0 | B5355: =LOG(RC[-1]) -> #NUM!
A5356: 0 | B5356: =LOG(RC[-1]) -> #NUM!
A5357: 0 | B5357: =LOG(RC[-1]) -> #NUM!
A5358: 0 | B5358: =LOG(RC[-1]) -> #NUM!
A5359: 0 | B5359: =LOG(RC[-1]) -> #NUM!
A5360: 0 | B5360: =LOG(RC[-1]) -> #NUM!
A5361: 0 | B5361: =LOG(RC[-1]) -> #NUM!
A5362: 0 | B5362: =LOG(RC[-1]) -> #NUM!
A5363: 0 | B5363: =LOG(RC[-1]) -> #NUM!
A5364: 0 | B5364: =LOG(RC[-1]) -> #NUM!
A5365: 0 | B5365: =LOG(RC[-1]) -> #NUM!
A5366: 0 | B5366: =LOG(RC[-1]) -> #NUM!
A5367: 0 | B5367: =LOG(RC[-1]) -> #NUM!
A5368: 0 | B5368: =LOG(RC[-1]) -> #NUM!
A5369: 0 | B5369: =LOG(RC[-1]) -> #NUM!
A5370: 0 | B5370: =LOG(RC[-1]) -> #NUM!
A5371: 0 | B5371: =LOG(RC[-1]) -> #NUM!
A5372: 0 | B5372: =LOG(RC[-1]) -> #NUM!
A5373: 0 | B5373: =LOG(RC[-1]) -> #NUM!
A5374: 0 | B5374: =LOG(RC[-1]) -> #NUM!
A5375: 0 | B5375: =LOG(RC[-1]) -> #NUM!
A5376: 0 | B5376: =LOG(RC[-1]) -> #NUM!
A5377: 0 | B5377: =LOG(RC[-1]) -> #NUM!
A5378: 0 | B5378: =LOG(RC[-1]) -> #NUM!
A5379: 0 | B5379: =LOG(RC[-1]) -> #NUM!
A5380: 0 | B5380: =LOG(RC[-1]) -> #NUM!
A5381: 0 | B5381: =LOG(RC[-1]) -> #NUM!
A5382: 0 | B5382: =LOG(RC[-1]) -> #NUM!
A5383: 0 | B5383: =LOG(RC[-1]) -> #NUM!
A5384: 0 | B5384: =LOG(RC[-1]) -> #NUM!
A5385: 0 | B5385: =LOG(RC[-1]) -> #NUM!
A5386: 0 | B5386: =LOG(RC[-1]) -> #NUM!
A5387: 0 | B5387: =LOG(RC[-1]) -> #NUM!
A5388: 0 | B5388: =LOG(RC[-1]) -> #NUM!
A5389: 0 | B5389: =LOG(RC[-1]) -> #NUM!
A5390: 0 | B5390: =LOG(RC[-1]) -> #NUM!
A5391: 0 | B5391: =LOG(RC[-1]) -> #NUM!
A5392: 0 | B5392: =LOG(RC[-1]) -> #NUM!
A5393: 0 | B5393: =LOG(RC[-1]) -> #NUM!
A5394: 0 | B5394: =LOG(RC[-1]) -> #NUM!
A5395: 0 | B5395: =LOG(RC[-1]) -> #NUM!
A5396: 0 | B5396: =LOG(RC[-1]) -> #NUM!
A5397: 0 | B5397: =LOG(RC[-1]) -> #NUM!
A5398: 0 | B5398: =LOG(RC[-1]) -> #NUM!
A5399: 0 | B5399: =LOG(RC[-1]) -> #NUM!
A5400: 0 | B5400: =LOG(RC[-1]) -> #NUM!
A5401: 0 | B5401: =LOG(RC[-1]) -> #NUM!
A5402: 0 | B5402: =LOG(RC[-1]) -> #NUM!
A5403: 0 | B5403: =LOG(RC[-1]) -> #NUM!
A5404: 0 | B5404: =LOG(RC[-1]) -> #NUM!
A5405: 0 | B5405: =LOG(RC[-1]) -> #NUM!
A5406: 0 | B5406: =LOG(RC[-1]) -> #NUM!
A5407: 0 | B5407: =LOG(RC[-1]) -> #NUM!
A5408: 0 | B5408: =LOG(RC[-1]) -> #NUM!
A5409: 0 | B5409: =LOG(RC[-1]) -> #NUM!
A5410: 0 | B5410: =LOG(RC[-1]) -> #NUM!
A5411: 0 | B5411: =LOG(RC[-1]) -> #NUM!
A5412: 0 | B5412: =LOG(RC[-1]) -> #NUM!
A5413: 0 | B5413: =LOG(RC[-1]) -> #NUM!
A5414: 0 | B5414: =LOG(RC[-1]) -> #NUM!
A5415: 0 | B5415: =LOG(RC[-1]) -> #NUM!
A5416: 0 | B5416: =LOG(RC[-1]) -> #NUM!
A5417: 0 | B5417: =LOG(RC[-1]) -> #NUM!
A5418: 0 | B5418: =LOG(RC[-1]) -> #NUM!
A5419: 0 | B5419: =LOG(RC[-1]) -> #NUM!
A5420: 0 | B5420: =LOG(RC[-1]) -> #NUM!
A5421: 0 | B5421: =LOG(RC[-1]) -> #NUM!
A5422: 0 | B5422: =LOG(RC[-1]) -> #NUM!
A5423: 0 | B5423: =LOG(RC[-1]) -> #NUM!
A5424: 0 | B5424: =LOG(RC[-1]) -> #NUM!
A5425: 0 | B5425: =LOG(RC[-1]) -> #NUM!
A5426: 0 | B5426: =LOG(RC[-1]) -> #NUM!
A5427: 0 | B5427: =LOG(RC[-1]) -> #NUM!
A5428: 0 | B5428: =LOG(RC[-1]) -> #NUM!
A5429: 0 | B5429: =LOG(RC[-1]) -> #NUM!
A5430: 0 | B5430: =LOG(RC[-1]) -> #NUM!
A5431: 0 | B5431: =LOG(RC[-1]) -> #NUM!
A5432: 0 | B5432: =LOG(RC[-1]) -> #NUM!
A5433: 0 | B5433: =LOG(RC[-1]) -> #NUM!
A5434: 0 | B5434: =LOG(RC[-1]) -> #NUM!
A5435: 0 | B5435: =LOG(RC[-1]) -> #NUM!
A5436: 0 | B5436: =LOG(RC[-1]) -> #NUM!
A5437: 0 | B5437: =LOG(RC[-1]) -> #NUM!
A5438: 0 | B5438: =LOG(RC[-1]) -> #NUM!
A5439: 0 | B5439: =LOG(RC[-1]) -> #NUM!
A5440: 0 | B5440: =LOG(RC[-1]) -> #NUM!
A5441: 0 | B5441: =LOG(RC[-1]) -> #NUM!
A5442: 0 | B5442: =LOG(RC[-1]) -> #NUM!
A5443: 0 | B5443: =LOG(RC[-1]) -> #NUM!
A5444: 0 | B5444: =LOG(RC[-1]) -> #NUM!
A5445: 0 | B5445: =LOG(RC[-1]) -> #NUM!
A5446: 0 | B5446: =LOG(RC[-1]) -> #NUM!
A5447: 0 | B5447: =LOG(RC[-1]) -> #NUM!
A5448: 0 | B5448: =LOG(RC[-1]) -> #NUM!
A5449: 0 | B5449: =LOG(RC[-1]) -> #NUM!
A5450: 0 | B5450: =LOG(RC[-1]) -> #NUM!
A5451: 0 | B5451: =LOG(RC[-1]) -> #NUM!
A5452: 0 | B5452: =LOG(RC[-1]) -> #NUM!
A5453: 0 | B5453: =LOG(RC[-1]) -> #NUM!
A5454: 0 | B5454: =LOG(RC[-1]) -> #NUM!
A5455: 0 | B5455: =LOG(RC[-1]) -> #NUM!
A5456: 0 | B5456: =LOG(RC[-1]) -> #NUM!
A5457: 0 | B5457: =LOG(RC[-1]) -> #NUM!
A5458: 0 | B5458: =LOG(RC[-1]) -> #NUM!
A5459: 0 | B5459: =LOG(RC[-1]) -> #NUM!
A5460: 0 | B5460: =LOG(RC[-1]) -> #NUM!
A5461: 0 | B5461: =LOG(RC[-1]) -> #NUM!
A5462: 0 | B5462: =LOG(RC[-1]) -> #NUM!
A5463: 0 | B5463: =LOG(RC[-1]) -> #NUM!
A5464: 0 | B5464: =LOG(RC[-1]) -> #NUM!
A5465: 0 | B5465: =LOG(RC[-1]) -> #NUM!
A5466: 0 | B5466: =LOG(RC[-1]) -> #NUM!
A5467: 0 | B5467: =LOG(RC[-1]) -> #NUM!
A5468: 0 | B5468: =LOG(RC[-1]) -> #NUM!
A5469: 0 | B5469: =LOG(RC[-1]) -> #NUM!
A5470: 0 | B5470: =LOG(RC[-1]) -> #NUM!
A5471: 0 | B5471: =LOG(RC[-1]) -> #NUM!
A5472: 0 | B5472: =LOG(RC[-1]) -> #NUM!
A5473: 0 | B5473: =LOG(RC[-1]) -> #NUM!
A5474: 0 | B5474: =LOG(RC[-1]) -> #NUM!
A5475: 0 | B5475: =LOG(RC[-1]) -> #NUM!
A5476: 0 | B5476: =LOG(RC[-1]) -> #NUM!
A5477: 0 | B5477: =LOG(RC[-1]) -> #NUM!
A5478: 0 | B5478: =LOG(RC[-1]) -> #NUM!
A5479: 0 | B5479: =LOG(RC[-1]) -> #NUM!
A5480: 0 | B5480: =LOG(RC[-1]) -> #NUM!
A5481: 0 | B5481: =LOG(RC[-1]) -> #NUM!
A5482: 0 | B5482: =LOG(RC[-1]) -> #NUM!
A5483: 0 | B5483: =LOG(RC[-1]) -> #NUM!
A5484: 0 | B5484: =LOG(RC[-1]) -> #NUM!
A5485: 0 | B5485: =LOG(RC[-1]) -> #NUM!
A5486: 0 | B5486: =LOG(RC[-1]) -> #NUM!
A5487: 0 | B5487: =LOG(RC[-1]) -> #NUM!
A5488: 0 | B5488: =LOG(RC[-1]) -> #NUM!
A5489: 0 | B5489: =LOG(RC[-1]) -> #NUM!
A5490: 0 | B5490: =LOG(RC[-1]) -> #NUM!
A5491: 0 | B5491: =LOG(RC[-1]) -> #NUM!
A5492: 0 | B5492: =LOG(RC[-1]) -> #NUM!
A5493: 0 | B5493: =LOG(RC[-1]) -> #NUM!
A5494: 0 | B5494: =LOG(RC[-1]) -> #NUM!
A5495: 0 | B5495: =LOG(RC[-1]) -> #NUM!
A5496: 0 | B5496: =LOG(RC[-1]) -> #NUM!
A5497: 0 | B5497: =LOG(RC[-1]) -> #NUM!
A5498: 0 | B5498: =LOG(RC[-1]) -> #NUM!
A5499: 0 | B5499: =LOG(RC[-1]) -> #NUM!
A5500: 0 | B5500: =LOG(RC[-1]) -> #NUM!
A5501: 0 | B5501: =LOG(RC[-1]) -> #NUM!
A5502: 0 | B5502: =LOG(RC[-1]) -> #NUM!
A5503: 0 | B5503: =LOG(RC[-1]) -> #NUM!
A5504: 0 | B5504: =LOG(RC[-1]) -> #NUM!
A5505: 0 | B5505: =LOG(RC[-1]) -> #NUM!
A5506: 0 | B5506: =LOG(RC[-1]) -> #NUM!
A5507: 0 | B5507: =LOG(RC[-1]) -> #NUM!
A5508: 0 | B5508: =LOG(RC[-1]) -> #NUM!
A5509: 0 | B5509: =LOG(RC[-1]) -> #NUM!
A5510: 0 | B5510: =LOG(RC[-1]) -> #NUM!
A5511: 0 | B5511: =LOG(RC[-1]) -> #NUM!
A5512: 0 | B5512: =LOG(RC[-1]) -> #NUM!
A5513: 0 | B5513: =LOG(RC[-1]) -> #NUM!
A5514: 0 | B5514: =LOG(RC[-1]) -> #NUM!
A5515: 0 | B5515: =LOG(RC[-1]) -> #NUM!
A5516: 0 | B5516: =LOG(RC[-1]) -> #NUM!
A5517: 0 | B5517: =LOG(RC[-1]) -> #NUM!
A5518: 0 | B5518: =LOG(RC[-1]) -> #NUM!
A5519: 0 | B5519: =LOG(RC[-1]) -> #NUM!
A5520: 0 | B5520: =LOG(RC[-1]) -> #NUM!
A5521: 0 | B5521: =LOG(RC[-1]) -> #NUM!
A5522: 0 | B5522: =LOG(RC[-1]) -> #NUM!
A5523: 0 | B5523: =LOG(RC[-1]) -> #NUM!
A5524: 0 | B5524: =LOG(RC[-1]) -> #NUM!
A5525: 0 | B5525: =LOG(RC[-1]) -> #NUM!
A5526: 0 | B5526: =LOG(RC[-1]) -> #NUM!
A5527: 0 | B5527: =LOG(RC[-1]) -> #NUM!
A5528: 0 | B5528: =LOG(RC[-1]) -> #NUM!
A5529: 0 | B5529: =LOG(RC[-1]) -> #NUM!
A5530: 0 | B5530: =LOG(RC[-1]) -> #NUM!
A5531: 0 | B5531: =LOG(RC[-1]) -> #NUM!
A5532: 0 | B5532: =LOG(RC[-1]) -> #NUM!
A5533: 0 | B5533: =LOG(RC[-1]) -> #NUM!
A5534: 0 | B5534: =LOG(RC[-1]) -> #NUM!
A5535: 0 | B5535: =LOG(RC[-1]) -> #NUM!
A5536: 0 | B5536: =LOG(RC[-1]) -> #NUM!
A5537: 0 | B5537: =LOG(RC[-1]) -> #NUM!
A5538: 0 | B5538: =LOG(RC[-1]) -> #NUM!
A5539: 0 | B5539: =LOG(RC[-1]) -> #NUM!
A5540: 0 | B5540: =LOG(RC[-1]) -> #NUM!
A5541: 0 | B5541: =LOG(RC[-1]) -> #NUM!
A5542: 0 | B5542: =LOG(RC[-1]) -> #NUM!
A5543: 0 | B5543: =LOG(RC[-1]) -> #NUM!
A5544: 0 | B5544: =LOG(RC[-1]) -> #NUM!
A5545: 0 | B5545: =LOG(RC[-1]) -> #NUM!
A5546: 0 | B5546: =LOG(RC[-1]) -> #NUM!
A5547: 0 | B5547: =LOG(RC[-1]) -> #NUM!
A5548: 0 | B5548: =LOG(RC[-1]) -> #NUM!
A5549: 0 | B5549: =LOG(RC[-1]) -> #NUM!
A5550: 0 | B5550: =LOG(RC[-1]) -> #NUM!
A5551: 0 | B5551: =LOG(RC[-1]) -> #NUM!
A5552: 0 | B5552: =LOG(RC[-1]) -> #NUM!
A5553: 0 | B5553: =LOG(RC[-1]) -> #NUM!
A5554: 0 | B5554: =LOG(RC[-1]) -> #NUM!
A5555: 0 | B5555: =LOG(RC[-1]) -> #NUM!
A5556: 0 | B5556: =LOG(RC[-1]) -> #NUM!
A5557: 0 | B5557: =LOG(RC[-1]) -> #NUM!
A5558: 0 | B5558: =LOG(RC[-1]) -> #NUM!
A5559: 0 | B5559: =LOG(RC[-1]) -> #NUM!
A5560: 0 | B5560: =LOG(RC[-1]) -> #NUM!
A5561: 0 | B5561: =LOG(RC[-1]) -> #NUM!
A5562: 0 | B5562: =LOG(RC[-1]) -> #NUM!
A5563: 0 | B5563: =LOG(RC[-1]) -> #NUM!
A5564: 0 | B5564: =LOG(RC[-1]) -> #NUM!
A5565: 0 | B5565: =LOG(RC[-1]) -> #NUM!
A5566: 0 | B5566: =LOG(RC[-1]) -> #NUM!
A5567: 0 | B5567: =LOG(RC[-1]) -> #NUM!
A5568: 0 | B5568: =LOG(RC[-1]) -> #NUM!
A5569: 0 | B5569: =LOG(RC[-1]) -> #NUM!
A5570: 0 | B5570: =LOG(RC[-1]) -> #NUM!
A5571: 0 | B5571: =LOG(RC[-1]) -> #NUM!
A5572: 0 | B5572: =LOG(RC[-1]) -> #NUM!
A5573: 0 | B5573: =LOG(RC[-1]) -> #NUM!
A5574: 0 | B5574: =LOG(RC[-1]) -> #NUM!
A5575: 0 | B5575: =LOG(RC[-1]) -> #NUM!
A5576: 0 | B5576: =LOG(RC[-1]) -> #NUM!
A5577: 0 | B5577: =LOG(RC[-1]) -> #NUM!
A5578: 0 | B5578: =LOG(RC[-1]) -> #NUM!
A5579: 0 | B5579: =LOG(RC[-1]) -> #NUM!
A5580: 0 | B5580: =LOG(RC[-1]) -> #NUM!
A5581: 0 | B5581: =LOG(RC[-1]) -> #NUM!
A5582: 0 | B5582: =LOG(RC[-1]) -> #NUM!
A5583: 0 | B5583: =LOG(RC[-1]) -> #NUM!
A5584: 0
A5585: 0
A5586: 0
A5587: 0
A5588: 0
A5589: 0
A5590: 0
A5591: 0
A5592: 0
A5593: 0
A5594: 0
A5595: 0
A5596: 0
A5597: 0
A5598: 0
A5599: 0
A5600: 0
A5601: 0
A5602: 0
A5603: 0
A5604: 0
A5605: 0
A5606: 0
A5607: 0
A5608: 0
A5609: 0
A5610: 0
A5611: 0
A5612: 0
A5613: 0
A5614: 0
A5615: 0
A5616: 0
A5617: 0
A5618: 0
A5619: 0
A5620: 0
A5621: 0
A5622: 0
A5623: 0
A5624: 0
A5625: 0
A5626: 0
A5627: 0
A5628: 0
A5629: 0
A5630: 0
A5631: 0
A5632: 0
A5633: 0
A5634: 0
A5635: 0
A5636: 0
A5637: 0
A5638: 0
A5639: 0
A5640: 0
A5641: 0
A5642: 0
A5643: 0
A5644: 0
A5645: 0
A5646: 0
A5647: 0
A5648: 0
A5649: 0
A5650: 0
A5651: 0
A5652: 0
A5653: 0
A5654: 0
A5655: 0
A5656: 0
A5657: 0
A5658: 0
A5659: 0
A5660: 0
A5661: 0
A5662: 0
A5663: 0
A5664: 0
A5665: 0
A5666: 0
A5667: 0
A5668: 0
A5669: 0
A5670: 0
A5671: 0
A5672: 0
A5673: 0
A5674: 0
A5675: 0
A5676: 0
A5677: 0
A5678: 0
A5679: 0
A5680: 0
A5681: 0
A5682: 0
A5683: 0
A5684: 0
A5685: 0
A5686: 0
A5687: 0
A5688: 0
A5689: 0
A5690: 0
A5691: 0
A5692: 0
A5693: 0
A5694: 0
A5695: 0
A5696: 0
A5697: 0
A5698: 0
A5699: 0
A5700: 0
A5701: 0
A5702: 0
A5703: 0
A5704: 0
A5705: 0
A5706: 0
A5707: 0
A5708: 0
A5709: 0
A5710: 0
A5711: 0
A5712: 0
A5713: 0
A5714: 0
A5715: 0
A5716: 0
A5717: 0
A5718: 0
A5719: 0
A5720: 0
A5721: 0
A5722: 0
A5723: 0
A5724: 0
A5725: 0
A5726: 0
A5727: 0
A5728: 0
A5729: 0
A5730: 0
A5731: 0
A5732: 0
A5733: 0
A5734: 0
A5735: 0
A5736: 0
A5737: 0
A5738: 0
A5739: 0
A5740: 0
A5741: 0
A5742: 0
A5743: 0
A5744: 0
A5745: 0
A5746: 0
A5747: 0
A5748: 0
A5749: 0
A5750: 0
A5751: 0
A5752: 0
A5753: 0
A5754: 0
A5755: 0
A5756: 0
A5757: 0
A5758: 0
A5759: 0
A5760: 0
A5761: 0
A5762: 0
A5763: 0
A5764: 0
A5765: 0
A5766: 0
A5767: 0
A5768: 0
A5769: 0
A5770: 0
A5771: 0
A5772: 0
A5773: 0
A5774: 0
A5775: 0
A5776: 0
A5777: 0
A5778: 0
A5779: 0
A5780: 0
A5781: 0
A5782: 0
A5783: 0
A5784: 0
A5785: 0
A5786: 0
A5787: 0
A5788: 0
A5789: 0
A5790: 0
A5791: 0
A5792: 0
A5793: 0
A5794: 0
A5795: 0
A5796: 0
A5797: 0
A5798: 0
A5799: 0
A5800: 0
A5801: 0
A5802: 0
A5803: 0
A5804: 0
A5805: 0
A5806: 0
A5807: 0
A5808: 0
A5809: 0
A5810: 0
A5811: 0
A5812: 0
A5813: 0
A5814: 0
A5815: 0
A5816: 0
A5817: 0
A5818: 0
A5819: 0
A5820: 0
A5821: 0
A5822: 0
A5823: 0
A5824: 0
A5825: 0
A5826: 0
A5827: 0
A5828: 0
A5829: 0
A5830: 0
A5831: 0
A5832: 0
A5833: 0
A5834: 0
A5835: 0
A5836: 0
A5837: 0
A5838: 0
A5839: 0
A5840: 0
A5841: 0
A5842: 0
A5843: 0
A5844: 0
A5845: 0
A5846: 0
A5847: 0
A5848: 0
A5849: 0
A5850: 0
A5851: 0
A5852: 0
A5853: 0
A5854: 0
A5855: 0
A5856: 0
A5857: 0
A5858: 0
A5859: 0
A5860: 0
A5861: 0
A5862: 0
A5863: 0
A5864: 0
A5865: 0
A5866: 0
A5867: 0
A5868: 0
A5869: 0
A5870: 0
A5871: 0
A5872: 0
A5873: 0
A5874: 0
A5875: 0
A5876: 0
A5877: 0
A5878: 0
A5879: 0
A5880: 0
A5881: 0
A5882: 0
A5883: 0
A5884: 0
A5885: 0
A5886: 0
A5887: 0
A5888: 0
A5889: 0
A5890: 0
A5891: 0
A5892: 0
A5893: 0
A5894: 0
A5895: 0
A5896: 0
A5897: 0
A5898: 0
A5899: 0
A5900: 0
A5901: 0
A5902: 0
A5903: 0
A5904: 0
A5905: 0
A5906: 0
A5907: 0
A5908: 0
A5909: 0
A5910: 0
A5911: 0
A5912: 0
A5913: 0
A5914: 0
A5915: 0
A5916: 0
A5917: 0
A5918: 0
A5919: 0
A5920: 0
A5921: 0
A5922: 0
A5923: 0
A5924: 0
A5925: 0
A5926: 0
A5927: 0
A5928: 0
A5929: 0
A5930: 0
A5931: 0
A5932: 0
A5933: 0
A5934: 0
A5935: 0
A5936: 0
A5937: 0
A5938: 0
A5939: 0
A5940: 0
A5941: 0
A5942: 0
A5943: 0
A5944: 0
A5945: 0
A5946: 0
A5947: 0
A5948: 0
A5949: 0
A5950: 0
A5951: 0
A5952: 0
A5953: 0
A5954: 0
A5955: 0
A5956: 0
A5957: 0
A5958: 0
A5959: 0
A5960: 0
A5961: 0
A5962: 0
A5963: 0
A5964: 0
A5965: 0
A5966: 0
A5967: 0
A5968: 0
A5969: 0
A5970: 0
A5971: 0
A5972: 0
A5973: 0
A5974: 0
A5975: 0
A5976: 0
A5977: 0
A5978: 0
A5979: 0
A5980: 0
A5981: 0
A5982: 0
A5983: 0
A5984: 0
A5985: 0
A5986: 0
A5987: 0
A5988: 0
A5989: 0
A5990: 0
A5991: 0
A5992: 0
A5993: 0
A5994: 0
A5995: 0
A5996: 0
A5997: 0
A5998: 0
A5999: 0
A6000: 0
A6001: 0
A6002: 0
A6003: 0
A6004: 0
A6005: 0
A6006: 0
A6007: 0
A6008: 0
A6009: 0
A6010: 0
A6011: 0
A6012: 0
A6013: 0
A6014: 0
A6015: 0
A6016: 0
A6017: 0
A6018: 0
A6019: 0
A6020: 0
A6021: 0
A6022: 0
A6023: 0
A6024: 0
A6025: 0
A6026: 0
A6027: 0
A6028: 0
A6029: 0
A6030: 0
A6031: 0
A6032: 0
A6033: 0
A6034: 0
A6035: 0
A6036: 0
A6037: 0
A6038: 0
A6039: 0
A6040: 0
A6041: 0
A6042: 0
A6043: 0
A6044: 0
A6045: 0
A6046: 0
A6047: 0
A6048: 0
A6049: 0
A6050: 0
A6051: 0
A6052: 0
A6053: 0
A6054: 0
A6055: 0
A6056: 0
A6057: 0
A6058: 0
A6059: 0
A6060: 0
A6061: 0
A6062: 0
A6063: 0
A6064: 0
A6065: 0
A6066: 0
A6067: 0
A6068: 0
A6069: 0
A6070: 0
A6071: 0
A6072: 0
A6073: 0
A6074: 0
A6075: 0
A6076: 0
A6077: 0
A6078: 0
A6079: 0
A6080: 0
A6081: 0
A6082: 0
A6083: 0
A6084: 0
A6085: 0
A6086: 0
A6087: 0
A6088: 0
A6089: 0
A6090: 0
A6091: 0
A6092: 0
A6093: 0
A6094: 0
A6095: 0
A6096: 0
A6097: 0
A6098: 0
A6099: 0
A6100: 0
A6101: 0
A6102: 0
A6103: 0
A6104: 0
A6105: 0
A6106: 0
A6107: 0
A6108: 0
A6109: 0
A6110: 0
A6111: 0
A6112: 0
A6113: 0
A6114: 0
A6115: 0
A6116: 0
A6117: 0
A6118: 0
A6119: 0
A6120: 0
A6121: 0
A6122: 0
A6123: 0
A6124: 0
A6125: 0
A6126: 0
A6127: 0
A6128: 0
A6129: 0
A6130: 0
A6131: 0
A6132: 0
A6133: 0
A6134: 0
A6135: 0
A6136: 0
A6137: 0
A6138: 0
A6139: 0
A6140: 0
A6141: 0
A6142: 0
A6143: 0
A6144: 0
A6145: 0
A6146: 0
A6147: 0
A6148: 0
A6149: 0
A6150: 0
A6151: 0
A6152: 0
A6153: 0
A6154: 0
A6155: 0
A6156: 0
A6157: 0
A6158: 0
A6159: 0
A6160: 0
A6161: 0
A6162: 0
A6163: 0
A6164: 0
A6165: 0
A6166: 0
A6167: 0
A6168: 0
A6169: 0
A6170: 0
A6171: 0
A6172: 0
A6173: 0
A6174: 0
A6175: 0
A6176: 0
A6177: 0
A6178: 0
A6179: 0
A6180: 0
A6181: 0
A6182: 0
A6183: 0
A6184: 0
A6185: 0
A6186: 0
A6187: 0
A6188: 0
A6189: 0
A6190: 0
A6191: 0
A6192: 0
A6193: 0
A6194: 0
A6195: 0
A6196: 0
A6197: 0
A6198: 0
A6199: 0
A6200: 0
A6201: 0
A6202: 0
A6203: 0
A6204: 0
A6205: 0
A6206: 0
A6207: 0
A6208: 0
A6209: 0
A6210: 0
A6211: 0
A6212: 0
A6213: 0
A6214: 0
A6215: 0
A6216: 0
A6217: 0
A6218: 0
A6219: 0
A6220: 0
A6221: 0
A6222: 0
A6223: 0
A6224: 0
A6225: 0
A6226: 0
A6227: 0
A6228: 0
A6229: 0
A6230: 0
A6231: 0
A6232: 0
A6233: 0
A6234: 0
A6235: 0
A6236: 0
A6237: 0
A6238: 0
A6239: 0
A6240: 0
A6241: 0
A6242: 0
A6243: 0
A6244: 0
A6245: 0
A6246: 0
A6247: 0
A6248: 0
A6249: 0
A6250: 0
A6251: 0
A6252: 0
A6253: 0
A6254: 0
A6255: 0
A6256: 0
A6257: 0
A6258: 0
A6259: 0
A6260: 0
A6261: 0
A6262: 0
A6263: 0
A6264: 0
A6265: 0
A6266: 0
A6267: 0
A6268: 0
A6269: 0
A6270: 0
A6271: 0
A6272: 0
A6273: 0
A6274: 0
A6275: 0
A6276: 0
A6277: 0
A6278: 0
A6279: 0
A6280: 0
A6281: 0
A6282: 0
A6283: 0
A6284: 0
A6285: 0
A6286: 0
A6287: 0
A6288: 0
A6289: 0
A6290: 0
A6291: 0
A6292: 0
A6293: 0
A6294: 0
A6295: 0
A6296: 0
A6297: 0
A6298: 0
A6299: 0
A6300: 0
A6301: 0
A6302: 0
A6303: 0
A6304: 0
A6305: 0
A6306: 0
A6307: 0
A6308: 0
A6309: 0
A6310: 0
A6311: 0
A6312: 0
A6313: 0
A6314: 0
A6315: 0
A6316: 0
A6317: 0
A6318: 0
A6319: 0
A6320: 0
A6321: 0
A6322: 0
A6323: 0
A6324: 0
A6325: 0
A6326: 0
A6327: 0
A6328: 0
A6329: 0
A6330: 0
A6331: 0
A6332: 0
A6333: 0
A6334: 0
A6335: 0
A6336: 0
A6337: 0
A6338: 0
A6339: 0
A6340: 0
A6341: 0
A6342: 0
A6343: 0
A6344: 0
A6345: 0
A6346: 0
A6347: 0
A6348: 0
A6349: 0
A6350: 0
A6351: 0
A6352: 0
A6353: 0
A6354: 0
A6355: 0
A6356: 0
A6357: 0
A6358: 0
A6359: 0
A6360: 0
A6361: 0
A6362: 0
A6363: 0
A6364: 0
A6365: 0
A6366: 0
A6367: 0
A6368: 0
A6369: 0
A6370: 0
A6371: 0
A6372: 0
A6373: 0
A6374: 0
A6375: 0
A6376: 0
A6377: 0
A6378: 0
A6379: 0
A6380: 0
A6381: 0
A6382: 0
A6383: 0
A6384: 0
A6385: 0
A6386: 0
A6387: 0
A6388: 0
A6389: 0
A6390: 0
A6391: 0
A6392: 0
A6393: 0
A6394: 0
A6395: 0
A6396: 0
A6397: 0
A6398: 0
A6399: 0
A6400: 0
A6401: 0
A6402: 0
A6403: 0
A6404: 0
A6405: 0
A6406: 0
A6407: 0
A6408: 0
A6409: 0
A6410: 0
A6411: 0
A6412: 0
A6413: 0
A6414: 0
A6415: 0
A6416: 0
A6417: 0
A6418: 0
A6419: 0
A6420: 0
A6421: 0
A6422: 0
A6423: 0
A6424: 0
A6425: 0
A6426: 0
A6427: 0
A6428: 0
A6429: 0
A6430: 0
A6431: 0
A6432: 0
A6433: 0
A6434: 0
A6435: 0
A6436: 0
A6437: 0
A6438: 0
A6439: 0
A6440: 0
A6441: 0
A6442: 0
A6443: 0
A6444: 0
A6445: 0
A6446: 0
A6447: 0
A6448: 0
A6449: 0
A6450: 0
A6451: 0
A6452: 0
A6453: 0
A6454: 0
A6455: 0
A6456: 0
A6457: 0
A6458: 0
A6459: 0
A6460: 0
A6461: 0
A6462: 0
A6463: 0
A6464: 0
A6465: 0
A6466: 0
A6467: 0
A6468: 0
A6469: 0
A6470: 0
A6471: 0
A6472: 0
A6473: 0
A6474: 0
A6475: 0
A6476: 0
A6477: 0
A6478: 0
A6479: 0
A6480: 0
A6481: 0
A6482: 0
A6483: 0
A6484: 0
A6485: 0
A6486: 0
A6487: 0
A6488: 0
A6489: 0
A6490: 0
A6491: 0
A6492: 0
A6493: 0
A6494: 0
A6495: 0
A6496: 0
A6497: 0
A6498: 0
A6499: 0
A6500: 0
A6501: 0
A6502: 0
A6503: 0
A6504: 0
A6505: 0
A6506: 0
A6507: 0
A6508: 0
A6509: 0
A6510: 0
A6511: 0
A6512: 0
A6513: 0
A6514: 0
A6515: 0
A6516: 0
A6517: 0
A6518: 0
A6519: 0
A6520: 0
A6521: 0
A6522: 0
A6523: 0
A6524: 0
A6525: 0
A6526: 0
A6527: 0
A6528: 0
A6529: 0
A6530: 0
A6531: 0
A6532: 0
A6533: 0
A6534: 0
A6535: 0
A6536: 0
A6537: 0
A6538: 0
A6539: 0
A6540: 0
A6541: 0
A6542: 0
A6543: 0
A6544: 0
A6545: 0
A6546: 0
A6547: 0
A6548: 0
A6549: 0
A6550: 0
A6551: 0
A6552: 0
A6553: 0
A6554: 0
A6555: 0
A6556: 0
A6557: 0
A6558: 0
A6559: 0
A6560: 0
A6561: 0
A6562: 0
A6563: 0
A6564: 0
A6565: 0
A6566: 0
A6567: 0
A6568: 0
A6569: 0
A6570: 0
A6571: 0
A6572: 0
A6573: 0
A6574: 0
A6575: 0
A6576: 0
A6577: 0
A6578: 0
A6579: 0
A6580: 0
A6581: 0
A6582: 0
A6583: 0
A6584: 0
A6585: 0
A6586: 0
A6587: 0
A6588: 0
A6589: 0
A6590: 0
A6591: 0
A6592: 0
A6593: 0
A6594: 0
A6595: 0
A6596: 0
A6597: 0
A6598: 0
A6599: 0
A6600: 0
A6601: 0
A6602: 0
A6603: 0
A6604: 0
A6605: 0
A6606: 0
A6607: 0
A6608: 0
A6609: 0
A6610: 0
A6611: 0
A6612: 0
A6613: 0
A6614: 0
A6615: 0
A6616: 0
A6617: 0
A6618: 0
A6619: 0
A6620: 0
A6621: 0
A6622: 0
A6623: 0
A6624: 0
A6625: 0
A6626: 0
A6627: 0
A6628: 0
A6629: 0
A6630: 0
A6631: 0
A6632: 0
A6633: 0
A6634: 0
A6635: 0
A6636: 0
A6637: 0
A6638: 0
A6639: 0
A6640: 0
A6641: 0
A6642: 0
A6643: 0
A6644: 0
A6645: 0
A6646: 0
A6647: 0
A6648: 0
A6649: 0
A6650: 0
A6651: 0
A6652: 0
A6653: 0
A6654: 0
A6655: 0
A6656: 0
A6657: 0
A6658: 0
A6659: 0
A6660: 0
A6661: 0
A6662: 0
A6663: 0
A6664: 0
A6665: 0
A6666: 0
A6667: 0
A6668: 0
A6669: 0
A6670: 0
A6671: 0
A6672: 0
A6673: 0
A6674: 0
A6675: 0
A6676: 0
A6677: 0
A6678: 0
A6679: 0
A6680: 0
A6681: 0
A6682: 0
A6683: 0
A6684: 0
A6685: 0
A6686: 0
A6687: 0
A6688: 0
A6689: 0
A6690: 0
A6691: 0
A6692: 0
A6693: 0
A6694: 0
A6695: 0
A6696: 0
A6697: 0
A6698: 0
A6699: 0
A6700: 0
A6701: 0
A6702: 0
A6703: 0
A6704: 0
A6705: 0
A6706: 0
A6707: 0
A6708: 0
A6709: 0
A6710: 0
A6711: 0
A6712: 0
A6713: 0
A6714: 0
A6715: 0
A6716: 0
A6717: 0
A6718: 0
A6719: 0
A6720: 0
A6721: 0
A6722: 0
A6723: 0
A6724: 0
A6725: 0
A6726: 0
A6727: 0
A6728: 0
A6729: 0
A6730: 0
A6731: 0
A6732: 0
A6733: 0
A6734: 0
A6735: 0
A6736: 0
A6737: 0
A6738: 0
A6739: 0
A6740: 0
A6741: 0
A6742: 0
A6743: 0
A6744: 0
A6745: 0
A6746: 0
A6747: 0
A6748: 0
A6749: 0
A6750: 0
A6751: 0
A6752: 0
A6753: 0
A6754: 0
A6755: 0
A6756: 0
A6757: 0
A6758: 0
A6759: 0
A6760: 0
A6761: 0
A6762: 0
A6763: 0
A6764: 0
A6765: 0
A6766: 0
A6767: 0
A6768: 0
A6769: 0
A6770: 0
A6771: 0
A6772: 0
A6773: 0
A6774: 0
A6775: 0
A6776: 0
A6777: 0
A6778: 0
A6779: 0
A6780: 0
A6781: 0
A6782: 0
A6783: 0
A6784: 0
A6785: 0
A6786: 0
A6787: 0
A6788: 0
A6789: 0
A6790: 0
A6791: 0
A6792: 0
A6793: 0
A6794: 0
A6795: 0
A6796: 0
A6797: 0
A6798: 0
A6799: 0
A6800: 0
A6801: 0
A6802: 0
A6803: 0
A6804: 0
A6805: 0
A6806: 0
A6807: 0
A6808: 0
A6809: 0
A6810: 0
A6811: 0
A6812: 0
A6813: 0
A6814: 0
A6815: 0
A6816: 0
A6817: 0
A6818: 0
A6819: 0
A6820: 0
A6821: 0
A6822: 0
A6823: 0
A6824: 0
A6825: 0
A6826: 0
A6827: 0
A6828: 0
A6829: 0
A6830: 0
A6831: 0
A6832: 0
A6833: 0
A6834: 0
A6835: 0
A6836: 0
A6837: 0
A6838: 0
A6839: 0
A6840: 0
A6841: 0
A6842: 0
A6843: 0
A6844: 0
A6845: 0
A6846: 0
A6847: 0
A6848: 0
A6849: 0
A6850: 0
A6851: 0
A6852: 0
A6853: 0
A6854: 0
A6855: 0
A6856: 0
A6857: 0
A6858: 0
A6859: 0
A6860: 0
A6861: 0
A6862: 0
A6863: 0
A6864: 0
A6865: 0
A6866: 0
A6867: 0
A6868: 0
A6869: 0
A6870: 0
A6871: 0
A6872: 0
A6873: 0
A6874: 0
A6875: 0
A6876: 0
A6877: 0
A6878: 0
A6879: 0
A6880: 0
A6881: 0
A6882: 0
A6883: 0
A6884: 0
A6885: 0
A6886: 0
A6887: 0
A6888: 0
A6889: 0
A6890: 0
A6891: 0
A6892: 0
A6893: 0
A6894: 0
A6895: 0
A6896: 0
A6897: 0
A6898: 0
A6899: 0
A6900: 0
A6901: 0
A6902: 0
A6903: 0
A6904: 0
A6905: 0
A6906: 0
A6907: 0
A6908: 0
A6909: 0
A6910: 0
A6911: 0
A6912: 0
A6913: 0
A6914: 0
A6915: 0
A6916: 0
A6917: 0
A6918: 0
A6919: 0
A6920: 0
A6921: 0
A6922: 0
A6923: 0
A6924: 0
A6925: 0
A6926: 0
A6927: 0
A6928: 0
A6929: 0
A6930: 0
A6931: 0
A6932: 0
A6933: 0
A6934: 0
A6935: 0
A6936: 0
A6937: 0
A6938: 0
A6939: 0
A6940: 0
A6941: 0
A6942: 0
A6943: 0
A6944: 0
A6945: 0
A6946: 0
A6947: 0
A6948: 0
A6949: 0
A6950: 0
A6951: 0
A6952: 0
A6953: 0
A6954: 0
A6955: 0
A6956: 0
A6957: 0
A6958: 0
A6959: 0
A6960: 0
A6961: 0
A6962: 0
A6963: 0
A6964: 0
A6965: 0
A6966: 0
A6967: 0
A6968: 0
A6969: 0
A6970: 0
A6971: 0
A6972: 0
A6973: 0
A6974: 0
A6975: 0
A6976: 0
A6977: 0
A6978: 0
A6979: 0
A6980: 0
A6981: 0
A6982: 0
A6983: 0
A6984: 0
A6985: 0
A6986: 0
A6987: 0
A6988: 0
A6989: 0
A6990: 0
A6991: 0
A6992: 0
A6993: 0
A6994: 0
A6995: 0
A6996: 0
A6997: 0
A6998: 0
A6999: 0
A7000: 0
A7001: 0
A7002: 0
A7003: 0
A7004: 0
A7005: 0
A7006: 0
A7007: 0
A7008: 0
A7009: 0
A7010: 0
A7011: 0
A7012: 0
A7013: 0
A7014: 0
A7015: 0
A7016: 0
A7017: 0
A7018: 0
A7019: 0
A7020: 0
A7021: 0
A7022: 0
A7023: 0
A7024: 0
A7025: 0
A7026: 0
A7027: 0
A7028: 0
A7029: 0
A7030: 0
A7031: 0
A7032: 0
A7033: 0
A7034: 0
A7035: 0
A7036: 0
A7037: 0
A7038: 0
A7039: 0
A7040: 0
A7041: 0
A7042: 0
A7043: 0
A7044: 0
A7045: 0
A7046: 0
A7047: 0
A7048: 0
A7049: 0
A7050: 0
A7051: 0
A7052: 0
A7053: 0
A7054: 0
A7055: 0
A7056: 0
A7057: 0
A7058: 0
A7059: 0
A7060: 0
A7061: 0
A7062: 0
A7063: 0
A7064: 0
A7065: 0
A7066: 0
A7067: 0
A7068: 0
A7069: 0
A7070: 0
A7071: 0
A7072: 0
A7073: 0
A7074: 0
A7075: 0
A7076: 0
A7077: 0
A7078: 0
A7079: 0
A7080: 0
A7081: 0
A7082: 0
A7083: 0
A7084: 0
A7085: 0
A7086: 0
A7087: 0
A7088: 0
A7089: 0
A7090: 0
A7091: 0
A7092: 0
A7093: 0
A7094: 0
A7095: 0
A7096: 0
A7097: 0
A7098: 0
A7099: 0
A7100: 0
A7101: 0
A7102: 0
A7103: 0
A7104: 0
A7105: 0
A7106: 0
A7107: 0
A7108: 0
A7109: 0
A7110: 0
A7111: 0
A7112: 0
A7113: 0
A7114: 0
A7115: 0
A7116: 0
A7117: 0
A7118: 0
A7119: 0
A7120: 0
A7121: 0
A7122: 0
A7123: 0
A7124: 0
A7125: 0
A7126: 0
A7127: 0
A7128: 0
A7129: 0
A7130: 0
A7131: 0
A7132: 0
A7133: 0
A7134: 0
A7135: 0
A7136: 0
A7137: 0
A7138: 0
A7139: 0
A7140: 0
A7141: 0
A7142: 0
A7143: 0
A7144: 0
A7145: 0
A7146: 0
A7147: 0
A7148: 0
A7149: 0
A7150: 0
A7151: 0
A7152: 0
A7153: 0
A7154: 0
A7155: 0
A7156: 0
A7157: 0
A7158: 0
A7159: 0
A7160: 0
A7161: 0
A7162: 0
A7163: 0
A7164: 0
A7165: 0
A7166: 0
A7167: 0
A7168: 0
A7169: 0
A7170: 0
A7171: 0
A7172: 0
A7173: 0
A7174: 0
A7175: 0
A7176: 0
A7177: 0
A7178: 0
A7179: 0
A7180: 0
A7181: 0
A7182: 0
A7183: 0
A7184: 0
A7185: 0
A7186: 0
A7187: 0
A7188: 0
A7189: 0
A7190: 0
A7191: 0
A7192: 0
A7193: 0
A7194: 0
A7195: 0
A7196: 0
A7197: 0
A7198: 0
A7199: 0
A7200: 0
A7201: 0
A7202: 0
A7203: 0
A7204: 0
A7205: 0
A7206: 0
A7207: 0
A7208: 0
A7209: 0
A7210: 0
A7211: 0
A7212: 0
A7213: 0
A7214: 0
A7215: 0
A7216: 0
A7217: 0
A7218: 0
A7219: 0
A7220: 0
A7221: 0
A7222: 0
A7223: 0
A7224: 0
A7225: 0
A7226: 0
A7227: 0
A7228: 0
A7229: 0
A7230: 0
A7231: 0
A7232: 0
A7233: 0
A7234: 0
A7235: 0
A7236: 0
A7237: 0
A7238: 0
A7239: 0
A7240: 0
A7241: 0
A7242: 0
A7243: 0
A7244: 0
A7245: 0
A7246: 0
A7247: 0
A7248: 0
A7249: 0
A7250: 0
A7251: 0
A7252: 0
A7253: 0
A7254: 0
A7255: 0
A7256: 0
A7257: 0
A7258: 0
A7259: 0
A7260: 0
A7261: 0
A7262: 0
A7263: 0
A7264: 0
A7265: 0
A7266: 0
A7267: 0
A7268: 0
A7269: 0
A7270: 0
A7271: 0
A7272: 0
A7273: 0
A7274: 0
A7275: 0
A7276: 0
A7277: 0
A7278: 0
A7279: 0
A7280: 0
A7281: 0
A7282: 0
A7283: 0
A7284: 0
A7285: 0
A7286: 0
A7287: 0
A7288: 0
A7289: 0
A7290: 0
A7291: 0
A7292: 0
A7293: 0
A7294: 0
A7295: 0
A7296: 0
A7297: 0
A7298: 0
A7299: 0
A7300: 0
A7301: 0
A7302: 0
A7303: 0
A7304: 0
A7305: 0
A7306: 0
A7307: 0
A7308: 0
A7309: 0
A7310: 0
A7311: 0
A7312: 0
A7313: 0
A7314: 0
A7315: 0
A7316: 0
A7317: 0
A7318: 0
A7319: 0
A7320: 0
A7321: 0
A7322: 0
A7323: 0
A7324: 0
A7325: 0
A7326: 0
A7327: 0
A7328: 0
A7329: 0
A7330: 0
A7331: 0
A7332: 0
A7333: 0
A7334: 0
A7335: 0
A7336: 0
A7337: 0
A7338: 0
A7339: 0
A7340: 0
A7341: 0
A7342: 0
A7343: 0
A7344: 0
A7345: 0
A7346: 0
A7347: 0
A7348: 0
A7349: 0
A7350: 0
A7351: 0
A7352: 0
A7353: 0
A7354: 0
A7355: 0
A7356: 0
A7357: 0
A7358: 0
A7359: 0
A7360: 0
A7361: 0
A7362: 0
A7363: 0
A7364: 0
A7365: 0
A7366: 0
A7367: 0
A7368: 0
A7369: 0
A7370: 0
A7371: 0
A7372: 0
A7373: 0
A7374: 0
A7375: 0
A7376: 0
A7377: 0
A7378: 0
A7379: 0
A7380: 0
A7381: 0
A7382: 0
A7383: 0
A7384: 0
A7385: 0
A7386: 0
A7387: 0
A7388: 0
A7389: 0
A7390: 0
A7391: 0
A7392: 0
A7393: 0
A7394: 0
A7395: 0
A7396: 0
A7397: 0
A7398: 0
A7399: 0
A7400: 0
A7401: 0
A7402: 0
A7403: 0
A7404: 0
A7405: 0
A7406: 0
A7407: 0
A7408: 0
A7409: 0
A7410: 0
A7411: 0
A7412: 0
A7413: 0
A7414: 0
A7415: 0
A7416: 0
A7417: 0
A7418: 0
A7419: 0
A7420: 0
A7421: 0
A7422: 0
A7423: 0
A7424: 0
A7425: 0
A7426: 0
A7427: 0
A7428: 0
A7429: 0
A7430: 0
A7431: 0
A7432: 0
A7433: 0
A7434: 0
A7435: 0
A7436: 0
A7437: 0
A7438: 0
A7439: 0
A7440: 0
A7441: 0
A7442: 0
A7443: 0
A7444: 0
A7445: 0
A7446: 0
A7447: 0
A7448: 0
A7449: 0
A7450: 0
A7451: 0
A7452: 0
A7453: 0
A7454: 0
A7455: 0
A7456: 0
A7457: 0
A7458: 0
A7459: 0
A7460: 0
A7461: 0
A7462: 0
A7463: 0
A7464: 0
A7465: 0
A7466: 0
A7467: 0
A7468: 0
A7469: 0
A7470: 0
A7471: 0
A7472: 0
A7473: 0
A7474: 0
A7475: 0
A7476: 0
A7477: 0
A7478: 0
A7479: 0
A7480: 0
A7481: 0
A7482: 0
A7483: 0
A7484: 0
A7485: 0
A7486: 0
A7487: 0
A7488: 0
A7489: 0
A7490: 0
A7491: 0
A7492: 0
A7493: 0
A7494: 0
A7495: 0
A7496: 0
A7497: 0
A7498: 0
A7499: 0
A7500: 0
A7501: 0
A7502: 0
A7503: 0
A7504: 0
A7505: 0
A7506: 0
A7507: 0
A7508: 0
A7509: 0
A7510: 0
A7511: 0
A7512: 0
A7513: 0
A7514: 0
A7515: 0
A7516: 0
A7517: 0
A7518: 0
A7519: 0
A7520: 0
A7521: 0
A7522: 0
A7523: 0
A7524: 0
A7525: 0
A7526: 0
A7527: 0
A7528: 0
A7529: 0
A7530: 0
A7531: 0
A7532: 0
A7533: 0
A7534: 0
A7535: 0
A7536: 0
A7537: 0
A7538: 0
A7539: 0
A7540: 0
A7541: 0
A7542: 0
A7543: 0
A7544: 0
A7545: 0
A7546: 0
A7547: 0
A7548: 0
A7549: 0
A7550: 0
A7551: 0
A7552: 0
A7553: 0
A7554: 0
A7555: 0
A7556: 0
A7557: 0
A7558: 0
A7559: 0
A7560: 0
A7561: 0
A7562: 0
A7563: 0
A7564: 0
A7565: 0
A7566: 0
A7567: 0
A7568: 0
A7569: 0
A7570: 0
A7571: 0
A7572: 0
A7573: 0
A7574: 0
A7575: 0
A7576: 0
A7577: 0
A7578: 0
A7579: 0
A7580: 0
A7581: 0
A7582: 0
A7583: 0
A7584: 0
A7585: 0
A7586: 0
A7587: 0
A7588: 0
A7589: 0
A7590: 0
A7591: 0
A7592: 0
A7593: 0
A7594: 0
A7595: 0
A7596: 0
A7597: 0
A7598: 0
A7599: 0
A7600: 0
A7601: 0
A7602: 0
A7603: 0
A7604: 0
A7605: 0
A7606: 0
A7607: 0
A7608: 0
A7609: 0
A7610: 0
A7611: 0
A7612: 0
A7613: 0
A7614: 0
A7615: 0
A7616: 0
A7617: 0
A7618: 0
A7619: 0
A7620: 0
A7621: 0
A7622: 0
A7623: 0
A7624: 0
A7625: 0
A7626: 0
A7627: 0
A7628: 0
A7629: 0
A7630: 0
A7631: 0
A7632: 0
A7633: 0
A7634: 0
A7635: 0
A7636: 0
A7637: 0
A7638: 0
A7639: 0
A7640: 0
A7641: 0
A7642: 0
A7643: 0
A7644: 0
A7645: 0
A7646: 0
A7647: 0
A7648: 0
A7649: 0
A7650: 0
A7651: 0
A7652: 0
A7653: 0
A7654: 0
A7655: 0
A7656: 0
A7657: 0
A7658: 0
A7659: 0
A7660: 0
A7661: 0
A7662: 0
A7663: 0
A7664: 0
A7665: 0
A7666: 0
A7667: 0
A7668: 0
A7669: 0
A7670: 0
A7671: 0
A7672: 0
A7673: 0
A7674: 0
A7675: 0
A7676: 0
A7677: 0
A7678: 0
A7679: 0
A7680: 0
A7681: 0
A7682: 0
A7683: 0
A7684: 0
A7685: 0
A7686: 0
A7687: 0
A7688: 0
A7689: 0
A7690: 0
A7691: 0
A7692: 0
A7693: 0
A7694: 0
A7695: 0
A7696: 0
A7697: 0
A7698: 0
A7699: 0
A7700: 0
A7701: 0
A7702: 0
A7703: 0
A7704: 0
A7705: 0
A7706: 0
A7707: 0
A7708: 0
A7709: 0
A7710: 0
A7711: 0
A7712: 0
A7713: 0
A7714: 0
A7715: 0
A7716: 0
A7717: 0
A7718: 0
A7719: 0
A7720: 0
A7721: 0
A7722: 0
A7723: 0
A7724: 0
A7725: 0
A7726: 0
A7727: 0
A7728: 0
A7729: 0
A7730: 0
A7731: 0
A7732: 0
A7733: 0
A7734: 0
A7735: 0
A7736: 0
A7737: 0
A7738: 0
A7739: 0
A7740: 0
A7741: 0
A7742: 0
A7743: 0
A7744: 0
A7745: 0
A7746: 0
A7747: 0
A7748: 0
A7749: 0
A7750: 0
A7751: 0
A7752: 0
A7753: 0
A7754: 0
A7755: 0
A7756: 0
A7757: 0
A7758: 0
A7759: 0
A7760: 0
A7761: 0
A7762: 0
A7763: 0
A7764: 0
A7765: 0
A7766: 0
A7767: 0
A7768: 0
A7769: 0
A7770: 0
A7771: 0
A7772: 0
A7773: 0
A7774: 0
A7775: 0
A7776: 0
A7777: 0
A7778: 0
A7779: 0
A7780: 0
A7781: 0
A7782: 0
A7783: 0
A7784: 0
A7785: 0
A7786: 0
A7787: 0
A7788: 0
A7789: 0
A7790: 0
A7791: 0
A7792: 0
A7793: 0
A7794: 0
A7795: 0
A7796: 0
A7797: 0
A7798: 0
A7799: 0
A7800: 0
A7801: 0
A7802: 0
A7803: 0
A7804: 0
A7805: 0
A7806: 0
A7807: 0
A7808: 0
A7809: 0
A7810: 0
A7811: 0
A7812: 0
A7813: 0
A7814: 0
A7815: 0
A7816: 0
A7817: 0
A7818: 0
A7819: 0
A7820: 0
A7821: 0
A7822: 0
A7823: 0
A7824: 0
A7825: 0
A7826: 0
A7827: 0
A7828: 0
A7829: 0
A7830: 0
A7831: 0
A7832: 0
A7833: 0
A7834: 0
A7835: 0
A7836: 0
A7837: 0
A7838: 0
A7839: 0
A7840: 0
A7841: 0
A7842: 0
A7843: 0
A7844: 0
A7845: 0
A7846: 0
A7847: 0
A7848: 0
A7849: 0
A7850: 0
A7851: 0
A7852: 0
A7853: 0
A7854: 0
A7855: 0
A7856: 0
A7857: 0
A7858: 0
A7859: 0
A7860: 0
A7861: 0
A7862: 0
A7863: 0
A7864: 0
A7865: 0
A7866: 0
A7867: 0
A7868: 0
A7869: 0
A7870: 0
A7871: 0
A7872: 0
A7873: 0
A7874: 0
A7875: 0
A7876: 0
A7877: 0
A7878: 0
A7879: 0
A7880: 0
A7881: 0
A7882: 0
A7883: 0
A7884: 0
A7885: 0
A7886: 0
A7887: 0
A7888: 0
A7889: 0
A7890: 0
A7891: 0
A7892: 0
A7893: 0
A7894: 0
A7895: 0
A7896: 0
A7897: 0
A7898: 0
A7899: 0
A7900: 0
A7901: 0
A7902: 0
A7903: 0
A7904: 0
A7905: 0
A7906: 0
A7907: 0
A7908: 0
A7909: 0
A7910: 0
A7911: 0
A7912: 0
A7913: 0
A7914: 0
A7915: 0
A7916: 0
A7917: 0
A7918: 0
A7919: 0
A7920: 0
A7921: 0
A7922: 0
A7923: 0
A7924: 0
A7925: 0
A7926: 0
A7927: 0
A7928: 0
A7929: 0
A7930: 0
A7931: 0
A7932: 0
A7933: 0
A7934: 0
A7935: 0
A7936: 0
A7937: 0
A7938: 0
A7939: 0
A7940: 0
A7941: 0
A7942: 0
A7943: 0
A7944: 0
A7945: 0
A7946: 0
A7947: 0
A7948: 0
A7949: 0
A7950: 0
A7951: 0
A7952: 0
A7953: 0
A7954: 0
A7955: 0
A7956: 0
A7957: 0
A7958: 0
A7959: 0
A7960: 0
A7961: 0
A7962: 0
A7963: 0
A7964: 0
A7965: 0
A7966: 0
A7967: 0
A7968: 0
A7969: 0
A7970: 0
A7971: 0
A7972: 0
A7973: 0
A7974: 0
A7975: 0
A7976: 0
A7977: 0
A7978: 0
A7979: 0
A7980: 0
A7981: 0
A7982: 0
A7983: 0
A7984: 0
A7985: 0
A7986: 0
A7987: 0
A7988: 0
A7989: 0
A7990: 0
A7991: 0
A7992: 0
A7993: 0
A7994: 0
A7995: 0
A7996: 0
A7997: 0
A7998: 0
A7999: 0
A8000: 0
A8001: 0
A8002: 0
A8003: 0
A8004: 0
A8005: 0
A8006: 0
A8007: 0
A8008: 0
A8009: 0
A8010: 0
A8011: 0
A8012: 0
A8013: 0
A8014: 0
A8015: 0
A8016: 0
A8017: 0
A8018: 0
A8019: 0
A8020: 0
A8021: 0
A8022: 0
A8023: 0
A8024: 0
A8025: 0
A8026: 0
A8027: 0
A8028: 0
A8029: 0
A8030: 0
A8031: 0
A8032: 0
A8033: 0
A8034: 0
A8035: 0
A8036: 0
A8037: 0
A8038: 0
A8039: 0
A8040: 0
A8041: 0
A8042: 0
A8043: 0
A8044: 0
A8045: 0
A8046: 0
A8047: 0
A8048: 0
A8049: 0
A8050: 0
A8051: 0
A8052: 0
A8053: 0
A8054: 0
A8055: 0
A8056: 0
A8057: 0
A8058: 0
A8059: 0
A8060: 0
A8061: 0
A8062: 0
A8063: 0
A8064: 0
A8065: 0
A8066: 0
A8067: 0
A8068: 0
A8069: 0
A8070: 0
A8071: 0
A8072: 0
A8073: 0
A8074: 0
A8075: 0
A8076: 0
A8077: 0
A8078: 0
A8079: 0
A8080: 0
A8081: 0
A8082: 0
A8083: 0
A8084: 0
A8085: 0
A8086: 0
A8087: 0
A8088: 0
A8089: 0
A8090: 0
A8091: 0
A8092: 0
A8093: 0
A8094: 0
A8095: 0
A8096: 0
A8097: 0
A8098: 0
A8099: 0
A8100: 0
A8101: 0
A8102: 0
A8103: 0
A8104: 0
A8105: 0
A8106: 0
A8107: 0
A8108: 0
A8109: 0
A8110: 0
A8111: 0
A8112: 0
A8113: 0
A8114: 0
A8115: 0
A8116: 0
A8117: 0
A8118: 0
A8119: 0
A8120: 0
A8121: 0
A8122: 0
A8123: 0
A8124: 0
A8125: 0
A8126: 0
A8127: 0
A8128: 0
A8129: 0
A8130: 0
A8131: 0
A8132: 0
A8133: 0
A8134: 0
A8135: 0
A8136: 0
A8137: 0
A8138: 0
A8139: 0
A8140: 0
A8141: 0
A8142: 0
A8143: 0
A8144: 0
A8145: 0
A8146: 0
A8147: 0
A8148: 0
A8149: 0
A8150: 0
A8151: 0
A8152: 0
A8153: 0
A8154: 0
A8155: 0
A8156: 0
A8157: 0
A8158: 0
A8159: 0
A8160: 0
A8161: 0
A8162: 0
A8163: 0
A8164: 0
A8165: 0
A8166: 0
A8167: 0
A8168: 0
A8169: 0
A8170: 0
A8171: 0
A8172: 0
A8173: 0
A8174: 0
A8175: 0
A8176: 0
A8177: 0
A8178: 0
A8179: 0
A8180: 0
A8181: 0
A8182: 0
A8183: 0
A8184: 0
A8185: 0
A8186: 0
A8187: 0
A8188: 0
A8189: 0
A8190: 0
A8191: 0
A8192: 0
A8193: 0
A8194: 0
A8195: 0
A8196: 0
A8197: 0
A8198: 0
A8199: 0
A8200: 0
A8201: 0
A8202: 0
A8203: 0
A8204: 0
A8205: 0
A8206: 0
A8207: 0
A8208: 0
A8209: 0
A8210: 0
A8211: 0
A8212: 0
A8213: 0
A8214: 0
A8215: 0
A8216: 0
A8217: 0
A8218: 0
A8219: 0
A8220: 0
A8221: 0
A8222: 0
A8223: 0
A8224: 0
A8225: 0
A8226: 0
A8227: 0
A8228: 0
A8229: 0
A8230: 0
A8231: 0
A8232: 0
A8233: 0
A8234: 0
A8235: 0
A8236: 0
A8237: 0
A8238: 0
A8239: 0
A8240: 0
A8241: 0
A8242: 0
A8243: 0
A8244: 0
A8245: 0
A8246: 0
A8247: 0
A8248: 0
A8249: 0
A8250: 0
A8251: 0
A8252: 0
A8253: 0
A8254: 0
A8255: 0
A8256: 0
A8257: 0
A8258: 0
A8259: 0
A8260: 0
A8261: 0
A8262: 0
A8263: 0
A8264: 0
A8265: 0
A8266: 0
A8267: 0
A8268: 0
A8269: 0
A8270: 0
A8271: 0
A8272: 0
A8273: 0
A8274: 0
A8275: 0
A8276: 0
A8277: 0
A8278: 0
A8279: 0
A8280: 0
A8281: 0
A8282: 0
A8283: 0
A8284: 0
A8285: 0
A8286: 0
A8287: 0
A8288: 0
A8289: 0
A8290: 0
A8291: 0
A8292: 0
A8293: 0
A8294: 0
A8295: 0
A8296: 0
A8297: 0
A8298: 0
A8299: 0
A8300: 0
A8301: 0
A8302: 0
A8303: 0
A8304: 0
A8305: 0
A8306: 0
A8307: 0
A8308: 0
A8309: 0
A8310: 0
A8311: 0
A8312: 0
A8313: 0
A8314: 0
A8315: 0
A8316: 0
A8317: 0
A8318: 0
A8319: 0
A8320: 0
A8321: 0
A8322: 0
A8323: 0
A8324: 0
A8325: 0
A8326: 0
A8327: 0
A8328: 0
A8329: 0
A8330: 0
A8331: 0
A8332: 0
A8333: 0
A8334: 0
A8335: 0
A8336: 0
A8337: 0
A8338: 0
A8339: 0
A8340: 0
A8341: 0
A8342: 0
A8343: 0
A8344: 0
A8345: 0
A8346: 0
A8347: 0
A8348: 0
A8349: 0
A8350: 0
A8351: 0
A8352: 0
A8353: 0
A8354: 0
A8355: 0
A8356: 0
A8357: 0
A8358: 0
A8359: 0
A8360: 0
A8361: 0
A8362: 0
A8363: 0
A8364: 0
A8365: 0
A8366: 0
A8367: 0
A8368: 0
A8369: 0
A8370: 0
A8371: 0
A8372: 0
A8373: 0
A8374: 0
A8375: 0
A8376: 0
A8377: 0
A8378: 0
A8379: 0
A8380: 0
A8381: 0
A8382: 0
A8383: 0
A8384: 0
A8385: 0
A8386: 0
A8387: 0
A8388: 0
A8389: 0
A8390: 0
A8391: 0
A8392: 0
A8393: 0
A8394: 0
A8395: 0
A8396: 0
A8397: 0
A8398: 0
A8399: 0
A8400: 0
A8401: 0
A8402: 0
A8403: 0
A8404: 0
A8405: 0
A8406: 0
A8407: 0
A8408: 0
A8409: 0
A8410: 0
A8411: 0
A8412: 0
A8413: 0
A8414: 0
A8415: 0
A8416: 0
A8417: 0
A8418: 0
A8419: 0
A8420: 0
A8421: 0
A8422: 0
A8423: 0
A8424: 0
A8425: 0
A8426: 0
A8427: 0
A8428: 0
A8429: 0
A8430: 0
A8431: 0
A8432: 0
A8433: 0
A8434: 0
A8435: 0
A8436: 0
A8437: 0
A8438: 0
A8439: 0
A8440: 0
A8441: 0
A8442: 0
A8443: 0
A8444: 0
A8445: 0
A8446: 0
A8447: 0
A8448: 0
A8449: 0
A8450: 0
A8451: 0
A8452: 0
A8453: 0
A8454: 0
A8455: 0
A8456: 0
A8457: 0
A8458: 0
A8459: 0
A8460: 0
A8461: 0
A8462: 0
A8463: 0
A8464: 0
A8465: 0
A8466: 0
A8467: 0
A8468: 0
A8469: 0
A8470: 0
A8471: 0
A8472: 0
A8473: 0
A8474: 0
A8475: 0
A8476: 0
A8477: 0
A8478: 0
A8479: 0
A8480: 0
A8481: 0
A8482: 0
A8483: 0
A8484: 0
A8485: 0
A8486: 0
A8487: 0
A8488: 0
A8489: 0
A8490: 0
A8491: 0
A8492: 0
A8493: 0
A8494: 0
A8495: 0
A8496: 0
A8497: 0
A8498: 0
A8499: 0
A8500: 0
A8501: 0
A8502: 0
A8503: 0
A8504: 0
A8505: 0
A8506: 0
A8507: 0
A8508: 0
A8509: 0
A8510: 0
A8511: 0
A8512: 0
A8513: 0
A8514: 0
A8515: 0
A8516: 0
A8517: 0
A8518: 0
A8519: 0
A8520: 0
A8521: 0
A8522: 0
A8523: 0
A8524: 0
A8525: 0
A8526: 0
A8527: 0
A8528: 0
A8529: 0
A8530: 0
A8531: 0
A8532: 0
A8533: 0
A8534: 0
A8535: 0
A8536: 0
A8537: 0
A8538: 0
A8539: 0
A8540: 0
A8541: 0
A8542: 0
A8543: 0
A8544: 0
A8545: 0
A8546: 0
A8547: 0
A8548: 0
A8549: 0
A8550: 0
A8551: 0
A8552: 0
A8553: 0
A8554: 0
A8555: 0
A8556: 0
A8557: 0
A8558: 0
A8559: 0
A8560: 0
A8561: 0
A8562: 0
A8563: 0
A8564: 0
A8565: 0
A8566: 0
A8567: 0
A8568: 0
A8569: 0
A8570: 0
A8571: 0
A8572: 0
A8573: 0
A8574: 0
A8575: 0
A8576: 0
A8577: 0
A8578: 0
A8579: 0
A8580: 0
A8581: 0
A8582: 0
A8583: 0
A8584: 0
A8585: 0
A8586: 0
A8587: 0
A8588: 0
A8589: 0
A8590: 0
A8591: 0
A8592: 0
A8593: 0
A8594: 0
A8595: 0
A8596: 0
A8597: 0
A8598: 0
A8599: 0
A8600: 0
A8601: 0
A8602: 0
A8603: 0
A8604: 0
A8605: 0
A8606: 0
A8607: 0
A8608: 0
A8609: 0
A8610: 0
A8611: 0
A8612: 0
A8613: 0
A8614: 0
A8615: 0
A8616: 0
A8617: 0
A8618: 0
A8619: 0
A8620: 0
A8621: 0
A8622: 0
A8623: 0
A8624: 0
A8625: 0
A8626: 0
A8627: 0
A8628: 0
A8629: 0
A8630: 0
A8631: 0
A8632: 0
A8633: 0
A8634: 0
A8635: 0
A8636: 0
A8637: 0
A8638: 0
A8639: 0
A8640: 0
A8641: 0
A8642: 0
A8643: 0
A8644: 0
A8645: 0
A8646: 0
A8647: 0
A8648: 0
A8649: 0
A8650: 0
A8651: 0
A8652: 0
A8653: 0
A8654: 0
A8655: 0
A8656: 0
A8657: 0
A8658: 0
A8659: 0
A8660: 0
A8661: 0
A8662: 0
A8663: 0
A8664: 0
A8665: 0
A8666: 0
A8667: 0
A8668: 0
A8669: 0
A8670: 0
A8671: 0
A8672: 0
A8673: 0
A8674: 0
A8675: 0
A8676: 0
A8677: 0
A8678: 0
A8679: 0
A8680: 0
A8681: 0
A8682: 0
A8683: 0
A8684: 0
A8685: 0
A8686: 0
A8687: 0
A8688: 0
A8689: 0
A8690: 0
A8691: 0
A8692: 0
A8693: 0
A8694: 0
A8695: 0
A8696: 0
A8697: 0
A8698: 0
A8699: 0
A8700: 0
A8701: 0
A8702: 0
A8703: 0
A8704: 0
A8705: 0
A8706: 0
A8707: 0
A8708: 0
A8709: 0
A8710: 0
A8711: 0
A8712: 0
A8713: 0
A8714: 0
A8715: 0
A8716: 0
A8717: 0
A8718: 0
A8719: 0
A8720: 0
A8721: 0
A8722: 0
A8723: 0
A8724: 0
A8725: 0
A8726: 0
A8727: 0
A8728: 0
A8729: 0
A8730: 0
A8731: 0
A8732: 0
A8733: 0
A8734: 0
A8735: 0
A8736: 0
A8737: 0
A8738: 0
A8739: 0
A8740: 0
A8741: 0
A8742: 0
A8743: 0
A8744: 0
A8745: 0
A8746: 0
A8747: 0
A8748: 0
A8749: 0
A8750: 0
A8751: 0
A8752: 0
A8753: 0
A8754: 0
A8755: 0
A8756: 0
A8757: 0
A8758: 0
A8759: 0
A8760: 0
A8761: 0
A8762: 0
A8763: 0
A8764: 0
A8765: 0
A8766: 0
A8767: 0
A8768: 0
A8769: 0
A8770: 0
A8771: 0
A8772: 0
A8773: 0
A8774: 0
A8775: 0
A8776: 0
A8777: 0
A8778: 0
A8779: 0
A8780: 0
A8781: 0
A8782: 0
A8783: 0
A8784: 0
A8785: 0
A8786: 0
A8787: 0
A8788: 0
A8789: 0
A8790: 0
A8791: 0
A8792: 0
A8793: 0
A8794: 0
A8795: 0
A8796: 0
A8797: 0
A8798: 0
A8799: 0
A8800: 0
A8801: 0
A8802: 0
A8803: 0
A8804: 0
A8805: 0
A8806: 0
A8807: 0
A8808: 0
A8809: 0
A8810: 0
A8811: 0
A8812: 0
A8813: 0
A8814: 0
A8815: 0
A8816: 0
A8817: 0
A8818: 0
A8819: 0
A8820: 0
A8821: 0
A8822: 0
A8823: 0
A8824: 0
A8825: 0
A8826: 0
A8827: 0
A8828: 0
A8829: 0
A8830: 0
A8831: 0
A8832: 0
A8833: 0
A8834: 0
A8835: 0
A8836: 0
A8837: 0
A8838: 0
A8839: 0
A8840: 0
A8841: 0
A8842: 0
A8843: 0
A8844: 0
A8845: 0
A8846: 0
A8847: 0
A8848: 0
A8849: 0
A8850: 0
A8851: 0
A8852: 0
A8853: 0
A8854: 0
A8855: 0
A8856: 0
A8857: 0
A8858: 0
A8859: 0
A8860: 0
A8861: 0
A8862: 0
A8863: 0
A8864: 0
A8865: 0
A8866: 0
A8867: 0
A8868: 0
A8869: 0
A8870: 0
A8871: 0
A8872: 0
A8873: 0
A8874: 0
A8875: 0
A8876: 0
A8877: 0
A8878: 0
A8879: 0
A8880: 0
A8881: 0
A8882: 0
A8883: 0
A8884: 0
A8885: 0
A8886: 0
A8887: 0
A8888: 0
A8889: 0
A8890: 0
A8891: 0
A8892: 0
A8893: 0
A8894: 0
A8895: 0
A8896: 0
A8897: 0
A8898: 0
A8899: 0
A8900: 0
A8901: 0
A8902: 0
A8903: 0
A8904: 0
A8905: 0
A8906: 0
A8907: 0
A8908: 0
A8909: 0
A8910: 0
A8911: 0
A8912: 0
A8913: 0
A8914: 0
A8915: 0
A8916: 0
A8917: 0
A8918: 0
A8919: 0
A8920: 0
A8921: 0
A8922: 0
A8923: 0
A8924: 0
A8925: 0
A8926: 0
A8927: 0
A8928: 0
A8929: 0
A8930: 0
A8931: 0
A8932: 0
A8933: 0
A8934: 0
A8935: 0
A8936: 0
A8937: 0
A8938: 0
A8939: 0
A8940: 0
A8941: 0
A8942: 0
A8943: 0
A8944: 0
A8945: 0
A8946: 0
A8947: 0
A8948: 0
A8949: 0
A8950: 0
A8951: 0
A8952: 0
A8953: 0
A8954: 0
A8955: 0
A8956: 0
A8957: 0
A8958: 0
A8959: 0
A8960: 0
A8961: 0
A8962: 0
A8963: 0
A8964: 0
A8965: 0
A8966: 0
A8967: 0
A8968: 0
A8969: 0
A8970: 0
A8971: 0
A8972: 0
A8973: 0
A8974: 0
A8975: 0
A8976: 0
A8977: 0
A8978: 0
A8979: 0
A8980: 0
A8981: 0
A8982: 0
A8983: 0
A8984: 0
A8985: 0
A8986: 0
A8987: 0
A8988: 0
A8989: 0
A8990: 0
A8991: 0
A8992: 0
A8993: 0
A8994: 0
A8995: 0
A8996: 0
A8997: 0
A8998: 0
A8999: 0
A9000: 0
A9001: 0
A9002: 0
A9003: 0
A9004: 0
A9005: 0
A9006: 0
A9007: 0
A9008: 0
A9009: 0
A9010: 0
A9011: 0
A9012: 0
A9013: 0
A9014: 0
A9015: 0
A9016: 0
A9017: 0
A9018: 0
A9019: 0
A9020: 0
A9021: 0
A9022: 0
A9023: 0
A9024: 0
A9025: 0
A9026: 0
A9027: 0
A9028: 0
A9029: 0
A9030: 0
A9031: 0
A9032: 0
A9033: 0
A9034: 0
A9035: 0
A9036: 0
A9037: 0
A9038: 0
A9039: 0
A9040: 0
A9041: 0
A9042: 0
A9043: 0
A9044: 0
A9045: 0
A9046: 0
A9047: 0
A9048: 0
A9049: 0
A9050: 0
A9051: 0
A9052: 0
A9053: 0
A9054: 0
A9055: 0
A9056: 0
A9057: 0
A9058: 0
A9059: 0
A9060: 0
A9061: 0
A9062: 0
A9063: 0
A9064: 0
A9065: 0
A9066: 0
A9067: 0
A9068: 0
A9069: 0
A9070: 0
A9071: 0
A9072: 0
A9073: 0
A9074: 0
A9075: 0
A9076: 0
A9077: 0
A9078: 0
A9079: 0
A9080: 0
A9081: 0
A9082: 0
A9083: 0
A9084: 0
A9085: 0
A9086: 0
A9087: 0
A9088: 0
A9089: 0
A9090: 0
A9091: 0
A9092: 0
A9093: 0
A9094: 0
A9095: 0
A9096: 0
A9097: 0
A9098: 0
A9099: 0
A9100: 0
A9101: 0
A9102: 0
A9103: 0
A9104: 0
A9105: 0
A9106: 0
A9107: 0
A9108: 0
A9109: 0
A9110: 0
A9111: 0
A9112: 0
A9113: 0
A9114: 0
A9115: 0
A9116: 0
A9117: 0
A9118: 0
A9119: 0
A9120: 0
A9121: 0
A9122: 0
A9123: 0
A9124: 0
A9125: 0
A9126: 0
A9127: 0
A9128: 0
A9129: 0
A9130: 0
A9131: 0
A9132: 0
A9133: 0
A9134: 0
A9135: 0
A9136: 0
A9137: 0
A9138: 0
A9139: 0
A9140: 0
A9141: 0
A9142: 0
A9143: 0
A9144: 0
A9145: 0
A9146: 0
A9147: 0
A9148: 0
A9149: 0
A9150: 0
A9151: 0
A9152: 0
A9153: 0
A9154: 0
A9155: 0
A9156: 0
A9157: 0
A9158: 0
A9159: 0
A9160: 0
A9161: 0
A9162: 0
A9163: 0
A9164: 0
A9165: 0
A9166: 0
A9167: 0
A9168: 0
A9169: 0
A9170: 0
A9171: 0
A9172: 0
A9173: 0
A9174: 0
A9175: 0
A9176: 0
A9177: 0
A9178: 0
A9179: 0
A9180: 0
A9181: 0
A9182: 0
A9183: 0
A9184: 0
A9185: 0
A9186: 0
A9187: 0
A9188: 0
A9189: 0
A9190: 0
A9191: 0
A9192: 0
A9193: 0
A9194: 0
A9195: 0
A9196: 0
A9197: 0
A9198: 0
A9199: 0
A9200: 0
A9201: 0
A9202: 0
A9203: 0
A9204: 0
A9205: 0
A9206: 0
A9207: 0
A9208: 0
A9209: 0
A9210: 0
A9211: 0
A9212: 0
A9213: 0
A9214: 0
A9215: 0
A9216: 0
A9217: 0
A9218: 0
A9219: 0
A9220: 0
A9221: 0
A9222: 0
A9223: 0
A9224: 0
A9225: 0
A9226: 0
A9227: 0
A9228: 0
A9229: 0
A9230: 0
A9231: 0
A9232: 0
A9233: 0
A9234: 0
A9235: 0
A9236: 0
A9237: 0
A9238: 0
A9239: 0
A9240: 0
A9241: 0
A9242: 0
A9243: 0
A9244: 0
A9245: 0
A9246: 0
A9247: 0
A9248: 0
A9249: 0
A9250: 0
A9251: 0
A9252: 0
A9253: 0
A9254: 0
A9255: 0
A9256: 0
A9257: 0
A9258: 0
A9259: 0
A9260: 0
A9261: 0
A9262: 0
A9263: 0
A9264: 0
A9265: 0
A9266: 0
A9267: 0
A9268: 0
A9269: 0
A9270: 0
A9271: 0
A9272: 0
A9273: 0
A9274: 0
A9275: 0
A9276: 0
A9277: 0
A9278: 0
A9279: 0
A9280: 0
A9281: 0
A9282: 0
A9283: 0
A9284: 0
A9285: 0
A9286: 0
A9287: 0
A9288: 0
A9289: 0
A9290: 0
A9291: 0
A9292: 0
A9293: 0
A9294: 0
A9295: 0
A9296: 0
A9297: 0
A9298: 0
A9299: 0
A9300: 0
A9301: 0
A9302: 0
A9303: 0
A9304: 0
A9305: 0
A9306: 0
A9307: 0
A9308: 0
A9309: 0
A9310: 0
A9311: 0
A9312: 0
A9313: 0
A9314: 0
A9315: 0
A9316: 0
A9317: 0
A9318: 0
A9319: 0
A9320: 0
A9321: 0
A9322: 0
A9323: 0
A9324: 0
A9325: 0
A9326: 0
A9327: 0
A9328: 0
A9329: 0
A9330: 0
A9331: 0
A9332: 0
A9333: 0
A9334: 0
A9335: 0
A9336: 0
A9337: 0
A9338: 0
A9339: 0
A9340: 0
A9341: 0
A9342: 0
A9343: 0
A9344: 0
A9345: 0
A9346: 0
A9347: 0
A9348: 0
A9349: 0
A9350: 0
A9351: 0
A9352: 0
A9353: 0
A9354: 0
A9355: 0
A9356: 0
A9357: 0
A9358: 0
A9359: 0
A9360: 0
A9361: 0
A9362: 0
A9363: 0
A9364: 0
A9365: 0
A9366: 0
A9367: 0
A9368: 0
A9369: 0
A9370: 0
A9371: 0
A9372: 0
A9373: 0
A9374: 0
A9375: 0
A9376: 0
A9377: 0
A9378: 0
A9379: 0
A9380: 0
A9381: 0
A9382: 0
A9383: 0
A9384: 0
A9385: 0
A9386: 0
A9387: 0
A9388: 0
A9389: 0
A9390: 0
A9391: 0
A9392: 0
A9393: 0
A9394: 0
A9395: 0
A9396: 0
A9397: 0
A9398: 0
A9399: 0
A9400: 0
A9401: 0
A9402: 0
A9403: 0
A9404: 0
A9405: 0
A9406: 0
A9407: 0
A9408: 0
A9409: 0
A9410: 0
A9411: 0
A9412: 0
A9413: 0
A9414: 0
A9415: 0
A9416: 0
A9417: 0
A9418: 0
A9419: 0
A9420: 0
A9421: 0
A9422: 0
A9423: 0
A9424: 0
A9425: 0
A9426: 0
A9427: 0
A9428: 0
A9429: 0
A9430: 0
A9431: 0
A9432: 0
A9433: 0
A9434: 0
A9435: 0
A9436: 0
A9437: 0
A9438: 0
A9439: 0
A9440: 0
A9441: 0
A9442: 0
A9443: 0
A9444: 0
A9445: 0
A9446: 0
A9447: 0
A9448: 0
A9449: 0
A9450: 0
A9451: 0
A9452: 0
A9453: 0
A9454: 0
A9455: 0
A9456: 0
A9457: 0
A9458: 0
A9459: 0
A9460: 0
A9461: 0
A9462: 0
A9463: 0
A9464: 0
A9465: 0
A9466: 0
A9467: 0
A9468: 0
A9469: 0
A9470: 0
A9471: 0
A9472: 0
A9473: 0
A9474: 0
A9475: 0
A9476: 0
A9477: 0
A9478: 0
A9479: 0
A9480: 0
A9481: 0
A9482: 0
A9483: 0
A9484: 0
A9485: 0
A9486: 0
A9487: 0
A9488: 0
A9489: 0
A9490: 0
A9491: 0
A9492: 0
A9493: 0
A9494: 0
A9495: 0
A9496: 0
A9497: 0
A9498: 0
A9499: 0
A9500: 0
A9501: 0
A9502: 0
A9503: 0
A9504: 0
A9505: 0
A9506: 0
A9507: 0
A9508: 0
A9509: 0
A9510: 0
A9511: 0
A9512: 0
A9513: 0
A9514: 0
A9515: 0
A9516: 0
A9517: 0
A9518: 0
A9519: 0
A9520: 0
A9521: 0
A9522: 0
A9523: 0
A9524: 0
A9525: 0
A9526: 0
A9527: 0
A9528: 0
A9529: 0
A9530: 0
A9531: 0
A9532: 0
A9533: 0
A9534: 0
A9535: 0
A9536: 0
A9537: 0
A9538: 0
A9539: 0
A9540: 0
A9541: 0
A9542: 0
A9543: 0
A9544: 0
A9545: 0
A9546: 0
A9547: 0
A9548: 0
A9549: 0
A9550: 0
A9551: 0
A9552: 0
A9553: 0
A9554: 0
A9555: 0
A9556: 0
A9557: 0
A9558: 0
A9559: 0
A9560: 0
A9561: 0
A9562: 0
A9563: 0
A9564: 0
A9565: 0
A9566: 0
A9567: 0
A9568: 0
A9569: 0
A9570: 0
A9571: 0
A9572: 0
A9573: 0
A9574: 0
A9575: 0
A9576: 0
A9577: 0
A9578: 0
A9579: 0
A9580: 0
A9581: 0
A9582: 0
A9583: 0
A9584: 0
A9585: 0
A9586: 0
A9587: 0
A9588: 0
A9589: 0
A9590: 0
A9591: 0
A9592: 0
A9593: 0
A9594: 0
A9595: 0
A9596: 0
A9597: 0
A9598: 0
A9599: 0
A9600: 0
A9601: 0
A9602: 0
A9603: 0
A9604: 0
A9605: 0
A9606: 0
A9607: 0
A9608: 0
A9609: 0
A9610: 0
A9611: 0
A9612: 0
A9613: 0
A9614: 0
A9615: 0
A9616: 0
A9617: 0
A9618: 0
A9619: 0
A9620: 0
A9621: 0
A9622: 0
A9623: 0
A9624: 0
A9625: 0
A9626: 0
A9627: 0
A9628: 0
A9629: 0
A9630: 0
A9631: 0
A9632: 0
A9633: 0
A9634: 0
A9635: 0
A9636: 0
A9637: 0
A9638: 0
A9639: 0
A9640: 0
A9641: 0
A9642: 0
A9643: 0
A9644: 0
A9645: 0
A9646: 0
A9647: 0
A9648: 0
A9649: 0
A9650: 0
A9651: 0
A9652: 0
A9653: 0
A9654: 0
A9655: 0
A9656: 0
A9657: 0
A9658: 0
A9659: 0
A9660: 0
A9661: 0
A9662: 0
A9663: 0
A9664: 0
A9665: 0
A9666: 0
A9667: 0
A9668: 0
A9669: 0
A9670: 0
A9671: 0
A9672: 0
A9673: 0
A9674: 0
A9675: 0
A9676: 0
A9677: 0
A9678: 0
A9679: 0
A9680: 0
A9681: 0
A9682: 0
A9683: 0
A9684: 0
A9685: 0
A9686: 0
A9687: 0
A9688: 0
A9689: 0
A9690: 0
A9691: 0
A9692: 0
A9693: 0
A9694: 0
A9695: 0
A9696: 0
A9697: 0
A9698: 0
A9699: 0
A9700: 0
A9701: 0
A9702: 0
A9703: 0
A9704: 0
A9705: 0
A9706: 0
A9707: 0
A9708: 0
A9709: 0
A9710: 0
A9711: 0
A9712: 0
A9713: 0
A9714: 0
A9715: 0
A9716: 0
A9717: 0
A9718: 0
A9719: 0
A9720: 0
A9721: 0
A9722: 0
A9723: 0
A9724: 0
A9725: 0
A9726: 0
A9727: 0
A9728: 0
A9729: 0
A9730: 0
A9731: 0
A9732: 0
A9733: 0
A9734: 0
A9735: 0
A9736: 0
A9737: 0
A9738: 0
A9739: 0
A9740: 0
A9741: 0
A9742: 0
A9743: 0
A9744: 0
A9745: 0
A9746: 0
A9747: 0
A9748: 0
A9749: 0
A9750: 0
A9751: 0
A9752: 0
A9753: 0
A9754: 0
A9755: 0
A9756: 0
A9757: 0
A9758: 0
A9759: 0
A9760: 0
A9761: 0
A9762: 0
A9763: 0
A9764: 0
A9765: 0
A9766: 0
A9767: 0
A9768: 0
A9769: 0
A9770: 0
A9771: 0
A9772: 0
A9773: 0
A9774: 0
A9775: 0
A9776: 0
A9777: 0
A9778: 0
A9779: 0
A9780: 0
A9781: 0
A9782: 0
A9783: 0
A9784: 0
A9785: 0
A9786: 0
A9787: 0
A9788: 0
A9789: 0
A9790: 0
A9791: 0
A9792: 0
A9793: 0
A9794: 0
A9795: 0
A9796: 0
A9797: 0
A9798: 0
A9799: 0
A9800: 0
A9801: 0
A9802: 0
A9803: 0
A9804: 0
A9805: 0
A9806: 0
A9807: 0
A9808: 0
A9809: 0
A9810: 0
A9811: 0
A9812: 0
A9813: 0
A9814: 0
A9815: 0
A9816: 0
A9817: 0
A9818: 0
A9819: 0
A9820: 0
A9821: 0
A9822: 0
A9823: 0
A9824: 0
A9825: 0
A9826: 0
A9827: 0
A9828: 0
A9829: 0
A9830: 0
A9831: 0
A9832: 0
A9833: 0
A9834: 0
A9835: 0
A9836: 0
A9837: 0
A9838: 0
A9839: 0
A9840: 0
A9841: 0
A9842: 0
A9843: 0
A9844: 0
A9845: 0
A9846: 0
A9847: 0
A9848: 0
A9849: 0
A9850: 0
A9851: 0
A9852: 0
A9853: 0
A9854: 0
A9855: 0
A9856: 0
A9857: 0
A9858: 0
A9859: 0
A9860: 0
A9861: 0
A9862: 0
A9863: 0
A9864: 0
A9865: 0
A9866: 0
A9867: 0
A9868: 0
A9869: 0
A9870: 0
A9871: 0
A9872: 0
A9873: 0
A9874: 0
A9875: 0
A9876: 0
A9877: 0
A9878: 0
A9879: 0
A9880: 0
A9881: 0
A9882: 0
A9883: 0
A9884: 0
A9885: 0
A9886: 0
A9887: 0
A9888: 0
A9889: 0
A9890: 0
A9891: 0
A9892: 0
A9893: 0
A9894: 0
A9895: 0
A9896: 0
A9897: 0
A9898: 0
A9899: 0
A9900: 0
A9901: 0
A9902: 0
A9903: 0
A9904: 0
A9905: 0
A9906: 0
A9907: 0
A9908: 0
A9909: 0
A9910: 0
A9911: 0
A9912: 0
A9913: 0
A9914: 0
A9915: 0
A9916: 0
A9917: 0
A9918: 0
A9919: 0
A9920: 0
A9921: 0
A9922: 0
A9923: 0
A9924: 0
A9925: 0
A9926: 0
A9927: 0
A9928: 0
A9929: 0
A9930: 0
A9931: 0
A9932: 0
A9933: 0
A9934: 0
A9935: 0
A9936: 0
A9937: 0
A9938: 0
A9939: 0
A9940: 0
A9941: 0
A9942: 0
A9943: 0
A9944: 0
A9945: 0
A9946: 0
A9947: 0
A9948: 0
A9949: 0
A9950: 0
A9951: 0
A9952: 0
A9953: 0
A9954: 0
A9955: 0
A9956: 0
A9957: 0
A9958: 0
A9959: 0
A9960: 0
A9961: 0
A9962: 0
A9963: 0
A9964: 0
A9965: 0
A9966: 0
A9967: 0
A9968: 0
A9969: 0
A9970: 0
A9971: 0
A9972: 0
A9973: 0
A9974: 0
A9975: 0
A9976: 0
A9977: 0
A9978: 0
A9979: 0
A9980: 0
A9981: 0
A9982: 0
A9983: 0
A9984: 0
A9985: 0
A9986: 0
A9987: 0
A9988: 0
A9989: 0
A9990: 0
A9991: 0
A9992: 0
A9993: 0
A9994: 0
A9995: 0
A9996: 0
A9997: 0
A9998: 0
A9999: 0
A10000: 0
A10001: 0
A10002: 0
A10003: 0
A10004: 0
A10005: 0
A10006: 0
A10007: 0
A10008: 0
A10009: 0
A10010: 0
A10011: 0
A10012: 0
A10013: 0
A10014: 0
A10015: 0
A10016: 0
A10017: 0
A10018: 0
A10019: 0
A10020: 0
A10021: 0
A10022: 0
A10023: 0
A10024: 0
A10025: 0
A10026: 0
A10027: 0
A10028: 0
A10029: 0
A10030: 0
A10031: 0
A10032: 0
A10033: 0
A10034: 0
A10035: 0
A10036: 0
A10037: 0
A10038: 0
A10039: 0
A10040: 0
A10041: 0
A10042: 0
A10043: 0
A10044: 0
A10045: 0
A10046: 0
A10047: 0
A10048: 0
A10049: 0
A10050: 0
A10051: 0
A10052: 0
A10053: 0
A10054: 0
A10055: 0
A10056: 0
A10057: 0
A10058: 0
A10059: 0
A10060: 0
A10061: 0
A10062: 0
A10063: 0
A10064: 0
A10065: 0
A10066: 0
A10067: 0
A10068: 0
A10069: 0
A10070: 0
A10071: 0
A10072: 0
A10073: 0
A10074: 0
A10075: 0
A10076: 0
A10077: 0
A10078: 0
A10079: 0
A10080: 0
A10081: 0
A10082: 0
A10083: 0
A10084: 0
A10085: 0
A10086: 0
A10087: 0
A10088: 0
A10089: 0
A10090: 0
A10091: 0
A10092: 0
A10093: 0
A10094: 0
A10095: 0
A10096: 0
A10097: 0
A10098: 0
A10099: 0
A10100: 0
A10101: 0
A10102: 0
A10103: 0
A10104: 0
A10105: 0
A10106: 0
A10107: 0
A10108: 0
A10109: 0
A10110: 0
A10111: 0
A10112: 0
A10113: 0
A10114: 0
A10115: 0
A10116: 0
A10117: 0
A10118: 0
A10119: 0
A10120: 0
A10121: 0
A10122: 0
A10123: 0
A10124: 0
A10125: 0
A10126: 0
A10127: 0
A10128: 0
A10129: 0
A10130: 0
A10131: 0
A10132: 0
A10133: 0
A10134: 0
A10135: 0
A10136: 0
A10137: 0
A10138: 0
A10139: 0
A10140: 0
A10141: 0
A10142: 0
A10143: 0
A10144: 0
A10145: 0
A10146: 0
A10147: 0
A10148: 0
A10149: 0
A10150: 0
A10151: 0
A10152: 0
A10153: 0
A10154: 0
A10155: 0
A10156: 0
A10157: 0
A10158: 0
A10159: 0
A10160: 0
A10161: 0
A10162: 0
A10163: 0
A10164: 0
A10165: 0
A10166: 0
A10167: 0
A10168: 0
A10169: 0
A10170: 0
A10171: 0
A10172: 0
A10173: 0
A10174: 0
A10175: 0
A10176: 0
A10177: 0
A10178: 0
A10179: 0
A10180: 0
A10181: 0
A10182: 0
A10183: 0
A10184: 0
A10185: 0
A10186: 0
A10187: 0
A10188: 0
A10189: 0
A10190: 0
A10191: 0
A10192: 0
A10193: 0
A10194: 0
A10195: 0
A10196: 0
A10197: 0
A10198: 0
A10199: 0
A10200: 0
A10201: 0
A10202: 0
A10203: 0
A10204: 0
A10205: 0
A10206: 0
A10207: 0
A10208: 0
A10209: 0
A10210: 0
A10211: 0
A10212: 0
A10213: 0
A10214: 0
A10215: 0
A10216: 0
A10217: 0
A10218: 0
A10219: 0
A10220: 0
A10221: 0
A10222: 0
A10223: 0
A10224: 0
A10225: 0
A10226: 0
A10227: 0
A10228: 0
A10229: 0
A10230: 0
A10231: 0
A10232: 0
A10233: 0
A10234: 0
A10235: 0
A10236: 0
A10237: 0
A10238: 0
A10239: 0
A10240: 0
A10241: 0
A10242: 0
A10243: 0
A10244: 0
A10245: 0
A10246: 0
A10247: 0
A10248: 0
A10249: 0
A10250: 0
A10251: 0
A10252: 0
A10253: 0
A10254: 0
A10255: 0
A10256: 0
A10257: 0
A10258: 0
A10259: 0
A10260: 0
A10261: 0
A10262: 0
A10263: 0
A10264: 0
A10265: 0
A10266: 0
A10267: 0
A10268: 0
A10269: 0
A10270: 0
A10271: 0
A10272: 0
A10273: 0
A10274: 0
A10275: 0
A10276: 0
A10277: 0
A10278: 0
A10279: 0
A10280: 0
A10281: 0
A10282: 0
A10283: 0
A10284: 0
A10285: 0
A10286: 0
A10287: 0
A10288: 0
A10289: 0
A10290: 0
A10291: 0
A10292: 0
A10293: 0
A10294: 0
A10295: 0
A10296: 0
A10297: 0
A10298: 0
A10299: 0
A10300: 0
A10301: 0
A10302: 0
A10303: 0
A10304: 0
A10305: 0
A10306: 0
A10307: 0
A10308: 0
A10309: 0
A10310: 0
A10311: 0
A10312: 0
A10313: 0
A10314: 0
A10315: 0
A10316: 0
A10317: 0
A10318: 0
A10319: 0
A10320: 0
A10321: 0
A10322: 0
A10323: 0
A10324: 0
A10325: 0
A10326: 0
A10327: 0
A10328: 0
A10329: 0
A10330: 0
A10331: 0
A10332: 0
A10333: 0
A10334: 0
A10335: 0
A10336: 0
A10337: 0
A10338: 0
A10339: 0
A10340: 0
A10341: 0
A10342: 0
A10343: 0
A10344: 0
A10345: 0
A10346: 0
A10347: 0
A10348: 0
A10349: 0
A10350: 0
A10351: 0
A10352: 0
A10353: 0
A10354: 0
A10355: 0
A10356: 0
A10357: 0
A10358: 0
A10359: 0
A10360: 0
A10361: 0
A10362: 0
A10363: 0
A10364: 0
A10365: 0
A10366: 0
A10367: 0
A10368: 0
A10369: 0
A10370: 0
A10371: 0
A10372: 0
A10373: 0
A10374: 0
A10375: 0
A10376: 0
A10377: 0
A10378: 0
A10379: 0
A10380: 0
A10381: 0
A10382: 0
A10383: 0
A10384: 0
A10385: 0
A10386: 0
A10387: 0
A10388: 0
A10389: 0
A10390: 0
A10391: 0
A10392: 0
A10393: 0
A10394: 0
A10395: 0
A10396: 0
A10397: 0
A10398: 0
A10399: 0
A10400: 0
A10401: 0
A10402: 0
A10403: 0
A10404: 0
A10405: 0
A10406: 0
A10407: 0
A10408: 0
A10409: 0
A10410: 0
A10411: 0
A10412: 0
A10413: 0
A10414: 0
A10415: 0
A10416: 0
A10417: 0
A10418: 0
A10419: 0
A10420: 0
A10421: 0
A10422: 0
A10423: 0
A10424: 0
A10425: 0
A10426: 0
A10427: 0
A10428: 0
A10429: 0
A10430: 0
A10431: 0
A10432: 0
A10433: 0
A10434: 0
A10435: 0
A10436: 0
A10437: 0
A10438: 0
A10439: 0
A10440: 0
A10441: 0
A10442: 0
A10443: 0
A10444: 0
A10445: 0
A10446: 0
A10447: 0
A10448: 0
A10449: 0
A10450: 0
A10451: 0
A10452: 0
A10453: 0
A10454: 0
A10455: 0
A10456: 0
A10457: 0
A10458: 0
A10459: 0
A10460: 0
A10461: 0
A10462: 0
A10463: 0
A10464: 0
A10465: 0
A10466: 0
A10467: 0
A10468: 0
A10469: 0
A10470: 0
A10471: 0
A10472: 0
A10473: 0
A10474: 0
A10475: 0
A10476: 0
A10477: 0
A10478: 0
A10479: 0
A10480: 0
A10481: 0
A10482: 0
A10483: 0
A10484: 0
A10485: 0
A10486: 0
A10487: 0
A10488: 0
A10489: 0
A10490: 0
A10491: 0
A10492: 0
A10493: 0
A10494: 0
A10495: 0
A10496: 0
A10497: 0
A10498: 0
A10499: 0
A10500: 0
A10501: 0
A10502: 0
A10503: 0
A10504: 0
A10505: 0
A10506: 0
A10507: 0
A10508: 0
A10509: 0
A10510: 0
A10511: 0
A10512: 0
A10513: 0
A10514: 0
A10515: 0
A10516: 0
A10517: 0
A10518: 0
A10519: 0
A10520: 0
A10521: 0
A10522: 0
A10523: 0
A10524: 0
A10525: 0
A10526: 0
A10527: 0
A10528: 0
A10529: 0
A10530: 0
A10531: 0
A10532: 0
A10533: 0
A10534: 0
A10535: 0
A10536: 0
A10537: 0
A10538: 0
A10539: 0
A10540: 0
A10541: 0
A10542: 0
A10543: 0
A10544: 0
A10545: 0
A10546: 0
A10547: 0
A10548: 0
A10549: 0
A10550: 0
A10551: 0
A10552: 0
A10553: 0
A10554: 0
A10555: 0
A10556: 0
A10557: 0
A10558: 0
A10559: 0
A10560: 0
A10561: 0
A10562: 0
A10563: 0
A10564: 0
A10565: 0